{"input": {"dx": ["IAMCEST anterior (I21.0)"], "proc": ["Coronariografia (K492)", "Angioplastia CD (K493)"], "tto": ["Enoxaparina 1mg/kg SC c/12h (B01AB05)", "Digoxina 0.25mg EV (C01AA05)"], "evo": "Pericarditis aguda con derrame leve, manejo antiinflamatorio", "dx_alta": ["IAMCEST anterior tratado (I21.0)"], "med": ["Metoprolol 50mg VO c/12h (C07AB02)", "Clopidogrel 75mg VO c/24h 12m (B01AC04)", "Aspirina 100mg VO c/24h (B01AC06)", "Ticagrelor 90mg VO c/12h 12m (B01AC24)", "Warfarina segun INR (B01AA03)"]}, "output": "Paciente que ingresa con cuadro de iamcest anterior (I21.0). Se realiza coronariografia (K492) encontrando lesion critica, realizandose angioplastia cd (K493) con implante de stent farmacoactivo y flujo TIMI 3 final. En su evolucion, pericarditis aguda con derrame leve, manejo antiinflamatorio. Recibio tratamiento con Enoxaparina 1mg/kg SC c/12h (B01AB05) y Digoxina 0.25mg EV (C01AA05). Evolucion satisfactoria, cumpliendo criterios de alta. Alta con diagnostico de iamcest anterior tratado (I21.0), indicandose Metoprolol 50mg VO c/12h (C07AB02), Clopidogrel 75mg VO c/24h 12m (B01AC04), Aspirina 100mg VO c/24h (B01AC06), Ticagrelor 90mg VO c/12h 12m (B01AC24) y Warfarina segun INR (B01AA03)."}
{"input": {"dx": ["Edema pulmonar agudo (J81)"], "proc": ["Test de esfuerzo (K492)"], "tto": ["Furosemida 80mg EV (C03CA01)", "Nitroglicerina EV (C01DA02)"], "evo": "Enfermedad de multiples vasos, se deriva a cirugia cardiaca para bypass", "dx_alta": ["Edema pulmonar agudo tratado (J81)"], "med": ["Prasugrel 10mg VO c/24h 12m (B01AC22)", "Ticagrelor 90mg VO c/12h 12m (B01AC24)", "Bisoprolol 5mg VO c/24h (C07AB07)", "Digoxina 0.125mg VO c/24h (C01AA05)"]}, "output": "Se hospitaliza por edema pulmonar agudo (J81). Se realiza test de esfuerzo (K492). Presenta, enfermedad de multiples vasos, se deriva a cirugia cardiaca para bypass. Recibio tratamiento con Furosemida 80mg EV (C03CA01) y Nitroglicerina EV (C01DA02). Buena evolucion, cumpliendo criterios de alta. Alta con diagnostico de edema pulmonar agudo tratado (J81), indicandose Prasugrel 10mg VO c/24h 12m (B01AC22), Ticagrelor 90mg VO c/12h 12m (B01AC24), Bisoprolol 5mg VO c/24h (C07AB07) y Digoxina 0.125mg VO c/24h (C01AA05)."}
{"input": {"dx": ["Obstruccion intestinal (K56.6)"], "proc": ["Endoscopia digestiva alta (45.13)", "RMN cerebral (88.91)"], "tto": ["Hidrocortisona 100mg EV c/8h (H02AB09)", "Ampicilina/Sulbactam 1.5g EV c/6h (J01CR01)"], "evo": "Sin complicaciones postoperatorias, herida operatoria limpia", "dx_alta": ["Obstruccion intestinal resuelto (K56.6)"], "med": ["Glibenclamida 5mg VO c/24h (A10BB01)", "Tramadol 50mg VO c/8h 7d (N02AX02)", "Paracetamol 500mg VO c/8h PRN (N02BE01)"]}, "output": "Paciente que ingresa con cuadro de obstruccion intestinal (K56.6). Se realiza endoscopia digestiva alta (45.13), rmn cerebral (88.91). Presenta, sin complicaciones postoperatorias, herida operatoria limpia. Recibio tratamiento con Hidrocortisona 100mg EV c/8h (H02AB09) y Ampicilina/Sulbactam 1.5g EV c/6h (J01CR01). Presenta evolucion favorable, cumpliendo criterios de alta. Alta con diagnostico de obstruccion intestinal resuelto (K56.6), indicandose Glibenclamida 5mg VO c/24h (A10BB01), Tramadol 50mg VO c/8h 7d (N02AX02) y Paracetamol 500mg VO c/8h PRN (N02BE01)."}
{"input": {"dx": ["ACV hemorragico (I61.9)"], "proc": ["RMN cerebral (88.91)"], "tto": ["Metronidazol 500mg EV c/8h (J01XD01)", "Vancomicina 1g EV c/12h (J01XA01)", "Metamizol 1g EV c/8h (N02BB02)"], "evo": "Estabilizacion clinica progresiva, sin eventos adversos", "dx_alta": ["ACV hemorragico resuelto (I61.9)"], "med": ["Glibenclamida 5mg VO c/24h (A10BB01)", "Levotiroxina 50mcg VO c/24h (H03AA01)", "Tramadol 50mg VO c/8h 7d (N02AX02)"]}, "output": "Paciente que ingresa con cuadro de acv hemorragico (I61.9). Se realiza rmn cerebral (88.91). En su evolucion, estabilizacion clinica progresiva, sin eventos adversos. Recibio tratamiento con Metronidazol 500mg EV c/8h (J01XD01), Vancomicina 1g EV c/12h (J01XA01) y Metamizol 1g EV c/8h (N02BB02). Evolucion clinica favorable, cumpliendo criterios de alta. Alta con diagnostico de acv hemorragico resuelto (I61.9), indicandose Glibenclamida 5mg VO c/24h (A10BB01), Levotiroxina 50mcg VO c/24h (H03AA01) y Tramadol 50mg VO c/8h 7d (N02AX02)."}
{"input": {"dx": ["IAMSEST alto riesgo (I21.4)"], "proc": ["Coronariografia (K492)", "Angioplastia OM (K493)"], "tto": ["Nitroglicerina EV (C01DA02)", "Heparina EV infusion (B01AB01)", "Clopidogrel 300mg carga (B01AC04)", "Furosemida 40mg EV (C03CA01)"], "evo": "Enfermedad de multiples vasos, se deriva a cirugia cardiaca para bypass", "dx_alta": ["IAMSEST alto riesgo tratado (I21.4)"], "med": ["Losartan 50mg VO c/24h (C09CA01)", "Warfarina segun INR (B01AA03)", "Espironolactona 25mg VO c/24h (C03DA01)", "Bisoprolol 5mg VO c/24h (C07AB07)", "Furosemida 40mg VO c/24h (C03CA01)"]}, "output": "Paciente que ingresa con cuadro de iamsest alto riesgo (I21.4). Se realiza coronariografia (K492) visualizando estenosis severa, realizandose angioplastia om (K493) con implante de stent farmacoactivo y flujo TIMI 3 final. En su evolucion, enfermedad de multiples vasos, se deriva a cirugia cardiaca para bypass. Recibio tratamiento con Nitroglicerina EV (C01DA02), Heparina EV infusion (B01AB01), Clopidogrel 300mg carga (B01AC04) y Furosemida 40mg EV (C03CA01). Evolucion clinica favorable, cumpliendo criterios de alta. Alta con diagnostico de iamsest alto riesgo tratado (I21.4), indicandose Losartan 50mg VO c/24h (C09CA01), Warfarina segun INR (B01AA03), Espironolactona 25mg VO c/24h (C03DA01), Bisoprolol 5mg VO c/24h (C07AB07) y Furosemida 40mg VO c/24h (C03CA01)."}
{"input": {"dx": ["Asma bronquial exacerbada (J45.9)"], "proc": ["Angio TAC cerebral (88.38)", "RMN cerebral (88.91)"], "tto": ["Morfina 3mg EV c/4h PRN (N02AA01)", "Paracetamol 1g EV c/8h (N02BE01)", "Insulina cristalina segun esquema (A10AB01)"], "evo": "Resolucion del cuadro agudo, alta con seguimiento ambulatorio", "dx_alta": ["Asma bronquial exacerbada resuelto (J45.9)"], "med": ["Paracetamol 500mg VO c/8h PRN (N02BE01)", "Amoxicilina/Clavulanico 875mg VO c/12h 7d (J01CR02)"]}, "output": "Paciente que ingresa con cuadro de asma bronquial exacerbada (J45.9). Se realiza angio tac cerebral (88.38), rmn cerebral (88.91). En su evolucion, resolucion del cuadro agudo, alta con seguimiento ambulatorio. Recibio tratamiento con Morfina 3mg EV c/4h PRN (N02AA01), Paracetamol 1g EV c/8h (N02BE01) y Insulina cristalina segun esquema (A10AB01). Evolucion satisfactoria, cumpliendo criterios de alta. Alta con diagnostico de asma bronquial exacerbada resuelto (J45.9), indicandose Paracetamol 500mg VO c/8h PRN (N02BE01) y Amoxicilina/Clavulanico 875mg VO c/12h 7d (J01CR02)."}
{"input": {"dx": ["Enfermedad coronaria de 2 vasos (I25.1)"], "proc": ["Coronariografia (K492)", "Angioplastia TCI (36.06)"], "tto": ["Heparina 5000UI EV (B01AB01)", "Digoxina 0.25mg EV (C01AA05)", "Enoxaparina 1mg/kg SC c/12h (B01AB05)", "Atorvastatina 80mg (C10AA05)"], "evo": "Estenosis aortica severa sintomatica, programada para TAVI", "dx_alta": ["Enfermedad coronaria de 2 vasos tratado (I25.1)"], "med": ["Enalapril 10mg VO c/12h (C09AA02)", "Metoprolol 50mg VO c/12h (C07AB02)", "Apixaban 5mg VO c/12h (B01AF02)"]}, "output": "Ingreso por enfermedad coronaria de 2 vasos (I25.1). Se realiza coronariografia (K492) encontrando lesion critica, realizandose angioplastia tci (36.06) con implante de stent farmacoactivo y flujo TIMI 3 final. Presenta, estenosis aortica severa sintomatica, programada para tavi. Recibio tratamiento con Heparina 5000UI EV (B01AB01), Digoxina 0.25mg EV (C01AA05), Enoxaparina 1mg/kg SC c/12h (B01AB05) y Atorvastatina 80mg (C10AA05). Evolucion clinica favorable, cumpliendo criterios de alta. Alta con diagnostico de enfermedad coronaria de 2 vasos tratado (I25.1), indicandose Enalapril 10mg VO c/12h (C09AA02), Metoprolol 50mg VO c/12h (C07AB02) y Apixaban 5mg VO c/12h (B01AF02)."}
{"input": {"dx": ["IAMCEST posterior (I21.2)"], "proc": ["Coronariografia (K492)", "Angioplastia CX (K493)"], "tto": ["Morfina 3mg EV (N02AA01)", "Aspirina 100mg (B01AC06)"], "evo": "Taquicardia ventricular sostenida, cardioversion electrica exitosa", "dx_alta": ["IAMCEST posterior tratado (I21.2)"], "med": ["Losartan 50mg VO c/24h (C09CA01)", "Espironolactona 25mg VO c/24h (C03DA01)", "Aspirina 100mg VO c/24h (B01AC06)", "Prasugrel 10mg VO c/24h 12m (B01AC22)", "Carvedilol 6.25mg VO c/12h (C07AG02)"]}, "output": "Se hospitaliza por iamcest posterior (I21.2). Se realiza coronariografia (K492) evidenciando oclusion aguda, realizandose angioplastia cx (K493) con implante de stent farmacoactivo y flujo TIMI 3 final. Durante la hospitalizacion, taquicardia ventricular sostenida, cardioversion electrica exitosa. Recibio tratamiento con Morfina 3mg EV (N02AA01) y Aspirina 100mg (B01AC06). Evolucion clinica favorable, cumpliendo criterios de alta. Alta con diagnostico de iamcest posterior tratado (I21.2), indicandose Losartan 50mg VO c/24h (C09CA01), Espironolactona 25mg VO c/24h (C03DA01), Aspirina 100mg VO c/24h (B01AC06), Prasugrel 10mg VO c/24h 12m (B01AC22) y Carvedilol 6.25mg VO c/12h (C07AG02)."}
{"input": {"dx": ["Taquicardia ventricular (I47.2)"], "proc": ["Trombectomia mecanica (39.74)"], "tto": ["Hidrocortisona 100mg EV c/8h (H02AB09)", "Paracetamol 1g EV c/8h (N02BE01)"], "evo": "Procedimiento sin complicaciones, buena tolerancia oral", "dx_alta": ["Taquicardia ventricular resuelto (I47.2)"], "med": ["Vitamina D 1000UI VO c/24h (A11CC05)", "Metformina 850mg VO c/12h (A10BA02)", "Levotiroxina 50mcg VO c/24h (H03AA01)", "Sertralina 50mg VO c/24h (N06AB06)"]}, "output": "Ingreso por taquicardia ventricular (I47.2). Se realiza trombectomia mecanica (39.74). En su evolucion, procedimiento sin complicaciones, buena tolerancia oral. Recibio tratamiento con Hidrocortisona 100mg EV c/8h (H02AB09) y Paracetamol 1g EV c/8h (N02BE01). Evolucion clinica favorable, cumpliendo criterios de alta. Alta con diagnostico de taquicardia ventricular resuelto (I47.2), indicandose Vitamina D 1000UI VO c/24h (A11CC05), Metformina 850mg VO c/12h (A10BA02), Levotiroxina 50mcg VO c/24h (H03AA01) y Sertralina 50mg VO c/24h (N06AB06)."}
{"input": {"dx": ["Hipertension arterial severa (I10)"], "proc": ["Trombolisis EV (99.10)", "Osteosintesis de cadera (79.35)"], "tto": ["Morfina 3mg EV c/4h PRN (N02AA01)", "N-acetilcisteina NBZ c/8h (R05CB01)"], "evo": "Respuesta adecuada al tratamiento antibiotico, afebril desde dia 2", "dx_alta": ["Hipertension arterial severa resuelto (I10)"], "med": ["Omeprazol 20mg VO c/24h (A02BC01)", "Insulina NPH 10UI SC c/12h (A10AC01)", "Clonazepam 0.5mg VO c/noche (N03AE01)"]}, "output": "Ingresa por hipertension arterial severa (I10). Se realiza trombolisis ev (99.10), osteosintesis de cadera (79.35). Durante la hospitalizacion, respuesta adecuada al tratamiento antibiotico, afebril desde dia 2. Recibio tratamiento con Morfina 3mg EV c/4h PRN (N02AA01) y N-acetilcisteina NBZ c/8h (R05CB01). Presenta evolucion favorable, cumpliendo criterios de alta. Alta con diagnostico de hipertension arterial severa resuelto (I10), indicandose Omeprazol 20mg VO c/24h (A02BC01), Insulina NPH 10UI SC c/12h (A10AC01) y Clonazepam 0.5mg VO c/noche (N03AE01)."}
{"input": {"dx": ["IAMCEST inferior (I21.1)"], "proc": ["Coronariografia (K492)", "Angioplastia DA (K493)"], "tto": ["Digoxina 0.25mg EV (C01AA05)", "Metoprolol 5mg EV (C07AB02)", "Clopidogrel 600mg carga (B01AC04)"], "evo": "Taquicardia ventricular sostenida, cardioversion electrica exitosa", "dx_alta": ["IAMCEST inferior tratado (I21.1)"], "med": ["Espironolactona 25mg VO c/24h (C03DA01)", "Atorvastatina 40mg VO c/noche (C10AA05)", "Digoxina 0.125mg VO c/24h (C01AA05)", "Metoprolol 50mg VO c/12h (C07AB02)", "Warfarina segun INR (B01AA03)"]}, "output": "Ingresa por iamcest inferior (I21.1). Se realiza coronariografia (K492) encontrando lesion critica, realizandose angioplastia da (K493) con implante de stent farmacoactivo y flujo TIMI 3 final. Evoluciona con, taquicardia ventricular sostenida, cardioversion electrica exitosa. Recibio tratamiento con Digoxina 0.25mg EV (C01AA05), Metoprolol 5mg EV (C07AB02) y Clopidogrel 600mg carga (B01AC04). Buena evolucion, cumpliendo criterios de alta. Alta con diagnostico de iamcest inferior tratado (I21.1), indicandose Espironolactona 25mg VO c/24h (C03DA01), Atorvastatina 40mg VO c/noche (C10AA05), Digoxina 0.125mg VO c/24h (C01AA05), Metoprolol 50mg VO c/12h (C07AB02) y Warfarina segun INR (B01AA03)."}
{"input": {"dx": ["Enfermedad de TCI (I25.1)"], "proc": ["Angioplastia (K493)"], "tto": ["Furosemida 40mg EV (C03CA01)", "Nitroglicerina EV (C01DA02)"], "evo": "Estenosis aortica severa sintomatica, programada para TAVI", "dx_alta": ["Enfermedad de TCI tratado (I25.1)"], "med": ["Warfarina segun INR (B01AA03)", "Nitroglicerina SL PRN (C01DA02)", "Furosemida 40mg VO c/24h (C03CA01)"]}, "output": "Paciente que ingresa con cuadro de enfermedad de tci (I25.1). Se realiza angioplastia (K493). Evoluciona con, estenosis aortica severa sintomatica, programada para tavi. Recibio tratamiento con Furosemida 40mg EV (C03CA01) y Nitroglicerina EV (C01DA02). Evolucion clinica favorable, cumpliendo criterios de alta. Alta con diagnostico de enfermedad de tci tratado (I25.1), indicandose Warfarina segun INR (B01AA03), Nitroglicerina SL PRN (C01DA02) y Furosemida 40mg VO c/24h (C03CA01)."}
{"input": {"dx": ["IAMSEST (I21.4)"], "proc": ["Coronariografia (K492)", "Angioplastia DA (36.06)"], "tto": ["Enoxaparina 1mg/kg SC c/12h (B01AB05)", "Heparina EV infusion (B01AB01)", "Levosimendan EV (C01CX08)", "Atorvastatina 80mg (C10AA05)"], "evo": "Oclusion aguda de DA media, angioplastia exitosa con stent farmacoactivo, flujo TIMI 3 final", "dx_alta": ["IAMSEST tratado (I21.4)"], "med": ["Metoprolol 50mg VO c/12h (C07AB02)", "Espironolactona 25mg VO c/24h (C03DA01)", "Isosorbide 20mg VO c/8h (C01DA08)"]}, "output": "Paciente que ingresa con cuadro de iamsest (I21.4). Se realiza coronariografia (K492) con hallazgo de lesion significativa, realizandose angioplastia da (36.06) con implante de stent farmacoactivo y flujo TIMI 3 final. Durante la hospitalizacion, oclusion aguda de da media, angioplastia exitosa con stent farmacoactivo, flujo timi 3 final. Recibio tratamiento con Enoxaparina 1mg/kg SC c/12h (B01AB05), Heparina EV infusion (B01AB01), Levosimendan EV (C01CX08) y Atorvastatina 80mg (C10AA05). Evolucion clinica favorable, cumpliendo criterios de alta. Alta con diagnostico de iamsest tratado (I21.4), indicandose Metoprolol 50mg VO c/12h (C07AB02), Espironolactona 25mg VO c/24h (C03DA01) y Isosorbide 20mg VO c/8h (C01DA08)."}
{"input": {"dx": ["Enfermedad coronaria de 2 vasos (I25.1)"], "proc": ["Coronariografia (K492)", "Angioplastia TCI (36.06)"], "tto": ["Atorvastatina 80mg (C10AA05)", "Digoxina 0.25mg EV (C01AA05)", "Metoprolol 5mg EV (C07AB02)"], "evo": "Oclusion de CD proximal con trombo, trombectomia por aspiracion mas stent", "dx_alta": ["Enfermedad coronaria de 2 vasos tratado (I25.1)"], "med": ["Clopidogrel 75mg VO c/24h 12m (B01AC04)", "Isosorbide 20mg VO c/8h (C01DA08)", "Nitroglicerina SL PRN (C01DA02)"]}, "output": "Ingresa por enfermedad coronaria de 2 vasos (I25.1). Se realiza coronariografia (K492) visualizando estenosis severa, realizandose angioplastia tci (36.06) con implante de stent farmacoactivo y flujo TIMI 3 final. Durante la hospitalizacion, oclusion de cd proximal con trombo, trombectomia por aspiracion mas stent. Recibio tratamiento con Atorvastatina 80mg (C10AA05), Digoxina 0.25mg EV (C01AA05) y Metoprolol 5mg EV (C07AB02). Presenta evolucion favorable, cumpliendo criterios de alta. Alta con diagnostico de enfermedad coronaria de 2 vasos tratado (I25.1), indicandose Clopidogrel 75mg VO c/24h 12m (B01AC04), Isosorbide 20mg VO c/8h (C01DA08) y Nitroglicerina SL PRN (C01DA02)."}
{"input": {"dx": ["Trombosis de stent (I21.0)"], "proc": ["TAVI (K493)"], "tto": ["Enalapril 5mg VO (C09AA02)", "Enoxaparina 60mg SC c/12h (B01AB05)"], "evo": "Oclusion de DA media con trombo, trombectomia por aspiracion mas stent", "dx_alta": ["Trombosis de stent tratado (I21.0)"], "med": ["Atorvastatina 40mg VO c/noche (C10AA05)", "Bisoprolol 5mg VO c/24h (C07AB07)", "Prasugrel 10mg VO c/24h 12m (B01AC22)"]}, "output": "Paciente que ingresa con cuadro de trombosis de stent (I21.0). Se realiza tavi (K493). Durante la hospitalizacion, oclusion de da media con trombo, trombectomia por aspiracion mas stent. Recibio tratamiento con Enalapril 5mg VO (C09AA02) y Enoxaparina 60mg SC c/12h (B01AB05). Presenta evolucion favorable, cumpliendo criterios de alta. Alta con diagnostico de trombosis de stent tratado (I21.0), indicandose Atorvastatina 40mg VO c/noche (C10AA05), Bisoprolol 5mg VO c/24h (C07AB07) y Prasugrel 10mg VO c/24h 12m (B01AC22)."}
{"input": {"dx": ["Edema pulmonar agudo (J81)"], "proc": ["TAVI (37.34)"], "tto": ["Clopidogrel 600mg carga (B01AC04)", "Digoxina 0.25mg EV (C01AA05)", "Nitroglicerina EV (C01DA02)"], "evo": "SDST en I, aVL, coronarias sin lesiones obstructivas, sindrome de Tako-Tsubo", "dx_alta": ["Edema pulmonar agudo tratado (J81)"], "med": ["Enalapril 10mg VO c/12h (C09AA02)", "Furosemida 40mg VO c/24h (C03CA01)", "Losartan 50mg VO c/24h (C09CA01)"]}, "output": "Ingresa por edema pulmonar agudo (J81). Se realiza tavi (37.34). Durante la hospitalizacion, sdst en i, avl, coronarias sin lesiones obstructivas, sindrome de tako-tsubo. Recibio tratamiento con Clopidogrel 600mg carga (B01AC04), Digoxina 0.25mg EV (C01AA05) y Nitroglicerina EV (C01DA02). Evolucion satisfactoria, cumpliendo criterios de alta. Alta con diagnostico de edema pulmonar agudo tratado (J81), indicandose Enalapril 10mg VO c/12h (C09AA02), Furosemida 40mg VO c/24h (C03CA01) y Losartan 50mg VO c/24h (C09CA01)."}
{"input": {"dx": ["Edema pulmonar agudo (J81)"], "proc": ["Angioplastia CD (K493)"], "tto": ["Clopidogrel 600mg carga (B01AC04)", "Enalapril 5mg VO (C09AA02)", "Ticagrelor 180mg carga (B01AC24)", "Aspirina 300mg carga (B01AC06)"], "evo": "Lesion critica de DA media, estabilizacion hemodinamica, angioplastia diferida", "dx_alta": ["Edema pulmonar agudo tratado (J81)"], "med": ["Enalapril 10mg VO c/12h (C09AA02)", "Apixaban 5mg VO c/12h (B01AF02)", "Furosemida 40mg VO c/24h (C03CA01)", "Digoxina 0.125mg VO c/24h (C01AA05)"]}, "output": "Ingresa por edema pulmonar agudo (J81). Se realiza angioplastia cd (K493). Presenta, lesion critica de da media, estabilizacion hemodinamica, angioplastia diferida. Recibio tratamiento con Clopidogrel 600mg carga (B01AC04), Enalapril 5mg VO (C09AA02), Ticagrelor 180mg carga (B01AC24) y Aspirina 300mg carga (B01AC06). Presenta evolucion favorable, cumpliendo criterios de alta. Alta con diagnostico de edema pulmonar agudo tratado (J81), indicandose Enalapril 10mg VO c/12h (C09AA02), Apixaban 5mg VO c/12h (B01AF02), Furosemida 40mg VO c/24h (C03CA01) y Digoxina 0.125mg VO c/24h (C01AA05)."}
{"input": {"dx": ["Sincope (R55)"], "proc": ["Endoscopia digestiva alta (45.13)", "Osteosintesis de cadera (79.35)"], "tto": ["Hidrocortisona 100mg EV c/8h (H02AB09)", "Paracetamol 1g EV c/8h (N02BE01)", "Ceftriaxona 2g EV c/24h (J01DD04)", "Ampicilina/Sulbactam 1.5g EV c/6h (J01CR01)"], "evo": "Sin complicaciones postoperatorias, herida operatoria limpia", "dx_alta": ["Sincope resuelto (R55)"], "med": ["Salbutamol INH 2 puff c/6h PRN (R03AC02)", "Glibenclamida 5mg VO c/24h (A10BB01)"]}, "output": "Se hospitaliza por sincope (R55). Se realiza endoscopia digestiva alta (45.13), osteosintesis de cadera (79.35). Evoluciona con, sin complicaciones postoperatorias, herida operatoria limpia. Recibio tratamiento con Hidrocortisona 100mg EV c/8h (H02AB09), Paracetamol 1g EV c/8h (N02BE01), Ceftriaxona 2g EV c/24h (J01DD04) y Ampicilina/Sulbactam 1.5g EV c/6h (J01CR01). Buena evolucion, cumpliendo criterios de alta. Alta con diagnostico de sincope resuelto (R55), indicandose Salbutamol INH 2 puff c/6h PRN (R03AC02) y Glibenclamida 5mg VO c/24h (A10BB01)."}
{"input": {"dx": ["ACV hemorragico (I61.9)"], "proc": ["Ecografia abdominal (88.76)"], "tto": ["Ciprofloxacino 400mg EV c/12h (J01MA02)", "Ceftriaxona 2g EV c/24h (J01DD04)", "Pantoprazol 40mg EV c/12h (A02BC02)", "Omeprazol 40mg EV c/12h (A02BC01)"], "evo": "Estabilizacion clinica progresiva, sin eventos adversos", "dx_alta": ["ACV hemorragico resuelto (I61.9)"], "med": ["Levotiroxina 50mcg VO c/24h (H03AA01)", "Metformina 850mg VO c/12h (A10BA02)"]}, "output": "Ingreso por acv hemorragico (I61.9). Se realiza ecografia abdominal (88.76). Evoluciona con, estabilizacion clinica progresiva, sin eventos adversos. Recibio tratamiento con Ciprofloxacino 400mg EV c/12h (J01MA02), Ceftriaxona 2g EV c/24h (J01DD04), Pantoprazol 40mg EV c/12h (A02BC02) y Omeprazol 40mg EV c/12h (A02BC01). Presenta evolucion favorable, cumpliendo criterios de alta. Alta con diagnostico de acv hemorragico resuelto (I61.9), indicandose Levotiroxina 50mcg VO c/24h (H03AA01) y Metformina 850mg VO c/12h (A10BA02)."}
{"input": {"dx": ["IAMCEST anteroseptal (I21.0)"], "proc": ["Coronariografia (K492)", "Angioplastia CX (K493)"], "tto": ["Aspirina 300mg carga (B01AC06)", "Heparina EV infusion (B01AB01)", "Prasugrel 60mg carga (B01AC22)"], "evo": "Lesion critica de DA proximal, estabilizacion hemodinamica, angioplastia diferida", "dx_alta": ["IAMCEST anteroseptal tratado (I21.0)"], "med": ["Atorvastatina 40mg VO c/noche (C10AA05)", "Prasugrel 10mg VO c/24h 12m (B01AC22)", "Carvedilol 6.25mg VO c/12h (C07AG02)"]}, "output": "Ingreso por iamcest anteroseptal (I21.0). Se realiza coronariografia (K492) evidenciando oclusion aguda, realizandose angioplastia cx (K493) con implante de stent farmacoactivo y flujo TIMI 3 final. En su evolucion, lesion critica de da proximal, estabilizacion hemodinamica, angioplastia diferida. Recibio tratamiento con Aspirina 300mg carga (B01AC06), Heparina EV infusion (B01AB01) y Prasugrel 60mg carga (B01AC22). Evolucion clinica favorable, cumpliendo criterios de alta. Alta con diagnostico de iamcest anteroseptal tratado (I21.0), indicandose Atorvastatina 40mg VO c/noche (C10AA05), Prasugrel 10mg VO c/24h 12m (B01AC22) y Carvedilol 6.25mg VO c/12h (C07AG02)."}
{"input": {"dx": ["Fractura de cadera (S72.0)"], "proc": ["Angio TAC cerebral (88.38)"], "tto": ["Metamizol 1g EV c/8h (N02BB02)", "Piperacilina/Tazobactam 4.5g EV c/8h (J01CR05)"], "evo": "Control de sintomas con tratamiento medico optimizado", "dx_alta": ["Fractura de cadera resuelto (S72.0)"], "med": ["Insulina NPH 10UI SC c/12h (A10AC01)", "Levotiroxina 50mcg VO c/24h (H03AA01)", "Metformina 850mg VO c/12h (A10BA02)", "Hierro 100mg VO c/24h (B03AA07)"]}, "output": "Ingresa por fractura de cadera (S72.0). Se realiza angio tac cerebral (88.38). Evoluciona con, control de sintomas con tratamiento medico optimizado. Recibio tratamiento con Metamizol 1g EV c/8h (N02BB02) y Piperacilina/Tazobactam 4.5g EV c/8h (J01CR05). Presenta evolucion favorable, cumpliendo criterios de alta. Alta con diagnostico de fractura de cadera resuelto (S72.0), indicandose Insulina NPH 10UI SC c/12h (A10AC01), Levotiroxina 50mcg VO c/24h (H03AA01), Metformina 850mg VO c/12h (A10BA02) y Hierro 100mg VO c/24h (B03AA07)."}
{"input": {"dx": ["Endocarditis infecciosa (I33.0)"], "proc": ["Trombolisis EV (99.10)"], "tto": ["Ampicilina/Sulbactam 1.5g EV c/6h (J01CR01)", "Morfina 3mg EV c/4h PRN (N02AA01)", "Ipratropio NBZ c/6h (R03BB01)"], "evo": "Evolucion favorable con tratamiento medico, sin complicaciones", "dx_alta": ["Endocarditis infecciosa resuelto (I33.0)"], "med": ["Glibenclamida 5mg VO c/24h (A10BB01)", "Hierro 100mg VO c/24h (B03AA07)", "Salbutamol INH 2 puff c/6h PRN (R03AC02)", "Ciprofloxacino 500mg VO c/12h 7d (J01MA02)"]}, "output": "Ingresa por endocarditis infecciosa (I33.0). Se realiza trombolisis ev (99.10). Presenta, evolucion favorable con tratamiento medico, sin complicaciones. Recibio tratamiento con Ampicilina/Sulbactam 1.5g EV c/6h (J01CR01), Morfina 3mg EV c/4h PRN (N02AA01) y Ipratropio NBZ c/6h (R03BB01). Buena evolucion, cumpliendo criterios de alta. Alta con diagnostico de endocarditis infecciosa resuelto (I33.0), indicandose Glibenclamida 5mg VO c/24h (A10BB01), Hierro 100mg VO c/24h (B03AA07), Salbutamol INH 2 puff c/6h PRN (R03AC02) y Ciprofloxacino 500mg VO c/12h 7d (J01MA02)."}
{"input": {"dx": ["Enfermedad coronaria de 2 vasos (I25.1)"], "proc": ["Coronariografia (K492)", "Angioplastia OM (36.06)"], "tto": ["Enoxaparina 1mg/kg SC c/12h (B01AB05)", "Ticagrelor 180mg carga (B01AC24)"], "evo": "Oclusion de OM2 con trombo, trombectomia por aspiracion mas stent", "dx_alta": ["Enfermedad coronaria de 2 vasos tratado (I25.1)"], "med": ["Prasugrel 10mg VO c/24h 12m (B01AC22)", "Metoprolol 50mg VO c/12h (C07AB02)", "Carvedilol 6.25mg VO c/12h (C07AG02)"]}, "output": "Se hospitaliza por enfermedad coronaria de 2 vasos (I25.1). Se realiza coronariografia (K492) con hallazgo de lesion significativa, realizandose angioplastia om (36.06) con implante de stent farmacoactivo y flujo TIMI 3 final. Durante la hospitalizacion, oclusion de om2 con trombo, trombectomia por aspiracion mas stent. Recibio tratamiento con Enoxaparina 1mg/kg SC c/12h (B01AB05) y Ticagrelor 180mg carga (B01AC24). Evolucion satisfactoria, cumpliendo criterios de alta. Alta con diagnostico de enfermedad coronaria de 2 vasos tratado (I25.1), indicandose Prasugrel 10mg VO c/24h 12m (B01AC22), Metoprolol 50mg VO c/12h (C07AB02) y Carvedilol 6.25mg VO c/12h (C07AG02)."}
{"input": {"dx": ["Miocarditis (I40.9)"], "proc": ["TAC de abdomen (88.01)", "Angio TAC cerebral (88.38)"], "tto": ["Insulina cristalina segun esquema (A10AB01)", "Hidrocortisona 100mg EV c/8h (H02AB09)"], "evo": "Manejo conservador exitoso, sin necesidad de cirugia", "dx_alta": ["Miocarditis resuelto (I40.9)"], "med": ["Acido folico 1mg VO c/24h (B03BB01)", "Tramadol 50mg VO c/8h 7d (N02AX02)", "Salbutamol INH 2 puff c/6h PRN (R03AC02)"]}, "output": "Se hospitaliza por miocarditis (I40.9). Se realiza tac de abdomen (88.01), angio tac cerebral (88.38). Durante la hospitalizacion, manejo conservador exitoso, sin necesidad de cirugia. Recibio tratamiento con Insulina cristalina segun esquema (A10AB01) y Hidrocortisona 100mg EV c/8h (H02AB09). Buena evolucion, cumpliendo criterios de alta. Alta con diagnostico de miocarditis resuelto (I40.9), indicandose Acido folico 1mg VO c/24h (B03BB01), Tramadol 50mg VO c/8h 7d (N02AX02) y Salbutamol INH 2 puff c/6h PRN (R03AC02)."}
{"input": {"dx": ["Enfermedad coronaria de 3 vasos (I25.1)"], "proc": ["Coronariografia (K492)", "Angioplastia CX (K493)"], "tto": ["Furosemida 80mg EV (C03CA01)", "Digoxina 0.25mg EV (C01AA05)"], "evo": "Fibrilacion auricular de alta respuesta, cardioversion farmacologica exitosa", "dx_alta": ["Enfermedad coronaria de 3 vasos tratado (I25.1)"], "med": ["Isosorbide 20mg VO c/8h (C01DA08)", "Enalapril 10mg VO c/12h (C09AA02)", "Bisoprolol 5mg VO c/24h (C07AB07)", "Aspirina 100mg VO c/24h (B01AC06)", "Digoxina 0.125mg VO c/24h (C01AA05)"]}, "output": "Se hospitaliza por enfermedad coronaria de 3 vasos (I25.1). Se realiza coronariografia (K492) evidenciando oclusion aguda, realizandose angioplastia cx (K493) con implante de stent farmacoactivo y flujo TIMI 3 final. Evoluciona con, fibrilacion auricular de alta respuesta, cardioversion farmacologica exitosa. Recibio tratamiento con Furosemida 80mg EV (C03CA01) y Digoxina 0.25mg EV (C01AA05). Buena evolucion, cumpliendo criterios de alta. Alta con diagnostico de enfermedad coronaria de 3 vasos tratado (I25.1), indicandose Isosorbide 20mg VO c/8h (C01DA08), Enalapril 10mg VO c/12h (C09AA02), Bisoprolol 5mg VO c/24h (C07AB07), Aspirina 100mg VO c/24h (B01AC06) y Digoxina 0.125mg VO c/24h (C01AA05)."}
{"input": {"dx": ["Enfermedad de TCI (I25.1)"], "proc": ["Ecocardiograma (35.05)"], "tto": ["Aspirina 100mg (B01AC06)", "Digoxina 0.25mg EV (C01AA05)", "Enoxaparina 60mg SC c/12h (B01AB05)"], "evo": "Enfermedad de multiples vasos, se deriva a cirugia cardiaca para bypass", "dx_alta": ["Enfermedad de TCI tratado (I25.1)"], "med": ["Ticagrelor 90mg VO c/12h 12m (B01AC24)", "Atorvastatina 40mg VO c/noche (C10AA05)", "Enalapril 10mg VO c/12h (C09AA02)", "Isosorbide 20mg VO c/8h (C01DA08)"]}, "output": "Paciente que ingresa con cuadro de enfermedad de tci (I25.1). Se realiza ecocardiograma (35.05). En su evolucion, enfermedad de multiples vasos, se deriva a cirugia cardiaca para bypass. Recibio tratamiento con Aspirina 100mg (B01AC06), Digoxina 0.25mg EV (C01AA05) y Enoxaparina 60mg SC c/12h (B01AB05). Presenta evolucion favorable, cumpliendo criterios de alta. Alta con diagnostico de enfermedad de tci tratado (I25.1), indicandose Ticagrelor 90mg VO c/12h 12m (B01AC24), Atorvastatina 40mg VO c/noche (C10AA05), Enalapril 10mg VO c/12h (C09AA02) y Isosorbide 20mg VO c/8h (C01DA08)."}
{"input": {"dx": ["Reestenosis intra-stent (I25.5)"], "proc": ["Angioplastia DA (37.0)"], "tto": ["Levosimendan EV (C01CX08)", "Noradrenalina EV (C01CA03)", "Clopidogrel 600mg carga (B01AC04)"], "evo": "Pericarditis aguda con derrame leve, manejo antiinflamatorio", "dx_alta": ["Reestenosis intra-stent tratado (I25.5)"], "med": ["Bisoprolol 5mg VO c/24h (C07AB07)", "Atorvastatina 40mg VO c/noche (C10AA05)", "Rivaroxaban 20mg VO c/24h (B01AF01)", "Aspirina 100mg VO c/24h (B01AC06)"]}, "output": "Ingresa por reestenosis intra-stent (I25.5). Se realiza angioplastia da (37.0). Evoluciona con, pericarditis aguda con derrame leve, manejo antiinflamatorio. Recibio tratamiento con Levosimendan EV (C01CX08), Noradrenalina EV (C01CA03) y Clopidogrel 600mg carga (B01AC04). Evolucion clinica favorable, cumpliendo criterios de alta. Alta con diagnostico de reestenosis intra-stent tratado (I25.5), indicandose Bisoprolol 5mg VO c/24h (C07AB07), Atorvastatina 40mg VO c/noche (C10AA05), Rivaroxaban 20mg VO c/24h (B01AF01) y Aspirina 100mg VO c/24h (B01AC06)."}
{"input": {"dx": ["Trombosis de stent (I21.0)"], "proc": ["Pericardiocentesis (K493)"], "tto": ["Clopidogrel 300mg carga (B01AC04)", "Enoxaparina 1mg/kg SC c/12h (B01AB05)", "Amiodarona 300mg EV (C01BD01)", "Aspirina 300mg carga (B01AC06)"], "evo": "Estenosis aortica severa sintomatica, programada para TAVI", "dx_alta": ["Trombosis de stent tratado (I21.0)"], "med": ["Digoxina 0.125mg VO c/24h (C01AA05)", "Losartan 50mg VO c/24h (C09CA01)", "Furosemida 40mg VO c/24h (C03CA01)", "Amlodipino 5mg VO c/24h (C08CA01)", "Metoprolol 50mg VO c/12h (C07AB02)"]}, "output": "Ingreso por trombosis de stent (I21.0). Se realiza pericardiocentesis (K493). En su evolucion, estenosis aortica severa sintomatica, programada para tavi. Recibio tratamiento con Clopidogrel 300mg carga (B01AC04), Enoxaparina 1mg/kg SC c/12h (B01AB05), Amiodarona 300mg EV (C01BD01) y Aspirina 300mg carga (B01AC06). Evolucion satisfactoria, cumpliendo criterios de alta. Alta con diagnostico de trombosis de stent tratado (I21.0), indicandose Digoxina 0.125mg VO c/24h (C01AA05), Losartan 50mg VO c/24h (C09CA01), Furosemida 40mg VO c/24h (C03CA01), Amlodipino 5mg VO c/24h (C08CA01) y Metoprolol 50mg VO c/12h (C07AB02)."}
{"input": {"dx": ["IAMSEST (I21.4)"], "proc": ["Coronariografia (K492)", "Angioplastia CX (36.06)"], "tto": ["Clopidogrel 300mg carga (B01AC04)", "Ticagrelor 180mg carga (B01AC24)", "Amiodarona 300mg EV (C01BD01)", "Enoxaparina 60mg SC c/12h (B01AB05)"], "evo": "Pericarditis aguda con derrame leve, manejo antiinflamatorio", "dx_alta": ["IAMSEST tratado (I21.4)"], "med": ["Losartan 50mg VO c/24h (C09CA01)", "Digoxina 0.125mg VO c/24h (C01AA05)", "Nitroglicerina SL PRN (C01DA02)", "Ticagrelor 90mg VO c/12h 12m (B01AC24)"]}, "output": "Paciente que ingresa con cuadro de iamsest (I21.4). Se realiza coronariografia (K492) evidenciando oclusion aguda, realizandose angioplastia cx (36.06) con implante de stent farmacoactivo y flujo TIMI 3 final. En su evolucion, pericarditis aguda con derrame leve, manejo antiinflamatorio. Recibio tratamiento con Clopidogrel 300mg carga (B01AC04), Ticagrelor 180mg carga (B01AC24), Amiodarona 300mg EV (C01BD01) y Enoxaparina 60mg SC c/12h (B01AB05). Evolucion satisfactoria, cumpliendo criterios de alta. Alta con diagnostico de iamsest tratado (I21.4), indicandose Losartan 50mg VO c/24h (C09CA01), Digoxina 0.125mg VO c/24h (C01AA05), Nitroglicerina SL PRN (C01DA02) y Ticagrelor 90mg VO c/12h 12m (B01AC24)."}
{"input": {"dx": ["IAMCEST anterolateral (I21.0)"], "proc": ["Coronariografia (K492)"], "tto": ["Nitroglicerina EV (C01DA02)", "Atorvastatina 80mg (C10AA05)", "Amiodarona 300mg EV (C01BD01)"], "evo": "Fibrilacion auricular de alta respuesta, cardioversion farmacologica exitosa", "dx_alta": ["IAMCEST anterolateral tratado (I21.0)"], "med": ["Bisoprolol 5mg VO c/24h (C07AB07)", "Isosorbide 20mg VO c/8h (C01DA08)", "Aspirina 100mg VO c/24h (B01AC06)", "Digoxina 0.125mg VO c/24h (C01AA05)"]}, "output": "Ingreso por iamcest anterolateral (I21.0). Se realiza coronariografia (K492). Durante la hospitalizacion, fibrilacion auricular de alta respuesta, cardioversion farmacologica exitosa. Recibio tratamiento con Nitroglicerina EV (C01DA02), Atorvastatina 80mg (C10AA05) y Amiodarona 300mg EV (C01BD01). Buena evolucion, cumpliendo criterios de alta. Alta con diagnostico de iamcest anterolateral tratado (I21.0), indicandose Bisoprolol 5mg VO c/24h (C07AB07), Isosorbide 20mg VO c/8h (C01DA08), Aspirina 100mg VO c/24h (B01AC06) y Digoxina 0.125mg VO c/24h (C01AA05)."}
{"input": {"dx": ["Enfermedad coronaria de 2 vasos (I25.1)"], "proc": ["Coronariografia (K492)", "Angioplastia TCI (K493)"], "tto": ["Clopidogrel 300mg carga (B01AC04)", "Ticagrelor 180mg carga (B01AC24)", "Furosemida 80mg EV (C03CA01)"], "evo": "Bloqueo AV completo sintomatico, requirio marcapasos transitorio", "dx_alta": ["Enfermedad coronaria de 2 vasos tratado (I25.1)"], "med": ["Bisoprolol 5mg VO c/24h (C07AB07)", "Apixaban 5mg VO c/12h (B01AF02)", "Furosemida 40mg VO c/24h (C03CA01)", "Rivaroxaban 20mg VO c/24h (B01AF01)"]}, "output": "Ingresa por enfermedad coronaria de 2 vasos (I25.1). Se realiza coronariografia (K492) con hallazgo de lesion significativa, realizandose angioplastia tci (K493) con implante de stent farmacoactivo y flujo TIMI 3 final. Durante la hospitalizacion, bloqueo av completo sintomatico, requirio marcapasos transitorio. Recibio tratamiento con Clopidogrel 300mg carga (B01AC04), Ticagrelor 180mg carga (B01AC24) y Furosemida 80mg EV (C03CA01). Presenta evolucion favorable, cumpliendo criterios de alta. Alta con diagnostico de enfermedad coronaria de 2 vasos tratado (I25.1), indicandose Bisoprolol 5mg VO c/24h (C07AB07), Apixaban 5mg VO c/12h (B01AF02), Furosemida 40mg VO c/24h (C03CA01) y Rivaroxaban 20mg VO c/24h (B01AF01)."}
{"input": {"dx": ["IAMCEST anteroseptal (I21.0)"], "proc": ["Coronariografia (K492)", "Angioplastia CD (K493)"], "tto": ["Furosemida 40mg EV (C03CA01)", "Nitroglicerina EV (C01DA02)", "Clopidogrel 600mg carga (B01AC04)"], "evo": "Bloqueo AV completo sintomatico, requirio marcapasos transitorio", "dx_alta": ["IAMCEST anteroseptal tratado (I21.0)"], "med": ["Rosuvastatina 20mg VO c/noche (C10AA07)", "Metoprolol 50mg VO c/12h (C07AB02)", "Digoxina 0.125mg VO c/24h (C01AA05)", "Ticagrelor 90mg VO c/12h 12m (B01AC24)"]}, "output": "Ingreso por iamcest anteroseptal (I21.0). Se realiza coronariografia (K492) encontrando lesion critica, realizandose angioplastia cd (K493) con implante de stent farmacoactivo y flujo TIMI 3 final. Durante la hospitalizacion, bloqueo av completo sintomatico, requirio marcapasos transitorio. Recibio tratamiento con Furosemida 40mg EV (C03CA01), Nitroglicerina EV (C01DA02) y Clopidogrel 600mg carga (B01AC04). Buena evolucion, cumpliendo criterios de alta. Alta con diagnostico de iamcest anteroseptal tratado (I21.0), indicandose Rosuvastatina 20mg VO c/noche (C10AA07), Metoprolol 50mg VO c/12h (C07AB02), Digoxina 0.125mg VO c/24h (C01AA05) y Ticagrelor 90mg VO c/12h 12m (B01AC24)."}
{"input": {"dx": ["IAMCEST lateral (I21.2)"], "proc": ["Coronariografia (K492)", "Angioplastia DA (K493)"], "tto": ["Clopidogrel 600mg carga (B01AC04)", "Heparina 5000UI EV (B01AB01)"], "evo": "Edema pulmonar agudo por disfuncion sistolica, respuesta favorable a diureticos", "dx_alta": ["IAMCEST lateral tratado (I21.2)"], "med": ["Espironolactona 25mg VO c/24h (C03DA01)", "Prasugrel 10mg VO c/24h 12m (B01AC22)", "Warfarina segun INR (B01AA03)"]}, "output": "Ingreso por iamcest lateral (I21.2). Se realiza coronariografia (K492) visualizando estenosis severa, realizandose angioplastia da (K493) con implante de stent farmacoactivo y flujo TIMI 3 final. Presenta, edema pulmonar agudo por disfuncion sistolica, respuesta favorable a diureticos. Recibio tratamiento con Clopidogrel 600mg carga (B01AC04) y Heparina 5000UI EV (B01AB01). Evolucion clinica favorable, cumpliendo criterios de alta. Alta con diagnostico de iamcest lateral tratado (I21.2), indicandose Espironolactona 25mg VO c/24h (C03DA01), Prasugrel 10mg VO c/24h 12m (B01AC22) y Warfarina segun INR (B01AA03)."}
{"input": {"dx": ["IAMCEST posterior (I21.2)"], "proc": ["Coronariografia (K492)", "Angioplastia CD (36.06)"], "tto": ["Noradrenalina EV (C01CA03)", "Heparina 5000UI EV (B01AB01)"], "evo": "Enfermedad de multiples vasos, se deriva a cirugia cardiaca para bypass", "dx_alta": ["IAMCEST posterior tratado (I21.2)"], "med": ["Warfarina segun INR (B01AA03)", "Ticagrelor 90mg VO c/12h 12m (B01AC24)", "Atorvastatina 40mg VO c/noche (C10AA05)", "Prasugrel 10mg VO c/24h 12m (B01AC22)"]}, "output": "Se hospitaliza por iamcest posterior (I21.2). Se realiza coronariografia (K492) encontrando lesion critica, realizandose angioplastia cd (36.06) con implante de stent farmacoactivo y flujo TIMI 3 final. Durante la hospitalizacion, enfermedad de multiples vasos, se deriva a cirugia cardiaca para bypass. Recibio tratamiento con Noradrenalina EV (C01CA03) y Heparina 5000UI EV (B01AB01). Buena evolucion, cumpliendo criterios de alta. Alta con diagnostico de iamcest posterior tratado (I21.2), indicandose Warfarina segun INR (B01AA03), Ticagrelor 90mg VO c/12h 12m (B01AC24), Atorvastatina 40mg VO c/noche (C10AA05) y Prasugrel 10mg VO c/24h 12m (B01AC22)."}
{"input": {"dx": ["Angina estable (I20.8)"], "proc": ["Coronariografia (K492)"], "tto": ["Nitroglicerina EV (C01DA02)", "Heparina 5000UI EV (B01AB01)", "Furosemida 80mg EV (C03CA01)", "Metoprolol 5mg EV (C07AB02)"], "evo": "Lesion severa de CX distal, angioplastia con implante de stent sin complicaciones", "dx_alta": ["Angina estable tratado (I20.8)"], "med": ["Furosemida 40mg VO c/24h (C03CA01)", "Rivaroxaban 20mg VO c/24h (B01AF01)", "Metoprolol 50mg VO c/12h (C07AB02)", "Apixaban 5mg VO c/12h (B01AF02)", "Rosuvastatina 20mg VO c/noche (C10AA07)"]}, "output": "Ingreso por angina estable (I20.8). Se realiza coronariografia (K492). Evoluciona con, lesion severa de cx distal, angioplastia con implante de stent sin complicaciones. Recibio tratamiento con Nitroglicerina EV (C01DA02), Heparina 5000UI EV (B01AB01), Furosemida 80mg EV (C03CA01) y Metoprolol 5mg EV (C07AB02). Evolucion satisfactoria, cumpliendo criterios de alta. Alta con diagnostico de angina estable tratado (I20.8), indicandose Furosemida 40mg VO c/24h (C03CA01), Rivaroxaban 20mg VO c/24h (B01AF01), Metoprolol 50mg VO c/12h (C07AB02), Apixaban 5mg VO c/12h (B01AF02) y Rosuvastatina 20mg VO c/noche (C10AA07)."}
{"input": {"dx": ["Insuficiencia renal aguda (N17.9)"], "proc": ["Paracentesis (54.91)", "Hernioplastia inguinal (53.00)"], "tto": ["Ceftriaxona 2g EV c/24h (J01DD04)", "Metronidazol 500mg EV c/8h (J01XD01)"], "evo": "Manejo conservador exitoso, sin necesidad de cirugia", "dx_alta": ["Insuficiencia renal aguda resuelto (N17.9)"], "med": ["Hierro 100mg VO c/24h (B03AA07)", "Salbutamol INH 2 puff c/6h PRN (R03AC02)", "Omeprazol 20mg VO c/24h (A02BC01)"]}, "output": "Ingreso por insuficiencia renal aguda (N17.9). Se realiza paracentesis (54.91), hernioplastia inguinal (53.00). Presenta, manejo conservador exitoso, sin necesidad de cirugia. Recibio tratamiento con Ceftriaxona 2g EV c/24h (J01DD04) y Metronidazol 500mg EV c/8h (J01XD01). Evolucion clinica favorable, cumpliendo criterios de alta. Alta con diagnostico de insuficiencia renal aguda resuelto (N17.9), indicandose Hierro 100mg VO c/24h (B03AA07), Salbutamol INH 2 puff c/6h PRN (R03AC02) y Omeprazol 20mg VO c/24h (A02BC01)."}
{"input": {"dx": ["Angina estable (I20.8)"], "proc": ["Coronariografia (K492)", "Angioplastia CX (36.06)"], "tto": ["Ticagrelor 180mg carga (B01AC24)", "Atorvastatina 80mg (C10AA05)", "Heparina 5000UI EV (B01AB01)", "Enalapril 5mg VO (C09AA02)"], "evo": "SDST en V1-V6, coronarias sin lesiones obstructivas, sindrome de Tako-Tsubo", "dx_alta": ["Angina estable tratado (I20.8)"], "med": ["Metoprolol 50mg VO c/12h (C07AB02)", "Espironolactona 25mg VO c/24h (C03DA01)", "Nitroglicerina SL PRN (C01DA02)", "Atorvastatina 40mg VO c/noche (C10AA05)", "Isosorbide 20mg VO c/8h (C01DA08)"]}, "output": "Ingreso por angina estable (I20.8). Se realiza coronariografia (K492) con hallazgo de lesion significativa, realizandose angioplastia cx (36.06) con implante de stent farmacoactivo y flujo TIMI 3 final. Durante la hospitalizacion, sdst en v1-v6, coronarias sin lesiones obstructivas, sindrome de tako-tsubo. Recibio tratamiento con Ticagrelor 180mg carga (B01AC24), Atorvastatina 80mg (C10AA05), Heparina 5000UI EV (B01AB01) y Enalapril 5mg VO (C09AA02). Presenta evolucion favorable, cumpliendo criterios de alta. Alta con diagnostico de angina estable tratado (I20.8), indicandose Metoprolol 50mg VO c/12h (C07AB02), Espironolactona 25mg VO c/24h (C03DA01), Nitroglicerina SL PRN (C01DA02), Atorvastatina 40mg VO c/noche (C10AA05) y Isosorbide 20mg VO c/8h (C01DA08)."}
{"input": {"dx": ["Enfermedad coronaria de 2 vasos (I25.1)"], "proc": ["Coronariografia (K492)", "Angioplastia CX (36.06)"], "tto": ["Atorvastatina 80mg (C10AA05)", "Enalapril 5mg VO (C09AA02)", "Morfina 3mg EV (N02AA01)"], "evo": "Fibrilacion auricular de alta respuesta, cardioversion farmacologica exitosa", "dx_alta": ["Enfermedad coronaria de 2 vasos tratado (I25.1)"], "med": ["Carvedilol 6.25mg VO c/12h (C07AG02)", "Furosemida 40mg VO c/24h (C03CA01)", "Rosuvastatina 20mg VO c/noche (C10AA07)", "Enalapril 10mg VO c/12h (C09AA02)"]}, "output": "Se hospitaliza por enfermedad coronaria de 2 vasos (I25.1). Se realiza coronariografia (K492) evidenciando oclusion aguda, realizandose angioplastia cx (36.06) con implante de stent farmacoactivo y flujo TIMI 3 final. Durante la hospitalizacion, fibrilacion auricular de alta respuesta, cardioversion farmacologica exitosa. Recibio tratamiento con Atorvastatina 80mg (C10AA05), Enalapril 5mg VO (C09AA02) y Morfina 3mg EV (N02AA01). Evolucion clinica favorable, cumpliendo criterios de alta. Alta con diagnostico de enfermedad coronaria de 2 vasos tratado (I25.1), indicandose Carvedilol 6.25mg VO c/12h (C07AG02), Furosemida 40mg VO c/24h (C03CA01), Rosuvastatina 20mg VO c/noche (C10AA07) y Enalapril 10mg VO c/12h (C09AA02)."}
{"input": {"dx": ["Insuficiencia cardiaca aguda (I50.9)"], "proc": ["Angioplastia TCI (88.72)"], "tto": ["Metoprolol 5mg EV (C07AB02)", "Ticagrelor 180mg carga (B01AC24)"], "evo": "Pericarditis aguda con derrame leve, manejo antiinflamatorio", "dx_alta": ["Insuficiencia cardiaca aguda tratado (I50.9)"], "med": ["Enalapril 10mg VO c/12h (C09AA02)", "Prasugrel 10mg VO c/24h 12m (B01AC22)", "Warfarina segun INR (B01AA03)", "Digoxina 0.125mg VO c/24h (C01AA05)", "Atorvastatina 40mg VO c/noche (C10AA05)"]}, "output": "Se hospitaliza por insuficiencia cardiaca aguda (I50.9). Se realiza angioplastia tci (88.72). En su evolucion, pericarditis aguda con derrame leve, manejo antiinflamatorio. Recibio tratamiento con Metoprolol 5mg EV (C07AB02) y Ticagrelor 180mg carga (B01AC24). Buena evolucion, cumpliendo criterios de alta. Alta con diagnostico de insuficiencia cardiaca aguda tratado (I50.9), indicandose Enalapril 10mg VO c/12h (C09AA02), Prasugrel 10mg VO c/24h 12m (B01AC22), Warfarina segun INR (B01AA03), Digoxina 0.125mg VO c/24h (C01AA05) y Atorvastatina 40mg VO c/noche (C10AA05)."}
{"input": {"dx": ["Insuficiencia cardiaca aguda (I50.9)"], "proc": ["Angioplastia CX (89.41)"], "tto": ["Heparina EV infusion (B01AB01)", "Atorvastatina 80mg (C10AA05)"], "evo": "Enfermedad de multiples vasos, se deriva a cirugia cardiaca para bypass", "dx_alta": ["Insuficiencia cardiaca aguda tratado (I50.9)"], "med": ["Espironolactona 25mg VO c/24h (C03DA01)", "Prasugrel 10mg VO c/24h 12m (B01AC22)", "Aspirina 100mg VO c/24h (B01AC06)", "Enalapril 10mg VO c/12h (C09AA02)", "Digoxina 0.125mg VO c/24h (C01AA05)"]}, "output": "Ingreso por insuficiencia cardiaca aguda (I50.9). Se realiza angioplastia cx (89.41). Evoluciona con, enfermedad de multiples vasos, se deriva a cirugia cardiaca para bypass. Recibio tratamiento con Heparina EV infusion (B01AB01) y Atorvastatina 80mg (C10AA05). Buena evolucion, cumpliendo criterios de alta. Alta con diagnostico de insuficiencia cardiaca aguda tratado (I50.9), indicandose Espironolactona 25mg VO c/24h (C03DA01), Prasugrel 10mg VO c/24h 12m (B01AC22), Aspirina 100mg VO c/24h (B01AC06), Enalapril 10mg VO c/12h (C09AA02) y Digoxina 0.125mg VO c/24h (C01AA05)."}
{"input": {"dx": ["IAMCEST inferior (I21.1)"], "proc": ["Coronariografia (K492)", "Angioplastia TCI (K493)"], "tto": ["Furosemida 40mg EV (C03CA01)", "Metoprolol 5mg EV (C07AB02)"], "evo": "Lesion severa de OM2, angioplastia con implante de stent sin complicaciones", "dx_alta": ["IAMCEST inferior tratado (I21.1)"], "med": ["Rivaroxaban 20mg VO c/24h (B01AF01)", "Isosorbide 20mg VO c/8h (C01DA08)", "Enalapril 10mg VO c/12h (C09AA02)"]}, "output": "Ingresa por iamcest inferior (I21.1). Se realiza coronariografia (K492) evidenciando oclusion aguda, realizandose angioplastia tci (K493) con implante de stent farmacoactivo y flujo TIMI 3 final. Durante la hospitalizacion, lesion severa de om2, angioplastia con implante de stent sin complicaciones. Recibio tratamiento con Furosemida 40mg EV (C03CA01) y Metoprolol 5mg EV (C07AB02). Evolucion satisfactoria, cumpliendo criterios de alta. Alta con diagnostico de iamcest inferior tratado (I21.1), indicandose Rivaroxaban 20mg VO c/24h (B01AF01), Isosorbide 20mg VO c/8h (C01DA08) y Enalapril 10mg VO c/12h (C09AA02)."}
{"input": {"dx": ["Shock cardiogenico (R57.0)"], "proc": ["Holter ECG (35.05)"], "tto": ["Amiodarona 300mg EV (C01BD01)", "Prasugrel 60mg carga (B01AC22)", "Noradrenalina EV (C01CA03)"], "evo": "Fibrilacion auricular de alta respuesta, cardioversion farmacologica exitosa", "dx_alta": ["Shock cardiogenico tratado (R57.0)"], "med": ["Clopidogrel 75mg VO c/24h 12m (B01AC04)", "Prasugrel 10mg VO c/24h 12m (B01AC22)", "Warfarina segun INR (B01AA03)", "Nitroglicerina SL PRN (C01DA02)", "Rosuvastatina 20mg VO c/noche (C10AA07)"]}, "output": "Ingresa por shock cardiogenico (R57.0). Se realiza holter ecg (35.05). En su evolucion, fibrilacion auricular de alta respuesta, cardioversion farmacologica exitosa. Recibio tratamiento con Amiodarona 300mg EV (C01BD01), Prasugrel 60mg carga (B01AC22) y Noradrenalina EV (C01CA03). Evolucion clinica favorable, cumpliendo criterios de alta. Alta con diagnostico de shock cardiogenico tratado (R57.0), indicandose Clopidogrel 75mg VO c/24h 12m (B01AC04), Prasugrel 10mg VO c/24h 12m (B01AC22), Warfarina segun INR (B01AA03), Nitroglicerina SL PRN (C01DA02) y Rosuvastatina 20mg VO c/noche (C10AA07)."}
{"input": {"dx": ["IAMCEST lateral (I21.2)"], "proc": ["Coronariografia (K492)"], "tto": ["Amiodarona 300mg EV (C01BD01)", "Dobutamina EV (C01CA07)", "Metoprolol 5mg EV (C07AB02)"], "evo": "Enfermedad de multiples vasos, se deriva a cirugia cardiaca para bypass", "dx_alta": ["IAMCEST lateral tratado (I21.2)"], "med": ["Enalapril 10mg VO c/12h (C09AA02)", "Furosemida 40mg VO c/24h (C03CA01)", "Ticagrelor 90mg VO c/12h 12m (B01AC24)", "Atorvastatina 40mg VO c/noche (C10AA05)"]}, "output": "Se hospitaliza por iamcest lateral (I21.2). Se realiza coronariografia (K492). En su evolucion, enfermedad de multiples vasos, se deriva a cirugia cardiaca para bypass. Recibio tratamiento con Amiodarona 300mg EV (C01BD01), Dobutamina EV (C01CA07) y Metoprolol 5mg EV (C07AB02). Evolucion satisfactoria, cumpliendo criterios de alta. Alta con diagnostico de iamcest lateral tratado (I21.2), indicandose Enalapril 10mg VO c/12h (C09AA02), Furosemida 40mg VO c/24h (C03CA01), Ticagrelor 90mg VO c/12h 12m (B01AC24) y Atorvastatina 40mg VO c/noche (C10AA05)."}
{"input": {"dx": ["IAMSEST (I21.4)"], "proc": ["Coronariografia (K492)", "Angioplastia CX (K493)"], "tto": ["Heparina EV infusion (B01AB01)", "Aspirina 100mg (B01AC06)"], "evo": "Estenosis aortica severa sintomatica, programada para TAVI", "dx_alta": ["IAMSEST tratado (I21.4)"], "med": ["Isosorbide 20mg VO c/8h (C01DA08)", "Enalapril 10mg VO c/12h (C09AA02)", "Furosemida 40mg VO c/24h (C03CA01)", "Prasugrel 10mg VO c/24h 12m (B01AC22)", "Nitroglicerina SL PRN (C01DA02)"]}, "output": "Se hospitaliza por iamsest (I21.4). Se realiza coronariografia (K492) con hallazgo de lesion significativa, realizandose angioplastia cx (K493) con implante de stent farmacoactivo y flujo TIMI 3 final. Presenta, estenosis aortica severa sintomatica, programada para tavi. Recibio tratamiento con Heparina EV infusion (B01AB01) y Aspirina 100mg (B01AC06). Evolucion satisfactoria, cumpliendo criterios de alta. Alta con diagnostico de iamsest tratado (I21.4), indicandose Isosorbide 20mg VO c/8h (C01DA08), Enalapril 10mg VO c/12h (C09AA02), Furosemida 40mg VO c/24h (C03CA01), Prasugrel 10mg VO c/24h 12m (B01AC22) y Nitroglicerina SL PRN (C01DA02)."}
{"input": {"dx": ["Shock cardiogenico (R57.0)"], "proc": ["Angioplastia (89.64)"], "tto": ["Nitroglicerina EV (C01DA02)", "Dobutamina EV (C01CA07)", "Ticagrelor 180mg carga (B01AC24)", "Heparina 5000UI EV (B01AB01)"], "evo": "Lesion severa de CD proximal, angioplastia con implante de stent sin complicaciones", "dx_alta": ["Shock cardiogenico tratado (R57.0)"], "med": ["Aspirina 100mg VO c/24h (B01AC06)", "Rosuvastatina 20mg VO c/noche (C10AA07)", "Clopidogrel 75mg VO c/24h 12m (B01AC04)", "Apixaban 5mg VO c/12h (B01AF02)", "Espironolactona 25mg VO c/24h (C03DA01)"]}, "output": "Ingreso por shock cardiogenico (R57.0). Se realiza angioplastia (89.64). Presenta, lesion severa de cd proximal, angioplastia con implante de stent sin complicaciones. Recibio tratamiento con Nitroglicerina EV (C01DA02), Dobutamina EV (C01CA07), Ticagrelor 180mg carga (B01AC24) y Heparina 5000UI EV (B01AB01). Evolucion clinica favorable, cumpliendo criterios de alta. Alta con diagnostico de shock cardiogenico tratado (R57.0), indicandose Aspirina 100mg VO c/24h (B01AC06), Rosuvastatina 20mg VO c/noche (C10AA07), Clopidogrel 75mg VO c/24h 12m (B01AC04), Apixaban 5mg VO c/12h (B01AF02) y Espironolactona 25mg VO c/24h (C03DA01)."}
{"input": {"dx": ["Crisis hipertensiva (I10)"], "proc": ["Ecografia abdominal (88.76)", "Trombectomia mecanica (39.74)"], "tto": ["Ciprofloxacino 400mg EV c/12h (J01MA02)", "Piperacilina/Tazobactam 4.5g EV c/8h (J01CR05)", "Ipratropio NBZ c/6h (R03BB01)"], "evo": "Respuesta adecuada al tratamiento antibiotico, afebril desde dia 2", "dx_alta": ["Crisis hipertensiva resuelto (I10)"], "med": ["Salbutamol INH 2 puff c/6h PRN (R03AC02)", "Acido folico 1mg VO c/24h (B03BB01)"]}, "output": "Ingreso por crisis hipertensiva (I10). Se realiza ecografia abdominal (88.76), trombectomia mecanica (39.74). Presenta, respuesta adecuada al tratamiento antibiotico, afebril desde dia 2. Recibio tratamiento con Ciprofloxacino 400mg EV c/12h (J01MA02), Piperacilina/Tazobactam 4.5g EV c/8h (J01CR05) y Ipratropio NBZ c/6h (R03BB01). Evolucion satisfactoria, cumpliendo criterios de alta. Alta con diagnostico de crisis hipertensiva resuelto (I10), indicandose Salbutamol INH 2 puff c/6h PRN (R03AC02) y Acido folico 1mg VO c/24h (B03BB01)."}
{"input": {"dx": ["Asma bronquial exacerbada (J45.9)"], "proc": ["Trombolisis EV (99.10)"], "tto": ["Piperacilina/Tazobactam 4.5g EV c/8h (J01CR05)", "Ceftriaxona 2g EV c/24h (J01DD04)"], "evo": "Estabilizacion clinica progresiva, sin eventos adversos", "dx_alta": ["Asma bronquial exacerbada resuelto (J45.9)"], "med": ["Hierro 100mg VO c/24h (B03AA07)", "Clonazepam 0.5mg VO c/noche (N03AE01)"]}, "output": "Ingresa por asma bronquial exacerbada (J45.9). Se realiza trombolisis ev (99.10). Evoluciona con, estabilizacion clinica progresiva, sin eventos adversos. Recibio tratamiento con Piperacilina/Tazobactam 4.5g EV c/8h (J01CR05) y Ceftriaxona 2g EV c/24h (J01DD04). Evolucion satisfactoria, cumpliendo criterios de alta. Alta con diagnostico de asma bronquial exacerbada resuelto (J45.9), indicandose Hierro 100mg VO c/24h (B03AA07) y Clonazepam 0.5mg VO c/noche (N03AE01)."}
{"input": {"dx": ["Trombosis de stent (I21.0)"], "proc": ["Implante de marcapasos (35.04)"], "tto": ["Amiodarona 300mg EV (C01BD01)", "Heparina EV infusion (B01AB01)", "Clopidogrel 600mg carga (B01AC04)", "Ticagrelor 180mg carga (B01AC24)"], "evo": "Taquicardia ventricular sostenida, cardioversion electrica exitosa", "dx_alta": ["Trombosis de stent tratado (I21.0)"], "med": ["Espironolactona 25mg VO c/24h (C03DA01)", "Prasugrel 10mg VO c/24h 12m (B01AC22)", "Aspirina 100mg VO c/24h (B01AC06)", "Atorvastatina 40mg VO c/noche (C10AA05)"]}, "output": "Paciente que ingresa con cuadro de trombosis de stent (I21.0). Se realiza implante de marcapasos (35.04). Presenta, taquicardia ventricular sostenida, cardioversion electrica exitosa. Recibio tratamiento con Amiodarona 300mg EV (C01BD01), Heparina EV infusion (B01AB01), Clopidogrel 600mg carga (B01AC04) y Ticagrelor 180mg carga (B01AC24). Presenta evolucion favorable, cumpliendo criterios de alta. Alta con diagnostico de trombosis de stent tratado (I21.0), indicandose Espironolactona 25mg VO c/24h (C03DA01), Prasugrel 10mg VO c/24h 12m (B01AC22), Aspirina 100mg VO c/24h (B01AC06) y Atorvastatina 40mg VO c/noche (C10AA05)."}
{"input": {"dx": ["IAMCEST lateral (I21.2)"], "proc": ["Coronariografia (K492)", "Angioplastia DA (36.06)"], "tto": ["Levosimendan EV (C01CX08)", "Aspirina 300mg carga (B01AC06)"], "evo": "Bloqueo AV completo sintomatico, requirio marcapasos transitorio", "dx_alta": ["IAMCEST lateral tratado (I21.2)"], "med": ["Rosuvastatina 20mg VO c/noche (C10AA07)", "Metoprolol 50mg VO c/12h (C07AB02)", "Espironolactona 25mg VO c/24h (C03DA01)", "Nitroglicerina SL PRN (C01DA02)", "Atorvastatina 40mg VO c/noche (C10AA05)"]}, "output": "Ingreso por iamcest lateral (I21.2). Se realiza coronariografia (K492) evidenciando oclusion aguda, realizandose angioplastia da (36.06) con implante de stent farmacoactivo y flujo TIMI 3 final. Evoluciona con, bloqueo av completo sintomatico, requirio marcapasos transitorio. Recibio tratamiento con Levosimendan EV (C01CX08) y Aspirina 300mg carga (B01AC06). Evolucion clinica favorable, cumpliendo criterios de alta. Alta con diagnostico de iamcest lateral tratado (I21.2), indicandose Rosuvastatina 20mg VO c/noche (C10AA07), Metoprolol 50mg VO c/12h (C07AB02), Espironolactona 25mg VO c/24h (C03DA01), Nitroglicerina SL PRN (C01DA02) y Atorvastatina 40mg VO c/noche (C10AA05)."}
{"input": {"dx": ["EPOC exacerbado (J44.1)"], "proc": ["Ecografia abdominal (88.76)"], "tto": ["Ciprofloxacino 400mg EV c/12h (J01MA02)", "Piperacilina/Tazobactam 4.5g EV c/8h (J01CR05)", "Insulina cristalina segun esquema (A10AB01)"], "evo": "Cirugia programada sin complicaciones, alta precoz", "dx_alta": ["EPOC exacerbado resuelto (J44.1)"], "med": ["Prednisona 20mg VO c/24h (H02AB07)", "Sertralina 50mg VO c/24h (N06AB06)"]}, "output": "Ingreso por epoc exacerbado (J44.1). Se realiza ecografia abdominal (88.76). En su evolucion, cirugia programada sin complicaciones, alta precoz. Recibio tratamiento con Ciprofloxacino 400mg EV c/12h (J01MA02), Piperacilina/Tazobactam 4.5g EV c/8h (J01CR05) y Insulina cristalina segun esquema (A10AB01). Evolucion satisfactoria, cumpliendo criterios de alta. Alta con diagnostico de epoc exacerbado resuelto (J44.1), indicandose Prednisona 20mg VO c/24h (H02AB07) y Sertralina 50mg VO c/24h (N06AB06)."}
{"input": {"dx": ["Angina estable (I20.8)"], "proc": ["Coronariografia (K492)", "Angioplastia OM (36.06)"], "tto": ["Nitroglicerina EV (C01DA02)", "Clopidogrel 600mg carga (B01AC04)", "Clopidogrel 300mg carga (B01AC04)"], "evo": "Edema pulmonar agudo por disfuncion sistolica, respuesta favorable a diureticos", "dx_alta": ["Angina estable tratado (I20.8)"], "med": ["Clopidogrel 75mg VO c/24h 12m (B01AC04)", "Losartan 50mg VO c/24h (C09CA01)", "Espironolactona 25mg VO c/24h (C03DA01)", "Bisoprolol 5mg VO c/24h (C07AB07)"]}, "output": "Ingreso por angina estable (I20.8). Se realiza coronariografia (K492) evidenciando oclusion aguda, realizandose angioplastia om (36.06) con implante de stent farmacoactivo y flujo TIMI 3 final. Evoluciona con, edema pulmonar agudo por disfuncion sistolica, respuesta favorable a diureticos. Recibio tratamiento con Nitroglicerina EV (C01DA02), Clopidogrel 600mg carga (B01AC04) y Clopidogrel 300mg carga (B01AC04). Presenta evolucion favorable, cumpliendo criterios de alta. Alta con diagnostico de angina estable tratado (I20.8), indicandose Clopidogrel 75mg VO c/24h 12m (B01AC04), Losartan 50mg VO c/24h (C09CA01), Espironolactona 25mg VO c/24h (C03DA01) y Bisoprolol 5mg VO c/24h (C07AB07)."}
{"input": {"dx": ["Edema pulmonar agudo (J81)"], "proc": ["Ablacion por radiofrecuencia (K493)"], "tto": ["Enoxaparina 1mg/kg SC c/12h (B01AB05)", "Enalapril 5mg VO (C09AA02)", "Amiodarona 300mg EV (C01BD01)"], "evo": "Oclusion aguda de ramus intermedio, angioplastia exitosa con stent farmacoactivo, flujo TIMI 3 final", "dx_alta": ["Edema pulmonar agudo tratado (J81)"], "med": ["Rivaroxaban 20mg VO c/24h (B01AF01)", "Ticagrelor 90mg VO c/12h 12m (B01AC24)", "Espironolactona 25mg VO c/24h (C03DA01)", "Rosuvastatina 20mg VO c/noche (C10AA07)"]}, "output": "Se hospitaliza por edema pulmonar agudo (J81). Se realiza ablacion por radiofrecuencia (K493). Evoluciona con, oclusion aguda de ramus intermedio, angioplastia exitosa con stent farmacoactivo, flujo timi 3 final. Recibio tratamiento con Enoxaparina 1mg/kg SC c/12h (B01AB05), Enalapril 5mg VO (C09AA02) y Amiodarona 300mg EV (C01BD01). Presenta evolucion favorable, cumpliendo criterios de alta. Alta con diagnostico de edema pulmonar agudo tratado (J81), indicandose Rivaroxaban 20mg VO c/24h (B01AF01), Ticagrelor 90mg VO c/12h 12m (B01AC24), Espironolactona 25mg VO c/24h (C03DA01) y Rosuvastatina 20mg VO c/noche (C10AA07)."}
{"input": {"dx": ["ACV hemorragico (I61.9)"], "proc": ["Paracentesis (54.91)", "Trombectomia mecanica (39.74)"], "tto": ["Pantoprazol 40mg EV c/12h (A02BC02)", "Ipratropio NBZ c/6h (R03BB01)", "Metoclopramida 10mg EV c/8h (A03FA01)", "Morfina 3mg EV c/4h PRN (N02AA01)"], "evo": "Cirugia programada sin complicaciones, alta precoz", "dx_alta": ["ACV hemorragico resuelto (I61.9)"], "med": ["Tramadol 50mg VO c/8h 7d (N02AX02)", "Acido folico 1mg VO c/24h (B03BB01)"]}, "output": "Ingresa por acv hemorragico (I61.9). Se realiza paracentesis (54.91), trombectomia mecanica (39.74). Durante la hospitalizacion, cirugia programada sin complicaciones, alta precoz. Recibio tratamiento con Pantoprazol 40mg EV c/12h (A02BC02), Ipratropio NBZ c/6h (R03BB01), Metoclopramida 10mg EV c/8h (A03FA01) y Morfina 3mg EV c/4h PRN (N02AA01). Evolucion satisfactoria, cumpliendo criterios de alta. Alta con diagnostico de acv hemorragico resuelto (I61.9), indicandose Tramadol 50mg VO c/8h 7d (N02AX02) y Acido folico 1mg VO c/24h (B03BB01)."}
{"input": {"dx": ["Angina inestable (I20.0)"], "proc": ["Coronariografia (K492)", "Angioplastia DA (36.06)"], "tto": ["Prasugrel 60mg carga (B01AC22)", "Morfina 3mg EV (N02AA01)"], "evo": "Lesion critica de CX distal, estabilizacion hemodinamica, angioplastia diferida", "dx_alta": ["Angina inestable tratado (I20.0)"], "med": ["Amlodipino 5mg VO c/24h (C08CA01)", "Metoprolol 50mg VO c/12h (C07AB02)", "Apixaban 5mg VO c/12h (B01AF02)"]}, "output": "Paciente que ingresa con cuadro de angina inestable (I20.0). Se realiza coronariografia (K492) evidenciando oclusion aguda, realizandose angioplastia da (36.06) con implante de stent farmacoactivo y flujo TIMI 3 final. Durante la hospitalizacion, lesion critica de cx distal, estabilizacion hemodinamica, angioplastia diferida. Recibio tratamiento con Prasugrel 60mg carga (B01AC22) y Morfina 3mg EV (N02AA01). Evolucion satisfactoria, cumpliendo criterios de alta. Alta con diagnostico de angina inestable tratado (I20.0), indicandose Amlodipino 5mg VO c/24h (C08CA01), Metoprolol 50mg VO c/12h (C07AB02) y Apixaban 5mg VO c/12h (B01AF02)."}
{"input": {"dx": ["IAMSEST (I21.4)"], "proc": ["Coronariografia (K492)", "Angioplastia OM (K493)"], "tto": ["Amiodarona 300mg EV (C01BD01)", "Levosimendan EV (C01CX08)"], "evo": "Enfermedad de multiples vasos, se deriva a cirugia cardiaca para bypass", "dx_alta": ["IAMSEST tratado (I21.4)"], "med": ["Aspirina 100mg VO c/24h (B01AC06)", "Furosemida 40mg VO c/24h (C03CA01)", "Enalapril 10mg VO c/12h (C09AA02)", "Apixaban 5mg VO c/12h (B01AF02)", "Ticagrelor 90mg VO c/12h 12m (B01AC24)"]}, "output": "Ingreso por iamsest (I21.4). Se realiza coronariografia (K492) visualizando estenosis severa, realizandose angioplastia om (K493) con implante de stent farmacoactivo y flujo TIMI 3 final. Presenta, enfermedad de multiples vasos, se deriva a cirugia cardiaca para bypass. Recibio tratamiento con Amiodarona 300mg EV (C01BD01) y Levosimendan EV (C01CX08). Evolucion satisfactoria, cumpliendo criterios de alta. Alta con diagnostico de iamsest tratado (I21.4), indicandose Aspirina 100mg VO c/24h (B01AC06), Furosemida 40mg VO c/24h (C03CA01), Enalapril 10mg VO c/12h (C09AA02), Apixaban 5mg VO c/12h (B01AF02) y Ticagrelor 90mg VO c/12h 12m (B01AC24)."}
{"input": {"dx": ["Enfermedad de TCI (I25.1)"], "proc": ["Cardioversion electrica (88.72)"], "tto": ["Metoprolol 5mg EV (C07AB02)", "Enoxaparina 1mg/kg SC c/12h (B01AB05)", "Clopidogrel 300mg carga (B01AC04)"], "evo": "Fibrilacion auricular de alta respuesta, cardioversion farmacologica exitosa", "dx_alta": ["Enfermedad de TCI tratado (I25.1)"], "med": ["Enalapril 10mg VO c/12h (C09AA02)", "Digoxina 0.125mg VO c/24h (C01AA05)", "Aspirina 100mg VO c/24h (B01AC06)", "Bisoprolol 5mg VO c/24h (C07AB07)", "Rosuvastatina 20mg VO c/noche (C10AA07)"]}, "output": "Ingresa por enfermedad de tci (I25.1). Se realiza cardioversion electrica (88.72). Durante la hospitalizacion, fibrilacion auricular de alta respuesta, cardioversion farmacologica exitosa. Recibio tratamiento con Metoprolol 5mg EV (C07AB02), Enoxaparina 1mg/kg SC c/12h (B01AB05) y Clopidogrel 300mg carga (B01AC04). Evolucion satisfactoria, cumpliendo criterios de alta. Alta con diagnostico de enfermedad de tci tratado (I25.1), indicandose Enalapril 10mg VO c/12h (C09AA02), Digoxina 0.125mg VO c/24h (C01AA05), Aspirina 100mg VO c/24h (B01AC06), Bisoprolol 5mg VO c/24h (C07AB07) y Rosuvastatina 20mg VO c/noche (C10AA07)."}
{"input": {"dx": ["Celulitis (L03.9)"], "proc": ["Hernioplastia inguinal (53.00)", "Hemodialisis (39.95)"], "tto": ["N-acetilcisteina NBZ c/8h (R05CB01)", "Tramadol 50mg EV c/8h (N02AX02)"], "evo": "Sin complicaciones postoperatorias, herida operatoria limpia", "dx_alta": ["Celulitis resuelto (L03.9)"], "med": ["Ciprofloxacino 500mg VO c/12h 7d (J01MA02)", "Amoxicilina/Clavulanico 875mg VO c/12h 7d (J01CR02)", "Paracetamol 500mg VO c/8h PRN (N02BE01)"]}, "output": "Se hospitaliza por celulitis (L03.9). Se realiza hernioplastia inguinal (53.00), hemodialisis (39.95). Evoluciona con, sin complicaciones postoperatorias, herida operatoria limpia. Recibio tratamiento con N-acetilcisteina NBZ c/8h (R05CB01) y Tramadol 50mg EV c/8h (N02AX02). Presenta evolucion favorable, cumpliendo criterios de alta. Alta con diagnostico de celulitis resuelto (L03.9), indicandose Ciprofloxacino 500mg VO c/12h 7d (J01MA02), Amoxicilina/Clavulanico 875mg VO c/12h 7d (J01CR02) y Paracetamol 500mg VO c/8h PRN (N02BE01)."}
{"input": {"dx": ["IAMCEST anteroseptal (I21.0)"], "proc": ["Coronariografia (K492)"], "tto": ["Nitroglicerina EV (C01DA02)", "Furosemida 80mg EV (C03CA01)", "Aspirina 100mg (B01AC06)"], "evo": "SDST en V5-V6, coronarias sin lesiones obstructivas, sindrome de Tako-Tsubo", "dx_alta": ["IAMCEST anteroseptal tratado (I21.0)"], "med": ["Amlodipino 5mg VO c/24h (C08CA01)", "Digoxina 0.125mg VO c/24h (C01AA05)", "Rosuvastatina 20mg VO c/noche (C10AA07)", "Apixaban 5mg VO c/12h (B01AF02)"]}, "output": "Se hospitaliza por iamcest anteroseptal (I21.0). Se realiza coronariografia (K492). Evoluciona con, sdst en v5-v6, coronarias sin lesiones obstructivas, sindrome de tako-tsubo. Recibio tratamiento con Nitroglicerina EV (C01DA02), Furosemida 80mg EV (C03CA01) y Aspirina 100mg (B01AC06). Buena evolucion, cumpliendo criterios de alta. Alta con diagnostico de iamcest anteroseptal tratado (I21.0), indicandose Amlodipino 5mg VO c/24h (C08CA01), Digoxina 0.125mg VO c/24h (C01AA05), Rosuvastatina 20mg VO c/noche (C10AA07) y Apixaban 5mg VO c/12h (B01AF02)."}
{"input": {"dx": ["TEP agudo (I26.9)"], "proc": ["Trombolisis EV (99.10)"], "tto": ["Paracetamol 1g EV c/8h (N02BE01)", "Morfina 3mg EV c/4h PRN (N02AA01)"], "evo": "Control de sintomas con tratamiento medico optimizado", "dx_alta": ["TEP agudo resuelto (I26.9)"], "med": ["Budesonide/Formoterol INH c/12h (R03AK07)", "Tramadol 50mg VO c/8h 7d (N02AX02)", "Hierro 100mg VO c/24h (B03AA07)", "Omeprazol 20mg VO c/24h (A02BC01)"]}, "output": "Se hospitaliza por tep agudo (I26.9). Se realiza trombolisis ev (99.10). Durante la hospitalizacion, control de sintomas con tratamiento medico optimizado. Recibio tratamiento con Paracetamol 1g EV c/8h (N02BE01) y Morfina 3mg EV c/4h PRN (N02AA01). Evolucion satisfactoria, cumpliendo criterios de alta. Alta con diagnostico de tep agudo resuelto (I26.9), indicandose Budesonide/Formoterol INH c/12h (R03AK07), Tramadol 50mg VO c/8h 7d (N02AX02), Hierro 100mg VO c/24h (B03AA07) y Omeprazol 20mg VO c/24h (A02BC01)."}
{"input": {"dx": ["IAMSEST alto riesgo (I21.4)"], "proc": ["Coronariografia (K492)", "Angioplastia CX (K493)"], "tto": ["Clopidogrel 300mg carga (B01AC04)", "Metoprolol 5mg EV (C07AB02)", "Heparina 5000UI EV (B01AB01)", "Dobutamina EV (C01CA07)"], "evo": "Taquicardia ventricular sostenida, cardioversion electrica exitosa", "dx_alta": ["IAMSEST alto riesgo tratado (I21.4)"], "med": ["Ticagrelor 90mg VO c/12h 12m (B01AC24)", "Furosemida 40mg VO c/24h (C03CA01)", "Enalapril 10mg VO c/12h (C09AA02)"]}, "output": "Ingreso por iamsest alto riesgo (I21.4). Se realiza coronariografia (K492) encontrando lesion critica, realizandose angioplastia cx (K493) con implante de stent farmacoactivo y flujo TIMI 3 final. En su evolucion, taquicardia ventricular sostenida, cardioversion electrica exitosa. Recibio tratamiento con Clopidogrel 300mg carga (B01AC04), Metoprolol 5mg EV (C07AB02), Heparina 5000UI EV (B01AB01) y Dobutamina EV (C01CA07). Presenta evolucion favorable, cumpliendo criterios de alta. Alta con diagnostico de iamsest alto riesgo tratado (I21.4), indicandose Ticagrelor 90mg VO c/12h 12m (B01AC24), Furosemida 40mg VO c/24h (C03CA01) y Enalapril 10mg VO c/12h (C09AA02)."}
{"input": {"dx": ["Insuficiencia mitral severa (I34.0)"], "proc": ["Endoscopia digestiva alta (45.13)", "Osteosintesis de cadera (79.35)"], "tto": ["Hidrocortisona 100mg EV c/8h (H02AB09)", "Paracetamol 1g EV c/8h (N02BE01)"], "evo": "Control de sintomas con tratamiento medico optimizado", "dx_alta": ["Insuficiencia mitral severa resuelto (I34.0)"], "med": ["Budesonide/Formoterol INH c/12h (R03AK07)", "Acido folico 1mg VO c/24h (B03BB01)", "Ciprofloxacino 500mg VO c/12h 7d (J01MA02)"]}, "output": "Ingreso por insuficiencia mitral severa (I34.0). Se realiza endoscopia digestiva alta (45.13), osteosintesis de cadera (79.35). Durante la hospitalizacion, control de sintomas con tratamiento medico optimizado. Recibio tratamiento con Hidrocortisona 100mg EV c/8h (H02AB09) y Paracetamol 1g EV c/8h (N02BE01). Evolucion satisfactoria, cumpliendo criterios de alta. Alta con diagnostico de insuficiencia mitral severa resuelto (I34.0), indicandose Budesonide/Formoterol INH c/12h (R03AK07), Acido folico 1mg VO c/24h (B03BB01) y Ciprofloxacino 500mg VO c/12h 7d (J01MA02)."}
{"input": {"dx": ["IAMSEST alto riesgo (I21.4)"], "proc": ["Coronariografia (K492)"], "tto": ["Clopidogrel 600mg carga (B01AC04)", "Amiodarona 300mg EV (C01BD01)", "Clopidogrel 300mg carga (B01AC04)"], "evo": "Lesion critica de DA media, estabilizacion hemodinamica, angioplastia diferida", "dx_alta": ["IAMSEST alto riesgo tratado (I21.4)"], "med": ["Carvedilol 6.25mg VO c/12h (C07AG02)", "Clopidogrel 75mg VO c/24h 12m (B01AC04)", "Bisoprolol 5mg VO c/24h (C07AB07)", "Rosuvastatina 20mg VO c/noche (C10AA07)", "Warfarina segun INR (B01AA03)"]}, "output": "Ingresa por iamsest alto riesgo (I21.4). Se realiza coronariografia (K492). Evoluciona con, lesion critica de da media, estabilizacion hemodinamica, angioplastia diferida. Recibio tratamiento con Clopidogrel 600mg carga (B01AC04), Amiodarona 300mg EV (C01BD01) y Clopidogrel 300mg carga (B01AC04). Presenta evolucion favorable, cumpliendo criterios de alta. Alta con diagnostico de iamsest alto riesgo tratado (I21.4), indicandose Carvedilol 6.25mg VO c/12h (C07AG02), Clopidogrel 75mg VO c/24h 12m (B01AC04), Bisoprolol 5mg VO c/24h (C07AB07), Rosuvastatina 20mg VO c/noche (C10AA07) y Warfarina segun INR (B01AA03)."}
{"input": {"dx": ["Shock cardiogenico (R57.0)"], "proc": ["Coronariografia (K493)"], "tto": ["Clopidogrel 300mg carga (B01AC04)", "Aspirina 300mg carga (B01AC06)", "Noradrenalina EV (C01CA03)"], "evo": "SDST en V5-V6, coronarias sin lesiones obstructivas, sindrome de Tako-Tsubo", "dx_alta": ["Shock cardiogenico tratado (R57.0)"], "med": ["Isosorbide 20mg VO c/8h (C01DA08)", "Warfarina segun INR (B01AA03)", "Atorvastatina 40mg VO c/noche (C10AA05)"]}, "output": "Se hospitaliza por shock cardiogenico (R57.0). Se realiza coronariografia (K493). En su evolucion, sdst en v5-v6, coronarias sin lesiones obstructivas, sindrome de tako-tsubo. Recibio tratamiento con Clopidogrel 300mg carga (B01AC04), Aspirina 300mg carga (B01AC06) y Noradrenalina EV (C01CA03). Presenta evolucion favorable, cumpliendo criterios de alta. Alta con diagnostico de shock cardiogenico tratado (R57.0), indicandose Isosorbide 20mg VO c/8h (C01DA08), Warfarina segun INR (B01AA03) y Atorvastatina 40mg VO c/noche (C10AA05)."}
{"input": {"dx": ["IAMCEST anteroseptal (I21.0)"], "proc": ["Coronariografia (K492)", "Angioplastia OM (36.06)"], "tto": ["Enoxaparina 1mg/kg SC c/12h (B01AB05)", "Digoxina 0.25mg EV (C01AA05)"], "evo": "Oclusion aguda de DA distal, angioplastia exitosa con stent farmacoactivo, flujo TIMI 3 final", "dx_alta": ["IAMCEST anteroseptal tratado (I21.0)"], "med": ["Atorvastatina 40mg VO c/noche (C10AA05)", "Isosorbide 20mg VO c/8h (C01DA08)", "Losartan 50mg VO c/24h (C09CA01)", "Aspirina 100mg VO c/24h (B01AC06)"]}, "output": "Paciente que ingresa con cuadro de iamcest anteroseptal (I21.0). Se realiza coronariografia (K492) visualizando estenosis severa, realizandose angioplastia om (36.06) con implante de stent farmacoactivo y flujo TIMI 3 final. Durante la hospitalizacion, oclusion aguda de da distal, angioplastia exitosa con stent farmacoactivo, flujo timi 3 final. Recibio tratamiento con Enoxaparina 1mg/kg SC c/12h (B01AB05) y Digoxina 0.25mg EV (C01AA05). Evolucion clinica favorable, cumpliendo criterios de alta. Alta con diagnostico de iamcest anteroseptal tratado (I21.0), indicandose Atorvastatina 40mg VO c/noche (C10AA05), Isosorbide 20mg VO c/8h (C01DA08), Losartan 50mg VO c/24h (C09CA01) y Aspirina 100mg VO c/24h (B01AC06)."}
{"input": {"dx": ["EPOC exacerbado (J44.1)"], "proc": ["Ecografia abdominal (88.76)"], "tto": ["Metronidazol 500mg EV c/8h (J01XD01)", "Vancomicina 1g EV c/12h (J01XA01)", "Insulina cristalina segun esquema (A10AB01)"], "evo": "Sin complicaciones postoperatorias, herida operatoria limpia", "dx_alta": ["EPOC exacerbado resuelto (J44.1)"], "med": ["Calcio 500mg VO c/12h (A12AA04)", "Clonazepam 0.5mg VO c/noche (N03AE01)"]}, "output": "Paciente que ingresa con cuadro de epoc exacerbado (J44.1). Se realiza ecografia abdominal (88.76). Durante la hospitalizacion, sin complicaciones postoperatorias, herida operatoria limpia. Recibio tratamiento con Metronidazol 500mg EV c/8h (J01XD01), Vancomicina 1g EV c/12h (J01XA01) y Insulina cristalina segun esquema (A10AB01). Buena evolucion, cumpliendo criterios de alta. Alta con diagnostico de epoc exacerbado resuelto (J44.1), indicandose Calcio 500mg VO c/12h (A12AA04) y Clonazepam 0.5mg VO c/noche (N03AE01)."}
{"input": {"dx": ["IAMCEST anterior (I21.0)"], "proc": ["Coronariografia (K492)"], "tto": ["Furosemida 40mg EV (C03CA01)", "Furosemida 80mg EV (C03CA01)", "Digoxina 0.25mg EV (C01AA05)"], "evo": "Lesion severa de TCI, angioplastia con implante de stent sin complicaciones", "dx_alta": ["IAMCEST anterior tratado (I21.0)"], "med": ["Ticagrelor 90mg VO c/12h 12m (B01AC24)", "Losartan 50mg VO c/24h (C09CA01)", "Rivaroxaban 20mg VO c/24h (B01AF01)"]}, "output": "Ingresa por iamcest anterior (I21.0). Se realiza coronariografia (K492). En su evolucion, lesion severa de tci, angioplastia con implante de stent sin complicaciones. Recibio tratamiento con Furosemida 40mg EV (C03CA01), Furosemida 80mg EV (C03CA01) y Digoxina 0.25mg EV (C01AA05). Buena evolucion, cumpliendo criterios de alta. Alta con diagnostico de iamcest anterior tratado (I21.0), indicandose Ticagrelor 90mg VO c/12h 12m (B01AC24), Losartan 50mg VO c/24h (C09CA01) y Rivaroxaban 20mg VO c/24h (B01AF01)."}
{"input": {"dx": ["Edema pulmonar agudo (J81)"], "proc": ["Ablacion por radiofrecuencia (37.94)"], "tto": ["Enalapril 5mg VO (C09AA02)", "Prasugrel 60mg carga (B01AC22)", "Amiodarona 300mg EV (C01BD01)", "Dobutamina EV (C01CA07)"], "evo": "Fibrilacion auricular de alta respuesta, cardioversion farmacologica exitosa", "dx_alta": ["Edema pulmonar agudo tratado (J81)"], "med": ["Nitroglicerina SL PRN (C01DA02)", "Warfarina segun INR (B01AA03)", "Metoprolol 50mg VO c/12h (C07AB02)", "Furosemida 40mg VO c/24h (C03CA01)", "Atorvastatina 40mg VO c/noche (C10AA05)"]}, "output": "Ingreso por edema pulmonar agudo (J81). Se realiza ablacion por radiofrecuencia (37.94). Presenta, fibrilacion auricular de alta respuesta, cardioversion farmacologica exitosa. Recibio tratamiento con Enalapril 5mg VO (C09AA02), Prasugrel 60mg carga (B01AC22), Amiodarona 300mg EV (C01BD01) y Dobutamina EV (C01CA07). Evolucion satisfactoria, cumpliendo criterios de alta. Alta con diagnostico de edema pulmonar agudo tratado (J81), indicandose Nitroglicerina SL PRN (C01DA02), Warfarina segun INR (B01AA03), Metoprolol 50mg VO c/12h (C07AB02), Furosemida 40mg VO c/24h (C03CA01) y Atorvastatina 40mg VO c/noche (C10AA05)."}
{"input": {"dx": ["IAMCEST posterior (I21.2)"], "proc": ["Coronariografia (K492)", "Angioplastia CX (36.06)"], "tto": ["Aspirina 300mg carga (B01AC06)", "Digoxina 0.25mg EV (C01AA05)", "Metoprolol 5mg EV (C07AB02)"], "evo": "Lesion severa de DA media, angioplastia con implante de stent sin complicaciones", "dx_alta": ["IAMCEST posterior tratado (I21.2)"], "med": ["Metoprolol 50mg VO c/12h (C07AB02)", "Prasugrel 10mg VO c/24h 12m (B01AC22)", "Carvedilol 6.25mg VO c/12h (C07AG02)"]}, "output": "Paciente que ingresa con cuadro de iamcest posterior (I21.2). Se realiza coronariografia (K492) encontrando lesion critica, realizandose angioplastia cx (36.06) con implante de stent farmacoactivo y flujo TIMI 3 final. Presenta, lesion severa de da media, angioplastia con implante de stent sin complicaciones. Recibio tratamiento con Aspirina 300mg carga (B01AC06), Digoxina 0.25mg EV (C01AA05) y Metoprolol 5mg EV (C07AB02). Presenta evolucion favorable, cumpliendo criterios de alta. Alta con diagnostico de iamcest posterior tratado (I21.2), indicandose Metoprolol 50mg VO c/12h (C07AB02), Prasugrel 10mg VO c/24h 12m (B01AC22) y Carvedilol 6.25mg VO c/12h (C07AG02)."}
{"input": {"dx": ["Enfermedad coronaria de 3 vasos (I25.1)"], "proc": ["Coronariografia (K492)", "Angioplastia DA (36.06)"], "tto": ["Prasugrel 60mg carga (B01AC22)", "Morfina 3mg EV (N02AA01)", "Enoxaparina 1mg/kg SC c/12h (B01AB05)", "Noradrenalina EV (C01CA03)"], "evo": "Taquicardia ventricular sostenida, cardioversion electrica exitosa", "dx_alta": ["Enfermedad coronaria de 3 vasos tratado (I25.1)"], "med": ["Espironolactona 25mg VO c/24h (C03DA01)", "Atorvastatina 40mg VO c/noche (C10AA05)", "Prasugrel 10mg VO c/24h 12m (B01AC22)", "Carvedilol 6.25mg VO c/12h (C07AG02)", "Amlodipino 5mg VO c/24h (C08CA01)"]}, "output": "Ingresa por enfermedad coronaria de 3 vasos (I25.1). Se realiza coronariografia (K492) visualizando estenosis severa, realizandose angioplastia da (36.06) con implante de stent farmacoactivo y flujo TIMI 3 final. En su evolucion, taquicardia ventricular sostenida, cardioversion electrica exitosa. Recibio tratamiento con Prasugrel 60mg carga (B01AC22), Morfina 3mg EV (N02AA01), Enoxaparina 1mg/kg SC c/12h (B01AB05) y Noradrenalina EV (C01CA03). Evolucion satisfactoria, cumpliendo criterios de alta. Alta con diagnostico de enfermedad coronaria de 3 vasos tratado (I25.1), indicandose Espironolactona 25mg VO c/24h (C03DA01), Atorvastatina 40mg VO c/noche (C10AA05), Prasugrel 10mg VO c/24h 12m (B01AC22), Carvedilol 6.25mg VO c/12h (C07AG02) y Amlodipino 5mg VO c/24h (C08CA01)."}
{"input": {"dx": ["Hernia inguinal (K40.9)"], "proc": ["Broncoscopia (33.22)"], "tto": ["Metamizol 1g EV c/8h (N02BB02)", "Ceftriaxona 2g EV c/24h (J01DD04)"], "evo": "Cirugia programada sin complicaciones, alta precoz", "dx_alta": ["Hernia inguinal resuelto (K40.9)"], "med": ["Budesonide/Formoterol INH c/12h (R03AK07)", "Omeprazol 20mg VO c/24h (A02BC01)", "Metformina 850mg VO c/12h (A10BA02)"]}, "output": "Paciente que ingresa con cuadro de hernia inguinal (K40.9). Se realiza broncoscopia (33.22). Evoluciona con, cirugia programada sin complicaciones, alta precoz. Recibio tratamiento con Metamizol 1g EV c/8h (N02BB02) y Ceftriaxona 2g EV c/24h (J01DD04). Presenta evolucion favorable, cumpliendo criterios de alta. Alta con diagnostico de hernia inguinal resuelto (K40.9), indicandose Budesonide/Formoterol INH c/12h (R03AK07), Omeprazol 20mg VO c/24h (A02BC01) y Metformina 850mg VO c/12h (A10BA02)."}
{"input": {"dx": ["IAMCEST anterior (I21.0)"], "proc": ["Coronariografia (K492)"], "tto": ["Clopidogrel 600mg carga (B01AC04)", "Furosemida 40mg EV (C03CA01)", "Furosemida 80mg EV (C03CA01)", "Amiodarona 300mg EV (C01BD01)"], "evo": "Lesion critica de DA distal, estabilizacion hemodinamica, angioplastia diferida", "dx_alta": ["IAMCEST anterior tratado (I21.0)"], "med": ["Losartan 50mg VO c/24h (C09CA01)", "Isosorbide 20mg VO c/8h (C01DA08)", "Ticagrelor 90mg VO c/12h 12m (B01AC24)", "Clopidogrel 75mg VO c/24h 12m (B01AC04)"]}, "output": "Paciente que ingresa con cuadro de iamcest anterior (I21.0). Se realiza coronariografia (K492). En su evolucion, lesion critica de da distal, estabilizacion hemodinamica, angioplastia diferida. Recibio tratamiento con Clopidogrel 600mg carga (B01AC04), Furosemida 40mg EV (C03CA01), Furosemida 80mg EV (C03CA01) y Amiodarona 300mg EV (C01BD01). Presenta evolucion favorable, cumpliendo criterios de alta. Alta con diagnostico de iamcest anterior tratado (I21.0), indicandose Losartan 50mg VO c/24h (C09CA01), Isosorbide 20mg VO c/8h (C01DA08), Ticagrelor 90mg VO c/12h 12m (B01AC24) y Clopidogrel 75mg VO c/24h 12m (B01AC04)."}
{"input": {"dx": ["IAMSEST alto riesgo (I21.4)"], "proc": ["Coronariografia (K492)", "Angioplastia TCI (36.06)"], "tto": ["Amiodarona 300mg EV (C01BD01)", "Furosemida 80mg EV (C03CA01)", "Ticagrelor 180mg carga (B01AC24)", "Clopidogrel 600mg carga (B01AC04)"], "evo": "Estenosis aortica severa sintomatica, programada para TAVI", "dx_alta": ["IAMSEST alto riesgo tratado (I21.4)"], "med": ["Metoprolol 50mg VO c/12h (C07AB02)", "Prasugrel 10mg VO c/24h 12m (B01AC22)", "Enalapril 10mg VO c/12h (C09AA02)", "Espironolactona 25mg VO c/24h (C03DA01)"]}, "output": "Se hospitaliza por iamsest alto riesgo (I21.4). Se realiza coronariografia (K492) encontrando lesion critica, realizandose angioplastia tci (36.06) con implante de stent farmacoactivo y flujo TIMI 3 final. En su evolucion, estenosis aortica severa sintomatica, programada para tavi. Recibio tratamiento con Amiodarona 300mg EV (C01BD01), Furosemida 80mg EV (C03CA01), Ticagrelor 180mg carga (B01AC24) y Clopidogrel 600mg carga (B01AC04). Evolucion satisfactoria, cumpliendo criterios de alta. Alta con diagnostico de iamsest alto riesgo tratado (I21.4), indicandose Metoprolol 50mg VO c/12h (C07AB02), Prasugrel 10mg VO c/24h 12m (B01AC22), Enalapril 10mg VO c/12h (C09AA02) y Espironolactona 25mg VO c/24h (C03DA01)."}
{"input": {"dx": ["Flutter auricular (I48.0)"], "proc": ["Apendicectomia (47.09)"], "tto": ["Tramadol 50mg EV c/8h (N02AX02)", "Paracetamol 1g EV c/8h (N02BE01)", "Ceftriaxona 2g EV c/24h (J01DD04)"], "evo": "Cirugia programada sin complicaciones, alta precoz", "dx_alta": ["Flutter auricular resuelto (I48.0)"], "med": ["Amoxicilina/Clavulanico 875mg VO c/12h 7d (J01CR02)", "Omeprazol 20mg VO c/24h (A02BC01)", "Vitamina D 1000UI VO c/24h (A11CC05)"]}, "output": "Ingreso por flutter auricular (I48.0). Se realiza apendicectomia (47.09). En su evolucion, cirugia programada sin complicaciones, alta precoz. Recibio tratamiento con Tramadol 50mg EV c/8h (N02AX02), Paracetamol 1g EV c/8h (N02BE01) y Ceftriaxona 2g EV c/24h (J01DD04). Evolucion clinica favorable, cumpliendo criterios de alta. Alta con diagnostico de flutter auricular resuelto (I48.0), indicandose Amoxicilina/Clavulanico 875mg VO c/12h 7d (J01CR02), Omeprazol 20mg VO c/24h (A02BC01) y Vitamina D 1000UI VO c/24h (A11CC05)."}
{"input": {"dx": ["IAMSEST (I21.4)"], "proc": ["Coronariografia (K492)", "Angioplastia CX (K493)"], "tto": ["Heparina EV infusion (B01AB01)", "Furosemida 80mg EV (C03CA01)", "Heparina 5000UI EV (B01AB01)"], "evo": "Bloqueo AV completo sintomatico, requirio marcapasos transitorio", "dx_alta": ["IAMSEST tratado (I21.4)"], "med": ["Metoprolol 50mg VO c/12h (C07AB02)", "Isosorbide 20mg VO c/8h (C01DA08)", "Bisoprolol 5mg VO c/24h (C07AB07)", "Digoxina 0.125mg VO c/24h (C01AA05)", "Enalapril 10mg VO c/12h (C09AA02)"]}, "output": "Ingresa por iamsest (I21.4). Se realiza coronariografia (K492) con hallazgo de lesion significativa, realizandose angioplastia cx (K493) con implante de stent farmacoactivo y flujo TIMI 3 final. Durante la hospitalizacion, bloqueo av completo sintomatico, requirio marcapasos transitorio. Recibio tratamiento con Heparina EV infusion (B01AB01), Furosemida 80mg EV (C03CA01) y Heparina 5000UI EV (B01AB01). Buena evolucion, cumpliendo criterios de alta. Alta con diagnostico de iamsest tratado (I21.4), indicandose Metoprolol 50mg VO c/12h (C07AB02), Isosorbide 20mg VO c/8h (C01DA08), Bisoprolol 5mg VO c/24h (C07AB07), Digoxina 0.125mg VO c/24h (C01AA05) y Enalapril 10mg VO c/12h (C09AA02)."}
{"input": {"dx": ["Shock cardiogenico (R57.0)"], "proc": ["Pericardiocentesis (37.80)"], "tto": ["Furosemida 80mg EV (C03CA01)", "Enoxaparina 1mg/kg SC c/12h (B01AB05)"], "evo": "SDST en V5-V6, coronarias sin lesiones obstructivas, sindrome de Tako-Tsubo", "dx_alta": ["Shock cardiogenico tratado (R57.0)"], "med": ["Amlodipino 5mg VO c/24h (C08CA01)", "Ticagrelor 90mg VO c/12h 12m (B01AC24)", "Bisoprolol 5mg VO c/24h (C07AB07)", "Enalapril 10mg VO c/12h (C09AA02)"]}, "output": "Se hospitaliza por shock cardiogenico (R57.0). Se realiza pericardiocentesis (37.80). En su evolucion, sdst en v5-v6, coronarias sin lesiones obstructivas, sindrome de tako-tsubo. Recibio tratamiento con Furosemida 80mg EV (C03CA01) y Enoxaparina 1mg/kg SC c/12h (B01AB05). Buena evolucion, cumpliendo criterios de alta. Alta con diagnostico de shock cardiogenico tratado (R57.0), indicandose Amlodipino 5mg VO c/24h (C08CA01), Ticagrelor 90mg VO c/12h 12m (B01AC24), Bisoprolol 5mg VO c/24h (C07AB07) y Enalapril 10mg VO c/12h (C09AA02)."}
{"input": {"dx": ["Taquicardia ventricular (I47.2)"], "proc": ["Osteosintesis de cadera (79.35)"], "tto": ["Tramadol 50mg EV c/8h (N02AX02)", "Vancomicina 1g EV c/12h (J01XA01)", "Ipratropio NBZ c/6h (R03BB01)", "Paracetamol 1g EV c/8h (N02BE01)"], "evo": "Manejo conservador exitoso, sin necesidad de cirugia", "dx_alta": ["Taquicardia ventricular resuelto (I47.2)"], "med": ["Ciprofloxacino 500mg VO c/12h 7d (J01MA02)", "Levotiroxina 50mcg VO c/24h (H03AA01)"]}, "output": "Paciente que ingresa con cuadro de taquicardia ventricular (I47.2). Se realiza osteosintesis de cadera (79.35). En su evolucion, manejo conservador exitoso, sin necesidad de cirugia. Recibio tratamiento con Tramadol 50mg EV c/8h (N02AX02), Vancomicina 1g EV c/12h (J01XA01), Ipratropio NBZ c/6h (R03BB01) y Paracetamol 1g EV c/8h (N02BE01). Evolucion clinica favorable, cumpliendo criterios de alta. Alta con diagnostico de taquicardia ventricular resuelto (I47.2), indicandose Ciprofloxacino 500mg VO c/12h 7d (J01MA02) y Levotiroxina 50mcg VO c/24h (H03AA01)."}
{"input": {"dx": ["Colecistitis aguda (K81.0)"], "proc": ["Colecistectomia laparoscopica (51.23)"], "tto": ["Insulina NPH 10UI SC c/12h (A10AC01)", "Metronidazol 500mg EV c/8h (J01XD01)", "Salbutamol NBZ c/4h (R03AC02)", "Ipratropio NBZ c/6h (R03BB01)"], "evo": "Sin complicaciones postoperatorias, herida operatoria limpia", "dx_alta": ["Colecistitis aguda resuelto (K81.0)"], "med": ["Salbutamol INH 2 puff c/6h PRN (R03AC02)", "Sertralina 50mg VO c/24h (N06AB06)", "Ciprofloxacino 500mg VO c/12h 7d (J01MA02)", "Insulina NPH 10UI SC c/12h (A10AC01)"]}, "output": "Ingresa por colecistitis aguda (K81.0). Se realiza colecistectomia laparoscopica (51.23). Evoluciona con, sin complicaciones postoperatorias, herida operatoria limpia. Recibio tratamiento con Insulina NPH 10UI SC c/12h (A10AC01), Metronidazol 500mg EV c/8h (J01XD01), Salbutamol NBZ c/4h (R03AC02) y Ipratropio NBZ c/6h (R03BB01). Evolucion satisfactoria, cumpliendo criterios de alta. Alta con diagnostico de colecistitis aguda resuelto (K81.0), indicandose Salbutamol INH 2 puff c/6h PRN (R03AC02), Sertralina 50mg VO c/24h (N06AB06), Ciprofloxacino 500mg VO c/12h 7d (J01MA02) y Insulina NPH 10UI SC c/12h (A10AC01)."}
{"input": {"dx": ["IAMSEST alto riesgo (I21.4)"], "proc": ["Coronariografia (K492)", "Angioplastia CX (K493)"], "tto": ["Amiodarona 300mg EV (C01BD01)", "Heparina EV infusion (B01AB01)", "Morfina 3mg EV (N02AA01)"], "evo": "Enfermedad de multiples vasos, se deriva a cirugia cardiaca para bypass", "dx_alta": ["IAMSEST alto riesgo tratado (I21.4)"], "med": ["Digoxina 0.125mg VO c/24h (C01AA05)", "Amlodipino 5mg VO c/24h (C08CA01)", "Bisoprolol 5mg VO c/24h (C07AB07)", "Furosemida 40mg VO c/24h (C03CA01)", "Clopidogrel 75mg VO c/24h 12m (B01AC04)"]}, "output": "Ingreso por iamsest alto riesgo (I21.4). Se realiza coronariografia (K492) evidenciando oclusion aguda, realizandose angioplastia cx (K493) con implante de stent farmacoactivo y flujo TIMI 3 final. Presenta, enfermedad de multiples vasos, se deriva a cirugia cardiaca para bypass. Recibio tratamiento con Amiodarona 300mg EV (C01BD01), Heparina EV infusion (B01AB01) y Morfina 3mg EV (N02AA01). Evolucion satisfactoria, cumpliendo criterios de alta. Alta con diagnostico de iamsest alto riesgo tratado (I21.4), indicandose Digoxina 0.125mg VO c/24h (C01AA05), Amlodipino 5mg VO c/24h (C08CA01), Bisoprolol 5mg VO c/24h (C07AB07), Furosemida 40mg VO c/24h (C03CA01) y Clopidogrel 75mg VO c/24h 12m (B01AC04)."}
{"input": {"dx": ["IAMCEST inferior (I21.1)"], "proc": ["Coronariografia (K492)", "Angioplastia CX (K493)"], "tto": ["Levosimendan EV (C01CX08)", "Aspirina 100mg (B01AC06)", "Heparina EV infusion (B01AB01)", "Clopidogrel 300mg carga (B01AC04)"], "evo": "Pericarditis aguda con derrame leve, manejo antiinflamatorio", "dx_alta": ["IAMCEST inferior tratado (I21.1)"], "med": ["Amlodipino 5mg VO c/24h (C08CA01)", "Apixaban 5mg VO c/12h (B01AF02)", "Carvedilol 6.25mg VO c/12h (C07AG02)", "Nitroglicerina SL PRN (C01DA02)", "Enalapril 10mg VO c/12h (C09AA02)"]}, "output": "Ingreso por iamcest inferior (I21.1). Se realiza coronariografia (K492) con hallazgo de lesion significativa, realizandose angioplastia cx (K493) con implante de stent farmacoactivo y flujo TIMI 3 final. Presenta, pericarditis aguda con derrame leve, manejo antiinflamatorio. Recibio tratamiento con Levosimendan EV (C01CX08), Aspirina 100mg (B01AC06), Heparina EV infusion (B01AB01) y Clopidogrel 300mg carga (B01AC04). Presenta evolucion favorable, cumpliendo criterios de alta. Alta con diagnostico de iamcest inferior tratado (I21.1), indicandose Amlodipino 5mg VO c/24h (C08CA01), Apixaban 5mg VO c/12h (B01AF02), Carvedilol 6.25mg VO c/12h (C07AG02), Nitroglicerina SL PRN (C01DA02) y Enalapril 10mg VO c/12h (C09AA02)."}
{"input": {"dx": ["Colecistitis aguda (K81.0)"], "proc": ["Ecografia abdominal (88.76)", "Paracentesis (54.91)"], "tto": ["Hidrocortisona 100mg EV c/8h (H02AB09)", "Meropenem 1g EV c/8h (J01DH02)"], "evo": "Cirugia programada sin complicaciones, alta precoz", "dx_alta": ["Colecistitis aguda resuelto (K81.0)"], "med": ["Ciprofloxacino 500mg VO c/12h 7d (J01MA02)", "Salbutamol INH 2 puff c/6h PRN (R03AC02)", "Tramadol 50mg VO c/8h 7d (N02AX02)"]}, "output": "Paciente que ingresa con cuadro de colecistitis aguda (K81.0). Se realiza ecografia abdominal (88.76), paracentesis (54.91). Presenta, cirugia programada sin complicaciones, alta precoz. Recibio tratamiento con Hidrocortisona 100mg EV c/8h (H02AB09) y Meropenem 1g EV c/8h (J01DH02). Buena evolucion, cumpliendo criterios de alta. Alta con diagnostico de colecistitis aguda resuelto (K81.0), indicandose Ciprofloxacino 500mg VO c/12h 7d (J01MA02), Salbutamol INH 2 puff c/6h PRN (R03AC02) y Tramadol 50mg VO c/8h 7d (N02AX02)."}
{"input": {"dx": ["Pancreatitis aguda (K85.9)"], "proc": ["Colonoscopia (45.23)", "Ecografia abdominal (88.76)"], "tto": ["Hidrocortisona 100mg EV c/8h (H02AB09)", "Meropenem 1g EV c/8h (J01DH02)", "Piperacilina/Tazobactam 4.5g EV c/8h (J01CR05)"], "evo": "Procedimiento sin complicaciones, buena tolerancia oral", "dx_alta": ["Pancreatitis aguda resuelto (K85.9)"], "med": ["Clonazepam 0.5mg VO c/noche (N03AE01)", "Tramadol 50mg VO c/8h 7d (N02AX02)", "Acido folico 1mg VO c/24h (B03BB01)", "Levotiroxina 50mcg VO c/24h (H03AA01)"]}, "output": "Se hospitaliza por pancreatitis aguda (K85.9). Se realiza colonoscopia (45.23), ecografia abdominal (88.76). Durante la hospitalizacion, procedimiento sin complicaciones, buena tolerancia oral. Recibio tratamiento con Hidrocortisona 100mg EV c/8h (H02AB09), Meropenem 1g EV c/8h (J01DH02) y Piperacilina/Tazobactam 4.5g EV c/8h (J01CR05). Buena evolucion, cumpliendo criterios de alta. Alta con diagnostico de pancreatitis aguda resuelto (K85.9), indicandose Clonazepam 0.5mg VO c/noche (N03AE01), Tramadol 50mg VO c/8h 7d (N02AX02), Acido folico 1mg VO c/24h (B03BB01) y Levotiroxina 50mcg VO c/24h (H03AA01)."}
{"input": {"dx": ["IAMCEST anterolateral (I21.0)"], "proc": ["Coronariografia (K492)", "Angioplastia TCI (K493)"], "tto": ["Aspirina 300mg carga (B01AC06)", "Enoxaparina 60mg SC c/12h (B01AB05)"], "evo": "Enfermedad de multiples vasos, se deriva a cirugia cardiaca para bypass", "dx_alta": ["IAMCEST anterolateral tratado (I21.0)"], "med": ["Amlodipino 5mg VO c/24h (C08CA01)", "Clopidogrel 75mg VO c/24h 12m (B01AC04)", "Losartan 50mg VO c/24h (C09CA01)", "Rivaroxaban 20mg VO c/24h (B01AF01)", "Bisoprolol 5mg VO c/24h (C07AB07)"]}, "output": "Paciente que ingresa con cuadro de iamcest anterolateral (I21.0). Se realiza coronariografia (K492) evidenciando oclusion aguda, realizandose angioplastia tci (K493) con implante de stent farmacoactivo y flujo TIMI 3 final. En su evolucion, enfermedad de multiples vasos, se deriva a cirugia cardiaca para bypass. Recibio tratamiento con Aspirina 300mg carga (B01AC06) y Enoxaparina 60mg SC c/12h (B01AB05). Evolucion clinica favorable, cumpliendo criterios de alta. Alta con diagnostico de iamcest anterolateral tratado (I21.0), indicandose Amlodipino 5mg VO c/24h (C08CA01), Clopidogrel 75mg VO c/24h 12m (B01AC04), Losartan 50mg VO c/24h (C09CA01), Rivaroxaban 20mg VO c/24h (B01AF01) y Bisoprolol 5mg VO c/24h (C07AB07)."}
{"input": {"dx": ["Flutter auricular (I48.0)"], "proc": ["Hemodialisis (39.95)", "Hernioplastia inguinal (53.00)"], "tto": ["Ipratropio NBZ c/6h (R03BB01)", "Ampicilina/Sulbactam 1.5g EV c/6h (J01CR01)", "Metronidazol 500mg EV c/8h (J01XD01)"], "evo": "Manejo conservador exitoso, sin necesidad de cirugia", "dx_alta": ["Flutter auricular resuelto (I48.0)"], "med": ["Insulina NPH 10UI SC c/12h (A10AC01)", "Prednisona 20mg VO c/24h (H02AB07)", "Vitamina D 1000UI VO c/24h (A11CC05)", "Calcio 500mg VO c/12h (A12AA04)"]}, "output": "Paciente que ingresa con cuadro de flutter auricular (I48.0). Se realiza hemodialisis (39.95), hernioplastia inguinal (53.00). Presenta, manejo conservador exitoso, sin necesidad de cirugia. Recibio tratamiento con Ipratropio NBZ c/6h (R03BB01), Ampicilina/Sulbactam 1.5g EV c/6h (J01CR01) y Metronidazol 500mg EV c/8h (J01XD01). Evolucion satisfactoria, cumpliendo criterios de alta. Alta con diagnostico de flutter auricular resuelto (I48.0), indicandose Insulina NPH 10UI SC c/12h (A10AC01), Prednisona 20mg VO c/24h (H02AB07), Vitamina D 1000UI VO c/24h (A11CC05) y Calcio 500mg VO c/12h (A12AA04)."}
{"input": {"dx": ["Angina inestable (I20.0)"], "proc": ["Coronariografia (K492)", "Angioplastia OM (36.06)"], "tto": ["Clopidogrel 600mg carga (B01AC04)", "Dobutamina EV (C01CA07)"], "evo": "Oclusion de CD media con trombo, trombectomia por aspiracion mas stent", "dx_alta": ["Angina inestable tratado (I20.0)"], "med": ["Espironolactona 25mg VO c/24h (C03DA01)", "Carvedilol 6.25mg VO c/12h (C07AG02)", "Nitroglicerina SL PRN (C01DA02)", "Prasugrel 10mg VO c/24h 12m (B01AC22)", "Amlodipino 5mg VO c/24h (C08CA01)"]}, "output": "Se hospitaliza por angina inestable (I20.0). Se realiza coronariografia (K492) encontrando lesion critica, realizandose angioplastia om (36.06) con implante de stent farmacoactivo y flujo TIMI 3 final. En su evolucion, oclusion de cd media con trombo, trombectomia por aspiracion mas stent. Recibio tratamiento con Clopidogrel 600mg carga (B01AC04) y Dobutamina EV (C01CA07). Buena evolucion, cumpliendo criterios de alta. Alta con diagnostico de angina inestable tratado (I20.0), indicandose Espironolactona 25mg VO c/24h (C03DA01), Carvedilol 6.25mg VO c/12h (C07AG02), Nitroglicerina SL PRN (C01DA02), Prasugrel 10mg VO c/24h 12m (B01AC22) y Amlodipino 5mg VO c/24h (C08CA01)."}
{"input": {"dx": ["Trombosis de stent (I21.0)"], "proc": ["Angioplastia CX (89.64)"], "tto": ["Clopidogrel 300mg carga (B01AC04)", "Amiodarona 300mg EV (C01BD01)"], "evo": "Lesion critica de DA proximal, estabilizacion hemodinamica, angioplastia diferida", "dx_alta": ["Trombosis de stent tratado (I21.0)"], "med": ["Bisoprolol 5mg VO c/24h (C07AB07)", "Amlodipino 5mg VO c/24h (C08CA01)", "Carvedilol 6.25mg VO c/12h (C07AG02)"]}, "output": "Paciente que ingresa con cuadro de trombosis de stent (I21.0). Se realiza angioplastia cx (89.64). Evoluciona con, lesion critica de da proximal, estabilizacion hemodinamica, angioplastia diferida. Recibio tratamiento con Clopidogrel 300mg carga (B01AC04) y Amiodarona 300mg EV (C01BD01). Presenta evolucion favorable, cumpliendo criterios de alta. Alta con diagnostico de trombosis de stent tratado (I21.0), indicandose Bisoprolol 5mg VO c/24h (C07AB07), Amlodipino 5mg VO c/24h (C08CA01) y Carvedilol 6.25mg VO c/12h (C07AG02)."}
{"input": {"dx": ["IAMCEST anterior (I21.0)"], "proc": ["Coronariografia (K492)", "Angioplastia DA (36.06)"], "tto": ["Aspirina 300mg carga (B01AC06)", "Heparina EV infusion (B01AB01)"], "evo": "Enfermedad de multiples vasos, se deriva a cirugia cardiaca para bypass", "dx_alta": ["IAMCEST anterior tratado (I21.0)"], "med": ["Espironolactona 25mg VO c/24h (C03DA01)", "Furosemida 40mg VO c/24h (C03CA01)", "Aspirina 100mg VO c/24h (B01AC06)", "Ticagrelor 90mg VO c/12h 12m (B01AC24)", "Nitroglicerina SL PRN (C01DA02)"]}, "output": "Se hospitaliza por iamcest anterior (I21.0). Se realiza coronariografia (K492) evidenciando oclusion aguda, realizandose angioplastia da (36.06) con implante de stent farmacoactivo y flujo TIMI 3 final. En su evolucion, enfermedad de multiples vasos, se deriva a cirugia cardiaca para bypass. Recibio tratamiento con Aspirina 300mg carga (B01AC06) y Heparina EV infusion (B01AB01). Evolucion satisfactoria, cumpliendo criterios de alta. Alta con diagnostico de iamcest anterior tratado (I21.0), indicandose Espironolactona 25mg VO c/24h (C03DA01), Furosemida 40mg VO c/24h (C03CA01), Aspirina 100mg VO c/24h (B01AC06), Ticagrelor 90mg VO c/12h 12m (B01AC24) y Nitroglicerina SL PRN (C01DA02)."}
{"input": {"dx": ["Angina inestable (I20.0)"], "proc": ["Coronariografia (K492)", "Angioplastia DA (K493)"], "tto": ["Furosemida 80mg EV (C03CA01)", "Levosimendan EV (C01CX08)"], "evo": "Estenosis aortica severa sintomatica, programada para TAVI", "dx_alta": ["Angina inestable tratado (I20.0)"], "med": ["Prasugrel 10mg VO c/24h 12m (B01AC22)", "Espironolactona 25mg VO c/24h (C03DA01)", "Nitroglicerina SL PRN (C01DA02)"]}, "output": "Ingresa por angina inestable (I20.0). Se realiza coronariografia (K492) evidenciando oclusion aguda, realizandose angioplastia da (K493) con implante de stent farmacoactivo y flujo TIMI 3 final. En su evolucion, estenosis aortica severa sintomatica, programada para tavi. Recibio tratamiento con Furosemida 80mg EV (C03CA01) y Levosimendan EV (C01CX08). Buena evolucion, cumpliendo criterios de alta. Alta con diagnostico de angina inestable tratado (I20.0), indicandose Prasugrel 10mg VO c/24h 12m (B01AC22), Espironolactona 25mg VO c/24h (C03DA01) y Nitroglicerina SL PRN (C01DA02)."}
{"input": {"dx": ["Shock cardiogenico (R57.0)"], "proc": ["Implante de marcapasos (89.50)"], "tto": ["Furosemida 80mg EV (C03CA01)", "Aspirina 100mg (B01AC06)", "Digoxina 0.25mg EV (C01AA05)", "Enoxaparina 60mg SC c/12h (B01AB05)"], "evo": "Taquicardia ventricular sostenida, cardioversion electrica exitosa", "dx_alta": ["Shock cardiogenico tratado (R57.0)"], "med": ["Nitroglicerina SL PRN (C01DA02)", "Amlodipino 5mg VO c/24h (C08CA01)", "Isosorbide 20mg VO c/8h (C01DA08)", "Aspirina 100mg VO c/24h (B01AC06)", "Bisoprolol 5mg VO c/24h (C07AB07)"]}, "output": "Ingreso por shock cardiogenico (R57.0). Se realiza implante de marcapasos (89.50). Durante la hospitalizacion, taquicardia ventricular sostenida, cardioversion electrica exitosa. Recibio tratamiento con Furosemida 80mg EV (C03CA01), Aspirina 100mg (B01AC06), Digoxina 0.25mg EV (C01AA05) y Enoxaparina 60mg SC c/12h (B01AB05). Evolucion satisfactoria, cumpliendo criterios de alta. Alta con diagnostico de shock cardiogenico tratado (R57.0), indicandose Nitroglicerina SL PRN (C01DA02), Amlodipino 5mg VO c/24h (C08CA01), Isosorbide 20mg VO c/8h (C01DA08), Aspirina 100mg VO c/24h (B01AC06) y Bisoprolol 5mg VO c/24h (C07AB07)."}
{"input": {"dx": ["Estenosis aortica severa (I35.0)"], "proc": ["Hemodialisis (39.95)"], "tto": ["Vancomicina 1g EV c/12h (J01XA01)", "Morfina 3mg EV c/4h PRN (N02AA01)"], "evo": "Respuesta adecuada al tratamiento antibiotico, afebril desde dia 2", "dx_alta": ["Estenosis aortica severa resuelto (I35.0)"], "med": ["Salbutamol INH 2 puff c/6h PRN (R03AC02)", "Ciprofloxacino 500mg VO c/12h 7d (J01MA02)", "Paracetamol 500mg VO c/8h PRN (N02BE01)", "Metformina 850mg VO c/12h (A10BA02)"]}, "output": "Se hospitaliza por estenosis aortica severa (I35.0). Se realiza hemodialisis (39.95). En su evolucion, respuesta adecuada al tratamiento antibiotico, afebril desde dia 2. Recibio tratamiento con Vancomicina 1g EV c/12h (J01XA01) y Morfina 3mg EV c/4h PRN (N02AA01). Evolucion satisfactoria, cumpliendo criterios de alta. Alta con diagnostico de estenosis aortica severa resuelto (I35.0), indicandose Salbutamol INH 2 puff c/6h PRN (R03AC02), Ciprofloxacino 500mg VO c/12h 7d (J01MA02), Paracetamol 500mg VO c/8h PRN (N02BE01) y Metformina 850mg VO c/12h (A10BA02)."}
{"input": {"dx": ["Neumonia adquirida comunidad (J18.9)"], "proc": ["Colonoscopia (45.23)"], "tto": ["Metronidazol 500mg EV c/8h (J01XD01)", "Pantoprazol 40mg EV c/12h (A02BC02)"], "evo": "Cirugia programada sin complicaciones, alta precoz", "dx_alta": ["Neumonia adquirida comunidad resuelto (J18.9)"], "med": ["Paracetamol 500mg VO c/8h PRN (N02BE01)", "Glibenclamida 5mg VO c/24h (A10BB01)"]}, "output": "Ingresa por neumonia adquirida comunidad (J18.9). Se realiza colonoscopia (45.23). Presenta, cirugia programada sin complicaciones, alta precoz. Recibio tratamiento con Metronidazol 500mg EV c/8h (J01XD01) y Pantoprazol 40mg EV c/12h (A02BC02). Buena evolucion, cumpliendo criterios de alta. Alta con diagnostico de neumonia adquirida comunidad resuelto (J18.9), indicandose Paracetamol 500mg VO c/8h PRN (N02BE01) y Glibenclamida 5mg VO c/24h (A10BB01)."}
{"input": {"dx": ["Insuficiencia cardiaca aguda (I50.9)"], "proc": ["Valvuloplastia mitral (89.41)"], "tto": ["Levosimendan EV (C01CX08)", "Clopidogrel 600mg carga (B01AC04)"], "evo": "Enfermedad de multiples vasos, se deriva a cirugia cardiaca para bypass", "dx_alta": ["Insuficiencia cardiaca aguda tratado (I50.9)"], "med": ["Losartan 50mg VO c/24h (C09CA01)", "Rosuvastatina 20mg VO c/noche (C10AA07)", "Prasugrel 10mg VO c/24h 12m (B01AC22)", "Carvedilol 6.25mg VO c/12h (C07AG02)", "Metoprolol 50mg VO c/12h (C07AB02)"]}, "output": "Ingreso por insuficiencia cardiaca aguda (I50.9). Se realiza valvuloplastia mitral (89.41). Evoluciona con, enfermedad de multiples vasos, se deriva a cirugia cardiaca para bypass. Recibio tratamiento con Levosimendan EV (C01CX08) y Clopidogrel 600mg carga (B01AC04). Evolucion satisfactoria, cumpliendo criterios de alta. Alta con diagnostico de insuficiencia cardiaca aguda tratado (I50.9), indicandose Losartan 50mg VO c/24h (C09CA01), Rosuvastatina 20mg VO c/noche (C10AA07), Prasugrel 10mg VO c/24h 12m (B01AC22), Carvedilol 6.25mg VO c/12h (C07AG02) y Metoprolol 50mg VO c/12h (C07AB02)."}
{"input": {"dx": ["IAMCEST inferolateral (I21.1)"], "proc": ["Coronariografia (K492)", "Angioplastia TCI (36.06)"], "tto": ["Ticagrelor 180mg carga (B01AC24)", "Enoxaparina 60mg SC c/12h (B01AB05)", "Furosemida 80mg EV (C03CA01)", "Dobutamina EV (C01CA07)"], "evo": "Oclusion de OM1 con trombo, trombectomia por aspiracion mas stent", "dx_alta": ["IAMCEST inferolateral tratado (I21.1)"], "med": ["Prasugrel 10mg VO c/24h 12m (B01AC22)", "Ticagrelor 90mg VO c/12h 12m (B01AC24)", "Losartan 50mg VO c/24h (C09CA01)", "Enalapril 10mg VO c/12h (C09AA02)"]}, "output": "Se hospitaliza por iamcest inferolateral (I21.1). Se realiza coronariografia (K492) con hallazgo de lesion significativa, realizandose angioplastia tci (36.06) con implante de stent farmacoactivo y flujo TIMI 3 final. Evoluciona con, oclusion de om1 con trombo, trombectomia por aspiracion mas stent. Recibio tratamiento con Ticagrelor 180mg carga (B01AC24), Enoxaparina 60mg SC c/12h (B01AB05), Furosemida 80mg EV (C03CA01) y Dobutamina EV (C01CA07). Evolucion clinica favorable, cumpliendo criterios de alta. Alta con diagnostico de iamcest inferolateral tratado (I21.1), indicandose Prasugrel 10mg VO c/24h 12m (B01AC22), Ticagrelor 90mg VO c/12h 12m (B01AC24), Losartan 50mg VO c/24h (C09CA01) y Enalapril 10mg VO c/12h (C09AA02)."}
{"input": {"dx": ["Angina estable (I20.8)"], "proc": ["Coronariografia (K492)", "Angioplastia CX (36.06)"], "tto": ["Levosimendan EV (C01CX08)", "Heparina EV infusion (B01AB01)", "Enoxaparina 60mg SC c/12h (B01AB05)"], "evo": "Shock cardiogenico, requirio soporte con inotropicos, evolucion favorable", "dx_alta": ["Angina estable tratado (I20.8)"], "med": ["Amlodipino 5mg VO c/24h (C08CA01)", "Apixaban 5mg VO c/12h (B01AF02)", "Aspirina 100mg VO c/24h (B01AC06)", "Rivaroxaban 20mg VO c/24h (B01AF01)"]}, "output": "Ingreso por angina estable (I20.8). Se realiza coronariografia (K492) encontrando lesion critica, realizandose angioplastia cx (36.06) con implante de stent farmacoactivo y flujo TIMI 3 final. En su evolucion, shock cardiogenico, requirio soporte con inotropicos, evolucion favorable. Recibio tratamiento con Levosimendan EV (C01CX08), Heparina EV infusion (B01AB01) y Enoxaparina 60mg SC c/12h (B01AB05). Presenta evolucion favorable, cumpliendo criterios de alta. Alta con diagnostico de angina estable tratado (I20.8), indicandose Amlodipino 5mg VO c/24h (C08CA01), Apixaban 5mg VO c/12h (B01AF02), Aspirina 100mg VO c/24h (B01AC06) y Rivaroxaban 20mg VO c/24h (B01AF01)."}
{"input": {"dx": ["Angina estable (I20.8)"], "proc": ["Coronariografia (K492)", "Angioplastia OM (K493)"], "tto": ["Aspirina 300mg carga (B01AC06)", "Digoxina 0.25mg EV (C01AA05)", "Amiodarona 300mg EV (C01BD01)", "Morfina 3mg EV (N02AA01)"], "evo": "Lesion critica de TCI, estabilizacion hemodinamica, angioplastia diferida", "dx_alta": ["Angina estable tratado (I20.8)"], "med": ["Rivaroxaban 20mg VO c/24h (B01AF01)", "Amlodipino 5mg VO c/24h (C08CA01)", "Carvedilol 6.25mg VO c/12h (C07AG02)", "Bisoprolol 5mg VO c/24h (C07AB07)", "Losartan 50mg VO c/24h (C09CA01)"]}, "output": "Se hospitaliza por angina estable (I20.8). Se realiza coronariografia (K492) evidenciando oclusion aguda, realizandose angioplastia om (K493) con implante de stent farmacoactivo y flujo TIMI 3 final. Durante la hospitalizacion, lesion critica de tci, estabilizacion hemodinamica, angioplastia diferida. Recibio tratamiento con Aspirina 300mg carga (B01AC06), Digoxina 0.25mg EV (C01AA05), Amiodarona 300mg EV (C01BD01) y Morfina 3mg EV (N02AA01). Presenta evolucion favorable, cumpliendo criterios de alta. Alta con diagnostico de angina estable tratado (I20.8), indicandose Rivaroxaban 20mg VO c/24h (B01AF01), Amlodipino 5mg VO c/24h (C08CA01), Carvedilol 6.25mg VO c/12h (C07AG02), Bisoprolol 5mg VO c/24h (C07AB07) y Losartan 50mg VO c/24h (C09CA01)."}
{"input": {"dx": ["Neumonia adquirida comunidad (J18.9)"], "proc": ["Endoscopia digestiva alta (45.13)", "Broncoscopia (33.22)"], "tto": ["Metronidazol 500mg EV c/8h (J01XD01)", "Tramadol 50mg EV c/8h (N02AX02)", "Ampicilina/Sulbactam 1.5g EV c/6h (J01CR01)"], "evo": "Resolucion del cuadro agudo, alta con seguimiento ambulatorio", "dx_alta": ["Neumonia adquirida comunidad resuelto (J18.9)"], "med": ["Amoxicilina/Clavulanico 875mg VO c/12h 7d (J01CR02)", "Ciprofloxacino 500mg VO c/12h 7d (J01MA02)"]}, "output": "Ingresa por neumonia adquirida comunidad (J18.9). Se realiza endoscopia digestiva alta (45.13), broncoscopia (33.22). Evoluciona con, resolucion del cuadro agudo, alta con seguimiento ambulatorio. Recibio tratamiento con Metronidazol 500mg EV c/8h (J01XD01), Tramadol 50mg EV c/8h (N02AX02) y Ampicilina/Sulbactam 1.5g EV c/6h (J01CR01). Evolucion clinica favorable, cumpliendo criterios de alta. Alta con diagnostico de neumonia adquirida comunidad resuelto (J18.9), indicandose Amoxicilina/Clavulanico 875mg VO c/12h 7d (J01CR02) y Ciprofloxacino 500mg VO c/12h 7d (J01MA02)."}
{"input": {"dx": ["Diabetes mellitus descompensada (E11.9)"], "proc": ["Paracentesis (54.91)"], "tto": ["Vancomicina 1g EV c/12h (J01XA01)", "Metoclopramida 10mg EV c/8h (A03FA01)", "Hidrocortisona 100mg EV c/8h (H02AB09)", "Salbutamol NBZ c/4h (R03AC02)"], "evo": "Cirugia programada sin complicaciones, alta precoz", "dx_alta": ["Diabetes mellitus descompensada resuelto (E11.9)"], "med": ["Metformina 850mg VO c/12h (A10BA02)", "Sertralina 50mg VO c/24h (N06AB06)", "Budesonide/Formoterol INH c/12h (R03AK07)"]}, "output": "Paciente que ingresa con cuadro de diabetes mellitus descompensada (E11.9). Se realiza paracentesis (54.91). Durante la hospitalizacion, cirugia programada sin complicaciones, alta precoz. Recibio tratamiento con Vancomicina 1g EV c/12h (J01XA01), Metoclopramida 10mg EV c/8h (A03FA01), Hidrocortisona 100mg EV c/8h (H02AB09) y Salbutamol NBZ c/4h (R03AC02). Evolucion clinica favorable, cumpliendo criterios de alta. Alta con diagnostico de diabetes mellitus descompensada resuelto (E11.9), indicandose Metformina 850mg VO c/12h (A10BA02), Sertralina 50mg VO c/24h (N06AB06) y Budesonide/Formoterol INH c/12h (R03AK07)."}
{"input": {"dx": ["Endocarditis infecciosa (I33.0)"], "proc": ["TAC de torax (87.41)", "Hemodialisis (39.95)"], "tto": ["Salbutamol NBZ c/4h (R03AC02)", "Vancomicina 1g EV c/12h (J01XA01)", "Metronidazol 500mg EV c/8h (J01XD01)", "Hidrocortisona 100mg EV c/8h (H02AB09)"], "evo": "Procedimiento sin complicaciones, buena tolerancia oral", "dx_alta": ["Endocarditis infecciosa resuelto (I33.0)"], "med": ["Tramadol 50mg VO c/8h 7d (N02AX02)", "Sertralina 50mg VO c/24h (N06AB06)", "Prednisona 20mg VO c/24h (H02AB07)", "Glibenclamida 5mg VO c/24h (A10BB01)"]}, "output": "Ingreso por endocarditis infecciosa (I33.0). Se realiza tac de torax (87.41), hemodialisis (39.95). Evoluciona con, procedimiento sin complicaciones, buena tolerancia oral. Recibio tratamiento con Salbutamol NBZ c/4h (R03AC02), Vancomicina 1g EV c/12h (J01XA01), Metronidazol 500mg EV c/8h (J01XD01) y Hidrocortisona 100mg EV c/8h (H02AB09). Evolucion satisfactoria, cumpliendo criterios de alta. Alta con diagnostico de endocarditis infecciosa resuelto (I33.0), indicandose Tramadol 50mg VO c/8h 7d (N02AX02), Sertralina 50mg VO c/24h (N06AB06), Prednisona 20mg VO c/24h (H02AB07) y Glibenclamida 5mg VO c/24h (A10BB01)."}
{"input": {"dx": ["Taquicardia ventricular (I47.2)"], "proc": ["Paracentesis (54.91)"], "tto": ["Metoclopramida 10mg EV c/8h (A03FA01)", "Metronidazol 500mg EV c/8h (J01XD01)", "Ipratropio NBZ c/6h (R03BB01)", "Insulina cristalina segun esquema (A10AB01)"], "evo": "Estabilizacion clinica progresiva, sin eventos adversos", "dx_alta": ["Taquicardia ventricular resuelto (I47.2)"], "med": ["Sertralina 50mg VO c/24h (N06AB06)", "Metformina 850mg VO c/12h (A10BA02)"]}, "output": "Paciente que ingresa con cuadro de taquicardia ventricular (I47.2). Se realiza paracentesis (54.91). Evoluciona con, estabilizacion clinica progresiva, sin eventos adversos. Recibio tratamiento con Metoclopramida 10mg EV c/8h (A03FA01), Metronidazol 500mg EV c/8h (J01XD01), Ipratropio NBZ c/6h (R03BB01) y Insulina cristalina segun esquema (A10AB01). Presenta evolucion favorable, cumpliendo criterios de alta. Alta con diagnostico de taquicardia ventricular resuelto (I47.2), indicandose Sertralina 50mg VO c/24h (N06AB06) y Metformina 850mg VO c/12h (A10BA02)."}
{"input": {"dx": ["EPOC exacerbado (J44.1)"], "proc": ["Toracocentesis (34.91)"], "tto": ["Metamizol 1g EV c/8h (N02BB02)", "Piperacilina/Tazobactam 4.5g EV c/8h (J01CR05)"], "evo": "Manejo conservador exitoso, sin necesidad de cirugia", "dx_alta": ["EPOC exacerbado resuelto (J44.1)"], "med": ["Clonazepam 0.5mg VO c/noche (N03AE01)", "Prednisona 20mg VO c/24h (H02AB07)", "Tramadol 50mg VO c/8h 7d (N02AX02)"]}, "output": "Se hospitaliza por epoc exacerbado (J44.1). Se realiza toracocentesis (34.91). En su evolucion, manejo conservador exitoso, sin necesidad de cirugia. Recibio tratamiento con Metamizol 1g EV c/8h (N02BB02) y Piperacilina/Tazobactam 4.5g EV c/8h (J01CR05). Buena evolucion, cumpliendo criterios de alta. Alta con diagnostico de epoc exacerbado resuelto (J44.1), indicandose Clonazepam 0.5mg VO c/noche (N03AE01), Prednisona 20mg VO c/24h (H02AB07) y Tramadol 50mg VO c/8h 7d (N02AX02)."}
{"input": {"dx": ["Angina inestable (I20.0)"], "proc": ["Coronariografia (K492)", "Angioplastia DA (K493)"], "tto": ["Noradrenalina EV (C01CA03)", "Aspirina 300mg carga (B01AC06)", "Aspirina 100mg (B01AC06)", "Digoxina 0.25mg EV (C01AA05)"], "evo": "Edema pulmonar agudo por disfuncion sistolica, respuesta favorable a diureticos", "dx_alta": ["Angina inestable tratado (I20.0)"], "med": ["Isosorbide 20mg VO c/8h (C01DA08)", "Clopidogrel 75mg VO c/24h 12m (B01AC04)", "Aspirina 100mg VO c/24h (B01AC06)", "Ticagrelor 90mg VO c/12h 12m (B01AC24)"]}, "output": "Ingresa por angina inestable (I20.0). Se realiza coronariografia (K492) visualizando estenosis severa, realizandose angioplastia da (K493) con implante de stent farmacoactivo y flujo TIMI 3 final. En su evolucion, edema pulmonar agudo por disfuncion sistolica, respuesta favorable a diureticos. Recibio tratamiento con Noradrenalina EV (C01CA03), Aspirina 300mg carga (B01AC06), Aspirina 100mg (B01AC06) y Digoxina 0.25mg EV (C01AA05). Evolucion satisfactoria, cumpliendo criterios de alta. Alta con diagnostico de angina inestable tratado (I20.0), indicandose Isosorbide 20mg VO c/8h (C01DA08), Clopidogrel 75mg VO c/24h 12m (B01AC04), Aspirina 100mg VO c/24h (B01AC06) y Ticagrelor 90mg VO c/12h 12m (B01AC24)."}
{"input": {"dx": ["IAMCEST anterior (I21.0)"], "proc": ["Coronariografia (K492)", "Angioplastia OM (36.06)"], "tto": ["Prasugrel 60mg carga (B01AC22)", "Metoprolol 5mg EV (C07AB02)", "Clopidogrel 300mg carga (B01AC04)", "Digoxina 0.25mg EV (C01AA05)"], "evo": "Fibrilacion auricular de alta respuesta, cardioversion farmacologica exitosa", "dx_alta": ["IAMCEST anterior tratado (I21.0)"], "med": ["Clopidogrel 75mg VO c/24h 12m (B01AC04)", "Apixaban 5mg VO c/12h (B01AF02)", "Furosemida 40mg VO c/24h (C03CA01)"]}, "output": "Ingreso por iamcest anterior (I21.0). Se realiza coronariografia (K492) con hallazgo de lesion significativa, realizandose angioplastia om (36.06) con implante de stent farmacoactivo y flujo TIMI 3 final. Evoluciona con, fibrilacion auricular de alta respuesta, cardioversion farmacologica exitosa. Recibio tratamiento con Prasugrel 60mg carga (B01AC22), Metoprolol 5mg EV (C07AB02), Clopidogrel 300mg carga (B01AC04) y Digoxina 0.25mg EV (C01AA05). Evolucion clinica favorable, cumpliendo criterios de alta. Alta con diagnostico de iamcest anterior tratado (I21.0), indicandose Clopidogrel 75mg VO c/24h 12m (B01AC04), Apixaban 5mg VO c/12h (B01AF02) y Furosemida 40mg VO c/24h (C03CA01)."}
{"input": {"dx": ["IAMCEST anteroseptal (I21.0)"], "proc": ["Coronariografia (K492)", "Angioplastia CX (36.06)"], "tto": ["Aspirina 300mg carga (B01AC06)", "Morfina 3mg EV (N02AA01)", "Enalapril 5mg VO (C09AA02)"], "evo": "Taquicardia ventricular sostenida, cardioversion electrica exitosa", "dx_alta": ["IAMCEST anteroseptal tratado (I21.0)"], "med": ["Furosemida 40mg VO c/24h (C03CA01)", "Prasugrel 10mg VO c/24h 12m (B01AC22)", "Rosuvastatina 20mg VO c/noche (C10AA07)"]}, "output": "Ingreso por iamcest anteroseptal (I21.0). Se realiza coronariografia (K492) evidenciando oclusion aguda, realizandose angioplastia cx (36.06) con implante de stent farmacoactivo y flujo TIMI 3 final. En su evolucion, taquicardia ventricular sostenida, cardioversion electrica exitosa. Recibio tratamiento con Aspirina 300mg carga (B01AC06), Morfina 3mg EV (N02AA01) y Enalapril 5mg VO (C09AA02). Presenta evolucion favorable, cumpliendo criterios de alta. Alta con diagnostico de iamcest anteroseptal tratado (I21.0), indicandose Furosemida 40mg VO c/24h (C03CA01), Prasugrel 10mg VO c/24h 12m (B01AC22) y Rosuvastatina 20mg VO c/noche (C10AA07)."}
{"input": {"dx": ["Enfermedad coronaria de 2 vasos (I25.1)"], "proc": ["Coronariografia (K492)", "Angioplastia TCI (K493)"], "tto": ["Nitroglicerina EV (C01DA02)", "Noradrenalina EV (C01CA03)"], "evo": "Pericarditis aguda con derrame leve, manejo antiinflamatorio", "dx_alta": ["Enfermedad coronaria de 2 vasos tratado (I25.1)"], "med": ["Espironolactona 25mg VO c/24h (C03DA01)", "Amlodipino 5mg VO c/24h (C08CA01)", "Furosemida 40mg VO c/24h (C03CA01)"]}, "output": "Ingreso por enfermedad coronaria de 2 vasos (I25.1). Se realiza coronariografia (K492) visualizando estenosis severa, realizandose angioplastia tci (K493) con implante de stent farmacoactivo y flujo TIMI 3 final. Evoluciona con, pericarditis aguda con derrame leve, manejo antiinflamatorio. Recibio tratamiento con Nitroglicerina EV (C01DA02) y Noradrenalina EV (C01CA03). Presenta evolucion favorable, cumpliendo criterios de alta. Alta con diagnostico de enfermedad coronaria de 2 vasos tratado (I25.1), indicandose Espironolactona 25mg VO c/24h (C03DA01), Amlodipino 5mg VO c/24h (C08CA01) y Furosemida 40mg VO c/24h (C03CA01)."}
{"input": {"dx": ["Enfermedad coronaria de 2 vasos (I25.1)"], "proc": ["Coronariografia (K492)", "Angioplastia CD (K493)"], "tto": ["Morfina 3mg EV (N02AA01)", "Heparina EV infusion (B01AB01)", "Prasugrel 60mg carga (B01AC22)", "Metoprolol 5mg EV (C07AB02)"], "evo": "Edema pulmonar agudo por disfuncion sistolica, respuesta favorable a diureticos", "dx_alta": ["Enfermedad coronaria de 2 vasos tratado (I25.1)"], "med": ["Nitroglicerina SL PRN (C01DA02)", "Aspirina 100mg VO c/24h (B01AC06)", "Prasugrel 10mg VO c/24h 12m (B01AC22)", "Metoprolol 50mg VO c/12h (C07AB02)"]}, "output": "Paciente que ingresa con cuadro de enfermedad coronaria de 2 vasos (I25.1). Se realiza coronariografia (K492) visualizando estenosis severa, realizandose angioplastia cd (K493) con implante de stent farmacoactivo y flujo TIMI 3 final. Presenta, edema pulmonar agudo por disfuncion sistolica, respuesta favorable a diureticos. Recibio tratamiento con Morfina 3mg EV (N02AA01), Heparina EV infusion (B01AB01), Prasugrel 60mg carga (B01AC22) y Metoprolol 5mg EV (C07AB02). Evolucion satisfactoria, cumpliendo criterios de alta. Alta con diagnostico de enfermedad coronaria de 2 vasos tratado (I25.1), indicandose Nitroglicerina SL PRN (C01DA02), Aspirina 100mg VO c/24h (B01AC06), Prasugrel 10mg VO c/24h 12m (B01AC22) y Metoprolol 50mg VO c/12h (C07AB02)."}
{"input": {"dx": ["Enfermedad coronaria de 2 vasos (I25.1)"], "proc": ["Coronariografia (K492)"], "tto": ["Clopidogrel 600mg carga (B01AC04)", "Morfina 3mg EV (N02AA01)", "Atorvastatina 80mg (C10AA05)", "Prasugrel 60mg carga (B01AC22)"], "evo": "Lesion severa de CX distal, angioplastia con implante de stent sin complicaciones", "dx_alta": ["Enfermedad coronaria de 2 vasos tratado (I25.1)"], "med": ["Nitroglicerina SL PRN (C01DA02)", "Rosuvastatina 20mg VO c/noche (C10AA07)", "Prasugrel 10mg VO c/24h 12m (B01AC22)", "Rivaroxaban 20mg VO c/24h (B01AF01)"]}, "output": "Ingresa por enfermedad coronaria de 2 vasos (I25.1). Se realiza coronariografia (K492). Evoluciona con, lesion severa de cx distal, angioplastia con implante de stent sin complicaciones. Recibio tratamiento con Clopidogrel 600mg carga (B01AC04), Morfina 3mg EV (N02AA01), Atorvastatina 80mg (C10AA05) y Prasugrel 60mg carga (B01AC22). Buena evolucion, cumpliendo criterios de alta. Alta con diagnostico de enfermedad coronaria de 2 vasos tratado (I25.1), indicandose Nitroglicerina SL PRN (C01DA02), Rosuvastatina 20mg VO c/noche (C10AA07), Prasugrel 10mg VO c/24h 12m (B01AC22) y Rivaroxaban 20mg VO c/24h (B01AF01)."}
{"input": {"dx": ["TEP agudo (I26.9)"], "proc": ["Colonoscopia (45.23)", "Apendicectomia (47.09)"], "tto": ["Insulina cristalina segun esquema (A10AB01)", "Meropenem 1g EV c/8h (J01DH02)", "N-acetilcisteina NBZ c/8h (R05CB01)", "Pantoprazol 40mg EV c/12h (A02BC02)"], "evo": "Evolucion favorable con tratamiento medico, sin complicaciones", "dx_alta": ["TEP agudo resuelto (I26.9)"], "med": ["Ciprofloxacino 500mg VO c/12h 7d (J01MA02)", "Salbutamol INH 2 puff c/6h PRN (R03AC02)"]}, "output": "Ingreso por tep agudo (I26.9). Se realiza colonoscopia (45.23), apendicectomia (47.09). Evoluciona con, evolucion favorable con tratamiento medico, sin complicaciones. Recibio tratamiento con Insulina cristalina segun esquema (A10AB01), Meropenem 1g EV c/8h (J01DH02), N-acetilcisteina NBZ c/8h (R05CB01) y Pantoprazol 40mg EV c/12h (A02BC02). Evolucion clinica favorable, cumpliendo criterios de alta. Alta con diagnostico de tep agudo resuelto (I26.9), indicandose Ciprofloxacino 500mg VO c/12h 7d (J01MA02) y Salbutamol INH 2 puff c/6h PRN (R03AC02)."}
{"input": {"dx": ["Trombosis de stent (I21.0)"], "proc": ["Angioplastia CX (37.34)"], "tto": ["Nitroglicerina EV (C01DA02)", "Aspirina 100mg (B01AC06)", "Furosemida 40mg EV (C03CA01)", "Dobutamina EV (C01CA07)"], "evo": "Pericarditis aguda con derrame leve, manejo antiinflamatorio", "dx_alta": ["Trombosis de stent tratado (I21.0)"], "med": ["Amlodipino 5mg VO c/24h (C08CA01)", "Digoxina 0.125mg VO c/24h (C01AA05)", "Nitroglicerina SL PRN (C01DA02)", "Espironolactona 25mg VO c/24h (C03DA01)"]}, "output": "Se hospitaliza por trombosis de stent (I21.0). Se realiza angioplastia cx (37.34). Evoluciona con, pericarditis aguda con derrame leve, manejo antiinflamatorio. Recibio tratamiento con Nitroglicerina EV (C01DA02), Aspirina 100mg (B01AC06), Furosemida 40mg EV (C03CA01) y Dobutamina EV (C01CA07). Presenta evolucion favorable, cumpliendo criterios de alta. Alta con diagnostico de trombosis de stent tratado (I21.0), indicandose Amlodipino 5mg VO c/24h (C08CA01), Digoxina 0.125mg VO c/24h (C01AA05), Nitroglicerina SL PRN (C01DA02) y Espironolactona 25mg VO c/24h (C03DA01)."}
{"input": {"dx": ["IAMCEST posterior (I21.2)"], "proc": ["Coronariografia (K492)", "Angioplastia OM (36.06)"], "tto": ["Levosimendan EV (C01CX08)", "Heparina 5000UI EV (B01AB01)", "Dobutamina EV (C01CA07)", "Metoprolol 5mg EV (C07AB02)"], "evo": "Enfermedad de multiples vasos, se deriva a cirugia cardiaca para bypass", "dx_alta": ["IAMCEST posterior tratado (I21.2)"], "med": ["Atorvastatina 40mg VO c/noche (C10AA05)", "Clopidogrel 75mg VO c/24h 12m (B01AC04)", "Espironolactona 25mg VO c/24h (C03DA01)", "Apixaban 5mg VO c/12h (B01AF02)", "Bisoprolol 5mg VO c/24h (C07AB07)"]}, "output": "Paciente que ingresa con cuadro de iamcest posterior (I21.2). Se realiza coronariografia (K492) evidenciando oclusion aguda, realizandose angioplastia om (36.06) con implante de stent farmacoactivo y flujo TIMI 3 final. Durante la hospitalizacion, enfermedad de multiples vasos, se deriva a cirugia cardiaca para bypass. Recibio tratamiento con Levosimendan EV (C01CX08), Heparina 5000UI EV (B01AB01), Dobutamina EV (C01CA07) y Metoprolol 5mg EV (C07AB02). Presenta evolucion favorable, cumpliendo criterios de alta. Alta con diagnostico de iamcest posterior tratado (I21.2), indicandose Atorvastatina 40mg VO c/noche (C10AA05), Clopidogrel 75mg VO c/24h 12m (B01AC04), Espironolactona 25mg VO c/24h (C03DA01), Apixaban 5mg VO c/12h (B01AF02) y Bisoprolol 5mg VO c/24h (C07AB07)."}
{"input": {"dx": ["Enfermedad de TCI (I25.1)"], "proc": ["Ablacion por radiofrecuencia (89.64)"], "tto": ["Furosemida 80mg EV (C03CA01)", "Clopidogrel 600mg carga (B01AC04)"], "evo": "Fibrilacion auricular de alta respuesta, cardioversion farmacologica exitosa", "dx_alta": ["Enfermedad de TCI tratado (I25.1)"], "med": ["Clopidogrel 75mg VO c/24h 12m (B01AC04)", "Rivaroxaban 20mg VO c/24h (B01AF01)", "Amlodipino 5mg VO c/24h (C08CA01)", "Warfarina segun INR (B01AA03)"]}, "output": "Se hospitaliza por enfermedad de tci (I25.1). Se realiza ablacion por radiofrecuencia (89.64). Evoluciona con, fibrilacion auricular de alta respuesta, cardioversion farmacologica exitosa. Recibio tratamiento con Furosemida 80mg EV (C03CA01) y Clopidogrel 600mg carga (B01AC04). Evolucion satisfactoria, cumpliendo criterios de alta. Alta con diagnostico de enfermedad de tci tratado (I25.1), indicandose Clopidogrel 75mg VO c/24h 12m (B01AC04), Rivaroxaban 20mg VO c/24h (B01AF01), Amlodipino 5mg VO c/24h (C08CA01) y Warfarina segun INR (B01AA03)."}
{"input": {"dx": ["IAMCEST inferolateral (I21.1)"], "proc": ["Coronariografia (K492)", "Angioplastia OM (36.06)"], "tto": ["Morfina 3mg EV (N02AA01)", "Digoxina 0.25mg EV (C01AA05)", "Levosimendan EV (C01CX08)", "Ticagrelor 180mg carga (B01AC24)"], "evo": "Edema pulmonar agudo por disfuncion sistolica, respuesta favorable a diureticos", "dx_alta": ["IAMCEST inferolateral tratado (I21.1)"], "med": ["Rosuvastatina 20mg VO c/noche (C10AA07)", "Nitroglicerina SL PRN (C01DA02)", "Enalapril 10mg VO c/12h (C09AA02)"]}, "output": "Paciente que ingresa con cuadro de iamcest inferolateral (I21.1). Se realiza coronariografia (K492) visualizando estenosis severa, realizandose angioplastia om (36.06) con implante de stent farmacoactivo y flujo TIMI 3 final. Presenta, edema pulmonar agudo por disfuncion sistolica, respuesta favorable a diureticos. Recibio tratamiento con Morfina 3mg EV (N02AA01), Digoxina 0.25mg EV (C01AA05), Levosimendan EV (C01CX08) y Ticagrelor 180mg carga (B01AC24). Evolucion clinica favorable, cumpliendo criterios de alta. Alta con diagnostico de iamcest inferolateral tratado (I21.1), indicandose Rosuvastatina 20mg VO c/noche (C10AA07), Nitroglicerina SL PRN (C01DA02) y Enalapril 10mg VO c/12h (C09AA02)."}
{"input": {"dx": ["Reestenosis intra-stent (I25.5)"], "proc": ["Ablacion por radiofrecuencia (35.04)"], "tto": ["Atorvastatina 80mg (C10AA05)", "Ticagrelor 180mg carga (B01AC24)", "Prasugrel 60mg carga (B01AC22)"], "evo": "Lesion severa de OM2, angioplastia con implante de stent sin complicaciones", "dx_alta": ["Reestenosis intra-stent tratado (I25.5)"], "med": ["Bisoprolol 5mg VO c/24h (C07AB07)", "Carvedilol 6.25mg VO c/12h (C07AG02)", "Rivaroxaban 20mg VO c/24h (B01AF01)", "Enalapril 10mg VO c/12h (C09AA02)"]}, "output": "Ingresa por reestenosis intra-stent (I25.5). Se realiza ablacion por radiofrecuencia (35.04). Presenta, lesion severa de om2, angioplastia con implante de stent sin complicaciones. Recibio tratamiento con Atorvastatina 80mg (C10AA05), Ticagrelor 180mg carga (B01AC24) y Prasugrel 60mg carga (B01AC22). Presenta evolucion favorable, cumpliendo criterios de alta. Alta con diagnostico de reestenosis intra-stent tratado (I25.5), indicandose Bisoprolol 5mg VO c/24h (C07AB07), Carvedilol 6.25mg VO c/12h (C07AG02), Rivaroxaban 20mg VO c/24h (B01AF01) y Enalapril 10mg VO c/12h (C09AA02)."}
{"input": {"dx": ["Enfermedad de TCI (I25.1)"], "proc": ["Test de esfuerzo (35.04)"], "tto": ["Clopidogrel 600mg carga (B01AC04)", "Atorvastatina 80mg (C10AA05)"], "evo": "Enfermedad de multiples vasos, se deriva a cirugia cardiaca para bypass", "dx_alta": ["Enfermedad de TCI tratado (I25.1)"], "med": ["Prasugrel 10mg VO c/24h 12m (B01AC22)", "Isosorbide 20mg VO c/8h (C01DA08)", "Atorvastatina 40mg VO c/noche (C10AA05)"]}, "output": "Paciente que ingresa con cuadro de enfermedad de tci (I25.1). Se realiza test de esfuerzo (35.04). Durante la hospitalizacion, enfermedad de multiples vasos, se deriva a cirugia cardiaca para bypass. Recibio tratamiento con Clopidogrel 600mg carga (B01AC04) y Atorvastatina 80mg (C10AA05). Evolucion clinica favorable, cumpliendo criterios de alta. Alta con diagnostico de enfermedad de tci tratado (I25.1), indicandose Prasugrel 10mg VO c/24h 12m (B01AC22), Isosorbide 20mg VO c/8h (C01DA08) y Atorvastatina 40mg VO c/noche (C10AA05)."}
{"input": {"dx": ["IAMCEST inferior (I21.1)"], "proc": ["Coronariografia (K492)"], "tto": ["Metoprolol 5mg EV (C07AB02)", "Enoxaparina 1mg/kg SC c/12h (B01AB05)", "Digoxina 0.25mg EV (C01AA05)"], "evo": "Estenosis aortica severa sintomatica, programada para TAVI", "dx_alta": ["IAMCEST inferior tratado (I21.1)"], "med": ["Apixaban 5mg VO c/12h (B01AF02)", "Metoprolol 50mg VO c/12h (C07AB02)", "Espironolactona 25mg VO c/24h (C03DA01)", "Nitroglicerina SL PRN (C01DA02)", "Warfarina segun INR (B01AA03)"]}, "output": "Se hospitaliza por iamcest inferior (I21.1). Se realiza coronariografia (K492). Presenta, estenosis aortica severa sintomatica, programada para tavi. Recibio tratamiento con Metoprolol 5mg EV (C07AB02), Enoxaparina 1mg/kg SC c/12h (B01AB05) y Digoxina 0.25mg EV (C01AA05). Buena evolucion, cumpliendo criterios de alta. Alta con diagnostico de iamcest inferior tratado (I21.1), indicandose Apixaban 5mg VO c/12h (B01AF02), Metoprolol 50mg VO c/12h (C07AB02), Espironolactona 25mg VO c/24h (C03DA01), Nitroglicerina SL PRN (C01DA02) y Warfarina segun INR (B01AA03)."}
{"input": {"dx": ["IAMCEST lateral (I21.2)"], "proc": ["Coronariografia (K492)", "Angioplastia CD (K493)"], "tto": ["Furosemida 80mg EV (C03CA01)", "Aspirina 100mg (B01AC06)"], "evo": "Oclusion aguda de CX distal, angioplastia exitosa con stent farmacoactivo, flujo TIMI 3 final", "dx_alta": ["IAMCEST lateral tratado (I21.2)"], "med": ["Enalapril 10mg VO c/12h (C09AA02)", "Clopidogrel 75mg VO c/24h 12m (B01AC04)", "Aspirina 100mg VO c/24h (B01AC06)"]}, "output": "Se hospitaliza por iamcest lateral (I21.2). Se realiza coronariografia (K492) encontrando lesion critica, realizandose angioplastia cd (K493) con implante de stent farmacoactivo y flujo TIMI 3 final. Presenta, oclusion aguda de cx distal, angioplastia exitosa con stent farmacoactivo, flujo timi 3 final. Recibio tratamiento con Furosemida 80mg EV (C03CA01) y Aspirina 100mg (B01AC06). Buena evolucion, cumpliendo criterios de alta. Alta con diagnostico de iamcest lateral tratado (I21.2), indicandose Enalapril 10mg VO c/12h (C09AA02), Clopidogrel 75mg VO c/24h 12m (B01AC04) y Aspirina 100mg VO c/24h (B01AC06)."}
{"input": {"dx": ["Insuficiencia cardiaca aguda (I50.9)"], "proc": ["TAVI (35.04)"], "tto": ["Enalapril 5mg VO (C09AA02)", "Amiodarona 300mg EV (C01BD01)"], "evo": "Enfermedad de multiples vasos, se deriva a cirugia cardiaca para bypass", "dx_alta": ["Insuficiencia cardiaca aguda tratado (I50.9)"], "med": ["Apixaban 5mg VO c/12h (B01AF02)", "Furosemida 40mg VO c/24h (C03CA01)", "Rosuvastatina 20mg VO c/noche (C10AA07)", "Digoxina 0.125mg VO c/24h (C01AA05)"]}, "output": "Ingresa por insuficiencia cardiaca aguda (I50.9). Se realiza tavi (35.04). Presenta, enfermedad de multiples vasos, se deriva a cirugia cardiaca para bypass. Recibio tratamiento con Enalapril 5mg VO (C09AA02) y Amiodarona 300mg EV (C01BD01). Buena evolucion, cumpliendo criterios de alta. Alta con diagnostico de insuficiencia cardiaca aguda tratado (I50.9), indicandose Apixaban 5mg VO c/12h (B01AF02), Furosemida 40mg VO c/24h (C03CA01), Rosuvastatina 20mg VO c/noche (C10AA07) y Digoxina 0.125mg VO c/24h (C01AA05)."}
{"input": {"dx": ["IAMCEST anterolateral (I21.0)"], "proc": ["Coronariografia (K492)"], "tto": ["Furosemida 40mg EV (C03CA01)", "Furosemida 80mg EV (C03CA01)", "Enalapril 5mg VO (C09AA02)", "Nitroglicerina EV (C01DA02)"], "evo": "Lesion severa de CX distal, angioplastia con implante de stent sin complicaciones", "dx_alta": ["IAMCEST anterolateral tratado (I21.0)"], "med": ["Rivaroxaban 20mg VO c/24h (B01AF01)", "Espironolactona 25mg VO c/24h (C03DA01)", "Losartan 50mg VO c/24h (C09CA01)"]}, "output": "Paciente que ingresa con cuadro de iamcest anterolateral (I21.0). Se realiza coronariografia (K492). Durante la hospitalizacion, lesion severa de cx distal, angioplastia con implante de stent sin complicaciones. Recibio tratamiento con Furosemida 40mg EV (C03CA01), Furosemida 80mg EV (C03CA01), Enalapril 5mg VO (C09AA02) y Nitroglicerina EV (C01DA02). Buena evolucion, cumpliendo criterios de alta. Alta con diagnostico de iamcest anterolateral tratado (I21.0), indicandose Rivaroxaban 20mg VO c/24h (B01AF01), Espironolactona 25mg VO c/24h (C03DA01) y Losartan 50mg VO c/24h (C09CA01)."}
{"input": {"dx": ["Enfermedad de TCI (I25.1)"], "proc": ["Test de esfuerzo (37.34)"], "tto": ["Noradrenalina EV (C01CA03)", "Heparina 5000UI EV (B01AB01)", "Ticagrelor 180mg carga (B01AC24)"], "evo": "Shock cardiogenico, requirio soporte con inotropicos, evolucion favorable", "dx_alta": ["Enfermedad de TCI tratado (I25.1)"], "med": ["Prasugrel 10mg VO c/24h 12m (B01AC22)", "Furosemida 40mg VO c/24h (C03CA01)", "Enalapril 10mg VO c/12h (C09AA02)"]}, "output": "Paciente que ingresa con cuadro de enfermedad de tci (I25.1). Se realiza test de esfuerzo (37.34). Evoluciona con, shock cardiogenico, requirio soporte con inotropicos, evolucion favorable. Recibio tratamiento con Noradrenalina EV (C01CA03), Heparina 5000UI EV (B01AB01) y Ticagrelor 180mg carga (B01AC24). Buena evolucion, cumpliendo criterios de alta. Alta con diagnostico de enfermedad de tci tratado (I25.1), indicandose Prasugrel 10mg VO c/24h 12m (B01AC22), Furosemida 40mg VO c/24h (C03CA01) y Enalapril 10mg VO c/12h (C09AA02)."}
{"input": {"dx": ["Angina inestable (I20.0)"], "proc": ["Coronariografia (K492)", "Angioplastia CD (K493)"], "tto": ["Metoprolol 5mg EV (C07AB02)", "Aspirina 300mg carga (B01AC06)"], "evo": "Bloqueo AV completo sintomatico, requirio marcapasos transitorio", "dx_alta": ["Angina inestable tratado (I20.0)"], "med": ["Metoprolol 50mg VO c/12h (C07AB02)", "Nitroglicerina SL PRN (C01DA02)", "Espironolactona 25mg VO c/24h (C03DA01)", "Warfarina segun INR (B01AA03)"]}, "output": "Paciente que ingresa con cuadro de angina inestable (I20.0). Se realiza coronariografia (K492) encontrando lesion critica, realizandose angioplastia cd (K493) con implante de stent farmacoactivo y flujo TIMI 3 final. Evoluciona con, bloqueo av completo sintomatico, requirio marcapasos transitorio. Recibio tratamiento con Metoprolol 5mg EV (C07AB02) y Aspirina 300mg carga (B01AC06). Buena evolucion, cumpliendo criterios de alta. Alta con diagnostico de angina inestable tratado (I20.0), indicandose Metoprolol 50mg VO c/12h (C07AB02), Nitroglicerina SL PRN (C01DA02), Espironolactona 25mg VO c/24h (C03DA01) y Warfarina segun INR (B01AA03)."}
{"input": {"dx": ["Edema pulmonar agudo (J81)"], "proc": ["Angioplastia CD (K493)"], "tto": ["Enalapril 5mg VO (C09AA02)", "Clopidogrel 600mg carga (B01AC04)", "Noradrenalina EV (C01CA03)", "Atorvastatina 80mg (C10AA05)"], "evo": "Oclusion de DA distal con trombo, trombectomia por aspiracion mas stent", "dx_alta": ["Edema pulmonar agudo tratado (J81)"], "med": ["Furosemida 40mg VO c/24h (C03CA01)", "Prasugrel 10mg VO c/24h 12m (B01AC22)", "Warfarina segun INR (B01AA03)", "Espironolactona 25mg VO c/24h (C03DA01)", "Ticagrelor 90mg VO c/12h 12m (B01AC24)"]}, "output": "Ingreso por edema pulmonar agudo (J81). Se realiza angioplastia cd (K493). Durante la hospitalizacion, oclusion de da distal con trombo, trombectomia por aspiracion mas stent. Recibio tratamiento con Enalapril 5mg VO (C09AA02), Clopidogrel 600mg carga (B01AC04), Noradrenalina EV (C01CA03) y Atorvastatina 80mg (C10AA05). Evolucion satisfactoria, cumpliendo criterios de alta. Alta con diagnostico de edema pulmonar agudo tratado (J81), indicandose Furosemida 40mg VO c/24h (C03CA01), Prasugrel 10mg VO c/24h 12m (B01AC22), Warfarina segun INR (B01AA03), Espironolactona 25mg VO c/24h (C03DA01) y Ticagrelor 90mg VO c/12h 12m (B01AC24)."}
{"input": {"dx": ["Enfermedad coronaria de 3 vasos (I25.1)"], "proc": ["Coronariografia (K492)", "Angioplastia DA (36.06)"], "tto": ["Prasugrel 60mg carga (B01AC22)", "Heparina 5000UI EV (B01AB01)", "Furosemida 40mg EV (C03CA01)", "Ticagrelor 180mg carga (B01AC24)"], "evo": "Oclusion aguda de ramus intermedio, angioplastia exitosa con stent farmacoactivo, flujo TIMI 3 final", "dx_alta": ["Enfermedad coronaria de 3 vasos tratado (I25.1)"], "med": ["Ticagrelor 90mg VO c/12h 12m (B01AC24)", "Clopidogrel 75mg VO c/24h 12m (B01AC04)", "Metoprolol 50mg VO c/12h (C07AB02)", "Carvedilol 6.25mg VO c/12h (C07AG02)", "Digoxina 0.125mg VO c/24h (C01AA05)"]}, "output": "Ingresa por enfermedad coronaria de 3 vasos (I25.1). Se realiza coronariografia (K492) encontrando lesion critica, realizandose angioplastia da (36.06) con implante de stent farmacoactivo y flujo TIMI 3 final. Evoluciona con, oclusion aguda de ramus intermedio, angioplastia exitosa con stent farmacoactivo, flujo timi 3 final. Recibio tratamiento con Prasugrel 60mg carga (B01AC22), Heparina 5000UI EV (B01AB01), Furosemida 40mg EV (C03CA01) y Ticagrelor 180mg carga (B01AC24). Presenta evolucion favorable, cumpliendo criterios de alta. Alta con diagnostico de enfermedad coronaria de 3 vasos tratado (I25.1), indicandose Ticagrelor 90mg VO c/12h 12m (B01AC24), Clopidogrel 75mg VO c/24h 12m (B01AC04), Metoprolol 50mg VO c/12h (C07AB02), Carvedilol 6.25mg VO c/12h (C07AG02) y Digoxina 0.125mg VO c/24h (C01AA05)."}
{"input": {"dx": ["IAMCEST inferolateral (I21.1)"], "proc": ["Coronariografia (K492)", "Angioplastia TCI (36.06)"], "tto": ["Amiodarona 300mg EV (C01BD01)", "Furosemida 40mg EV (C03CA01)", "Enoxaparina 60mg SC c/12h (B01AB05)"], "evo": "Shock cardiogenico, requirio soporte con inotropicos, evolucion favorable", "dx_alta": ["IAMCEST inferolateral tratado (I21.1)"], "med": ["Carvedilol 6.25mg VO c/12h (C07AG02)", "Prasugrel 10mg VO c/24h 12m (B01AC22)", "Apixaban 5mg VO c/12h (B01AF02)"]}, "output": "Ingreso por iamcest inferolateral (I21.1). Se realiza coronariografia (K492) evidenciando oclusion aguda, realizandose angioplastia tci (36.06) con implante de stent farmacoactivo y flujo TIMI 3 final. En su evolucion, shock cardiogenico, requirio soporte con inotropicos, evolucion favorable. Recibio tratamiento con Amiodarona 300mg EV (C01BD01), Furosemida 40mg EV (C03CA01) y Enoxaparina 60mg SC c/12h (B01AB05). Presenta evolucion favorable, cumpliendo criterios de alta. Alta con diagnostico de iamcest inferolateral tratado (I21.1), indicandose Carvedilol 6.25mg VO c/12h (C07AG02), Prasugrel 10mg VO c/24h 12m (B01AC22) y Apixaban 5mg VO c/12h (B01AF02)."}
{"input": {"dx": ["Insuficiencia mitral severa (I34.0)"], "proc": ["Angio TAC cerebral (88.38)", "RMN cerebral (88.91)"], "tto": ["Morfina 3mg EV c/4h PRN (N02AA01)", "Metronidazol 500mg EV c/8h (J01XD01)"], "evo": "Estabilizacion clinica progresiva, sin eventos adversos", "dx_alta": ["Insuficiencia mitral severa resuelto (I34.0)"], "med": ["Levotiroxina 50mcg VO c/24h (H03AA01)", "Glibenclamida 5mg VO c/24h (A10BB01)"]}, "output": "Ingresa por insuficiencia mitral severa (I34.0). Se realiza angio tac cerebral (88.38), rmn cerebral (88.91). Durante la hospitalizacion, estabilizacion clinica progresiva, sin eventos adversos. Recibio tratamiento con Morfina 3mg EV c/4h PRN (N02AA01) y Metronidazol 500mg EV c/8h (J01XD01). Evolucion satisfactoria, cumpliendo criterios de alta. Alta con diagnostico de insuficiencia mitral severa resuelto (I34.0), indicandose Levotiroxina 50mcg VO c/24h (H03AA01) y Glibenclamida 5mg VO c/24h (A10BB01)."}
{"input": {"dx": ["IAMCEST anterior (I21.0)"], "proc": ["Coronariografia (K492)", "Angioplastia DA (K493)"], "tto": ["Heparina EV infusion (B01AB01)", "Amiodarona 300mg EV (C01BD01)", "Dobutamina EV (C01CA07)", "Digoxina 0.25mg EV (C01AA05)"], "evo": "Pericarditis aguda con derrame leve, manejo antiinflamatorio", "dx_alta": ["IAMCEST anterior tratado (I21.0)"], "med": ["Clopidogrel 75mg VO c/24h 12m (B01AC04)", "Bisoprolol 5mg VO c/24h (C07AB07)", "Furosemida 40mg VO c/24h (C03CA01)", "Atorvastatina 40mg VO c/noche (C10AA05)", "Warfarina segun INR (B01AA03)"]}, "output": "Ingresa por iamcest anterior (I21.0). Se realiza coronariografia (K492) evidenciando oclusion aguda, realizandose angioplastia da (K493) con implante de stent farmacoactivo y flujo TIMI 3 final. Presenta, pericarditis aguda con derrame leve, manejo antiinflamatorio. Recibio tratamiento con Heparina EV infusion (B01AB01), Amiodarona 300mg EV (C01BD01), Dobutamina EV (C01CA07) y Digoxina 0.25mg EV (C01AA05). Evolucion clinica favorable, cumpliendo criterios de alta. Alta con diagnostico de iamcest anterior tratado (I21.0), indicandose Clopidogrel 75mg VO c/24h 12m (B01AC04), Bisoprolol 5mg VO c/24h (C07AB07), Furosemida 40mg VO c/24h (C03CA01), Atorvastatina 40mg VO c/noche (C10AA05) y Warfarina segun INR (B01AA03)."}
{"input": {"dx": ["Obstruccion intestinal (K56.6)"], "proc": ["Paracentesis (54.91)", "Hernioplastia inguinal (53.00)"], "tto": ["Paracetamol 1g EV c/8h (N02BE01)", "Insulina cristalina segun esquema (A10AB01)", "Morfina 3mg EV c/4h PRN (N02AA01)"], "evo": "Control de sintomas con tratamiento medico optimizado", "dx_alta": ["Obstruccion intestinal resuelto (K56.6)"], "med": ["Levotiroxina 50mcg VO c/24h (H03AA01)", "Paracetamol 500mg VO c/8h PRN (N02BE01)", "Metformina 850mg VO c/12h (A10BA02)"]}, "output": "Ingreso por obstruccion intestinal (K56.6). Se realiza paracentesis (54.91), hernioplastia inguinal (53.00). Evoluciona con, control de sintomas con tratamiento medico optimizado. Recibio tratamiento con Paracetamol 1g EV c/8h (N02BE01), Insulina cristalina segun esquema (A10AB01) y Morfina 3mg EV c/4h PRN (N02AA01). Presenta evolucion favorable, cumpliendo criterios de alta. Alta con diagnostico de obstruccion intestinal resuelto (K56.6), indicandose Levotiroxina 50mcg VO c/24h (H03AA01), Paracetamol 500mg VO c/8h PRN (N02BE01) y Metformina 850mg VO c/12h (A10BA02)."}
{"input": {"dx": ["Colecistitis aguda (K81.0)"], "proc": ["Osteosintesis de cadera (79.35)", "Paracentesis (54.91)"], "tto": ["Ciprofloxacino 400mg EV c/12h (J01MA02)", "N-acetilcisteina NBZ c/8h (R05CB01)", "Paracetamol 1g EV c/8h (N02BE01)", "Ampicilina/Sulbactam 1.5g EV c/6h (J01CR01)"], "evo": "Control de sintomas con tratamiento medico optimizado", "dx_alta": ["Colecistitis aguda resuelto (K81.0)"], "med": ["Sertralina 50mg VO c/24h (N06AB06)", "Vitamina D 1000UI VO c/24h (A11CC05)"]}, "output": "Paciente que ingresa con cuadro de colecistitis aguda (K81.0). Se realiza osteosintesis de cadera (79.35), paracentesis (54.91). En su evolucion, control de sintomas con tratamiento medico optimizado. Recibio tratamiento con Ciprofloxacino 400mg EV c/12h (J01MA02), N-acetilcisteina NBZ c/8h (R05CB01), Paracetamol 1g EV c/8h (N02BE01) y Ampicilina/Sulbactam 1.5g EV c/6h (J01CR01). Buena evolucion, cumpliendo criterios de alta. Alta con diagnostico de colecistitis aguda resuelto (K81.0), indicandose Sertralina 50mg VO c/24h (N06AB06) y Vitamina D 1000UI VO c/24h (A11CC05)."}
{"input": {"dx": ["Sincope (R55)"], "proc": ["TAC de abdomen (88.01)", "Angio TAC cerebral (88.38)"], "tto": ["Hidrocortisona 100mg EV c/8h (H02AB09)", "Insulina cristalina segun esquema (A10AB01)", "Paracetamol 1g EV c/8h (N02BE01)"], "evo": "Control de sintomas con tratamiento medico optimizado", "dx_alta": ["Sincope resuelto (R55)"], "med": ["Levotiroxina 50mcg VO c/24h (H03AA01)", "Glibenclamida 5mg VO c/24h (A10BB01)"]}, "output": "Se hospitaliza por sincope (R55). Se realiza tac de abdomen (88.01), angio tac cerebral (88.38). Durante la hospitalizacion, control de sintomas con tratamiento medico optimizado. Recibio tratamiento con Hidrocortisona 100mg EV c/8h (H02AB09), Insulina cristalina segun esquema (A10AB01) y Paracetamol 1g EV c/8h (N02BE01). Evolucion satisfactoria, cumpliendo criterios de alta. Alta con diagnostico de sincope resuelto (R55), indicandose Levotiroxina 50mcg VO c/24h (H03AA01) y Glibenclamida 5mg VO c/24h (A10BB01)."}
{"input": {"dx": ["Taquicardia ventricular (I47.2)"], "proc": ["TAC de abdomen (88.01)"], "tto": ["Meropenem 1g EV c/8h (J01DH02)", "Ipratropio NBZ c/6h (R03BB01)", "Pantoprazol 40mg EV c/12h (A02BC02)"], "evo": "Respuesta adecuada al tratamiento antibiotico, afebril desde dia 2", "dx_alta": ["Taquicardia ventricular resuelto (I47.2)"], "med": ["Sertralina 50mg VO c/24h (N06AB06)", "Glibenclamida 5mg VO c/24h (A10BB01)"]}, "output": "Ingreso por taquicardia ventricular (I47.2). Se realiza tac de abdomen (88.01). En su evolucion, respuesta adecuada al tratamiento antibiotico, afebril desde dia 2. Recibio tratamiento con Meropenem 1g EV c/8h (J01DH02), Ipratropio NBZ c/6h (R03BB01) y Pantoprazol 40mg EV c/12h (A02BC02). Buena evolucion, cumpliendo criterios de alta. Alta con diagnostico de taquicardia ventricular resuelto (I47.2), indicandose Sertralina 50mg VO c/24h (N06AB06) y Glibenclamida 5mg VO c/24h (A10BB01)."}
{"input": {"dx": ["IAMCEST anterior (I21.0)"], "proc": ["Coronariografia (K492)", "Angioplastia CD (K493)"], "tto": ["Metoprolol 5mg EV (C07AB02)", "Clopidogrel 300mg carga (B01AC04)", "Dobutamina EV (C01CA07)", "Clopidogrel 600mg carga (B01AC04)"], "evo": "Fibrilacion auricular de alta respuesta, cardioversion farmacologica exitosa", "dx_alta": ["IAMCEST anterior tratado (I21.0)"], "med": ["Enalapril 10mg VO c/12h (C09AA02)", "Bisoprolol 5mg VO c/24h (C07AB07)", "Furosemida 40mg VO c/24h (C03CA01)", "Carvedilol 6.25mg VO c/12h (C07AG02)"]}, "output": "Se hospitaliza por iamcest anterior (I21.0). Se realiza coronariografia (K492) visualizando estenosis severa, realizandose angioplastia cd (K493) con implante de stent farmacoactivo y flujo TIMI 3 final. Presenta, fibrilacion auricular de alta respuesta, cardioversion farmacologica exitosa. Recibio tratamiento con Metoprolol 5mg EV (C07AB02), Clopidogrel 300mg carga (B01AC04), Dobutamina EV (C01CA07) y Clopidogrel 600mg carga (B01AC04). Evolucion satisfactoria, cumpliendo criterios de alta. Alta con diagnostico de iamcest anterior tratado (I21.0), indicandose Enalapril 10mg VO c/12h (C09AA02), Bisoprolol 5mg VO c/24h (C07AB07), Furosemida 40mg VO c/24h (C03CA01) y Carvedilol 6.25mg VO c/12h (C07AG02)."}
{"input": {"dx": ["Reestenosis intra-stent (I25.5)"], "proc": ["Ablacion por radiofrecuencia (88.72)"], "tto": ["Nitroglicerina EV (C01DA02)", "Furosemida 80mg EV (C03CA01)", "Heparina EV infusion (B01AB01)"], "evo": "Edema pulmonar agudo por disfuncion sistolica, respuesta favorable a diureticos", "dx_alta": ["Reestenosis intra-stent tratado (I25.5)"], "med": ["Rosuvastatina 20mg VO c/noche (C10AA07)", "Nitroglicerina SL PRN (C01DA02)", "Metoprolol 50mg VO c/12h (C07AB02)"]}, "output": "Se hospitaliza por reestenosis intra-stent (I25.5). Se realiza ablacion por radiofrecuencia (88.72). En su evolucion, edema pulmonar agudo por disfuncion sistolica, respuesta favorable a diureticos. Recibio tratamiento con Nitroglicerina EV (C01DA02), Furosemida 80mg EV (C03CA01) y Heparina EV infusion (B01AB01). Evolucion clinica favorable, cumpliendo criterios de alta. Alta con diagnostico de reestenosis intra-stent tratado (I25.5), indicandose Rosuvastatina 20mg VO c/noche (C10AA07), Nitroglicerina SL PRN (C01DA02) y Metoprolol 50mg VO c/12h (C07AB02)."}
{"input": {"dx": ["Enfermedad coronaria de 2 vasos (I25.1)"], "proc": ["Coronariografia (K492)", "Angioplastia CD (36.06)"], "tto": ["Levosimendan EV (C01CX08)", "Digoxina 0.25mg EV (C01AA05)", "Nitroglicerina EV (C01DA02)", "Ticagrelor 180mg carga (B01AC24)"], "evo": "Estenosis aortica severa sintomatica, programada para TAVI", "dx_alta": ["Enfermedad coronaria de 2 vasos tratado (I25.1)"], "med": ["Apixaban 5mg VO c/12h (B01AF02)", "Carvedilol 6.25mg VO c/12h (C07AG02)", "Digoxina 0.125mg VO c/24h (C01AA05)", "Rivaroxaban 20mg VO c/24h (B01AF01)"]}, "output": "Ingreso por enfermedad coronaria de 2 vasos (I25.1). Se realiza coronariografia (K492) evidenciando oclusion aguda, realizandose angioplastia cd (36.06) con implante de stent farmacoactivo y flujo TIMI 3 final. Durante la hospitalizacion, estenosis aortica severa sintomatica, programada para tavi. Recibio tratamiento con Levosimendan EV (C01CX08), Digoxina 0.25mg EV (C01AA05), Nitroglicerina EV (C01DA02) y Ticagrelor 180mg carga (B01AC24). Presenta evolucion favorable, cumpliendo criterios de alta. Alta con diagnostico de enfermedad coronaria de 2 vasos tratado (I25.1), indicandose Apixaban 5mg VO c/12h (B01AF02), Carvedilol 6.25mg VO c/12h (C07AG02), Digoxina 0.125mg VO c/24h (C01AA05) y Rivaroxaban 20mg VO c/24h (B01AF01)."}
{"input": {"dx": ["Taquicardia ventricular (I47.2)"], "proc": ["TAC de torax (87.41)"], "tto": ["Paracetamol 1g EV c/8h (N02BE01)", "Morfina 3mg EV c/4h PRN (N02AA01)", "Metoclopramida 10mg EV c/8h (A03FA01)"], "evo": "Procedimiento sin complicaciones, buena tolerancia oral", "dx_alta": ["Taquicardia ventricular resuelto (I47.2)"], "med": ["Glibenclamida 5mg VO c/24h (A10BB01)", "Clonazepam 0.5mg VO c/noche (N03AE01)"]}, "output": "Ingreso por taquicardia ventricular (I47.2). Se realiza tac de torax (87.41). Presenta, procedimiento sin complicaciones, buena tolerancia oral. Recibio tratamiento con Paracetamol 1g EV c/8h (N02BE01), Morfina 3mg EV c/4h PRN (N02AA01) y Metoclopramida 10mg EV c/8h (A03FA01). Presenta evolucion favorable, cumpliendo criterios de alta. Alta con diagnostico de taquicardia ventricular resuelto (I47.2), indicandose Glibenclamida 5mg VO c/24h (A10BB01) y Clonazepam 0.5mg VO c/noche (N03AE01)."}
{"input": {"dx": ["Shock cardiogenico (R57.0)"], "proc": ["Valvuloplastia mitral (35.04)"], "tto": ["Heparina 5000UI EV (B01AB01)", "Atorvastatina 80mg (C10AA05)"], "evo": "Taquicardia ventricular sostenida, cardioversion electrica exitosa", "dx_alta": ["Shock cardiogenico tratado (R57.0)"], "med": ["Amlodipino 5mg VO c/24h (C08CA01)", "Rosuvastatina 20mg VO c/noche (C10AA07)", "Nitroglicerina SL PRN (C01DA02)"]}, "output": "Se hospitaliza por shock cardiogenico (R57.0). Se realiza valvuloplastia mitral (35.04). Durante la hospitalizacion, taquicardia ventricular sostenida, cardioversion electrica exitosa. Recibio tratamiento con Heparina 5000UI EV (B01AB01) y Atorvastatina 80mg (C10AA05). Evolucion satisfactoria, cumpliendo criterios de alta. Alta con diagnostico de shock cardiogenico tratado (R57.0), indicandose Amlodipino 5mg VO c/24h (C08CA01), Rosuvastatina 20mg VO c/noche (C10AA07) y Nitroglicerina SL PRN (C01DA02)."}
{"input": {"dx": ["Sepsis (A41.9)"], "proc": ["Endoscopia digestiva alta (45.13)"], "tto": ["Insulina cristalina segun esquema (A10AB01)", "Paracetamol 1g EV c/8h (N02BE01)"], "evo": "Manejo conservador exitoso, sin necesidad de cirugia", "dx_alta": ["Sepsis resuelto (A41.9)"], "med": ["Clonazepam 0.5mg VO c/noche (N03AE01)", "Levotiroxina 50mcg VO c/24h (H03AA01)"]}, "output": "Se hospitaliza por sepsis (A41.9). Se realiza endoscopia digestiva alta (45.13). Presenta, manejo conservador exitoso, sin necesidad de cirugia. Recibio tratamiento con Insulina cristalina segun esquema (A10AB01) y Paracetamol 1g EV c/8h (N02BE01). Evolucion satisfactoria, cumpliendo criterios de alta. Alta con diagnostico de sepsis resuelto (A41.9), indicandose Clonazepam 0.5mg VO c/noche (N03AE01) y Levotiroxina 50mcg VO c/24h (H03AA01)."}
{"input": {"dx": ["Enfermedad coronaria de 2 vasos (I25.1)"], "proc": ["Coronariografia (K492)", "Angioplastia CD (K493)"], "tto": ["Digoxina 0.25mg EV (C01AA05)", "Enoxaparina 60mg SC c/12h (B01AB05)", "Levosimendan EV (C01CX08)"], "evo": "Shock cardiogenico, requirio soporte con inotropicos, evolucion favorable", "dx_alta": ["Enfermedad coronaria de 2 vasos tratado (I25.1)"], "med": ["Bisoprolol 5mg VO c/24h (C07AB07)", "Digoxina 0.125mg VO c/24h (C01AA05)", "Nitroglicerina SL PRN (C01DA02)", "Espironolactona 25mg VO c/24h (C03DA01)"]}, "output": "Ingresa por enfermedad coronaria de 2 vasos (I25.1). Se realiza coronariografia (K492) encontrando lesion critica, realizandose angioplastia cd (K493) con implante de stent farmacoactivo y flujo TIMI 3 final. En su evolucion, shock cardiogenico, requirio soporte con inotropicos, evolucion favorable. Recibio tratamiento con Digoxina 0.25mg EV (C01AA05), Enoxaparina 60mg SC c/12h (B01AB05) y Levosimendan EV (C01CX08). Presenta evolucion favorable, cumpliendo criterios de alta. Alta con diagnostico de enfermedad coronaria de 2 vasos tratado (I25.1), indicandose Bisoprolol 5mg VO c/24h (C07AB07), Digoxina 0.125mg VO c/24h (C01AA05), Nitroglicerina SL PRN (C01DA02) y Espironolactona 25mg VO c/24h (C03DA01)."}
{"input": {"dx": ["Enfermedad coronaria de 3 vasos (I25.1)"], "proc": ["Coronariografia (K492)", "Angioplastia CX (K493)"], "tto": ["Heparina EV infusion (B01AB01)", "Clopidogrel 300mg carga (B01AC04)", "Clopidogrel 600mg carga (B01AC04)", "Noradrenalina EV (C01CA03)"], "evo": "Bloqueo AV completo sintomatico, requirio marcapasos transitorio", "dx_alta": ["Enfermedad coronaria de 3 vasos tratado (I25.1)"], "med": ["Rosuvastatina 20mg VO c/noche (C10AA07)", "Nitroglicerina SL PRN (C01DA02)", "Clopidogrel 75mg VO c/24h 12m (B01AC04)"]}, "output": "Paciente que ingresa con cuadro de enfermedad coronaria de 3 vasos (I25.1). Se realiza coronariografia (K492) visualizando estenosis severa, realizandose angioplastia cx (K493) con implante de stent farmacoactivo y flujo TIMI 3 final. Durante la hospitalizacion, bloqueo av completo sintomatico, requirio marcapasos transitorio. Recibio tratamiento con Heparina EV infusion (B01AB01), Clopidogrel 300mg carga (B01AC04), Clopidogrel 600mg carga (B01AC04) y Noradrenalina EV (C01CA03). Evolucion clinica favorable, cumpliendo criterios de alta. Alta con diagnostico de enfermedad coronaria de 3 vasos tratado (I25.1), indicandose Rosuvastatina 20mg VO c/noche (C10AA07), Nitroglicerina SL PRN (C01DA02) y Clopidogrel 75mg VO c/24h 12m (B01AC04)."}
{"input": {"dx": ["Enfermedad coronaria de 2 vasos (I25.1)"], "proc": ["Coronariografia (K492)", "Angioplastia CX (K493)"], "tto": ["Clopidogrel 300mg carga (B01AC04)", "Noradrenalina EV (C01CA03)", "Furosemida 40mg EV (C03CA01)", "Digoxina 0.25mg EV (C01AA05)"], "evo": "Taquicardia ventricular sostenida, cardioversion electrica exitosa", "dx_alta": ["Enfermedad coronaria de 2 vasos tratado (I25.1)"], "med": ["Rivaroxaban 20mg VO c/24h (B01AF01)", "Ticagrelor 90mg VO c/12h 12m (B01AC24)", "Amlodipino 5mg VO c/24h (C08CA01)", "Carvedilol 6.25mg VO c/12h (C07AG02)", "Clopidogrel 75mg VO c/24h 12m (B01AC04)"]}, "output": "Ingresa por enfermedad coronaria de 2 vasos (I25.1). Se realiza coronariografia (K492) con hallazgo de lesion significativa, realizandose angioplastia cx (K493) con implante de stent farmacoactivo y flujo TIMI 3 final. En su evolucion, taquicardia ventricular sostenida, cardioversion electrica exitosa. Recibio tratamiento con Clopidogrel 300mg carga (B01AC04), Noradrenalina EV (C01CA03), Furosemida 40mg EV (C03CA01) y Digoxina 0.25mg EV (C01AA05). Presenta evolucion favorable, cumpliendo criterios de alta. Alta con diagnostico de enfermedad coronaria de 2 vasos tratado (I25.1), indicandose Rivaroxaban 20mg VO c/24h (B01AF01), Ticagrelor 90mg VO c/12h 12m (B01AC24), Amlodipino 5mg VO c/24h (C08CA01), Carvedilol 6.25mg VO c/12h (C07AG02) y Clopidogrel 75mg VO c/24h 12m (B01AC04)."}
{"input": {"dx": ["Shock cardiogenico (R57.0)"], "proc": ["Implante de DAI (37.34)"], "tto": ["Levosimendan EV (C01CX08)", "Ticagrelor 180mg carga (B01AC24)"], "evo": "Estenosis aortica severa sintomatica, programada para TAVI", "dx_alta": ["Shock cardiogenico tratado (R57.0)"], "med": ["Carvedilol 6.25mg VO c/12h (C07AG02)", "Nitroglicerina SL PRN (C01DA02)", "Bisoprolol 5mg VO c/24h (C07AB07)"]}, "output": "Ingreso por shock cardiogenico (R57.0). Se realiza implante de dai (37.34). En su evolucion, estenosis aortica severa sintomatica, programada para tavi. Recibio tratamiento con Levosimendan EV (C01CX08) y Ticagrelor 180mg carga (B01AC24). Evolucion satisfactoria, cumpliendo criterios de alta. Alta con diagnostico de shock cardiogenico tratado (R57.0), indicandose Carvedilol 6.25mg VO c/12h (C07AG02), Nitroglicerina SL PRN (C01DA02) y Bisoprolol 5mg VO c/24h (C07AB07)."}
{"input": {"dx": ["Shock cardiogenico (R57.0)"], "proc": ["Cardioversion electrica (89.50)"], "tto": ["Enoxaparina 60mg SC c/12h (B01AB05)", "Ticagrelor 180mg carga (B01AC24)", "Aspirina 300mg carga (B01AC06)", "Furosemida 40mg EV (C03CA01)"], "evo": "Pericarditis aguda con derrame leve, manejo antiinflamatorio", "dx_alta": ["Shock cardiogenico tratado (R57.0)"], "med": ["Bisoprolol 5mg VO c/24h (C07AB07)", "Losartan 50mg VO c/24h (C09CA01)", "Carvedilol 6.25mg VO c/12h (C07AG02)", "Prasugrel 10mg VO c/24h 12m (B01AC22)", "Ticagrelor 90mg VO c/12h 12m (B01AC24)"]}, "output": "Ingresa por shock cardiogenico (R57.0). Se realiza cardioversion electrica (89.50). Presenta, pericarditis aguda con derrame leve, manejo antiinflamatorio. Recibio tratamiento con Enoxaparina 60mg SC c/12h (B01AB05), Ticagrelor 180mg carga (B01AC24), Aspirina 300mg carga (B01AC06) y Furosemida 40mg EV (C03CA01). Evolucion satisfactoria, cumpliendo criterios de alta. Alta con diagnostico de shock cardiogenico tratado (R57.0), indicandose Bisoprolol 5mg VO c/24h (C07AB07), Losartan 50mg VO c/24h (C09CA01), Carvedilol 6.25mg VO c/12h (C07AG02), Prasugrel 10mg VO c/24h 12m (B01AC22) y Ticagrelor 90mg VO c/12h 12m (B01AC24)."}
{"input": {"dx": ["IAMSEST alto riesgo (I21.4)"], "proc": ["Coronariografia (K492)"], "tto": ["Aspirina 100mg (B01AC06)", "Furosemida 80mg EV (C03CA01)"], "evo": "Bloqueo AV completo sintomatico, requirio marcapasos transitorio", "dx_alta": ["IAMSEST alto riesgo tratado (I21.4)"], "med": ["Metoprolol 50mg VO c/12h (C07AB02)", "Prasugrel 10mg VO c/24h 12m (B01AC22)", "Aspirina 100mg VO c/24h (B01AC06)", "Ticagrelor 90mg VO c/12h 12m (B01AC24)", "Carvedilol 6.25mg VO c/12h (C07AG02)"]}, "output": "Ingresa por iamsest alto riesgo (I21.4). Se realiza coronariografia (K492). Presenta, bloqueo av completo sintomatico, requirio marcapasos transitorio. Recibio tratamiento con Aspirina 100mg (B01AC06) y Furosemida 80mg EV (C03CA01). Evolucion satisfactoria, cumpliendo criterios de alta. Alta con diagnostico de iamsest alto riesgo tratado (I21.4), indicandose Metoprolol 50mg VO c/12h (C07AB02), Prasugrel 10mg VO c/24h 12m (B01AC22), Aspirina 100mg VO c/24h (B01AC06), Ticagrelor 90mg VO c/12h 12m (B01AC24) y Carvedilol 6.25mg VO c/12h (C07AG02)."}
{"input": {"dx": ["Enfermedad coronaria de 3 vasos (I25.1)"], "proc": ["Coronariografia (K492)", "Angioplastia DA (K493)"], "tto": ["Enalapril 5mg VO (C09AA02)", "Aspirina 100mg (B01AC06)", "Digoxina 0.25mg EV (C01AA05)", "Furosemida 40mg EV (C03CA01)"], "evo": "Oclusion de DA distal con trombo, trombectomia por aspiracion mas stent", "dx_alta": ["Enfermedad coronaria de 3 vasos tratado (I25.1)"], "med": ["Rosuvastatina 20mg VO c/noche (C10AA07)", "Espironolactona 25mg VO c/24h (C03DA01)", "Rivaroxaban 20mg VO c/24h (B01AF01)", "Ticagrelor 90mg VO c/12h 12m (B01AC24)"]}, "output": "Paciente que ingresa con cuadro de enfermedad coronaria de 3 vasos (I25.1). Se realiza coronariografia (K492) con hallazgo de lesion significativa, realizandose angioplastia da (K493) con implante de stent farmacoactivo y flujo TIMI 3 final. Presenta, oclusion de da distal con trombo, trombectomia por aspiracion mas stent. Recibio tratamiento con Enalapril 5mg VO (C09AA02), Aspirina 100mg (B01AC06), Digoxina 0.25mg EV (C01AA05) y Furosemida 40mg EV (C03CA01). Evolucion satisfactoria, cumpliendo criterios de alta. Alta con diagnostico de enfermedad coronaria de 3 vasos tratado (I25.1), indicandose Rosuvastatina 20mg VO c/noche (C10AA07), Espironolactona 25mg VO c/24h (C03DA01), Rivaroxaban 20mg VO c/24h (B01AF01) y Ticagrelor 90mg VO c/12h 12m (B01AC24)."}
{"input": {"dx": ["IAMCEST lateral (I21.2)"], "proc": ["Coronariografia (K492)", "Angioplastia CD (36.06)"], "tto": ["Dobutamina EV (C01CA07)", "Clopidogrel 600mg carga (B01AC04)", "Amiodarona 300mg EV (C01BD01)", "Enoxaparina 1mg/kg SC c/12h (B01AB05)"], "evo": "Oclusion de CD media con trombo, trombectomia por aspiracion mas stent", "dx_alta": ["IAMCEST lateral tratado (I21.2)"], "med": ["Losartan 50mg VO c/24h (C09CA01)", "Bisoprolol 5mg VO c/24h (C07AB07)", "Digoxina 0.125mg VO c/24h (C01AA05)", "Furosemida 40mg VO c/24h (C03CA01)"]}, "output": "Se hospitaliza por iamcest lateral (I21.2). Se realiza coronariografia (K492) con hallazgo de lesion significativa, realizandose angioplastia cd (36.06) con implante de stent farmacoactivo y flujo TIMI 3 final. En su evolucion, oclusion de cd media con trombo, trombectomia por aspiracion mas stent. Recibio tratamiento con Dobutamina EV (C01CA07), Clopidogrel 600mg carga (B01AC04), Amiodarona 300mg EV (C01BD01) y Enoxaparina 1mg/kg SC c/12h (B01AB05). Buena evolucion, cumpliendo criterios de alta. Alta con diagnostico de iamcest lateral tratado (I21.2), indicandose Losartan 50mg VO c/24h (C09CA01), Bisoprolol 5mg VO c/24h (C07AB07), Digoxina 0.125mg VO c/24h (C01AA05) y Furosemida 40mg VO c/24h (C03CA01)."}
{"input": {"dx": ["IAMCEST anterolateral (I21.0)"], "proc": ["Coronariografia (K492)", "Angioplastia CD (36.06)"], "tto": ["Prasugrel 60mg carga (B01AC22)", "Levosimendan EV (C01CX08)", "Metoprolol 5mg EV (C07AB02)"], "evo": "Edema pulmonar agudo por disfuncion sistolica, respuesta favorable a diureticos", "dx_alta": ["IAMCEST anterolateral tratado (I21.0)"], "med": ["Rosuvastatina 20mg VO c/noche (C10AA07)", "Bisoprolol 5mg VO c/24h (C07AB07)", "Carvedilol 6.25mg VO c/12h (C07AG02)", "Prasugrel 10mg VO c/24h 12m (B01AC22)"]}, "output": "Paciente que ingresa con cuadro de iamcest anterolateral (I21.0). Se realiza coronariografia (K492) evidenciando oclusion aguda, realizandose angioplastia cd (36.06) con implante de stent farmacoactivo y flujo TIMI 3 final. Durante la hospitalizacion, edema pulmonar agudo por disfuncion sistolica, respuesta favorable a diureticos. Recibio tratamiento con Prasugrel 60mg carga (B01AC22), Levosimendan EV (C01CX08) y Metoprolol 5mg EV (C07AB02). Evolucion satisfactoria, cumpliendo criterios de alta. Alta con diagnostico de iamcest anterolateral tratado (I21.0), indicandose Rosuvastatina 20mg VO c/noche (C10AA07), Bisoprolol 5mg VO c/24h (C07AB07), Carvedilol 6.25mg VO c/12h (C07AG02) y Prasugrel 10mg VO c/24h 12m (B01AC22)."}
{"input": {"dx": ["Miocarditis (I40.9)"], "proc": ["Toracocentesis (34.91)", "Ecografia abdominal (88.76)"], "tto": ["Insulina NPH 10UI SC c/12h (A10AC01)", "Paracetamol 1g EV c/8h (N02BE01)", "Ampicilina/Sulbactam 1.5g EV c/6h (J01CR01)"], "evo": "Manejo conservador exitoso, sin necesidad de cirugia", "dx_alta": ["Miocarditis resuelto (I40.9)"], "med": ["Ciprofloxacino 500mg VO c/12h 7d (J01MA02)", "Acido folico 1mg VO c/24h (B03BB01)", "Hierro 100mg VO c/24h (B03AA07)"]}, "output": "Ingresa por miocarditis (I40.9). Se realiza toracocentesis (34.91), ecografia abdominal (88.76). Evoluciona con, manejo conservador exitoso, sin necesidad de cirugia. Recibio tratamiento con Insulina NPH 10UI SC c/12h (A10AC01), Paracetamol 1g EV c/8h (N02BE01) y Ampicilina/Sulbactam 1.5g EV c/6h (J01CR01). Evolucion satisfactoria, cumpliendo criterios de alta. Alta con diagnostico de miocarditis resuelto (I40.9), indicandose Ciprofloxacino 500mg VO c/12h 7d (J01MA02), Acido folico 1mg VO c/24h (B03BB01) y Hierro 100mg VO c/24h (B03AA07)."}
{"input": {"dx": ["Insuficiencia cardiaca aguda (I50.9)"], "proc": ["TAVI (89.64)"], "tto": ["Heparina EV infusion (B01AB01)", "Morfina 3mg EV (N02AA01)", "Atorvastatina 80mg (C10AA05)", "Dobutamina EV (C01CA07)"], "evo": "Shock cardiogenico, requirio soporte con inotropicos, evolucion favorable", "dx_alta": ["Insuficiencia cardiaca aguda tratado (I50.9)"], "med": ["Carvedilol 6.25mg VO c/12h (C07AG02)", "Apixaban 5mg VO c/12h (B01AF02)", "Clopidogrel 75mg VO c/24h 12m (B01AC04)"]}, "output": "Ingreso por insuficiencia cardiaca aguda (I50.9). Se realiza tavi (89.64). Presenta, shock cardiogenico, requirio soporte con inotropicos, evolucion favorable. Recibio tratamiento con Heparina EV infusion (B01AB01), Morfina 3mg EV (N02AA01), Atorvastatina 80mg (C10AA05) y Dobutamina EV (C01CA07). Evolucion satisfactoria, cumpliendo criterios de alta. Alta con diagnostico de insuficiencia cardiaca aguda tratado (I50.9), indicandose Carvedilol 6.25mg VO c/12h (C07AG02), Apixaban 5mg VO c/12h (B01AF02) y Clopidogrel 75mg VO c/24h 12m (B01AC04)."}
{"input": {"dx": ["IAMCEST posterior (I21.2)"], "proc": ["Coronariografia (K492)", "Angioplastia OM (K493)"], "tto": ["Morfina 3mg EV (N02AA01)", "Furosemida 40mg EV (C03CA01)", "Amiodarona 300mg EV (C01BD01)"], "evo": "Estenosis aortica severa sintomatica, programada para TAVI", "dx_alta": ["IAMCEST posterior tratado (I21.2)"], "med": ["Amlodipino 5mg VO c/24h (C08CA01)", "Rivaroxaban 20mg VO c/24h (B01AF01)", "Carvedilol 6.25mg VO c/12h (C07AG02)", "Aspirina 100mg VO c/24h (B01AC06)", "Espironolactona 25mg VO c/24h (C03DA01)"]}, "output": "Ingresa por iamcest posterior (I21.2). Se realiza coronariografia (K492) visualizando estenosis severa, realizandose angioplastia om (K493) con implante de stent farmacoactivo y flujo TIMI 3 final. Evoluciona con, estenosis aortica severa sintomatica, programada para tavi. Recibio tratamiento con Morfina 3mg EV (N02AA01), Furosemida 40mg EV (C03CA01) y Amiodarona 300mg EV (C01BD01). Presenta evolucion favorable, cumpliendo criterios de alta. Alta con diagnostico de iamcest posterior tratado (I21.2), indicandose Amlodipino 5mg VO c/24h (C08CA01), Rivaroxaban 20mg VO c/24h (B01AF01), Carvedilol 6.25mg VO c/12h (C07AG02), Aspirina 100mg VO c/24h (B01AC06) y Espironolactona 25mg VO c/24h (C03DA01)."}
{"input": {"dx": ["IAMCEST anteroseptal (I21.0)"], "proc": ["Coronariografia (K492)", "Angioplastia CX (36.06)"], "tto": ["Enalapril 5mg VO (C09AA02)", "Metoprolol 5mg EV (C07AB02)"], "evo": "Lesion critica de TCI, estabilizacion hemodinamica, angioplastia diferida", "dx_alta": ["IAMCEST anteroseptal tratado (I21.0)"], "med": ["Furosemida 40mg VO c/24h (C03CA01)", "Losartan 50mg VO c/24h (C09CA01)", "Ticagrelor 90mg VO c/12h 12m (B01AC24)", "Enalapril 10mg VO c/12h (C09AA02)"]}, "output": "Ingresa por iamcest anteroseptal (I21.0). Se realiza coronariografia (K492) encontrando lesion critica, realizandose angioplastia cx (36.06) con implante de stent farmacoactivo y flujo TIMI 3 final. Durante la hospitalizacion, lesion critica de tci, estabilizacion hemodinamica, angioplastia diferida. Recibio tratamiento con Enalapril 5mg VO (C09AA02) y Metoprolol 5mg EV (C07AB02). Buena evolucion, cumpliendo criterios de alta. Alta con diagnostico de iamcest anteroseptal tratado (I21.0), indicandose Furosemida 40mg VO c/24h (C03CA01), Losartan 50mg VO c/24h (C09CA01), Ticagrelor 90mg VO c/12h 12m (B01AC24) y Enalapril 10mg VO c/12h (C09AA02)."}
{"input": {"dx": ["IAMCEST inferolateral (I21.1)"], "proc": ["Coronariografia (K492)", "Angioplastia CD (K493)"], "tto": ["Aspirina 100mg (B01AC06)", "Nitroglicerina EV (C01DA02)", "Atorvastatina 80mg (C10AA05)", "Furosemida 80mg EV (C03CA01)"], "evo": "Bloqueo AV completo sintomatico, requirio marcapasos transitorio", "dx_alta": ["IAMCEST inferolateral tratado (I21.1)"], "med": ["Apixaban 5mg VO c/12h (B01AF02)", "Digoxina 0.125mg VO c/24h (C01AA05)", "Metoprolol 50mg VO c/12h (C07AB02)", "Bisoprolol 5mg VO c/24h (C07AB07)", "Aspirina 100mg VO c/24h (B01AC06)"]}, "output": "Paciente que ingresa con cuadro de iamcest inferolateral (I21.1). Se realiza coronariografia (K492) con hallazgo de lesion significativa, realizandose angioplastia cd (K493) con implante de stent farmacoactivo y flujo TIMI 3 final. Evoluciona con, bloqueo av completo sintomatico, requirio marcapasos transitorio. Recibio tratamiento con Aspirina 100mg (B01AC06), Nitroglicerina EV (C01DA02), Atorvastatina 80mg (C10AA05) y Furosemida 80mg EV (C03CA01). Evolucion satisfactoria, cumpliendo criterios de alta. Alta con diagnostico de iamcest inferolateral tratado (I21.1), indicandose Apixaban 5mg VO c/12h (B01AF02), Digoxina 0.125mg VO c/24h (C01AA05), Metoprolol 50mg VO c/12h (C07AB02), Bisoprolol 5mg VO c/24h (C07AB07) y Aspirina 100mg VO c/24h (B01AC06)."}
{"input": {"dx": ["IAMCEST anterolateral (I21.0)"], "proc": ["Coronariografia (K492)", "Angioplastia DA (K493)"], "tto": ["Aspirina 100mg (B01AC06)", "Morfina 3mg EV (N02AA01)", "Nitroglicerina EV (C01DA02)", "Clopidogrel 600mg carga (B01AC04)"], "evo": "Bloqueo AV completo sintomatico, requirio marcapasos transitorio", "dx_alta": ["IAMCEST anterolateral tratado (I21.0)"], "med": ["Espironolactona 25mg VO c/24h (C03DA01)", "Amlodipino 5mg VO c/24h (C08CA01)", "Losartan 50mg VO c/24h (C09CA01)", "Bisoprolol 5mg VO c/24h (C07AB07)", "Isosorbide 20mg VO c/8h (C01DA08)"]}, "output": "Ingresa por iamcest anterolateral (I21.0). Se realiza coronariografia (K492) visualizando estenosis severa, realizandose angioplastia da (K493) con implante de stent farmacoactivo y flujo TIMI 3 final. Presenta, bloqueo av completo sintomatico, requirio marcapasos transitorio. Recibio tratamiento con Aspirina 100mg (B01AC06), Morfina 3mg EV (N02AA01), Nitroglicerina EV (C01DA02) y Clopidogrel 600mg carga (B01AC04). Evolucion satisfactoria, cumpliendo criterios de alta. Alta con diagnostico de iamcest anterolateral tratado (I21.0), indicandose Espironolactona 25mg VO c/24h (C03DA01), Amlodipino 5mg VO c/24h (C08CA01), Losartan 50mg VO c/24h (C09CA01), Bisoprolol 5mg VO c/24h (C07AB07) y Isosorbide 20mg VO c/8h (C01DA08)."}
{"input": {"dx": ["Angina inestable (I20.0)"], "proc": ["Coronariografia (K492)", "Angioplastia OM (K493)"], "tto": ["Aspirina 300mg carga (B01AC06)", "Nitroglicerina EV (C01DA02)", "Enoxaparina 1mg/kg SC c/12h (B01AB05)", "Clopidogrel 300mg carga (B01AC04)"], "evo": "Enfermedad de multiples vasos, se deriva a cirugia cardiaca para bypass", "dx_alta": ["Angina inestable tratado (I20.0)"], "med": ["Rivaroxaban 20mg VO c/24h (B01AF01)", "Amlodipino 5mg VO c/24h (C08CA01)", "Bisoprolol 5mg VO c/24h (C07AB07)", "Metoprolol 50mg VO c/12h (C07AB02)"]}, "output": "Paciente que ingresa con cuadro de angina inestable (I20.0). Se realiza coronariografia (K492) con hallazgo de lesion significativa, realizandose angioplastia om (K493) con implante de stent farmacoactivo y flujo TIMI 3 final. Evoluciona con, enfermedad de multiples vasos, se deriva a cirugia cardiaca para bypass. Recibio tratamiento con Aspirina 300mg carga (B01AC06), Nitroglicerina EV (C01DA02), Enoxaparina 1mg/kg SC c/12h (B01AB05) y Clopidogrel 300mg carga (B01AC04). Evolucion clinica favorable, cumpliendo criterios de alta. Alta con diagnostico de angina inestable tratado (I20.0), indicandose Rivaroxaban 20mg VO c/24h (B01AF01), Amlodipino 5mg VO c/24h (C08CA01), Bisoprolol 5mg VO c/24h (C07AB07) y Metoprolol 50mg VO c/12h (C07AB02)."}
{"input": {"dx": ["Insuficiencia cardiaca aguda (I50.9)"], "proc": ["Angioplastia TCI (K493)"], "tto": ["Prasugrel 60mg carga (B01AC22)", "Aspirina 300mg carga (B01AC06)", "Aspirina 100mg (B01AC06)"], "evo": "Lesion critica de TCI, estabilizacion hemodinamica, angioplastia diferida", "dx_alta": ["Insuficiencia cardiaca aguda tratado (I50.9)"], "med": ["Carvedilol 6.25mg VO c/12h (C07AG02)", "Aspirina 100mg VO c/24h (B01AC06)", "Espironolactona 25mg VO c/24h (C03DA01)"]}, "output": "Paciente que ingresa con cuadro de insuficiencia cardiaca aguda (I50.9). Se realiza angioplastia tci (K493). En su evolucion, lesion critica de tci, estabilizacion hemodinamica, angioplastia diferida. Recibio tratamiento con Prasugrel 60mg carga (B01AC22), Aspirina 300mg carga (B01AC06) y Aspirina 100mg (B01AC06). Evolucion satisfactoria, cumpliendo criterios de alta. Alta con diagnostico de insuficiencia cardiaca aguda tratado (I50.9), indicandose Carvedilol 6.25mg VO c/12h (C07AG02), Aspirina 100mg VO c/24h (B01AC06) y Espironolactona 25mg VO c/24h (C03DA01)."}
{"input": {"dx": ["EPOC exacerbado (J44.1)"], "proc": ["Angio TAC cerebral (88.38)", "Trombectomia mecanica (39.74)"], "tto": ["Metronidazol 500mg EV c/8h (J01XD01)", "Insulina NPH 10UI SC c/12h (A10AC01)", "Metamizol 1g EV c/8h (N02BB02)"], "evo": "Respuesta adecuada al tratamiento antibiotico, afebril desde dia 2", "dx_alta": ["EPOC exacerbado resuelto (J44.1)"], "med": ["Omeprazol 20mg VO c/24h (A02BC01)", "Insulina NPH 10UI SC c/12h (A10AC01)", "Prednisona 20mg VO c/24h (H02AB07)", "Sertralina 50mg VO c/24h (N06AB06)"]}, "output": "Se hospitaliza por epoc exacerbado (J44.1). Se realiza angio tac cerebral (88.38), trombectomia mecanica (39.74). En su evolucion, respuesta adecuada al tratamiento antibiotico, afebril desde dia 2. Recibio tratamiento con Metronidazol 500mg EV c/8h (J01XD01), Insulina NPH 10UI SC c/12h (A10AC01) y Metamizol 1g EV c/8h (N02BB02). Buena evolucion, cumpliendo criterios de alta. Alta con diagnostico de epoc exacerbado resuelto (J44.1), indicandose Omeprazol 20mg VO c/24h (A02BC01), Insulina NPH 10UI SC c/12h (A10AC01), Prednisona 20mg VO c/24h (H02AB07) y Sertralina 50mg VO c/24h (N06AB06)."}
{"input": {"dx": ["Enfermedad de TCI (I25.1)"], "proc": ["Valvuloplastia mitral (35.05)"], "tto": ["Noradrenalina EV (C01CA03)", "Enoxaparina 1mg/kg SC c/12h (B01AB05)"], "evo": "Enfermedad de multiples vasos, se deriva a cirugia cardiaca para bypass", "dx_alta": ["Enfermedad de TCI tratado (I25.1)"], "med": ["Clopidogrel 75mg VO c/24h 12m (B01AC04)", "Furosemida 40mg VO c/24h (C03CA01)", "Nitroglicerina SL PRN (C01DA02)", "Warfarina segun INR (B01AA03)", "Metoprolol 50mg VO c/12h (C07AB02)"]}, "output": "Ingresa por enfermedad de tci (I25.1). Se realiza valvuloplastia mitral (35.05). En su evolucion, enfermedad de multiples vasos, se deriva a cirugia cardiaca para bypass. Recibio tratamiento con Noradrenalina EV (C01CA03) y Enoxaparina 1mg/kg SC c/12h (B01AB05). Buena evolucion, cumpliendo criterios de alta. Alta con diagnostico de enfermedad de tci tratado (I25.1), indicandose Clopidogrel 75mg VO c/24h 12m (B01AC04), Furosemida 40mg VO c/24h (C03CA01), Nitroglicerina SL PRN (C01DA02), Warfarina segun INR (B01AA03) y Metoprolol 50mg VO c/12h (C07AB02)."}
{"input": {"dx": ["Flutter auricular (I48.0)"], "proc": ["Broncoscopia (33.22)", "Hemodialisis (39.95)"], "tto": ["Metronidazol 500mg EV c/8h (J01XD01)", "Ondansetron 8mg EV c/8h (A04AA01)"], "evo": "Manejo conservador exitoso, sin necesidad de cirugia", "dx_alta": ["Flutter auricular resuelto (I48.0)"], "med": ["Budesonide/Formoterol INH c/12h (R03AK07)", "Acido folico 1mg VO c/24h (B03BB01)"]}, "output": "Paciente que ingresa con cuadro de flutter auricular (I48.0). Se realiza broncoscopia (33.22), hemodialisis (39.95). En su evolucion, manejo conservador exitoso, sin necesidad de cirugia. Recibio tratamiento con Metronidazol 500mg EV c/8h (J01XD01) y Ondansetron 8mg EV c/8h (A04AA01). Evolucion clinica favorable, cumpliendo criterios de alta. Alta con diagnostico de flutter auricular resuelto (I48.0), indicandose Budesonide/Formoterol INH c/12h (R03AK07) y Acido folico 1mg VO c/24h (B03BB01)."}
{"input": {"dx": ["Fractura de cadera (S72.0)"], "proc": ["Hemodialisis (39.95)"], "tto": ["Ceftriaxona 2g EV c/24h (J01DD04)", "Ipratropio NBZ c/6h (R03BB01)", "Hidrocortisona 100mg EV c/8h (H02AB09)", "Metamizol 1g EV c/8h (N02BB02)"], "evo": "Estabilizacion clinica progresiva, sin eventos adversos", "dx_alta": ["Fractura de cadera resuelto (S72.0)"], "med": ["Prednisona 20mg VO c/24h (H02AB07)", "Sertralina 50mg VO c/24h (N06AB06)", "Levotiroxina 50mcg VO c/24h (H03AA01)", "Acido folico 1mg VO c/24h (B03BB01)"]}, "output": "Ingresa por fractura de cadera (S72.0). Se realiza hemodialisis (39.95). En su evolucion, estabilizacion clinica progresiva, sin eventos adversos. Recibio tratamiento con Ceftriaxona 2g EV c/24h (J01DD04), Ipratropio NBZ c/6h (R03BB01), Hidrocortisona 100mg EV c/8h (H02AB09) y Metamizol 1g EV c/8h (N02BB02). Evolucion satisfactoria, cumpliendo criterios de alta. Alta con diagnostico de fractura de cadera resuelto (S72.0), indicandose Prednisona 20mg VO c/24h (H02AB07), Sertralina 50mg VO c/24h (N06AB06), Levotiroxina 50mcg VO c/24h (H03AA01) y Acido folico 1mg VO c/24h (B03BB01)."}
{"input": {"dx": ["Estenosis aortica severa (I35.0)"], "proc": ["Colonoscopia (45.23)"], "tto": ["Paracetamol 1g EV c/8h (N02BE01)", "Piperacilina/Tazobactam 4.5g EV c/8h (J01CR05)"], "evo": "Manejo conservador exitoso, sin necesidad de cirugia", "dx_alta": ["Estenosis aortica severa resuelto (I35.0)"], "med": ["Hierro 100mg VO c/24h (B03AA07)", "Vitamina D 1000UI VO c/24h (A11CC05)", "Ciprofloxacino 500mg VO c/12h 7d (J01MA02)", "Prednisona 20mg VO c/24h (H02AB07)"]}, "output": "Se hospitaliza por estenosis aortica severa (I35.0). Se realiza colonoscopia (45.23). Evoluciona con, manejo conservador exitoso, sin necesidad de cirugia. Recibio tratamiento con Paracetamol 1g EV c/8h (N02BE01) y Piperacilina/Tazobactam 4.5g EV c/8h (J01CR05). Evolucion satisfactoria, cumpliendo criterios de alta. Alta con diagnostico de estenosis aortica severa resuelto (I35.0), indicandose Hierro 100mg VO c/24h (B03AA07), Vitamina D 1000UI VO c/24h (A11CC05), Ciprofloxacino 500mg VO c/12h 7d (J01MA02) y Prednisona 20mg VO c/24h (H02AB07)."}
{"input": {"dx": ["IAMCEST lateral (I21.2)"], "proc": ["Coronariografia (K492)", "Angioplastia CX (36.06)"], "tto": ["Metoprolol 5mg EV (C07AB02)", "Nitroglicerina EV (C01DA02)", "Noradrenalina EV (C01CA03)"], "evo": "Oclusion aguda de ramus intermedio, angioplastia exitosa con stent farmacoactivo, flujo TIMI 3 final", "dx_alta": ["IAMCEST lateral tratado (I21.2)"], "med": ["Furosemida 40mg VO c/24h (C03CA01)", "Carvedilol 6.25mg VO c/12h (C07AG02)", "Ticagrelor 90mg VO c/12h 12m (B01AC24)", "Bisoprolol 5mg VO c/24h (C07AB07)", "Warfarina segun INR (B01AA03)"]}, "output": "Ingreso por iamcest lateral (I21.2). Se realiza coronariografia (K492) evidenciando oclusion aguda, realizandose angioplastia cx (36.06) con implante de stent farmacoactivo y flujo TIMI 3 final. Evoluciona con, oclusion aguda de ramus intermedio, angioplastia exitosa con stent farmacoactivo, flujo timi 3 final. Recibio tratamiento con Metoprolol 5mg EV (C07AB02), Nitroglicerina EV (C01DA02) y Noradrenalina EV (C01CA03). Buena evolucion, cumpliendo criterios de alta. Alta con diagnostico de iamcest lateral tratado (I21.2), indicandose Furosemida 40mg VO c/24h (C03CA01), Carvedilol 6.25mg VO c/12h (C07AG02), Ticagrelor 90mg VO c/12h 12m (B01AC24), Bisoprolol 5mg VO c/24h (C07AB07) y Warfarina segun INR (B01AA03)."}
{"input": {"dx": ["Angina inestable (I20.0)"], "proc": ["Coronariografia (K492)", "Angioplastia OM (K493)"], "tto": ["Metoprolol 5mg EV (C07AB02)", "Nitroglicerina EV (C01DA02)", "Digoxina 0.25mg EV (C01AA05)", "Heparina EV infusion (B01AB01)"], "evo": "Oclusion aguda de DA media, angioplastia exitosa con stent farmacoactivo, flujo TIMI 3 final", "dx_alta": ["Angina inestable tratado (I20.0)"], "med": ["Prasugrel 10mg VO c/24h 12m (B01AC22)", "Apixaban 5mg VO c/12h (B01AF02)", "Furosemida 40mg VO c/24h (C03CA01)"]}, "output": "Ingreso por angina inestable (I20.0). Se realiza coronariografia (K492) encontrando lesion critica, realizandose angioplastia om (K493) con implante de stent farmacoactivo y flujo TIMI 3 final. Evoluciona con, oclusion aguda de da media, angioplastia exitosa con stent farmacoactivo, flujo timi 3 final. Recibio tratamiento con Metoprolol 5mg EV (C07AB02), Nitroglicerina EV (C01DA02), Digoxina 0.25mg EV (C01AA05) y Heparina EV infusion (B01AB01). Evolucion clinica favorable, cumpliendo criterios de alta. Alta con diagnostico de angina inestable tratado (I20.0), indicandose Prasugrel 10mg VO c/24h 12m (B01AC22), Apixaban 5mg VO c/12h (B01AF02) y Furosemida 40mg VO c/24h (C03CA01)."}
{"input": {"dx": ["Sepsis (A41.9)"], "proc": ["Toracocentesis (34.91)"], "tto": ["Ceftriaxona 2g EV c/24h (J01DD04)", "Metoclopramida 10mg EV c/8h (A03FA01)"], "evo": "Estabilizacion clinica progresiva, sin eventos adversos", "dx_alta": ["Sepsis resuelto (A41.9)"], "med": ["Tramadol 50mg VO c/8h 7d (N02AX02)", "Budesonide/Formoterol INH c/12h (R03AK07)", "Metformina 850mg VO c/12h (A10BA02)"]}, "output": "Ingresa por sepsis (A41.9). Se realiza toracocentesis (34.91). Evoluciona con, estabilizacion clinica progresiva, sin eventos adversos. Recibio tratamiento con Ceftriaxona 2g EV c/24h (J01DD04) y Metoclopramida 10mg EV c/8h (A03FA01). Buena evolucion, cumpliendo criterios de alta. Alta con diagnostico de sepsis resuelto (A41.9), indicandose Tramadol 50mg VO c/8h 7d (N02AX02), Budesonide/Formoterol INH c/12h (R03AK07) y Metformina 850mg VO c/12h (A10BA02)."}
{"input": {"dx": ["Hernia inguinal (K40.9)"], "proc": ["Angio TAC cerebral (88.38)"], "tto": ["Metoclopramida 10mg EV c/8h (A03FA01)", "Ondansetron 8mg EV c/8h (A04AA01)", "Omeprazol 40mg EV c/12h (A02BC01)", "Tramadol 50mg EV c/8h (N02AX02)"], "evo": "Resolucion del cuadro agudo, alta con seguimiento ambulatorio", "dx_alta": ["Hernia inguinal resuelto (K40.9)"], "med": ["Ciprofloxacino 500mg VO c/12h 7d (J01MA02)", "Insulina NPH 10UI SC c/12h (A10AC01)"]}, "output": "Ingreso por hernia inguinal (K40.9). Se realiza angio tac cerebral (88.38). Durante la hospitalizacion, resolucion del cuadro agudo, alta con seguimiento ambulatorio. Recibio tratamiento con Metoclopramida 10mg EV c/8h (A03FA01), Ondansetron 8mg EV c/8h (A04AA01), Omeprazol 40mg EV c/12h (A02BC01) y Tramadol 50mg EV c/8h (N02AX02). Presenta evolucion favorable, cumpliendo criterios de alta. Alta con diagnostico de hernia inguinal resuelto (K40.9), indicandose Ciprofloxacino 500mg VO c/12h 7d (J01MA02) y Insulina NPH 10UI SC c/12h (A10AC01)."}
{"input": {"dx": ["IAMCEST posterior (I21.2)"], "proc": ["Coronariografia (K492)", "Angioplastia TCI (K493)"], "tto": ["Enoxaparina 60mg SC c/12h (B01AB05)", "Clopidogrel 300mg carga (B01AC04)", "Furosemida 40mg EV (C03CA01)"], "evo": "Lesion severa de ramus intermedio, angioplastia con implante de stent sin complicaciones", "dx_alta": ["IAMCEST posterior tratado (I21.2)"], "med": ["Losartan 50mg VO c/24h (C09CA01)", "Carvedilol 6.25mg VO c/12h (C07AG02)", "Enalapril 10mg VO c/12h (C09AA02)"]}, "output": "Paciente que ingresa con cuadro de iamcest posterior (I21.2). Se realiza coronariografia (K492) con hallazgo de lesion significativa, realizandose angioplastia tci (K493) con implante de stent farmacoactivo y flujo TIMI 3 final. En su evolucion, lesion severa de ramus intermedio, angioplastia con implante de stent sin complicaciones. Recibio tratamiento con Enoxaparina 60mg SC c/12h (B01AB05), Clopidogrel 300mg carga (B01AC04) y Furosemida 40mg EV (C03CA01). Evolucion clinica favorable, cumpliendo criterios de alta. Alta con diagnostico de iamcest posterior tratado (I21.2), indicandose Losartan 50mg VO c/24h (C09CA01), Carvedilol 6.25mg VO c/12h (C07AG02) y Enalapril 10mg VO c/12h (C09AA02)."}
{"input": {"dx": ["Edema pulmonar agudo (J81)"], "proc": ["Coronariografia (K493)"], "tto": ["Morfina 3mg EV (N02AA01)", "Clopidogrel 600mg carga (B01AC04)", "Levosimendan EV (C01CX08)"], "evo": "Pericarditis aguda con derrame leve, manejo antiinflamatorio", "dx_alta": ["Edema pulmonar agudo tratado (J81)"], "med": ["Furosemida 40mg VO c/24h (C03CA01)", "Warfarina segun INR (B01AA03)", "Ticagrelor 90mg VO c/12h 12m (B01AC24)", "Prasugrel 10mg VO c/24h 12m (B01AC22)", "Rivaroxaban 20mg VO c/24h (B01AF01)"]}, "output": "Ingresa por edema pulmonar agudo (J81). Se realiza coronariografia (K493). Evoluciona con, pericarditis aguda con derrame leve, manejo antiinflamatorio. Recibio tratamiento con Morfina 3mg EV (N02AA01), Clopidogrel 600mg carga (B01AC04) y Levosimendan EV (C01CX08). Buena evolucion, cumpliendo criterios de alta. Alta con diagnostico de edema pulmonar agudo tratado (J81), indicandose Furosemida 40mg VO c/24h (C03CA01), Warfarina segun INR (B01AA03), Ticagrelor 90mg VO c/12h 12m (B01AC24), Prasugrel 10mg VO c/24h 12m (B01AC22) y Rivaroxaban 20mg VO c/24h (B01AF01)."}
{"input": {"dx": ["TEP agudo (I26.9)"], "proc": ["Hernioplastia inguinal (53.00)"], "tto": ["N-acetilcisteina NBZ c/8h (R05CB01)", "Metoclopramida 10mg EV c/8h (A03FA01)", "Morfina 3mg EV c/4h PRN (N02AA01)"], "evo": "Mejora clnica sostenida, cumple criterios de alta", "dx_alta": ["TEP agudo resuelto (I26.9)"], "med": ["Prednisona 20mg VO c/24h (H02AB07)", "Omeprazol 20mg VO c/24h (A02BC01)", "Sertralina 50mg VO c/24h (N06AB06)", "Amoxicilina/Clavulanico 875mg VO c/12h 7d (J01CR02)"]}, "output": "Paciente que ingresa con cuadro de tep agudo (I26.9). Se realiza hernioplastia inguinal (53.00). Evoluciona con, mejora clnica sostenida, cumple criterios de alta. Recibio tratamiento con N-acetilcisteina NBZ c/8h (R05CB01), Metoclopramida 10mg EV c/8h (A03FA01) y Morfina 3mg EV c/4h PRN (N02AA01). Buena evolucion, cumpliendo criterios de alta. Alta con diagnostico de tep agudo resuelto (I26.9), indicandose Prednisona 20mg VO c/24h (H02AB07), Omeprazol 20mg VO c/24h (A02BC01), Sertralina 50mg VO c/24h (N06AB06) y Amoxicilina/Clavulanico 875mg VO c/12h 7d (J01CR02)."}
{"input": {"dx": ["IAMSEST (I21.4)"], "proc": ["Coronariografia (K492)", "Angioplastia DA (K493)"], "tto": ["Levosimendan EV (C01CX08)", "Dobutamina EV (C01CA07)", "Enoxaparina 60mg SC c/12h (B01AB05)"], "evo": "Taquicardia ventricular sostenida, cardioversion electrica exitosa", "dx_alta": ["IAMSEST tratado (I21.4)"], "med": ["Rivaroxaban 20mg VO c/24h (B01AF01)", "Bisoprolol 5mg VO c/24h (C07AB07)", "Metoprolol 50mg VO c/12h (C07AB02)", "Carvedilol 6.25mg VO c/12h (C07AG02)"]}, "output": "Paciente que ingresa con cuadro de iamsest (I21.4). Se realiza coronariografia (K492) con hallazgo de lesion significativa, realizandose angioplastia da (K493) con implante de stent farmacoactivo y flujo TIMI 3 final. Durante la hospitalizacion, taquicardia ventricular sostenida, cardioversion electrica exitosa. Recibio tratamiento con Levosimendan EV (C01CX08), Dobutamina EV (C01CA07) y Enoxaparina 60mg SC c/12h (B01AB05). Presenta evolucion favorable, cumpliendo criterios de alta. Alta con diagnostico de iamsest tratado (I21.4), indicandose Rivaroxaban 20mg VO c/24h (B01AF01), Bisoprolol 5mg VO c/24h (C07AB07), Metoprolol 50mg VO c/12h (C07AB02) y Carvedilol 6.25mg VO c/12h (C07AG02)."}
{"input": {"dx": ["IAMCEST anterior (I21.0)"], "proc": ["Coronariografia (K492)", "Angioplastia DA (K493)"], "tto": ["Enalapril 5mg VO (C09AA02)", "Prasugrel 60mg carga (B01AC22)", "Levosimendan EV (C01CX08)"], "evo": "Pericarditis aguda con derrame leve, manejo antiinflamatorio", "dx_alta": ["IAMCEST anterior tratado (I21.0)"], "med": ["Bisoprolol 5mg VO c/24h (C07AB07)", "Ticagrelor 90mg VO c/12h 12m (B01AC24)", "Nitroglicerina SL PRN (C01DA02)", "Rivaroxaban 20mg VO c/24h (B01AF01)"]}, "output": "Se hospitaliza por iamcest anterior (I21.0). Se realiza coronariografia (K492) encontrando lesion critica, realizandose angioplastia da (K493) con implante de stent farmacoactivo y flujo TIMI 3 final. Presenta, pericarditis aguda con derrame leve, manejo antiinflamatorio. Recibio tratamiento con Enalapril 5mg VO (C09AA02), Prasugrel 60mg carga (B01AC22) y Levosimendan EV (C01CX08). Presenta evolucion favorable, cumpliendo criterios de alta. Alta con diagnostico de iamcest anterior tratado (I21.0), indicandose Bisoprolol 5mg VO c/24h (C07AB07), Ticagrelor 90mg VO c/12h 12m (B01AC24), Nitroglicerina SL PRN (C01DA02) y Rivaroxaban 20mg VO c/24h (B01AF01)."}
{"input": {"dx": ["IAMCEST anterolateral (I21.0)"], "proc": ["Coronariografia (K492)", "Angioplastia CD (36.06)"], "tto": ["Noradrenalina EV (C01CA03)", "Levosimendan EV (C01CX08)", "Digoxina 0.25mg EV (C01AA05)"], "evo": "Shock cardiogenico, requirio soporte con inotropicos, evolucion favorable", "dx_alta": ["IAMCEST anterolateral tratado (I21.0)"], "med": ["Metoprolol 50mg VO c/12h (C07AB02)", "Atorvastatina 40mg VO c/noche (C10AA05)", "Clopidogrel 75mg VO c/24h 12m (B01AC04)", "Isosorbide 20mg VO c/8h (C01DA08)", "Ticagrelor 90mg VO c/12h 12m (B01AC24)"]}, "output": "Ingreso por iamcest anterolateral (I21.0). Se realiza coronariografia (K492) encontrando lesion critica, realizandose angioplastia cd (36.06) con implante de stent farmacoactivo y flujo TIMI 3 final. Evoluciona con, shock cardiogenico, requirio soporte con inotropicos, evolucion favorable. Recibio tratamiento con Noradrenalina EV (C01CA03), Levosimendan EV (C01CX08) y Digoxina 0.25mg EV (C01AA05). Presenta evolucion favorable, cumpliendo criterios de alta. Alta con diagnostico de iamcest anterolateral tratado (I21.0), indicandose Metoprolol 50mg VO c/12h (C07AB02), Atorvastatina 40mg VO c/noche (C10AA05), Clopidogrel 75mg VO c/24h 12m (B01AC04), Isosorbide 20mg VO c/8h (C01DA08) y Ticagrelor 90mg VO c/12h 12m (B01AC24)."}
{"input": {"dx": ["IAMCEST inferolateral (I21.1)"], "proc": ["Coronariografia (K492)"], "tto": ["Aspirina 300mg carga (B01AC06)", "Heparina 5000UI EV (B01AB01)", "Aspirina 100mg (B01AC06)", "Metoprolol 5mg EV (C07AB02)"], "evo": "Lesion critica de OM1, estabilizacion hemodinamica, angioplastia diferida", "dx_alta": ["IAMCEST inferolateral tratado (I21.1)"], "med": ["Rosuvastatina 20mg VO c/noche (C10AA07)", "Apixaban 5mg VO c/12h (B01AF02)", "Carvedilol 6.25mg VO c/12h (C07AG02)", "Rivaroxaban 20mg VO c/24h (B01AF01)", "Digoxina 0.125mg VO c/24h (C01AA05)"]}, "output": "Ingresa por iamcest inferolateral (I21.1). Se realiza coronariografia (K492). Durante la hospitalizacion, lesion critica de om1, estabilizacion hemodinamica, angioplastia diferida. Recibio tratamiento con Aspirina 300mg carga (B01AC06), Heparina 5000UI EV (B01AB01), Aspirina 100mg (B01AC06) y Metoprolol 5mg EV (C07AB02). Buena evolucion, cumpliendo criterios de alta. Alta con diagnostico de iamcest inferolateral tratado (I21.1), indicandose Rosuvastatina 20mg VO c/noche (C10AA07), Apixaban 5mg VO c/12h (B01AF02), Carvedilol 6.25mg VO c/12h (C07AG02), Rivaroxaban 20mg VO c/24h (B01AF01) y Digoxina 0.125mg VO c/24h (C01AA05)."}
{"input": {"dx": ["Estenosis aortica severa (I35.0)"], "proc": ["Broncoscopia (33.22)"], "tto": ["Salbutamol NBZ c/4h (R03AC02)", "Metoclopramida 10mg EV c/8h (A03FA01)", "Insulina NPH 10UI SC c/12h (A10AC01)", "Metronidazol 500mg EV c/8h (J01XD01)"], "evo": "Mejora clnica sostenida, cumple criterios de alta", "dx_alta": ["Estenosis aortica severa resuelto (I35.0)"], "med": ["Paracetamol 500mg VO c/8h PRN (N02BE01)", "Vitamina D 1000UI VO c/24h (A11CC05)", "Metformina 850mg VO c/12h (A10BA02)"]}, "output": "Se hospitaliza por estenosis aortica severa (I35.0). Se realiza broncoscopia (33.22). En su evolucion, mejora clnica sostenida, cumple criterios de alta. Recibio tratamiento con Salbutamol NBZ c/4h (R03AC02), Metoclopramida 10mg EV c/8h (A03FA01), Insulina NPH 10UI SC c/12h (A10AC01) y Metronidazol 500mg EV c/8h (J01XD01). Buena evolucion, cumpliendo criterios de alta. Alta con diagnostico de estenosis aortica severa resuelto (I35.0), indicandose Paracetamol 500mg VO c/8h PRN (N02BE01), Vitamina D 1000UI VO c/24h (A11CC05) y Metformina 850mg VO c/12h (A10BA02)."}
{"input": {"dx": ["Celulitis (L03.9)"], "proc": ["Hernioplastia inguinal (53.00)"], "tto": ["Insulina cristalina segun esquema (A10AB01)", "Omeprazol 40mg EV c/12h (A02BC01)", "Pantoprazol 40mg EV c/12h (A02BC02)", "Ipratropio NBZ c/6h (R03BB01)"], "evo": "Manejo conservador exitoso, sin necesidad de cirugia", "dx_alta": ["Celulitis resuelto (L03.9)"], "med": ["Vitamina D 1000UI VO c/24h (A11CC05)", "Budesonide/Formoterol INH c/12h (R03AK07)"]}, "output": "Ingreso por celulitis (L03.9). Se realiza hernioplastia inguinal (53.00). En su evolucion, manejo conservador exitoso, sin necesidad de cirugia. Recibio tratamiento con Insulina cristalina segun esquema (A10AB01), Omeprazol 40mg EV c/12h (A02BC01), Pantoprazol 40mg EV c/12h (A02BC02) y Ipratropio NBZ c/6h (R03BB01). Evolucion clinica favorable, cumpliendo criterios de alta. Alta con diagnostico de celulitis resuelto (L03.9), indicandose Vitamina D 1000UI VO c/24h (A11CC05) y Budesonide/Formoterol INH c/12h (R03AK07)."}
{"input": {"dx": ["ACV hemorragico (I61.9)"], "proc": ["Angio TAC cerebral (88.38)"], "tto": ["Piperacilina/Tazobactam 4.5g EV c/8h (J01CR05)", "Morfina 3mg EV c/4h PRN (N02AA01)"], "evo": "Control de sintomas con tratamiento medico optimizado", "dx_alta": ["ACV hemorragico resuelto (I61.9)"], "med": ["Salbutamol INH 2 puff c/6h PRN (R03AC02)", "Levotiroxina 50mcg VO c/24h (H03AA01)", "Tramadol 50mg VO c/8h 7d (N02AX02)", "Prednisona 20mg VO c/24h (H02AB07)"]}, "output": "Se hospitaliza por acv hemorragico (I61.9). Se realiza angio tac cerebral (88.38). Durante la hospitalizacion, control de sintomas con tratamiento medico optimizado. Recibio tratamiento con Piperacilina/Tazobactam 4.5g EV c/8h (J01CR05) y Morfina 3mg EV c/4h PRN (N02AA01). Presenta evolucion favorable, cumpliendo criterios de alta. Alta con diagnostico de acv hemorragico resuelto (I61.9), indicandose Salbutamol INH 2 puff c/6h PRN (R03AC02), Levotiroxina 50mcg VO c/24h (H03AA01), Tramadol 50mg VO c/8h 7d (N02AX02) y Prednisona 20mg VO c/24h (H02AB07)."}
{"input": {"dx": ["Trombosis de stent (I21.0)"], "proc": ["Angioplastia (37.94)"], "tto": ["Amiodarona 300mg EV (C01BD01)", "Prasugrel 60mg carga (B01AC22)"], "evo": "Estenosis aortica severa sintomatica, programada para TAVI", "dx_alta": ["Trombosis de stent tratado (I21.0)"], "med": ["Nitroglicerina SL PRN (C01DA02)", "Furosemida 40mg VO c/24h (C03CA01)", "Aspirina 100mg VO c/24h (B01AC06)"]}, "output": "Se hospitaliza por trombosis de stent (I21.0). Se realiza angioplastia (37.94). En su evolucion, estenosis aortica severa sintomatica, programada para tavi. Recibio tratamiento con Amiodarona 300mg EV (C01BD01) y Prasugrel 60mg carga (B01AC22). Buena evolucion, cumpliendo criterios de alta. Alta con diagnostico de trombosis de stent tratado (I21.0), indicandose Nitroglicerina SL PRN (C01DA02), Furosemida 40mg VO c/24h (C03CA01) y Aspirina 100mg VO c/24h (B01AC06)."}
{"input": {"dx": ["Angina inestable (I20.0)"], "proc": ["Coronariografia (K492)", "Angioplastia CD (36.06)"], "tto": ["Noradrenalina EV (C01CA03)", "Metoprolol 5mg EV (C07AB02)", "Clopidogrel 600mg carga (B01AC04)"], "evo": "Pericarditis aguda con derrame leve, manejo antiinflamatorio", "dx_alta": ["Angina inestable tratado (I20.0)"], "med": ["Aspirina 100mg VO c/24h (B01AC06)", "Metoprolol 50mg VO c/12h (C07AB02)", "Digoxina 0.125mg VO c/24h (C01AA05)"]}, "output": "Paciente que ingresa con cuadro de angina inestable (I20.0). Se realiza coronariografia (K492) visualizando estenosis severa, realizandose angioplastia cd (36.06) con implante de stent farmacoactivo y flujo TIMI 3 final. Durante la hospitalizacion, pericarditis aguda con derrame leve, manejo antiinflamatorio. Recibio tratamiento con Noradrenalina EV (C01CA03), Metoprolol 5mg EV (C07AB02) y Clopidogrel 600mg carga (B01AC04). Buena evolucion, cumpliendo criterios de alta. Alta con diagnostico de angina inestable tratado (I20.0), indicandose Aspirina 100mg VO c/24h (B01AC06), Metoprolol 50mg VO c/12h (C07AB02) y Digoxina 0.125mg VO c/24h (C01AA05)."}
{"input": {"dx": ["Enfermedad coronaria de 2 vasos (I25.1)"], "proc": ["Coronariografia (K492)", "Angioplastia CX (K493)"], "tto": ["Enalapril 5mg VO (C09AA02)", "Clopidogrel 300mg carga (B01AC04)"], "evo": "Fibrilacion auricular de alta respuesta, cardioversion farmacologica exitosa", "dx_alta": ["Enfermedad coronaria de 2 vasos tratado (I25.1)"], "med": ["Rosuvastatina 20mg VO c/noche (C10AA07)", "Ticagrelor 90mg VO c/12h 12m (B01AC24)", "Clopidogrel 75mg VO c/24h 12m (B01AC04)"]}, "output": "Paciente que ingresa con cuadro de enfermedad coronaria de 2 vasos (I25.1). Se realiza coronariografia (K492) con hallazgo de lesion significativa, realizandose angioplastia cx (K493) con implante de stent farmacoactivo y flujo TIMI 3 final. Presenta, fibrilacion auricular de alta respuesta, cardioversion farmacologica exitosa. Recibio tratamiento con Enalapril 5mg VO (C09AA02) y Clopidogrel 300mg carga (B01AC04). Evolucion satisfactoria, cumpliendo criterios de alta. Alta con diagnostico de enfermedad coronaria de 2 vasos tratado (I25.1), indicandose Rosuvastatina 20mg VO c/noche (C10AA07), Ticagrelor 90mg VO c/12h 12m (B01AC24) y Clopidogrel 75mg VO c/24h 12m (B01AC04)."}
{"input": {"dx": ["Taquicardia ventricular (I47.2)"], "proc": ["Osteosintesis de cadera (79.35)"], "tto": ["N-acetilcisteina NBZ c/8h (R05CB01)", "Meropenem 1g EV c/8h (J01DH02)"], "evo": "Respuesta adecuada al tratamiento antibiotico, afebril desde dia 2", "dx_alta": ["Taquicardia ventricular resuelto (I47.2)"], "med": ["Paracetamol 500mg VO c/8h PRN (N02BE01)", "Acido folico 1mg VO c/24h (B03BB01)", "Ciprofloxacino 500mg VO c/12h 7d (J01MA02)", "Amoxicilina/Clavulanico 875mg VO c/12h 7d (J01CR02)"]}, "output": "Se hospitaliza por taquicardia ventricular (I47.2). Se realiza osteosintesis de cadera (79.35). Presenta, respuesta adecuada al tratamiento antibiotico, afebril desde dia 2. Recibio tratamiento con N-acetilcisteina NBZ c/8h (R05CB01) y Meropenem 1g EV c/8h (J01DH02). Buena evolucion, cumpliendo criterios de alta. Alta con diagnostico de taquicardia ventricular resuelto (I47.2), indicandose Paracetamol 500mg VO c/8h PRN (N02BE01), Acido folico 1mg VO c/24h (B03BB01), Ciprofloxacino 500mg VO c/12h 7d (J01MA02) y Amoxicilina/Clavulanico 875mg VO c/12h 7d (J01CR02)."}
{"input": {"dx": ["Hipertension arterial severa (I10)"], "proc": ["Paracentesis (54.91)", "Trombolisis EV (99.10)"], "tto": ["Morfina 3mg EV c/4h PRN (N02AA01)", "Metoclopramida 10mg EV c/8h (A03FA01)", "Tramadol 50mg EV c/8h (N02AX02)"], "evo": "Procedimiento sin complicaciones, buena tolerancia oral", "dx_alta": ["Hipertension arterial severa resuelto (I10)"], "med": ["Amoxicilina/Clavulanico 875mg VO c/12h 7d (J01CR02)", "Ciprofloxacino 500mg VO c/12h 7d (J01MA02)", "Sertralina 50mg VO c/24h (N06AB06)", "Tramadol 50mg VO c/8h 7d (N02AX02)"]}, "output": "Ingreso por hipertension arterial severa (I10). Se realiza paracentesis (54.91), trombolisis ev (99.10). Evoluciona con, procedimiento sin complicaciones, buena tolerancia oral. Recibio tratamiento con Morfina 3mg EV c/4h PRN (N02AA01), Metoclopramida 10mg EV c/8h (A03FA01) y Tramadol 50mg EV c/8h (N02AX02). Buena evolucion, cumpliendo criterios de alta. Alta con diagnostico de hipertension arterial severa resuelto (I10), indicandose Amoxicilina/Clavulanico 875mg VO c/12h 7d (J01CR02), Ciprofloxacino 500mg VO c/12h 7d (J01MA02), Sertralina 50mg VO c/24h (N06AB06) y Tramadol 50mg VO c/8h 7d (N02AX02)."}
{"input": {"dx": ["Insuficiencia cardiaca aguda (I50.9)"], "proc": ["Implante de marcapasos (88.72)"], "tto": ["Prasugrel 60mg carga (B01AC22)", "Amiodarona 300mg EV (C01BD01)", "Ticagrelor 180mg carga (B01AC24)"], "evo": "Lesion severa de DA media, angioplastia con implante de stent sin complicaciones", "dx_alta": ["Insuficiencia cardiaca aguda tratado (I50.9)"], "med": ["Enalapril 10mg VO c/12h (C09AA02)", "Clopidogrel 75mg VO c/24h 12m (B01AC04)", "Warfarina segun INR (B01AA03)", "Losartan 50mg VO c/24h (C09CA01)", "Rivaroxaban 20mg VO c/24h (B01AF01)"]}, "output": "Ingresa por insuficiencia cardiaca aguda (I50.9). Se realiza implante de marcapasos (88.72). En su evolucion, lesion severa de da media, angioplastia con implante de stent sin complicaciones. Recibio tratamiento con Prasugrel 60mg carga (B01AC22), Amiodarona 300mg EV (C01BD01) y Ticagrelor 180mg carga (B01AC24). Buena evolucion, cumpliendo criterios de alta. Alta con diagnostico de insuficiencia cardiaca aguda tratado (I50.9), indicandose Enalapril 10mg VO c/12h (C09AA02), Clopidogrel 75mg VO c/24h 12m (B01AC04), Warfarina segun INR (B01AA03), Losartan 50mg VO c/24h (C09CA01) y Rivaroxaban 20mg VO c/24h (B01AF01)."}
{"input": {"dx": ["IAMCEST inferior (I21.1)"], "proc": ["Coronariografia (K492)", "Angioplastia CX (K493)"], "tto": ["Furosemida 40mg EV (C03CA01)", "Amiodarona 300mg EV (C01BD01)"], "evo": "Taquicardia ventricular sostenida, cardioversion electrica exitosa", "dx_alta": ["IAMCEST inferior tratado (I21.1)"], "med": ["Prasugrel 10mg VO c/24h 12m (B01AC22)", "Furosemida 40mg VO c/24h (C03CA01)", "Digoxina 0.125mg VO c/24h (C01AA05)"]}, "output": "Paciente que ingresa con cuadro de iamcest inferior (I21.1). Se realiza coronariografia (K492) encontrando lesion critica, realizandose angioplastia cx (K493) con implante de stent farmacoactivo y flujo TIMI 3 final. Durante la hospitalizacion, taquicardia ventricular sostenida, cardioversion electrica exitosa. Recibio tratamiento con Furosemida 40mg EV (C03CA01) y Amiodarona 300mg EV (C01BD01). Presenta evolucion favorable, cumpliendo criterios de alta. Alta con diagnostico de iamcest inferior tratado (I21.1), indicandose Prasugrel 10mg VO c/24h 12m (B01AC22), Furosemida 40mg VO c/24h (C03CA01) y Digoxina 0.125mg VO c/24h (C01AA05)."}
{"input": {"dx": ["Endocarditis infecciosa (I33.0)"], "proc": ["Apendicectomia (47.09)"], "tto": ["Vancomicina 1g EV c/12h (J01XA01)", "Metoclopramida 10mg EV c/8h (A03FA01)", "Salbutamol NBZ c/4h (R03AC02)"], "evo": "Sin complicaciones postoperatorias, herida operatoria limpia", "dx_alta": ["Endocarditis infecciosa resuelto (I33.0)"], "med": ["Tramadol 50mg VO c/8h 7d (N02AX02)", "Omeprazol 20mg VO c/24h (A02BC01)", "Sertralina 50mg VO c/24h (N06AB06)"]}, "output": "Paciente que ingresa con cuadro de endocarditis infecciosa (I33.0). Se realiza apendicectomia (47.09). Evoluciona con, sin complicaciones postoperatorias, herida operatoria limpia. Recibio tratamiento con Vancomicina 1g EV c/12h (J01XA01), Metoclopramida 10mg EV c/8h (A03FA01) y Salbutamol NBZ c/4h (R03AC02). Evolucion clinica favorable, cumpliendo criterios de alta. Alta con diagnostico de endocarditis infecciosa resuelto (I33.0), indicandose Tramadol 50mg VO c/8h 7d (N02AX02), Omeprazol 20mg VO c/24h (A02BC01) y Sertralina 50mg VO c/24h (N06AB06)."}
{"input": {"dx": ["Angina inestable alto riesgo (I20.0)"], "proc": ["Coronariografia (K492)"], "tto": ["Heparina EV infusion (B01AB01)", "Aspirina 100mg (B01AC06)", "Noradrenalina EV (C01CA03)"], "evo": "Fibrilacion auricular de alta respuesta, cardioversion farmacologica exitosa", "dx_alta": ["Angina inestable alto riesgo tratado (I20.0)"], "med": ["Aspirina 100mg VO c/24h (B01AC06)", "Bisoprolol 5mg VO c/24h (C07AB07)", "Metoprolol 50mg VO c/12h (C07AB02)", "Apixaban 5mg VO c/12h (B01AF02)"]}, "output": "Se hospitaliza por angina inestable alto riesgo (I20.0). Se realiza coronariografia (K492). En su evolucion, fibrilacion auricular de alta respuesta, cardioversion farmacologica exitosa. Recibio tratamiento con Heparina EV infusion (B01AB01), Aspirina 100mg (B01AC06) y Noradrenalina EV (C01CA03). Evolucion clinica favorable, cumpliendo criterios de alta. Alta con diagnostico de angina inestable alto riesgo tratado (I20.0), indicandose Aspirina 100mg VO c/24h (B01AC06), Bisoprolol 5mg VO c/24h (C07AB07), Metoprolol 50mg VO c/12h (C07AB02) y Apixaban 5mg VO c/12h (B01AF02)."}
{"input": {"dx": ["Enfermedad de TCI (I25.1)"], "proc": ["Angioplastia CX (K493)"], "tto": ["Dobutamina EV (C01CA07)", "Clopidogrel 300mg carga (B01AC04)", "Levosimendan EV (C01CX08)", "Prasugrel 60mg carga (B01AC22)"], "evo": "Bloqueo AV completo sintomatico, requirio marcapasos transitorio", "dx_alta": ["Enfermedad de TCI tratado (I25.1)"], "med": ["Clopidogrel 75mg VO c/24h 12m (B01AC04)", "Ticagrelor 90mg VO c/12h 12m (B01AC24)", "Rosuvastatina 20mg VO c/noche (C10AA07)", "Bisoprolol 5mg VO c/24h (C07AB07)"]}, "output": "Paciente que ingresa con cuadro de enfermedad de tci (I25.1). Se realiza angioplastia cx (K493). Evoluciona con, bloqueo av completo sintomatico, requirio marcapasos transitorio. Recibio tratamiento con Dobutamina EV (C01CA07), Clopidogrel 300mg carga (B01AC04), Levosimendan EV (C01CX08) y Prasugrel 60mg carga (B01AC22). Evolucion clinica favorable, cumpliendo criterios de alta. Alta con diagnostico de enfermedad de tci tratado (I25.1), indicandose Clopidogrel 75mg VO c/24h 12m (B01AC04), Ticagrelor 90mg VO c/12h 12m (B01AC24), Rosuvastatina 20mg VO c/noche (C10AA07) y Bisoprolol 5mg VO c/24h (C07AB07)."}
{"input": {"dx": ["Trombosis de stent (I21.0)"], "proc": ["Holter ECG (K492)"], "tto": ["Morfina 3mg EV (N02AA01)", "Metoprolol 5mg EV (C07AB02)", "Atorvastatina 80mg (C10AA05)"], "evo": "Estenosis aortica severa sintomatica, programada para TAVI", "dx_alta": ["Trombosis de stent tratado (I21.0)"], "med": ["Amlodipino 5mg VO c/24h (C08CA01)", "Losartan 50mg VO c/24h (C09CA01)", "Bisoprolol 5mg VO c/24h (C07AB07)", "Rosuvastatina 20mg VO c/noche (C10AA07)", "Apixaban 5mg VO c/12h (B01AF02)"]}, "output": "Ingresa por trombosis de stent (I21.0). Se realiza holter ecg (K492). Presenta, estenosis aortica severa sintomatica, programada para tavi. Recibio tratamiento con Morfina 3mg EV (N02AA01), Metoprolol 5mg EV (C07AB02) y Atorvastatina 80mg (C10AA05). Evolucion clinica favorable, cumpliendo criterios de alta. Alta con diagnostico de trombosis de stent tratado (I21.0), indicandose Amlodipino 5mg VO c/24h (C08CA01), Losartan 50mg VO c/24h (C09CA01), Bisoprolol 5mg VO c/24h (C07AB07), Rosuvastatina 20mg VO c/noche (C10AA07) y Apixaban 5mg VO c/12h (B01AF02)."}
{"input": {"dx": ["IAMSEST alto riesgo (I21.4)"], "proc": ["Coronariografia (K492)"], "tto": ["Enalapril 5mg VO (C09AA02)", "Morfina 3mg EV (N02AA01)", "Noradrenalina EV (C01CA03)"], "evo": "SDST en V1-V4, coronarias sin lesiones obstructivas, sindrome de Tako-Tsubo", "dx_alta": ["IAMSEST alto riesgo tratado (I21.4)"], "med": ["Atorvastatina 40mg VO c/noche (C10AA05)", "Rosuvastatina 20mg VO c/noche (C10AA07)", "Nitroglicerina SL PRN (C01DA02)"]}, "output": "Ingresa por iamsest alto riesgo (I21.4). Se realiza coronariografia (K492). En su evolucion, sdst en v1-v4, coronarias sin lesiones obstructivas, sindrome de tako-tsubo. Recibio tratamiento con Enalapril 5mg VO (C09AA02), Morfina 3mg EV (N02AA01) y Noradrenalina EV (C01CA03). Evolucion satisfactoria, cumpliendo criterios de alta. Alta con diagnostico de iamsest alto riesgo tratado (I21.4), indicandose Atorvastatina 40mg VO c/noche (C10AA05), Rosuvastatina 20mg VO c/noche (C10AA07) y Nitroglicerina SL PRN (C01DA02)."}
{"input": {"dx": ["IAMCEST inferolateral (I21.1)"], "proc": ["Coronariografia (K492)"], "tto": ["Nitroglicerina EV (C01DA02)", "Morfina 3mg EV (N02AA01)", "Noradrenalina EV (C01CA03)", "Heparina 5000UI EV (B01AB01)"], "evo": "Pericarditis aguda con derrame leve, manejo antiinflamatorio", "dx_alta": ["IAMCEST inferolateral tratado (I21.1)"], "med": ["Isosorbide 20mg VO c/8h (C01DA08)", "Rivaroxaban 20mg VO c/24h (B01AF01)", "Warfarina segun INR (B01AA03)", "Espironolactona 25mg VO c/24h (C03DA01)", "Enalapril 10mg VO c/12h (C09AA02)"]}, "output": "Paciente que ingresa con cuadro de iamcest inferolateral (I21.1). Se realiza coronariografia (K492). Evoluciona con, pericarditis aguda con derrame leve, manejo antiinflamatorio. Recibio tratamiento con Nitroglicerina EV (C01DA02), Morfina 3mg EV (N02AA01), Noradrenalina EV (C01CA03) y Heparina 5000UI EV (B01AB01). Presenta evolucion favorable, cumpliendo criterios de alta. Alta con diagnostico de iamcest inferolateral tratado (I21.1), indicandose Isosorbide 20mg VO c/8h (C01DA08), Rivaroxaban 20mg VO c/24h (B01AF01), Warfarina segun INR (B01AA03), Espironolactona 25mg VO c/24h (C03DA01) y Enalapril 10mg VO c/12h (C09AA02)."}
{"input": {"dx": ["IAMSEST (I21.4)"], "proc": ["Coronariografia (K492)", "Angioplastia DA (36.06)"], "tto": ["Nitroglicerina EV (C01DA02)", "Dobutamina EV (C01CA07)"], "evo": "SDST en II, III, aVF, coronarias sin lesiones obstructivas, sindrome de Tako-Tsubo", "dx_alta": ["IAMSEST tratado (I21.4)"], "med": ["Apixaban 5mg VO c/12h (B01AF02)", "Losartan 50mg VO c/24h (C09CA01)", "Clopidogrel 75mg VO c/24h 12m (B01AC04)", "Aspirina 100mg VO c/24h (B01AC06)", "Rivaroxaban 20mg VO c/24h (B01AF01)"]}, "output": "Paciente que ingresa con cuadro de iamsest (I21.4). Se realiza coronariografia (K492) encontrando lesion critica, realizandose angioplastia da (36.06) con implante de stent farmacoactivo y flujo TIMI 3 final. Presenta, sdst en ii, iii, avf, coronarias sin lesiones obstructivas, sindrome de tako-tsubo. Recibio tratamiento con Nitroglicerina EV (C01DA02) y Dobutamina EV (C01CA07). Presenta evolucion favorable, cumpliendo criterios de alta. Alta con diagnostico de iamsest tratado (I21.4), indicandose Apixaban 5mg VO c/12h (B01AF02), Losartan 50mg VO c/24h (C09CA01), Clopidogrel 75mg VO c/24h 12m (B01AC04), Aspirina 100mg VO c/24h (B01AC06) y Rivaroxaban 20mg VO c/24h (B01AF01)."}
{"input": {"dx": ["Enfermedad coronaria de 2 vasos (I25.1)"], "proc": ["Coronariografia (K492)", "Angioplastia CX (36.06)"], "tto": ["Aspirina 300mg carga (B01AC06)", "Aspirina 100mg (B01AC06)", "Furosemida 80mg EV (C03CA01)"], "evo": "Estenosis aortica severa sintomatica, programada para TAVI", "dx_alta": ["Enfermedad coronaria de 2 vasos tratado (I25.1)"], "med": ["Losartan 50mg VO c/24h (C09CA01)", "Apixaban 5mg VO c/12h (B01AF02)", "Nitroglicerina SL PRN (C01DA02)", "Carvedilol 6.25mg VO c/12h (C07AG02)", "Atorvastatina 40mg VO c/noche (C10AA05)"]}, "output": "Paciente que ingresa con cuadro de enfermedad coronaria de 2 vasos (I25.1). Se realiza coronariografia (K492) con hallazgo de lesion significativa, realizandose angioplastia cx (36.06) con implante de stent farmacoactivo y flujo TIMI 3 final. Presenta, estenosis aortica severa sintomatica, programada para tavi. Recibio tratamiento con Aspirina 300mg carga (B01AC06), Aspirina 100mg (B01AC06) y Furosemida 80mg EV (C03CA01). Buena evolucion, cumpliendo criterios de alta. Alta con diagnostico de enfermedad coronaria de 2 vasos tratado (I25.1), indicandose Losartan 50mg VO c/24h (C09CA01), Apixaban 5mg VO c/12h (B01AF02), Nitroglicerina SL PRN (C01DA02), Carvedilol 6.25mg VO c/12h (C07AG02) y Atorvastatina 40mg VO c/noche (C10AA05)."}
{"input": {"dx": ["IAMCEST anterior (I21.0)"], "proc": ["Coronariografia (K492)", "Angioplastia OM (36.06)"], "tto": ["Heparina EV infusion (B01AB01)", "Aspirina 100mg (B01AC06)", "Dobutamina EV (C01CA07)", "Nitroglicerina EV (C01DA02)"], "evo": "Estenosis aortica severa sintomatica, programada para TAVI", "dx_alta": ["IAMCEST anterior tratado (I21.0)"], "med": ["Isosorbide 20mg VO c/8h (C01DA08)", "Prasugrel 10mg VO c/24h 12m (B01AC22)", "Espironolactona 25mg VO c/24h (C03DA01)", "Rivaroxaban 20mg VO c/24h (B01AF01)", "Losartan 50mg VO c/24h (C09CA01)"]}, "output": "Ingresa por iamcest anterior (I21.0). Se realiza coronariografia (K492) evidenciando oclusion aguda, realizandose angioplastia om (36.06) con implante de stent farmacoactivo y flujo TIMI 3 final. Presenta, estenosis aortica severa sintomatica, programada para tavi. Recibio tratamiento con Heparina EV infusion (B01AB01), Aspirina 100mg (B01AC06), Dobutamina EV (C01CA07) y Nitroglicerina EV (C01DA02). Buena evolucion, cumpliendo criterios de alta. Alta con diagnostico de iamcest anterior tratado (I21.0), indicandose Isosorbide 20mg VO c/8h (C01DA08), Prasugrel 10mg VO c/24h 12m (B01AC22), Espironolactona 25mg VO c/24h (C03DA01), Rivaroxaban 20mg VO c/24h (B01AF01) y Losartan 50mg VO c/24h (C09CA01)."}
{"input": {"dx": ["IAMCEST lateral (I21.2)"], "proc": ["Coronariografia (K492)", "Angioplastia CX (36.06)"], "tto": ["Ticagrelor 180mg carga (B01AC24)", "Clopidogrel 600mg carga (B01AC04)"], "evo": "SDST en V1-V4, coronarias sin lesiones obstructivas, sindrome de Tako-Tsubo", "dx_alta": ["IAMCEST lateral tratado (I21.2)"], "med": ["Rosuvastatina 20mg VO c/noche (C10AA07)", "Prasugrel 10mg VO c/24h 12m (B01AC22)", "Aspirina 100mg VO c/24h (B01AC06)", "Clopidogrel 75mg VO c/24h 12m (B01AC04)"]}, "output": "Ingreso por iamcest lateral (I21.2). Se realiza coronariografia (K492) con hallazgo de lesion significativa, realizandose angioplastia cx (36.06) con implante de stent farmacoactivo y flujo TIMI 3 final. Evoluciona con, sdst en v1-v4, coronarias sin lesiones obstructivas, sindrome de tako-tsubo. Recibio tratamiento con Ticagrelor 180mg carga (B01AC24) y Clopidogrel 600mg carga (B01AC04). Evolucion clinica favorable, cumpliendo criterios de alta. Alta con diagnostico de iamcest lateral tratado (I21.2), indicandose Rosuvastatina 20mg VO c/noche (C10AA07), Prasugrel 10mg VO c/24h 12m (B01AC22), Aspirina 100mg VO c/24h (B01AC06) y Clopidogrel 75mg VO c/24h 12m (B01AC04)."}
{"input": {"dx": ["Neumonia adquirida comunidad (J18.9)"], "proc": ["Hemodialisis (39.95)", "RMN cerebral (88.91)"], "tto": ["Insulina NPH 10UI SC c/12h (A10AC01)", "Salbutamol NBZ c/4h (R03AC02)"], "evo": "Manejo conservador exitoso, sin necesidad de cirugia", "dx_alta": ["Neumonia adquirida comunidad resuelto (J18.9)"], "med": ["Calcio 500mg VO c/12h (A12AA04)", "Tramadol 50mg VO c/8h 7d (N02AX02)"]}, "output": "Ingresa por neumonia adquirida comunidad (J18.9). Se realiza hemodialisis (39.95), rmn cerebral (88.91). Presenta, manejo conservador exitoso, sin necesidad de cirugia. Recibio tratamiento con Insulina NPH 10UI SC c/12h (A10AC01) y Salbutamol NBZ c/4h (R03AC02). Presenta evolucion favorable, cumpliendo criterios de alta. Alta con diagnostico de neumonia adquirida comunidad resuelto (J18.9), indicandose Calcio 500mg VO c/12h (A12AA04) y Tramadol 50mg VO c/8h 7d (N02AX02)."}
{"input": {"dx": ["IAMCEST posterior (I21.2)"], "proc": ["Coronariografia (K492)"], "tto": ["Furosemida 40mg EV (C03CA01)", "Aspirina 100mg (B01AC06)"], "evo": "Pericarditis aguda con derrame leve, manejo antiinflamatorio", "dx_alta": ["IAMCEST posterior tratado (I21.2)"], "med": ["Losartan 50mg VO c/24h (C09CA01)", "Espironolactona 25mg VO c/24h (C03DA01)", "Aspirina 100mg VO c/24h (B01AC06)"]}, "output": "Ingreso por iamcest posterior (I21.2). Se realiza coronariografia (K492). En su evolucion, pericarditis aguda con derrame leve, manejo antiinflamatorio. Recibio tratamiento con Furosemida 40mg EV (C03CA01) y Aspirina 100mg (B01AC06). Evolucion satisfactoria, cumpliendo criterios de alta. Alta con diagnostico de iamcest posterior tratado (I21.2), indicandose Losartan 50mg VO c/24h (C09CA01), Espironolactona 25mg VO c/24h (C03DA01) y Aspirina 100mg VO c/24h (B01AC06)."}
{"input": {"dx": ["IAMCEST posterior (I21.2)"], "proc": ["Coronariografia (K492)", "Angioplastia CD (36.06)"], "tto": ["Atorvastatina 80mg (C10AA05)", "Ticagrelor 180mg carga (B01AC24)", "Digoxina 0.25mg EV (C01AA05)", "Prasugrel 60mg carga (B01AC22)"], "evo": "Enfermedad de multiples vasos, se deriva a cirugia cardiaca para bypass", "dx_alta": ["IAMCEST posterior tratado (I21.2)"], "med": ["Bisoprolol 5mg VO c/24h (C07AB07)", "Isosorbide 20mg VO c/8h (C01DA08)", "Nitroglicerina SL PRN (C01DA02)"]}, "output": "Ingreso por iamcest posterior (I21.2). Se realiza coronariografia (K492) evidenciando oclusion aguda, realizandose angioplastia cd (36.06) con implante de stent farmacoactivo y flujo TIMI 3 final. Durante la hospitalizacion, enfermedad de multiples vasos, se deriva a cirugia cardiaca para bypass. Recibio tratamiento con Atorvastatina 80mg (C10AA05), Ticagrelor 180mg carga (B01AC24), Digoxina 0.25mg EV (C01AA05) y Prasugrel 60mg carga (B01AC22). Buena evolucion, cumpliendo criterios de alta. Alta con diagnostico de iamcest posterior tratado (I21.2), indicandose Bisoprolol 5mg VO c/24h (C07AB07), Isosorbide 20mg VO c/8h (C01DA08) y Nitroglicerina SL PRN (C01DA02)."}
{"input": {"dx": ["IAMCEST lateral (I21.2)"], "proc": ["Coronariografia (K492)", "Angioplastia OM (36.06)"], "tto": ["Enoxaparina 1mg/kg SC c/12h (B01AB05)", "Heparina 5000UI EV (B01AB01)"], "evo": "SDST en II, III, aVF, coronarias sin lesiones obstructivas, sindrome de Tako-Tsubo", "dx_alta": ["IAMCEST lateral tratado (I21.2)"], "med": ["Espironolactona 25mg VO c/24h (C03DA01)", "Prasugrel 10mg VO c/24h 12m (B01AC22)", "Enalapril 10mg VO c/12h (C09AA02)"]}, "output": "Ingreso por iamcest lateral (I21.2). Se realiza coronariografia (K492) con hallazgo de lesion significativa, realizandose angioplastia om (36.06) con implante de stent farmacoactivo y flujo TIMI 3 final. Evoluciona con, sdst en ii, iii, avf, coronarias sin lesiones obstructivas, sindrome de tako-tsubo. Recibio tratamiento con Enoxaparina 1mg/kg SC c/12h (B01AB05) y Heparina 5000UI EV (B01AB01). Buena evolucion, cumpliendo criterios de alta. Alta con diagnostico de iamcest lateral tratado (I21.2), indicandose Espironolactona 25mg VO c/24h (C03DA01), Prasugrel 10mg VO c/24h 12m (B01AC22) y Enalapril 10mg VO c/12h (C09AA02)."}
{"input": {"dx": ["Insuficiencia cardiaca aguda (I50.9)"], "proc": ["Implante de DAI (K493)"], "tto": ["Furosemida 40mg EV (C03CA01)", "Morfina 3mg EV (N02AA01)", "Aspirina 100mg (B01AC06)"], "evo": "Bloqueo AV completo sintomatico, requirio marcapasos transitorio", "dx_alta": ["Insuficiencia cardiaca aguda tratado (I50.9)"], "med": ["Furosemida 40mg VO c/24h (C03CA01)", "Rosuvastatina 20mg VO c/noche (C10AA07)", "Atorvastatina 40mg VO c/noche (C10AA05)", "Isosorbide 20mg VO c/8h (C01DA08)"]}, "output": "Ingresa por insuficiencia cardiaca aguda (I50.9). Se realiza implante de dai (K493). En su evolucion, bloqueo av completo sintomatico, requirio marcapasos transitorio. Recibio tratamiento con Furosemida 40mg EV (C03CA01), Morfina 3mg EV (N02AA01) y Aspirina 100mg (B01AC06). Presenta evolucion favorable, cumpliendo criterios de alta. Alta con diagnostico de insuficiencia cardiaca aguda tratado (I50.9), indicandose Furosemida 40mg VO c/24h (C03CA01), Rosuvastatina 20mg VO c/noche (C10AA07), Atorvastatina 40mg VO c/noche (C10AA05) y Isosorbide 20mg VO c/8h (C01DA08)."}
{"input": {"dx": ["Angina estable (I20.8)"], "proc": ["Coronariografia (K492)", "Angioplastia TCI (K493)"], "tto": ["Heparina EV infusion (B01AB01)", "Furosemida 40mg EV (C03CA01)", "Enalapril 5mg VO (C09AA02)", "Furosemida 80mg EV (C03CA01)"], "evo": "Taquicardia ventricular sostenida, cardioversion electrica exitosa", "dx_alta": ["Angina estable tratado (I20.8)"], "med": ["Atorvastatina 40mg VO c/noche (C10AA05)", "Espironolactona 25mg VO c/24h (C03DA01)", "Enalapril 10mg VO c/12h (C09AA02)", "Ticagrelor 90mg VO c/12h 12m (B01AC24)", "Bisoprolol 5mg VO c/24h (C07AB07)"]}, "output": "Ingresa por angina estable (I20.8). Se realiza coronariografia (K492) evidenciando oclusion aguda, realizandose angioplastia tci (K493) con implante de stent farmacoactivo y flujo TIMI 3 final. Durante la hospitalizacion, taquicardia ventricular sostenida, cardioversion electrica exitosa. Recibio tratamiento con Heparina EV infusion (B01AB01), Furosemida 40mg EV (C03CA01), Enalapril 5mg VO (C09AA02) y Furosemida 80mg EV (C03CA01). Evolucion satisfactoria, cumpliendo criterios de alta. Alta con diagnostico de angina estable tratado (I20.8), indicandose Atorvastatina 40mg VO c/noche (C10AA05), Espironolactona 25mg VO c/24h (C03DA01), Enalapril 10mg VO c/12h (C09AA02), Ticagrelor 90mg VO c/12h 12m (B01AC24) y Bisoprolol 5mg VO c/24h (C07AB07)."}
{"input": {"dx": ["IAMCEST inferolateral (I21.1)"], "proc": ["Coronariografia (K492)", "Angioplastia CD (K493)"], "tto": ["Furosemida 80mg EV (C03CA01)", "Enoxaparina 60mg SC c/12h (B01AB05)"], "evo": "Shock cardiogenico, requirio soporte con inotropicos, evolucion favorable", "dx_alta": ["IAMCEST inferolateral tratado (I21.1)"], "med": ["Rivaroxaban 20mg VO c/24h (B01AF01)", "Rosuvastatina 20mg VO c/noche (C10AA07)", "Losartan 50mg VO c/24h (C09CA01)", "Ticagrelor 90mg VO c/12h 12m (B01AC24)", "Amlodipino 5mg VO c/24h (C08CA01)"]}, "output": "Ingreso por iamcest inferolateral (I21.1). Se realiza coronariografia (K492) con hallazgo de lesion significativa, realizandose angioplastia cd (K493) con implante de stent farmacoactivo y flujo TIMI 3 final. Presenta, shock cardiogenico, requirio soporte con inotropicos, evolucion favorable. Recibio tratamiento con Furosemida 80mg EV (C03CA01) y Enoxaparina 60mg SC c/12h (B01AB05). Buena evolucion, cumpliendo criterios de alta. Alta con diagnostico de iamcest inferolateral tratado (I21.1), indicandose Rivaroxaban 20mg VO c/24h (B01AF01), Rosuvastatina 20mg VO c/noche (C10AA07), Losartan 50mg VO c/24h (C09CA01), Ticagrelor 90mg VO c/12h 12m (B01AC24) y Amlodipino 5mg VO c/24h (C08CA01)."}
{"input": {"dx": ["IAMCEST anterior (I21.0)"], "proc": ["Coronariografia (K492)", "Angioplastia OM (36.06)"], "tto": ["Furosemida 80mg EV (C03CA01)", "Aspirina 300mg carga (B01AC06)"], "evo": "Oclusion de OM2 con trombo, trombectomia por aspiracion mas stent", "dx_alta": ["IAMCEST anterior tratado (I21.0)"], "med": ["Prasugrel 10mg VO c/24h 12m (B01AC22)", "Digoxina 0.125mg VO c/24h (C01AA05)", "Isosorbide 20mg VO c/8h (C01DA08)", "Enalapril 10mg VO c/12h (C09AA02)", "Carvedilol 6.25mg VO c/12h (C07AG02)"]}, "output": "Ingreso por iamcest anterior (I21.0). Se realiza coronariografia (K492) visualizando estenosis severa, realizandose angioplastia om (36.06) con implante de stent farmacoactivo y flujo TIMI 3 final. Evoluciona con, oclusion de om2 con trombo, trombectomia por aspiracion mas stent. Recibio tratamiento con Furosemida 80mg EV (C03CA01) y Aspirina 300mg carga (B01AC06). Evolucion satisfactoria, cumpliendo criterios de alta. Alta con diagnostico de iamcest anterior tratado (I21.0), indicandose Prasugrel 10mg VO c/24h 12m (B01AC22), Digoxina 0.125mg VO c/24h (C01AA05), Isosorbide 20mg VO c/8h (C01DA08), Enalapril 10mg VO c/12h (C09AA02) y Carvedilol 6.25mg VO c/12h (C07AG02)."}
{"input": {"dx": ["Reestenosis intra-stent (I25.5)"], "proc": ["Angioplastia (K493)"], "tto": ["Furosemida 40mg EV (C03CA01)", "Aspirina 300mg carga (B01AC06)", "Dobutamina EV (C01CA07)"], "evo": "Edema pulmonar agudo por disfuncion sistolica, respuesta favorable a diureticos", "dx_alta": ["Reestenosis intra-stent tratado (I25.5)"], "med": ["Bisoprolol 5mg VO c/24h (C07AB07)", "Losartan 50mg VO c/24h (C09CA01)", "Atorvastatina 40mg VO c/noche (C10AA05)"]}, "output": "Ingresa por reestenosis intra-stent (I25.5). Se realiza angioplastia (K493). Evoluciona con, edema pulmonar agudo por disfuncion sistolica, respuesta favorable a diureticos. Recibio tratamiento con Furosemida 40mg EV (C03CA01), Aspirina 300mg carga (B01AC06) y Dobutamina EV (C01CA07). Buena evolucion, cumpliendo criterios de alta. Alta con diagnostico de reestenosis intra-stent tratado (I25.5), indicandose Bisoprolol 5mg VO c/24h (C07AB07), Losartan 50mg VO c/24h (C09CA01) y Atorvastatina 40mg VO c/noche (C10AA05)."}
{"input": {"dx": ["Fibrilacion auricular (I48.9)"], "proc": ["Toracocentesis (34.91)", "Osteosintesis de cadera (79.35)"], "tto": ["Insulina NPH 10UI SC c/12h (A10AC01)", "Ondansetron 8mg EV c/8h (A04AA01)", "Morfina 3mg EV c/4h PRN (N02AA01)"], "evo": "Procedimiento sin complicaciones, buena tolerancia oral", "dx_alta": ["Fibrilacion auricular resuelto (I48.9)"], "med": ["Calcio 500mg VO c/12h (A12AA04)", "Salbutamol INH 2 puff c/6h PRN (R03AC02)", "Levotiroxina 50mcg VO c/24h (H03AA01)"]}, "output": "Ingreso por fibrilacion auricular (I48.9). Se realiza toracocentesis (34.91), osteosintesis de cadera (79.35). Durante la hospitalizacion, procedimiento sin complicaciones, buena tolerancia oral. Recibio tratamiento con Insulina NPH 10UI SC c/12h (A10AC01), Ondansetron 8mg EV c/8h (A04AA01) y Morfina 3mg EV c/4h PRN (N02AA01). Evolucion clinica favorable, cumpliendo criterios de alta. Alta con diagnostico de fibrilacion auricular resuelto (I48.9), indicandose Calcio 500mg VO c/12h (A12AA04), Salbutamol INH 2 puff c/6h PRN (R03AC02) y Levotiroxina 50mcg VO c/24h (H03AA01)."}
{"input": {"dx": ["Enfermedad coronaria de 3 vasos (I25.1)"], "proc": ["Coronariografia (K492)", "Angioplastia OM (36.06)"], "tto": ["Enalapril 5mg VO (C09AA02)", "Aspirina 100mg (B01AC06)"], "evo": "Lesion severa de CD media, angioplastia con implante de stent sin complicaciones", "dx_alta": ["Enfermedad coronaria de 3 vasos tratado (I25.1)"], "med": ["Rivaroxaban 20mg VO c/24h (B01AF01)", "Amlodipino 5mg VO c/24h (C08CA01)", "Aspirina 100mg VO c/24h (B01AC06)", "Apixaban 5mg VO c/12h (B01AF02)"]}, "output": "Paciente que ingresa con cuadro de enfermedad coronaria de 3 vasos (I25.1). Se realiza coronariografia (K492) evidenciando oclusion aguda, realizandose angioplastia om (36.06) con implante de stent farmacoactivo y flujo TIMI 3 final. Durante la hospitalizacion, lesion severa de cd media, angioplastia con implante de stent sin complicaciones. Recibio tratamiento con Enalapril 5mg VO (C09AA02) y Aspirina 100mg (B01AC06). Evolucion clinica favorable, cumpliendo criterios de alta. Alta con diagnostico de enfermedad coronaria de 3 vasos tratado (I25.1), indicandose Rivaroxaban 20mg VO c/24h (B01AF01), Amlodipino 5mg VO c/24h (C08CA01), Aspirina 100mg VO c/24h (B01AC06) y Apixaban 5mg VO c/12h (B01AF02)."}
{"input": {"dx": ["IAMCEST inferior (I21.1)"], "proc": ["Coronariografia (K492)", "Angioplastia CD (36.06)"], "tto": ["Amiodarona 300mg EV (C01BD01)", "Enalapril 5mg VO (C09AA02)", "Furosemida 40mg EV (C03CA01)"], "evo": "Shock cardiogenico, requirio soporte con inotropicos, evolucion favorable", "dx_alta": ["IAMCEST inferior tratado (I21.1)"], "med": ["Carvedilol 6.25mg VO c/12h (C07AG02)", "Espironolactona 25mg VO c/24h (C03DA01)", "Furosemida 40mg VO c/24h (C03CA01)"]}, "output": "Paciente que ingresa con cuadro de iamcest inferior (I21.1). Se realiza coronariografia (K492) con hallazgo de lesion significativa, realizandose angioplastia cd (36.06) con implante de stent farmacoactivo y flujo TIMI 3 final. Presenta, shock cardiogenico, requirio soporte con inotropicos, evolucion favorable. Recibio tratamiento con Amiodarona 300mg EV (C01BD01), Enalapril 5mg VO (C09AA02) y Furosemida 40mg EV (C03CA01). Buena evolucion, cumpliendo criterios de alta. Alta con diagnostico de iamcest inferior tratado (I21.1), indicandose Carvedilol 6.25mg VO c/12h (C07AG02), Espironolactona 25mg VO c/24h (C03DA01) y Furosemida 40mg VO c/24h (C03CA01)."}
{"input": {"dx": ["IAMSEST alto riesgo (I21.4)"], "proc": ["Coronariografia (K492)", "Angioplastia DA (36.06)"], "tto": ["Furosemida 40mg EV (C03CA01)", "Heparina EV infusion (B01AB01)"], "evo": "Oclusion de OM2 con trombo, trombectomia por aspiracion mas stent", "dx_alta": ["IAMSEST alto riesgo tratado (I21.4)"], "med": ["Atorvastatina 40mg VO c/noche (C10AA05)", "Warfarina segun INR (B01AA03)", "Rosuvastatina 20mg VO c/noche (C10AA07)"]}, "output": "Ingreso por iamsest alto riesgo (I21.4). Se realiza coronariografia (K492) encontrando lesion critica, realizandose angioplastia da (36.06) con implante de stent farmacoactivo y flujo TIMI 3 final. Durante la hospitalizacion, oclusion de om2 con trombo, trombectomia por aspiracion mas stent. Recibio tratamiento con Furosemida 40mg EV (C03CA01) y Heparina EV infusion (B01AB01). Evolucion satisfactoria, cumpliendo criterios de alta. Alta con diagnostico de iamsest alto riesgo tratado (I21.4), indicandose Atorvastatina 40mg VO c/noche (C10AA05), Warfarina segun INR (B01AA03) y Rosuvastatina 20mg VO c/noche (C10AA07)."}
{"input": {"dx": ["Colecistitis aguda (K81.0)"], "proc": ["TAC de torax (87.41)"], "tto": ["Ceftriaxona 2g EV c/24h (J01DD04)", "Ipratropio NBZ c/6h (R03BB01)"], "evo": "Cirugia programada sin complicaciones, alta precoz", "dx_alta": ["Colecistitis aguda resuelto (K81.0)"], "med": ["Levotiroxina 50mcg VO c/24h (H03AA01)", "Acido folico 1mg VO c/24h (B03BB01)", "Hierro 100mg VO c/24h (B03AA07)", "Clonazepam 0.5mg VO c/noche (N03AE01)"]}, "output": "Se hospitaliza por colecistitis aguda (K81.0). Se realiza tac de torax (87.41). Evoluciona con, cirugia programada sin complicaciones, alta precoz. Recibio tratamiento con Ceftriaxona 2g EV c/24h (J01DD04) y Ipratropio NBZ c/6h (R03BB01). Buena evolucion, cumpliendo criterios de alta. Alta con diagnostico de colecistitis aguda resuelto (K81.0), indicandose Levotiroxina 50mcg VO c/24h (H03AA01), Acido folico 1mg VO c/24h (B03BB01), Hierro 100mg VO c/24h (B03AA07) y Clonazepam 0.5mg VO c/noche (N03AE01)."}
{"input": {"dx": ["Angina inestable (I20.0)"], "proc": ["Coronariografia (K492)", "Angioplastia OM (36.06)"], "tto": ["Enoxaparina 1mg/kg SC c/12h (B01AB05)", "Heparina 5000UI EV (B01AB01)", "Enalapril 5mg VO (C09AA02)", "Digoxina 0.25mg EV (C01AA05)"], "evo": "Lesion critica de OM1, estabilizacion hemodinamica, angioplastia diferida", "dx_alta": ["Angina inestable tratado (I20.0)"], "med": ["Enalapril 10mg VO c/12h (C09AA02)", "Digoxina 0.125mg VO c/24h (C01AA05)", "Prasugrel 10mg VO c/24h 12m (B01AC22)", "Espironolactona 25mg VO c/24h (C03DA01)", "Ticagrelor 90mg VO c/12h 12m (B01AC24)"]}, "output": "Se hospitaliza por angina inestable (I20.0). Se realiza coronariografia (K492) visualizando estenosis severa, realizandose angioplastia om (36.06) con implante de stent farmacoactivo y flujo TIMI 3 final. Presenta, lesion critica de om1, estabilizacion hemodinamica, angioplastia diferida. Recibio tratamiento con Enoxaparina 1mg/kg SC c/12h (B01AB05), Heparina 5000UI EV (B01AB01), Enalapril 5mg VO (C09AA02) y Digoxina 0.25mg EV (C01AA05). Buena evolucion, cumpliendo criterios de alta. Alta con diagnostico de angina inestable tratado (I20.0), indicandose Enalapril 10mg VO c/12h (C09AA02), Digoxina 0.125mg VO c/24h (C01AA05), Prasugrel 10mg VO c/24h 12m (B01AC22), Espironolactona 25mg VO c/24h (C03DA01) y Ticagrelor 90mg VO c/12h 12m (B01AC24)."}
{"input": {"dx": ["Angina inestable (I20.0)"], "proc": ["Coronariografia (K492)"], "tto": ["Clopidogrel 300mg carga (B01AC04)", "Heparina EV infusion (B01AB01)", "Dobutamina EV (C01CA07)", "Furosemida 40mg EV (C03CA01)"], "evo": "Shock cardiogenico, requirio soporte con inotropicos, evolucion favorable", "dx_alta": ["Angina inestable tratado (I20.0)"], "med": ["Aspirina 100mg VO c/24h (B01AC06)", "Espironolactona 25mg VO c/24h (C03DA01)", "Enalapril 10mg VO c/12h (C09AA02)", "Rosuvastatina 20mg VO c/noche (C10AA07)", "Metoprolol 50mg VO c/12h (C07AB02)"]}, "output": "Ingreso por angina inestable (I20.0). Se realiza coronariografia (K492). Evoluciona con, shock cardiogenico, requirio soporte con inotropicos, evolucion favorable. Recibio tratamiento con Clopidogrel 300mg carga (B01AC04), Heparina EV infusion (B01AB01), Dobutamina EV (C01CA07) y Furosemida 40mg EV (C03CA01). Presenta evolucion favorable, cumpliendo criterios de alta. Alta con diagnostico de angina inestable tratado (I20.0), indicandose Aspirina 100mg VO c/24h (B01AC06), Espironolactona 25mg VO c/24h (C03DA01), Enalapril 10mg VO c/12h (C09AA02), Rosuvastatina 20mg VO c/noche (C10AA07) y Metoprolol 50mg VO c/12h (C07AB02)."}
{"input": {"dx": ["Edema pulmonar agudo (J81)"], "proc": ["Ecocardiograma (37.34)"], "tto": ["Clopidogrel 300mg carga (B01AC04)", "Digoxina 0.25mg EV (C01AA05)", "Atorvastatina 80mg (C10AA05)", "Levosimendan EV (C01CX08)"], "evo": "Estenosis aortica severa sintomatica, programada para TAVI", "dx_alta": ["Edema pulmonar agudo tratado (J81)"], "med": ["Enalapril 10mg VO c/12h (C09AA02)", "Apixaban 5mg VO c/12h (B01AF02)", "Nitroglicerina SL PRN (C01DA02)", "Isosorbide 20mg VO c/8h (C01DA08)", "Digoxina 0.125mg VO c/24h (C01AA05)"]}, "output": "Ingresa por edema pulmonar agudo (J81). Se realiza ecocardiograma (37.34). Evoluciona con, estenosis aortica severa sintomatica, programada para tavi. Recibio tratamiento con Clopidogrel 300mg carga (B01AC04), Digoxina 0.25mg EV (C01AA05), Atorvastatina 80mg (C10AA05) y Levosimendan EV (C01CX08). Evolucion clinica favorable, cumpliendo criterios de alta. Alta con diagnostico de edema pulmonar agudo tratado (J81), indicandose Enalapril 10mg VO c/12h (C09AA02), Apixaban 5mg VO c/12h (B01AF02), Nitroglicerina SL PRN (C01DA02), Isosorbide 20mg VO c/8h (C01DA08) y Digoxina 0.125mg VO c/24h (C01AA05)."}
{"input": {"dx": ["Obstruccion intestinal (K56.6)"], "proc": ["Paracentesis (54.91)"], "tto": ["Metoclopramida 10mg EV c/8h (A03FA01)", "Morfina 3mg EV c/4h PRN (N02AA01)", "Vancomicina 1g EV c/12h (J01XA01)", "Ipratropio NBZ c/6h (R03BB01)"], "evo": "Cirugia programada sin complicaciones, alta precoz", "dx_alta": ["Obstruccion intestinal resuelto (K56.6)"], "med": ["Salbutamol INH 2 puff c/6h PRN (R03AC02)", "Budesonide/Formoterol INH c/12h (R03AK07)", "Levotiroxina 50mcg VO c/24h (H03AA01)"]}, "output": "Se hospitaliza por obstruccion intestinal (K56.6). Se realiza paracentesis (54.91). Evoluciona con, cirugia programada sin complicaciones, alta precoz. Recibio tratamiento con Metoclopramida 10mg EV c/8h (A03FA01), Morfina 3mg EV c/4h PRN (N02AA01), Vancomicina 1g EV c/12h (J01XA01) y Ipratropio NBZ c/6h (R03BB01). Presenta evolucion favorable, cumpliendo criterios de alta. Alta con diagnostico de obstruccion intestinal resuelto (K56.6), indicandose Salbutamol INH 2 puff c/6h PRN (R03AC02), Budesonide/Formoterol INH c/12h (R03AK07) y Levotiroxina 50mcg VO c/24h (H03AA01)."}
{"input": {"dx": ["Edema pulmonar agudo (J81)"], "proc": ["Angioplastia DA (35.04)"], "tto": ["Enalapril 5mg VO (C09AA02)", "Enoxaparina 1mg/kg SC c/12h (B01AB05)"], "evo": "Shock cardiogenico, requirio soporte con inotropicos, evolucion favorable", "dx_alta": ["Edema pulmonar agudo tratado (J81)"], "med": ["Metoprolol 50mg VO c/12h (C07AB02)", "Clopidogrel 75mg VO c/24h 12m (B01AC04)", "Rivaroxaban 20mg VO c/24h (B01AF01)", "Nitroglicerina SL PRN (C01DA02)"]}, "output": "Paciente que ingresa con cuadro de edema pulmonar agudo (J81). Se realiza angioplastia da (35.04). Presenta, shock cardiogenico, requirio soporte con inotropicos, evolucion favorable. Recibio tratamiento con Enalapril 5mg VO (C09AA02) y Enoxaparina 1mg/kg SC c/12h (B01AB05). Evolucion satisfactoria, cumpliendo criterios de alta. Alta con diagnostico de edema pulmonar agudo tratado (J81), indicandose Metoprolol 50mg VO c/12h (C07AB02), Clopidogrel 75mg VO c/24h 12m (B01AC04), Rivaroxaban 20mg VO c/24h (B01AF01) y Nitroglicerina SL PRN (C01DA02)."}
{"input": {"dx": ["Celulitis (L03.9)"], "proc": ["Colonoscopia (45.23)", "Paracentesis (54.91)"], "tto": ["Metamizol 1g EV c/8h (N02BB02)", "Metoclopramida 10mg EV c/8h (A03FA01)", "Insulina NPH 10UI SC c/12h (A10AC01)", "Piperacilina/Tazobactam 4.5g EV c/8h (J01CR05)"], "evo": "Procedimiento sin complicaciones, buena tolerancia oral", "dx_alta": ["Celulitis resuelto (L03.9)"], "med": ["Paracetamol 500mg VO c/8h PRN (N02BE01)", "Omeprazol 20mg VO c/24h (A02BC01)", "Calcio 500mg VO c/12h (A12AA04)"]}, "output": "Se hospitaliza por celulitis (L03.9). Se realiza colonoscopia (45.23), paracentesis (54.91). En su evolucion, procedimiento sin complicaciones, buena tolerancia oral. Recibio tratamiento con Metamizol 1g EV c/8h (N02BB02), Metoclopramida 10mg EV c/8h (A03FA01), Insulina NPH 10UI SC c/12h (A10AC01) y Piperacilina/Tazobactam 4.5g EV c/8h (J01CR05). Evolucion clinica favorable, cumpliendo criterios de alta. Alta con diagnostico de celulitis resuelto (L03.9), indicandose Paracetamol 500mg VO c/8h PRN (N02BE01), Omeprazol 20mg VO c/24h (A02BC01) y Calcio 500mg VO c/12h (A12AA04)."}
{"input": {"dx": ["IAMCEST inferolateral (I21.1)"], "proc": ["Coronariografia (K492)", "Angioplastia DA (K493)"], "tto": ["Furosemida 80mg EV (C03CA01)", "Levosimendan EV (C01CX08)", "Furosemida 40mg EV (C03CA01)", "Metoprolol 5mg EV (C07AB02)"], "evo": "Fibrilacion auricular de alta respuesta, cardioversion farmacologica exitosa", "dx_alta": ["IAMCEST inferolateral tratado (I21.1)"], "med": ["Warfarina segun INR (B01AA03)", "Carvedilol 6.25mg VO c/12h (C07AG02)", "Aspirina 100mg VO c/24h (B01AC06)", "Losartan 50mg VO c/24h (C09CA01)", "Digoxina 0.125mg VO c/24h (C01AA05)"]}, "output": "Ingresa por iamcest inferolateral (I21.1). Se realiza coronariografia (K492) encontrando lesion critica, realizandose angioplastia da (K493) con implante de stent farmacoactivo y flujo TIMI 3 final. En su evolucion, fibrilacion auricular de alta respuesta, cardioversion farmacologica exitosa. Recibio tratamiento con Furosemida 80mg EV (C03CA01), Levosimendan EV (C01CX08), Furosemida 40mg EV (C03CA01) y Metoprolol 5mg EV (C07AB02). Evolucion clinica favorable, cumpliendo criterios de alta. Alta con diagnostico de iamcest inferolateral tratado (I21.1), indicandose Warfarina segun INR (B01AA03), Carvedilol 6.25mg VO c/12h (C07AG02), Aspirina 100mg VO c/24h (B01AC06), Losartan 50mg VO c/24h (C09CA01) y Digoxina 0.125mg VO c/24h (C01AA05)."}
{"input": {"dx": ["Angina estable (I20.8)"], "proc": ["Coronariografia (K492)", "Angioplastia DA (36.06)"], "tto": ["Noradrenalina EV (C01CA03)", "Prasugrel 60mg carga (B01AC22)", "Aspirina 100mg (B01AC06)", "Enoxaparina 60mg SC c/12h (B01AB05)"], "evo": "Oclusion aguda de CD media, angioplastia exitosa con stent farmacoactivo, flujo TIMI 3 final", "dx_alta": ["Angina estable tratado (I20.8)"], "med": ["Amlodipino 5mg VO c/24h (C08CA01)", "Digoxina 0.125mg VO c/24h (C01AA05)", "Losartan 50mg VO c/24h (C09CA01)", "Metoprolol 50mg VO c/12h (C07AB02)"]}, "output": "Paciente que ingresa con cuadro de angina estable (I20.8). Se realiza coronariografia (K492) visualizando estenosis severa, realizandose angioplastia da (36.06) con implante de stent farmacoactivo y flujo TIMI 3 final. Evoluciona con, oclusion aguda de cd media, angioplastia exitosa con stent farmacoactivo, flujo timi 3 final. Recibio tratamiento con Noradrenalina EV (C01CA03), Prasugrel 60mg carga (B01AC22), Aspirina 100mg (B01AC06) y Enoxaparina 60mg SC c/12h (B01AB05). Buena evolucion, cumpliendo criterios de alta. Alta con diagnostico de angina estable tratado (I20.8), indicandose Amlodipino 5mg VO c/24h (C08CA01), Digoxina 0.125mg VO c/24h (C01AA05), Losartan 50mg VO c/24h (C09CA01) y Metoprolol 50mg VO c/12h (C07AB02)."}
{"input": {"dx": ["Pericarditis aguda (I30.9)"], "proc": ["TAC de torax (87.41)", "Hernioplastia inguinal (53.00)"], "tto": ["Paracetamol 1g EV c/8h (N02BE01)", "Tramadol 50mg EV c/8h (N02AX02)"], "evo": "Evolucion favorable con tratamiento medico, sin complicaciones", "dx_alta": ["Pericarditis aguda resuelto (I30.9)"], "med": ["Clonazepam 0.5mg VO c/noche (N03AE01)", "Metformina 850mg VO c/12h (A10BA02)", "Amoxicilina/Clavulanico 875mg VO c/12h 7d (J01CR02)", "Sertralina 50mg VO c/24h (N06AB06)"]}, "output": "Ingresa por pericarditis aguda (I30.9). Se realiza tac de torax (87.41), hernioplastia inguinal (53.00). Evoluciona con, evolucion favorable con tratamiento medico, sin complicaciones. Recibio tratamiento con Paracetamol 1g EV c/8h (N02BE01) y Tramadol 50mg EV c/8h (N02AX02). Buena evolucion, cumpliendo criterios de alta. Alta con diagnostico de pericarditis aguda resuelto (I30.9), indicandose Clonazepam 0.5mg VO c/noche (N03AE01), Metformina 850mg VO c/12h (A10BA02), Amoxicilina/Clavulanico 875mg VO c/12h 7d (J01CR02) y Sertralina 50mg VO c/24h (N06AB06)."}
{"input": {"dx": ["Hemorragia digestiva alta (K92.2)"], "proc": ["TAC de abdomen (88.01)"], "tto": ["Ondansetron 8mg EV c/8h (A04AA01)", "Omeprazol 40mg EV c/12h (A02BC01)", "Pantoprazol 40mg EV c/12h (A02BC02)", "N-acetilcisteina NBZ c/8h (R05CB01)"], "evo": "Control de sintomas con tratamiento medico optimizado", "dx_alta": ["Hemorragia digestiva alta resuelto (K92.2)"], "med": ["Hierro 100mg VO c/24h (B03AA07)", "Amoxicilina/Clavulanico 875mg VO c/12h 7d (J01CR02)", "Levotiroxina 50mcg VO c/24h (H03AA01)"]}, "output": "Ingreso por hemorragia digestiva alta (K92.2). Se realiza tac de abdomen (88.01). En su evolucion, control de sintomas con tratamiento medico optimizado. Recibio tratamiento con Ondansetron 8mg EV c/8h (A04AA01), Omeprazol 40mg EV c/12h (A02BC01), Pantoprazol 40mg EV c/12h (A02BC02) y N-acetilcisteina NBZ c/8h (R05CB01). Evolucion clinica favorable, cumpliendo criterios de alta. Alta con diagnostico de hemorragia digestiva alta resuelto (K92.2), indicandose Hierro 100mg VO c/24h (B03AA07), Amoxicilina/Clavulanico 875mg VO c/12h 7d (J01CR02) y Levotiroxina 50mcg VO c/24h (H03AA01)."}
{"input": {"dx": ["IAMCEST anterior (I21.0)"], "proc": ["Coronariografia (K492)", "Angioplastia DA (36.06)"], "tto": ["Dobutamina EV (C01CA07)", "Aspirina 300mg carga (B01AC06)", "Furosemida 80mg EV (C03CA01)", "Enoxaparina 1mg/kg SC c/12h (B01AB05)"], "evo": "Taquicardia ventricular sostenida, cardioversion electrica exitosa", "dx_alta": ["IAMCEST anterior tratado (I21.0)"], "med": ["Enalapril 10mg VO c/12h (C09AA02)", "Prasugrel 10mg VO c/24h 12m (B01AC22)", "Isosorbide 20mg VO c/8h (C01DA08)"]}, "output": "Ingreso por iamcest anterior (I21.0). Se realiza coronariografia (K492) evidenciando oclusion aguda, realizandose angioplastia da (36.06) con implante de stent farmacoactivo y flujo TIMI 3 final. En su evolucion, taquicardia ventricular sostenida, cardioversion electrica exitosa. Recibio tratamiento con Dobutamina EV (C01CA07), Aspirina 300mg carga (B01AC06), Furosemida 80mg EV (C03CA01) y Enoxaparina 1mg/kg SC c/12h (B01AB05). Buena evolucion, cumpliendo criterios de alta. Alta con diagnostico de iamcest anterior tratado (I21.0), indicandose Enalapril 10mg VO c/12h (C09AA02), Prasugrel 10mg VO c/24h 12m (B01AC22) y Isosorbide 20mg VO c/8h (C01DA08)."}
{"input": {"dx": ["Miocarditis (I40.9)"], "proc": ["Angio TAC cerebral (88.38)", "Toracocentesis (34.91)"], "tto": ["Pantoprazol 40mg EV c/12h (A02BC02)", "Hidrocortisona 100mg EV c/8h (H02AB09)"], "evo": "Resolucion del cuadro agudo, alta con seguimiento ambulatorio", "dx_alta": ["Miocarditis resuelto (I40.9)"], "med": ["Vitamina D 1000UI VO c/24h (A11CC05)", "Salbutamol INH 2 puff c/6h PRN (R03AC02)"]}, "output": "Paciente que ingresa con cuadro de miocarditis (I40.9). Se realiza angio tac cerebral (88.38), toracocentesis (34.91). Durante la hospitalizacion, resolucion del cuadro agudo, alta con seguimiento ambulatorio. Recibio tratamiento con Pantoprazol 40mg EV c/12h (A02BC02) y Hidrocortisona 100mg EV c/8h (H02AB09). Presenta evolucion favorable, cumpliendo criterios de alta. Alta con diagnostico de miocarditis resuelto (I40.9), indicandose Vitamina D 1000UI VO c/24h (A11CC05) y Salbutamol INH 2 puff c/6h PRN (R03AC02)."}
{"input": {"dx": ["IAMCEST posterior (I21.2)"], "proc": ["Coronariografia (K492)", "Angioplastia TCI (K493)"], "tto": ["Enalapril 5mg VO (C09AA02)", "Enoxaparina 60mg SC c/12h (B01AB05)"], "evo": "Pericarditis aguda con derrame leve, manejo antiinflamatorio", "dx_alta": ["IAMCEST posterior tratado (I21.2)"], "med": ["Atorvastatina 40mg VO c/noche (C10AA05)", "Furosemida 40mg VO c/24h (C03CA01)", "Enalapril 10mg VO c/12h (C09AA02)", "Rosuvastatina 20mg VO c/noche (C10AA07)"]}, "output": "Ingreso por iamcest posterior (I21.2). Se realiza coronariografia (K492) encontrando lesion critica, realizandose angioplastia tci (K493) con implante de stent farmacoactivo y flujo TIMI 3 final. Durante la hospitalizacion, pericarditis aguda con derrame leve, manejo antiinflamatorio. Recibio tratamiento con Enalapril 5mg VO (C09AA02) y Enoxaparina 60mg SC c/12h (B01AB05). Evolucion clinica favorable, cumpliendo criterios de alta. Alta con diagnostico de iamcest posterior tratado (I21.2), indicandose Atorvastatina 40mg VO c/noche (C10AA05), Furosemida 40mg VO c/24h (C03CA01), Enalapril 10mg VO c/12h (C09AA02) y Rosuvastatina 20mg VO c/noche (C10AA07)."}
{"input": {"dx": ["ACV hemorragico (I61.9)"], "proc": ["Hemodialisis (39.95)", "Paracentesis (54.91)"], "tto": ["Ondansetron 8mg EV c/8h (A04AA01)", "N-acetilcisteina NBZ c/8h (R05CB01)", "Pantoprazol 40mg EV c/12h (A02BC02)"], "evo": "Evolucion favorable con tratamiento medico, sin complicaciones", "dx_alta": ["ACV hemorragico resuelto (I61.9)"], "med": ["Metformina 850mg VO c/12h (A10BA02)", "Salbutamol INH 2 puff c/6h PRN (R03AC02)"]}, "output": "Se hospitaliza por acv hemorragico (I61.9). Se realiza hemodialisis (39.95), paracentesis (54.91). Evoluciona con, evolucion favorable con tratamiento medico, sin complicaciones. Recibio tratamiento con Ondansetron 8mg EV c/8h (A04AA01), N-acetilcisteina NBZ c/8h (R05CB01) y Pantoprazol 40mg EV c/12h (A02BC02). Buena evolucion, cumpliendo criterios de alta. Alta con diagnostico de acv hemorragico resuelto (I61.9), indicandose Metformina 850mg VO c/12h (A10BA02) y Salbutamol INH 2 puff c/6h PRN (R03AC02)."}
{"input": {"dx": ["Taquicardia ventricular (I47.2)"], "proc": ["Paracentesis (54.91)", "Colecistectomia laparoscopica (51.23)"], "tto": ["Meropenem 1g EV c/8h (J01DH02)", "N-acetilcisteina NBZ c/8h (R05CB01)"], "evo": "Resolucion del cuadro agudo, alta con seguimiento ambulatorio", "dx_alta": ["Taquicardia ventricular resuelto (I47.2)"], "med": ["Hierro 100mg VO c/24h (B03AA07)", "Vitamina D 1000UI VO c/24h (A11CC05)", "Acido folico 1mg VO c/24h (B03BB01)"]}, "output": "Paciente que ingresa con cuadro de taquicardia ventricular (I47.2). Se realiza paracentesis (54.91), colecistectomia laparoscopica (51.23). Durante la hospitalizacion, resolucion del cuadro agudo, alta con seguimiento ambulatorio. Recibio tratamiento con Meropenem 1g EV c/8h (J01DH02) y N-acetilcisteina NBZ c/8h (R05CB01). Evolucion clinica favorable, cumpliendo criterios de alta. Alta con diagnostico de taquicardia ventricular resuelto (I47.2), indicandose Hierro 100mg VO c/24h (B03AA07), Vitamina D 1000UI VO c/24h (A11CC05) y Acido folico 1mg VO c/24h (B03BB01)."}
{"input": {"dx": ["IAMCEST inferior (I21.1)"], "proc": ["Coronariografia (K492)", "Angioplastia CD (K493)"], "tto": ["Noradrenalina EV (C01CA03)", "Metoprolol 5mg EV (C07AB02)", "Digoxina 0.25mg EV (C01AA05)"], "evo": "Bloqueo AV completo sintomatico, requirio marcapasos transitorio", "dx_alta": ["IAMCEST inferior tratado (I21.1)"], "med": ["Carvedilol 6.25mg VO c/12h (C07AG02)", "Aspirina 100mg VO c/24h (B01AC06)", "Rivaroxaban 20mg VO c/24h (B01AF01)", "Espironolactona 25mg VO c/24h (C03DA01)"]}, "output": "Ingreso por iamcest inferior (I21.1). Se realiza coronariografia (K492) encontrando lesion critica, realizandose angioplastia cd (K493) con implante de stent farmacoactivo y flujo TIMI 3 final. Evoluciona con, bloqueo av completo sintomatico, requirio marcapasos transitorio. Recibio tratamiento con Noradrenalina EV (C01CA03), Metoprolol 5mg EV (C07AB02) y Digoxina 0.25mg EV (C01AA05). Evolucion satisfactoria, cumpliendo criterios de alta. Alta con diagnostico de iamcest inferior tratado (I21.1), indicandose Carvedilol 6.25mg VO c/12h (C07AG02), Aspirina 100mg VO c/24h (B01AC06), Rivaroxaban 20mg VO c/24h (B01AF01) y Espironolactona 25mg VO c/24h (C03DA01)."}
{"input": {"dx": ["IAMSEST alto riesgo (I21.4)"], "proc": ["Coronariografia (K492)", "Angioplastia DA (K493)"], "tto": ["Nitroglicerina EV (C01DA02)", "Enalapril 5mg VO (C09AA02)", "Dobutamina EV (C01CA07)", "Enoxaparina 1mg/kg SC c/12h (B01AB05)"], "evo": "Fibrilacion auricular de alta respuesta, cardioversion farmacologica exitosa", "dx_alta": ["IAMSEST alto riesgo tratado (I21.4)"], "med": ["Carvedilol 6.25mg VO c/12h (C07AG02)", "Bisoprolol 5mg VO c/24h (C07AB07)", "Rivaroxaban 20mg VO c/24h (B01AF01)", "Clopidogrel 75mg VO c/24h 12m (B01AC04)"]}, "output": "Ingresa por iamsest alto riesgo (I21.4). Se realiza coronariografia (K492) evidenciando oclusion aguda, realizandose angioplastia da (K493) con implante de stent farmacoactivo y flujo TIMI 3 final. Evoluciona con, fibrilacion auricular de alta respuesta, cardioversion farmacologica exitosa. Recibio tratamiento con Nitroglicerina EV (C01DA02), Enalapril 5mg VO (C09AA02), Dobutamina EV (C01CA07) y Enoxaparina 1mg/kg SC c/12h (B01AB05). Evolucion satisfactoria, cumpliendo criterios de alta. Alta con diagnostico de iamsest alto riesgo tratado (I21.4), indicandose Carvedilol 6.25mg VO c/12h (C07AG02), Bisoprolol 5mg VO c/24h (C07AB07), Rivaroxaban 20mg VO c/24h (B01AF01) y Clopidogrel 75mg VO c/24h 12m (B01AC04)."}
{"input": {"dx": ["Taquicardia ventricular (I47.2)"], "proc": ["Paracentesis (54.91)", "Hernioplastia inguinal (53.00)"], "tto": ["Ceftriaxona 2g EV c/24h (J01DD04)", "Pantoprazol 40mg EV c/12h (A02BC02)", "Insulina cristalina segun esquema (A10AB01)"], "evo": "Manejo conservador exitoso, sin necesidad de cirugia", "dx_alta": ["Taquicardia ventricular resuelto (I47.2)"], "med": ["Hierro 100mg VO c/24h (B03AA07)", "Sertralina 50mg VO c/24h (N06AB06)", "Insulina NPH 10UI SC c/12h (A10AC01)", "Paracetamol 500mg VO c/8h PRN (N02BE01)"]}, "output": "Ingreso por taquicardia ventricular (I47.2). Se realiza paracentesis (54.91), hernioplastia inguinal (53.00). Evoluciona con, manejo conservador exitoso, sin necesidad de cirugia. Recibio tratamiento con Ceftriaxona 2g EV c/24h (J01DD04), Pantoprazol 40mg EV c/12h (A02BC02) y Insulina cristalina segun esquema (A10AB01). Evolucion satisfactoria, cumpliendo criterios de alta. Alta con diagnostico de taquicardia ventricular resuelto (I47.2), indicandose Hierro 100mg VO c/24h (B03AA07), Sertralina 50mg VO c/24h (N06AB06), Insulina NPH 10UI SC c/12h (A10AC01) y Paracetamol 500mg VO c/8h PRN (N02BE01)."}
{"input": {"dx": ["Reestenosis intra-stent (I25.5)"], "proc": ["Pericardiocentesis (37.34)"], "tto": ["Metoprolol 5mg EV (C07AB02)", "Levosimendan EV (C01CX08)"], "evo": "Oclusion aguda de DA media, angioplastia exitosa con stent farmacoactivo, flujo TIMI 3 final", "dx_alta": ["Reestenosis intra-stent tratado (I25.5)"], "med": ["Clopidogrel 75mg VO c/24h 12m (B01AC04)", "Nitroglicerina SL PRN (C01DA02)", "Isosorbide 20mg VO c/8h (C01DA08)", "Aspirina 100mg VO c/24h (B01AC06)"]}, "output": "Ingresa por reestenosis intra-stent (I25.5). Se realiza pericardiocentesis (37.34). Presenta, oclusion aguda de da media, angioplastia exitosa con stent farmacoactivo, flujo timi 3 final. Recibio tratamiento con Metoprolol 5mg EV (C07AB02) y Levosimendan EV (C01CX08). Evolucion clinica favorable, cumpliendo criterios de alta. Alta con diagnostico de reestenosis intra-stent tratado (I25.5), indicandose Clopidogrel 75mg VO c/24h 12m (B01AC04), Nitroglicerina SL PRN (C01DA02), Isosorbide 20mg VO c/8h (C01DA08) y Aspirina 100mg VO c/24h (B01AC06)."}
{"input": {"dx": ["Enfermedad de TCI (I25.1)"], "proc": ["Ablacion por radiofrecuencia (37.80)"], "tto": ["Clopidogrel 300mg carga (B01AC04)", "Amiodarona 300mg EV (C01BD01)"], "evo": "Lesion critica de OM1, estabilizacion hemodinamica, angioplastia diferida", "dx_alta": ["Enfermedad de TCI tratado (I25.1)"], "med": ["Espironolactona 25mg VO c/24h (C03DA01)", "Carvedilol 6.25mg VO c/12h (C07AG02)", "Furosemida 40mg VO c/24h (C03CA01)", "Prasugrel 10mg VO c/24h 12m (B01AC22)", "Amlodipino 5mg VO c/24h (C08CA01)"]}, "output": "Paciente que ingresa con cuadro de enfermedad de tci (I25.1). Se realiza ablacion por radiofrecuencia (37.80). Durante la hospitalizacion, lesion critica de om1, estabilizacion hemodinamica, angioplastia diferida. Recibio tratamiento con Clopidogrel 300mg carga (B01AC04) y Amiodarona 300mg EV (C01BD01). Buena evolucion, cumpliendo criterios de alta. Alta con diagnostico de enfermedad de tci tratado (I25.1), indicandose Espironolactona 25mg VO c/24h (C03DA01), Carvedilol 6.25mg VO c/12h (C07AG02), Furosemida 40mg VO c/24h (C03CA01), Prasugrel 10mg VO c/24h 12m (B01AC22) y Amlodipino 5mg VO c/24h (C08CA01)."}
{"input": {"dx": ["Angina inestable (I20.0)"], "proc": ["Coronariografia (K492)", "Angioplastia CX (K493)"], "tto": ["Aspirina 100mg (B01AC06)", "Metoprolol 5mg EV (C07AB02)"], "evo": "Oclusion de ramus intermedio con trombo, trombectomia por aspiracion mas stent", "dx_alta": ["Angina inestable tratado (I20.0)"], "med": ["Rosuvastatina 20mg VO c/noche (C10AA07)", "Warfarina segun INR (B01AA03)", "Isosorbide 20mg VO c/8h (C01DA08)"]}, "output": "Ingresa por angina inestable (I20.0). Se realiza coronariografia (K492) con hallazgo de lesion significativa, realizandose angioplastia cx (K493) con implante de stent farmacoactivo y flujo TIMI 3 final. En su evolucion, oclusion de ramus intermedio con trombo, trombectomia por aspiracion mas stent. Recibio tratamiento con Aspirina 100mg (B01AC06) y Metoprolol 5mg EV (C07AB02). Evolucion satisfactoria, cumpliendo criterios de alta. Alta con diagnostico de angina inestable tratado (I20.0), indicandose Rosuvastatina 20mg VO c/noche (C10AA07), Warfarina segun INR (B01AA03) y Isosorbide 20mg VO c/8h (C01DA08)."}
{"input": {"dx": ["Miocarditis (I40.9)"], "proc": ["Endoscopia digestiva alta (45.13)", "Angio TAC cerebral (88.38)"], "tto": ["N-acetilcisteina NBZ c/8h (R05CB01)", "Salbutamol NBZ c/4h (R03AC02)"], "evo": "Respuesta adecuada al tratamiento antibiotico, afebril desde dia 2", "dx_alta": ["Miocarditis resuelto (I40.9)"], "med": ["Calcio 500mg VO c/12h (A12AA04)", "Clonazepam 0.5mg VO c/noche (N03AE01)", "Ciprofloxacino 500mg VO c/12h 7d (J01MA02)"]}, "output": "Ingreso por miocarditis (I40.9). Se realiza endoscopia digestiva alta (45.13), angio tac cerebral (88.38). Durante la hospitalizacion, respuesta adecuada al tratamiento antibiotico, afebril desde dia 2. Recibio tratamiento con N-acetilcisteina NBZ c/8h (R05CB01) y Salbutamol NBZ c/4h (R03AC02). Presenta evolucion favorable, cumpliendo criterios de alta. Alta con diagnostico de miocarditis resuelto (I40.9), indicandose Calcio 500mg VO c/12h (A12AA04), Clonazepam 0.5mg VO c/noche (N03AE01) y Ciprofloxacino 500mg VO c/12h 7d (J01MA02)."}
{"input": {"dx": ["Enfermedad coronaria de 3 vasos (I25.1)"], "proc": ["Coronariografia (K492)", "Angioplastia TCI (K493)"], "tto": ["Noradrenalina EV (C01CA03)", "Aspirina 100mg (B01AC06)", "Aspirina 300mg carga (B01AC06)", "Enoxaparina 1mg/kg SC c/12h (B01AB05)"], "evo": "Fibrilacion auricular de alta respuesta, cardioversion farmacologica exitosa", "dx_alta": ["Enfermedad coronaria de 3 vasos tratado (I25.1)"], "med": ["Losartan 50mg VO c/24h (C09CA01)", "Amlodipino 5mg VO c/24h (C08CA01)", "Bisoprolol 5mg VO c/24h (C07AB07)", "Metoprolol 50mg VO c/12h (C07AB02)", "Atorvastatina 40mg VO c/noche (C10AA05)"]}, "output": "Se hospitaliza por enfermedad coronaria de 3 vasos (I25.1). Se realiza coronariografia (K492) con hallazgo de lesion significativa, realizandose angioplastia tci (K493) con implante de stent farmacoactivo y flujo TIMI 3 final. Presenta, fibrilacion auricular de alta respuesta, cardioversion farmacologica exitosa. Recibio tratamiento con Noradrenalina EV (C01CA03), Aspirina 100mg (B01AC06), Aspirina 300mg carga (B01AC06) y Enoxaparina 1mg/kg SC c/12h (B01AB05). Buena evolucion, cumpliendo criterios de alta. Alta con diagnostico de enfermedad coronaria de 3 vasos tratado (I25.1), indicandose Losartan 50mg VO c/24h (C09CA01), Amlodipino 5mg VO c/24h (C08CA01), Bisoprolol 5mg VO c/24h (C07AB07), Metoprolol 50mg VO c/12h (C07AB02) y Atorvastatina 40mg VO c/noche (C10AA05)."}
{"input": {"dx": ["IAMCEST anteroseptal (I21.0)"], "proc": ["Coronariografia (K492)"], "tto": ["Enalapril 5mg VO (C09AA02)", "Prasugrel 60mg carga (B01AC22)", "Atorvastatina 80mg (C10AA05)", "Nitroglicerina EV (C01DA02)"], "evo": "Pericarditis aguda con derrame leve, manejo antiinflamatorio", "dx_alta": ["IAMCEST anteroseptal tratado (I21.0)"], "med": ["Warfarina segun INR (B01AA03)", "Digoxina 0.125mg VO c/24h (C01AA05)", "Isosorbide 20mg VO c/8h (C01DA08)", "Enalapril 10mg VO c/12h (C09AA02)", "Carvedilol 6.25mg VO c/12h (C07AG02)"]}, "output": "Paciente que ingresa con cuadro de iamcest anteroseptal (I21.0). Se realiza coronariografia (K492). En su evolucion, pericarditis aguda con derrame leve, manejo antiinflamatorio. Recibio tratamiento con Enalapril 5mg VO (C09AA02), Prasugrel 60mg carga (B01AC22), Atorvastatina 80mg (C10AA05) y Nitroglicerina EV (C01DA02). Buena evolucion, cumpliendo criterios de alta. Alta con diagnostico de iamcest anteroseptal tratado (I21.0), indicandose Warfarina segun INR (B01AA03), Digoxina 0.125mg VO c/24h (C01AA05), Isosorbide 20mg VO c/8h (C01DA08), Enalapril 10mg VO c/12h (C09AA02) y Carvedilol 6.25mg VO c/12h (C07AG02)."}
{"input": {"dx": ["Hernia inguinal (K40.9)"], "proc": ["Trombectomia mecanica (39.74)", "Angio TAC cerebral (88.38)"], "tto": ["Hidrocortisona 100mg EV c/8h (H02AB09)", "Ampicilina/Sulbactam 1.5g EV c/6h (J01CR01)", "Ciprofloxacino 400mg EV c/12h (J01MA02)", "Omeprazol 40mg EV c/12h (A02BC01)"], "evo": "Mejora clnica sostenida, cumple criterios de alta", "dx_alta": ["Hernia inguinal resuelto (K40.9)"], "med": ["Omeprazol 20mg VO c/24h (A02BC01)", "Hierro 100mg VO c/24h (B03AA07)"]}, "output": "Paciente que ingresa con cuadro de hernia inguinal (K40.9). Se realiza trombectomia mecanica (39.74), angio tac cerebral (88.38). Durante la hospitalizacion, mejora clnica sostenida, cumple criterios de alta. Recibio tratamiento con Hidrocortisona 100mg EV c/8h (H02AB09), Ampicilina/Sulbactam 1.5g EV c/6h (J01CR01), Ciprofloxacino 400mg EV c/12h (J01MA02) y Omeprazol 40mg EV c/12h (A02BC01). Presenta evolucion favorable, cumpliendo criterios de alta. Alta con diagnostico de hernia inguinal resuelto (K40.9), indicandose Omeprazol 20mg VO c/24h (A02BC01) y Hierro 100mg VO c/24h (B03AA07)."}
{"input": {"dx": ["IAMCEST inferolateral (I21.1)"], "proc": ["Coronariografia (K492)", "Angioplastia CX (K493)"], "tto": ["Prasugrel 60mg carga (B01AC22)", "Clopidogrel 600mg carga (B01AC04)"], "evo": "Estenosis aortica severa sintomatica, programada para TAVI", "dx_alta": ["IAMCEST inferolateral tratado (I21.1)"], "med": ["Furosemida 40mg VO c/24h (C03CA01)", "Prasugrel 10mg VO c/24h 12m (B01AC22)", "Nitroglicerina SL PRN (C01DA02)", "Atorvastatina 40mg VO c/noche (C10AA05)"]}, "output": "Ingreso por iamcest inferolateral (I21.1). Se realiza coronariografia (K492) evidenciando oclusion aguda, realizandose angioplastia cx (K493) con implante de stent farmacoactivo y flujo TIMI 3 final. Presenta, estenosis aortica severa sintomatica, programada para tavi. Recibio tratamiento con Prasugrel 60mg carga (B01AC22) y Clopidogrel 600mg carga (B01AC04). Presenta evolucion favorable, cumpliendo criterios de alta. Alta con diagnostico de iamcest inferolateral tratado (I21.1), indicandose Furosemida 40mg VO c/24h (C03CA01), Prasugrel 10mg VO c/24h 12m (B01AC22), Nitroglicerina SL PRN (C01DA02) y Atorvastatina 40mg VO c/noche (C10AA05)."}
{"input": {"dx": ["Hipertension arterial severa (I10)"], "proc": ["Paracentesis (54.91)", "TAC de abdomen (88.01)"], "tto": ["Ceftriaxona 2g EV c/24h (J01DD04)", "Tramadol 50mg EV c/8h (N02AX02)"], "evo": "Sin complicaciones postoperatorias, herida operatoria limpia", "dx_alta": ["Hipertension arterial severa resuelto (I10)"], "med": ["Insulina NPH 10UI SC c/12h (A10AC01)", "Budesonide/Formoterol INH c/12h (R03AK07)", "Glibenclamida 5mg VO c/24h (A10BB01)"]}, "output": "Paciente que ingresa con cuadro de hipertension arterial severa (I10). Se realiza paracentesis (54.91), tac de abdomen (88.01). Presenta, sin complicaciones postoperatorias, herida operatoria limpia. Recibio tratamiento con Ceftriaxona 2g EV c/24h (J01DD04) y Tramadol 50mg EV c/8h (N02AX02). Evolucion satisfactoria, cumpliendo criterios de alta. Alta con diagnostico de hipertension arterial severa resuelto (I10), indicandose Insulina NPH 10UI SC c/12h (A10AC01), Budesonide/Formoterol INH c/12h (R03AK07) y Glibenclamida 5mg VO c/24h (A10BB01)."}
{"input": {"dx": ["IAMCEST lateral (I21.2)"], "proc": ["Coronariografia (K492)"], "tto": ["Enalapril 5mg VO (C09AA02)", "Enoxaparina 1mg/kg SC c/12h (B01AB05)"], "evo": "Fibrilacion auricular de alta respuesta, cardioversion farmacologica exitosa", "dx_alta": ["IAMCEST lateral tratado (I21.2)"], "med": ["Nitroglicerina SL PRN (C01DA02)", "Rosuvastatina 20mg VO c/noche (C10AA07)", "Rivaroxaban 20mg VO c/24h (B01AF01)", "Apixaban 5mg VO c/12h (B01AF02)"]}, "output": "Se hospitaliza por iamcest lateral (I21.2). Se realiza coronariografia (K492). Durante la hospitalizacion, fibrilacion auricular de alta respuesta, cardioversion farmacologica exitosa. Recibio tratamiento con Enalapril 5mg VO (C09AA02) y Enoxaparina 1mg/kg SC c/12h (B01AB05). Buena evolucion, cumpliendo criterios de alta. Alta con diagnostico de iamcest lateral tratado (I21.2), indicandose Nitroglicerina SL PRN (C01DA02), Rosuvastatina 20mg VO c/noche (C10AA07), Rivaroxaban 20mg VO c/24h (B01AF01) y Apixaban 5mg VO c/12h (B01AF02)."}
{"input": {"dx": ["IAMCEST anteroseptal (I21.0)"], "proc": ["Coronariografia (K492)"], "tto": ["Dobutamina EV (C01CA07)", "Heparina EV infusion (B01AB01)", "Levosimendan EV (C01CX08)"], "evo": "Edema pulmonar agudo por disfuncion sistolica, respuesta favorable a diureticos", "dx_alta": ["IAMCEST anteroseptal tratado (I21.0)"], "med": ["Isosorbide 20mg VO c/8h (C01DA08)", "Nitroglicerina SL PRN (C01DA02)", "Carvedilol 6.25mg VO c/12h (C07AG02)", "Ticagrelor 90mg VO c/12h 12m (B01AC24)"]}, "output": "Se hospitaliza por iamcest anteroseptal (I21.0). Se realiza coronariografia (K492). En su evolucion, edema pulmonar agudo por disfuncion sistolica, respuesta favorable a diureticos. Recibio tratamiento con Dobutamina EV (C01CA07), Heparina EV infusion (B01AB01) y Levosimendan EV (C01CX08). Evolucion clinica favorable, cumpliendo criterios de alta. Alta con diagnostico de iamcest anteroseptal tratado (I21.0), indicandose Isosorbide 20mg VO c/8h (C01DA08), Nitroglicerina SL PRN (C01DA02), Carvedilol 6.25mg VO c/12h (C07AG02) y Ticagrelor 90mg VO c/12h 12m (B01AC24)."}
{"input": {"dx": ["Trombosis de stent (I21.0)"], "proc": ["Angioplastia TCI (89.64)"], "tto": ["Atorvastatina 80mg (C10AA05)", "Furosemida 40mg EV (C03CA01)", "Enoxaparina 60mg SC c/12h (B01AB05)", "Morfina 3mg EV (N02AA01)"], "evo": "SDST en II, III, aVF, coronarias sin lesiones obstructivas, sindrome de Tako-Tsubo", "dx_alta": ["Trombosis de stent tratado (I21.0)"], "med": ["Carvedilol 6.25mg VO c/12h (C07AG02)", "Enalapril 10mg VO c/12h (C09AA02)", "Warfarina segun INR (B01AA03)", "Amlodipino 5mg VO c/24h (C08CA01)"]}, "output": "Ingreso por trombosis de stent (I21.0). Se realiza angioplastia tci (89.64). Durante la hospitalizacion, sdst en ii, iii, avf, coronarias sin lesiones obstructivas, sindrome de tako-tsubo. Recibio tratamiento con Atorvastatina 80mg (C10AA05), Furosemida 40mg EV (C03CA01), Enoxaparina 60mg SC c/12h (B01AB05) y Morfina 3mg EV (N02AA01). Presenta evolucion favorable, cumpliendo criterios de alta. Alta con diagnostico de trombosis de stent tratado (I21.0), indicandose Carvedilol 6.25mg VO c/12h (C07AG02), Enalapril 10mg VO c/12h (C09AA02), Warfarina segun INR (B01AA03) y Amlodipino 5mg VO c/24h (C08CA01)."}
{"input": {"dx": ["Enfermedad de TCI (I25.1)"], "proc": ["Holter ECG (89.50)"], "tto": ["Digoxina 0.25mg EV (C01AA05)", "Nitroglicerina EV (C01DA02)"], "evo": "Fibrilacion auricular de alta respuesta, cardioversion farmacologica exitosa", "dx_alta": ["Enfermedad de TCI tratado (I25.1)"], "med": ["Nitroglicerina SL PRN (C01DA02)", "Enalapril 10mg VO c/12h (C09AA02)", "Aspirina 100mg VO c/24h (B01AC06)", "Amlodipino 5mg VO c/24h (C08CA01)"]}, "output": "Se hospitaliza por enfermedad de tci (I25.1). Se realiza holter ecg (89.50). Evoluciona con, fibrilacion auricular de alta respuesta, cardioversion farmacologica exitosa. Recibio tratamiento con Digoxina 0.25mg EV (C01AA05) y Nitroglicerina EV (C01DA02). Evolucion satisfactoria, cumpliendo criterios de alta. Alta con diagnostico de enfermedad de tci tratado (I25.1), indicandose Nitroglicerina SL PRN (C01DA02), Enalapril 10mg VO c/12h (C09AA02), Aspirina 100mg VO c/24h (B01AC06) y Amlodipino 5mg VO c/24h (C08CA01)."}
{"input": {"dx": ["IAMCEST anterolateral (I21.0)"], "proc": ["Coronariografia (K492)", "Angioplastia DA (K493)"], "tto": ["Atorvastatina 80mg (C10AA05)", "Heparina 5000UI EV (B01AB01)"], "evo": "Shock cardiogenico, requirio soporte con inotropicos, evolucion favorable", "dx_alta": ["IAMCEST anterolateral tratado (I21.0)"], "med": ["Warfarina segun INR (B01AA03)", "Metoprolol 50mg VO c/12h (C07AB02)", "Prasugrel 10mg VO c/24h 12m (B01AC22)", "Digoxina 0.125mg VO c/24h (C01AA05)", "Isosorbide 20mg VO c/8h (C01DA08)"]}, "output": "Ingresa por iamcest anterolateral (I21.0). Se realiza coronariografia (K492) evidenciando oclusion aguda, realizandose angioplastia da (K493) con implante de stent farmacoactivo y flujo TIMI 3 final. Durante la hospitalizacion, shock cardiogenico, requirio soporte con inotropicos, evolucion favorable. Recibio tratamiento con Atorvastatina 80mg (C10AA05) y Heparina 5000UI EV (B01AB01). Evolucion satisfactoria, cumpliendo criterios de alta. Alta con diagnostico de iamcest anterolateral tratado (I21.0), indicandose Warfarina segun INR (B01AA03), Metoprolol 50mg VO c/12h (C07AB02), Prasugrel 10mg VO c/24h 12m (B01AC22), Digoxina 0.125mg VO c/24h (C01AA05) y Isosorbide 20mg VO c/8h (C01DA08)."}
{"input": {"dx": ["Flutter auricular (I48.0)"], "proc": ["Ecografia abdominal (88.76)"], "tto": ["Metamizol 1g EV c/8h (N02BB02)", "Ceftriaxona 2g EV c/24h (J01DD04)"], "evo": "Mejora clnica sostenida, cumple criterios de alta", "dx_alta": ["Flutter auricular resuelto (I48.0)"], "med": ["Insulina NPH 10UI SC c/12h (A10AC01)", "Levotiroxina 50mcg VO c/24h (H03AA01)"]}, "output": "Ingreso por flutter auricular (I48.0). Se realiza ecografia abdominal (88.76). Evoluciona con, mejora clnica sostenida, cumple criterios de alta. Recibio tratamiento con Metamizol 1g EV c/8h (N02BB02) y Ceftriaxona 2g EV c/24h (J01DD04). Evolucion satisfactoria, cumpliendo criterios de alta. Alta con diagnostico de flutter auricular resuelto (I48.0), indicandose Insulina NPH 10UI SC c/12h (A10AC01) y Levotiroxina 50mcg VO c/24h (H03AA01)."}
{"input": {"dx": ["Enfermedad coronaria de 3 vasos (I25.1)"], "proc": ["Coronariografia (K492)", "Angioplastia TCI (K493)"], "tto": ["Heparina 5000UI EV (B01AB01)", "Levosimendan EV (C01CX08)", "Dobutamina EV (C01CA07)", "Enoxaparina 60mg SC c/12h (B01AB05)"], "evo": "Estenosis aortica severa sintomatica, programada para TAVI", "dx_alta": ["Enfermedad coronaria de 3 vasos tratado (I25.1)"], "med": ["Ticagrelor 90mg VO c/12h 12m (B01AC24)", "Carvedilol 6.25mg VO c/12h (C07AG02)", "Amlodipino 5mg VO c/24h (C08CA01)"]}, "output": "Ingresa por enfermedad coronaria de 3 vasos (I25.1). Se realiza coronariografia (K492) visualizando estenosis severa, realizandose angioplastia tci (K493) con implante de stent farmacoactivo y flujo TIMI 3 final. Presenta, estenosis aortica severa sintomatica, programada para tavi. Recibio tratamiento con Heparina 5000UI EV (B01AB01), Levosimendan EV (C01CX08), Dobutamina EV (C01CA07) y Enoxaparina 60mg SC c/12h (B01AB05). Presenta evolucion favorable, cumpliendo criterios de alta. Alta con diagnostico de enfermedad coronaria de 3 vasos tratado (I25.1), indicandose Ticagrelor 90mg VO c/12h 12m (B01AC24), Carvedilol 6.25mg VO c/12h (C07AG02) y Amlodipino 5mg VO c/24h (C08CA01)."}
{"input": {"dx": ["Enfermedad de TCI (I25.1)"], "proc": ["Implante de DAI (37.94)"], "tto": ["Heparina 5000UI EV (B01AB01)", "Metoprolol 5mg EV (C07AB02)", "Aspirina 100mg (B01AC06)", "Atorvastatina 80mg (C10AA05)"], "evo": "SDST en I, aVL, coronarias sin lesiones obstructivas, sindrome de Tako-Tsubo", "dx_alta": ["Enfermedad de TCI tratado (I25.1)"], "med": ["Enalapril 10mg VO c/12h (C09AA02)", "Rivaroxaban 20mg VO c/24h (B01AF01)", "Digoxina 0.125mg VO c/24h (C01AA05)", "Carvedilol 6.25mg VO c/12h (C07AG02)", "Aspirina 100mg VO c/24h (B01AC06)"]}, "output": "Paciente que ingresa con cuadro de enfermedad de tci (I25.1). Se realiza implante de dai (37.94). Durante la hospitalizacion, sdst en i, avl, coronarias sin lesiones obstructivas, sindrome de tako-tsubo. Recibio tratamiento con Heparina 5000UI EV (B01AB01), Metoprolol 5mg EV (C07AB02), Aspirina 100mg (B01AC06) y Atorvastatina 80mg (C10AA05). Presenta evolucion favorable, cumpliendo criterios de alta. Alta con diagnostico de enfermedad de tci tratado (I25.1), indicandose Enalapril 10mg VO c/12h (C09AA02), Rivaroxaban 20mg VO c/24h (B01AF01), Digoxina 0.125mg VO c/24h (C01AA05), Carvedilol 6.25mg VO c/12h (C07AG02) y Aspirina 100mg VO c/24h (B01AC06)."}
{"input": {"dx": ["Shock cardiogenico (R57.0)"], "proc": ["Implante de DAI (K493)"], "tto": ["Clopidogrel 600mg carga (B01AC04)", "Morfina 3mg EV (N02AA01)", "Furosemida 80mg EV (C03CA01)"], "evo": "Shock cardiogenico, requirio soporte con inotropicos, evolucion favorable", "dx_alta": ["Shock cardiogenico tratado (R57.0)"], "med": ["Apixaban 5mg VO c/12h (B01AF02)", "Atorvastatina 40mg VO c/noche (C10AA05)", "Rosuvastatina 20mg VO c/noche (C10AA07)"]}, "output": "Paciente que ingresa con cuadro de shock cardiogenico (R57.0). Se realiza implante de dai (K493). Durante la hospitalizacion, shock cardiogenico, requirio soporte con inotropicos, evolucion favorable. Recibio tratamiento con Clopidogrel 600mg carga (B01AC04), Morfina 3mg EV (N02AA01) y Furosemida 80mg EV (C03CA01). Evolucion clinica favorable, cumpliendo criterios de alta. Alta con diagnostico de shock cardiogenico tratado (R57.0), indicandose Apixaban 5mg VO c/12h (B01AF02), Atorvastatina 40mg VO c/noche (C10AA05) y Rosuvastatina 20mg VO c/noche (C10AA07)."}
{"input": {"dx": ["Edema pulmonar agudo (J81)"], "proc": ["Angioplastia (37.0)"], "tto": ["Atorvastatina 80mg (C10AA05)", "Enoxaparina 60mg SC c/12h (B01AB05)", "Prasugrel 60mg carga (B01AC22)", "Digoxina 0.25mg EV (C01AA05)"], "evo": "Lesion severa de CD media, angioplastia con implante de stent sin complicaciones", "dx_alta": ["Edema pulmonar agudo tratado (J81)"], "med": ["Isosorbide 20mg VO c/8h (C01DA08)", "Espironolactona 25mg VO c/24h (C03DA01)", "Losartan 50mg VO c/24h (C09CA01)"]}, "output": "Se hospitaliza por edema pulmonar agudo (J81). Se realiza angioplastia (37.0). En su evolucion, lesion severa de cd media, angioplastia con implante de stent sin complicaciones. Recibio tratamiento con Atorvastatina 80mg (C10AA05), Enoxaparina 60mg SC c/12h (B01AB05), Prasugrel 60mg carga (B01AC22) y Digoxina 0.25mg EV (C01AA05). Evolucion clinica favorable, cumpliendo criterios de alta. Alta con diagnostico de edema pulmonar agudo tratado (J81), indicandose Isosorbide 20mg VO c/8h (C01DA08), Espironolactona 25mg VO c/24h (C03DA01) y Losartan 50mg VO c/24h (C09CA01)."}
{"input": {"dx": ["Shock cardiogenico (R57.0)"], "proc": ["Angioplastia DA (88.72)"], "tto": ["Metoprolol 5mg EV (C07AB02)", "Amiodarona 300mg EV (C01BD01)", "Nitroglicerina EV (C01DA02)"], "evo": "Edema pulmonar agudo por disfuncion sistolica, respuesta favorable a diureticos", "dx_alta": ["Shock cardiogenico tratado (R57.0)"], "med": ["Isosorbide 20mg VO c/8h (C01DA08)", "Rivaroxaban 20mg VO c/24h (B01AF01)", "Carvedilol 6.25mg VO c/12h (C07AG02)", "Losartan 50mg VO c/24h (C09CA01)", "Metoprolol 50mg VO c/12h (C07AB02)"]}, "output": "Paciente que ingresa con cuadro de shock cardiogenico (R57.0). Se realiza angioplastia da (88.72). Durante la hospitalizacion, edema pulmonar agudo por disfuncion sistolica, respuesta favorable a diureticos. Recibio tratamiento con Metoprolol 5mg EV (C07AB02), Amiodarona 300mg EV (C01BD01) y Nitroglicerina EV (C01DA02). Buena evolucion, cumpliendo criterios de alta. Alta con diagnostico de shock cardiogenico tratado (R57.0), indicandose Isosorbide 20mg VO c/8h (C01DA08), Rivaroxaban 20mg VO c/24h (B01AF01), Carvedilol 6.25mg VO c/12h (C07AG02), Losartan 50mg VO c/24h (C09CA01) y Metoprolol 50mg VO c/12h (C07AB02)."}
{"input": {"dx": ["IAMSEST (I21.4)"], "proc": ["Coronariografia (K492)", "Angioplastia TCI (36.06)"], "tto": ["Aspirina 300mg carga (B01AC06)", "Digoxina 0.25mg EV (C01AA05)", "Nitroglicerina EV (C01DA02)"], "evo": "Bloqueo AV completo sintomatico, requirio marcapasos transitorio", "dx_alta": ["IAMSEST tratado (I21.4)"], "med": ["Enalapril 10mg VO c/12h (C09AA02)", "Espironolactona 25mg VO c/24h (C03DA01)", "Nitroglicerina SL PRN (C01DA02)", "Prasugrel 10mg VO c/24h 12m (B01AC22)"]}, "output": "Paciente que ingresa con cuadro de iamsest (I21.4). Se realiza coronariografia (K492) encontrando lesion critica, realizandose angioplastia tci (36.06) con implante de stent farmacoactivo y flujo TIMI 3 final. Presenta, bloqueo av completo sintomatico, requirio marcapasos transitorio. Recibio tratamiento con Aspirina 300mg carga (B01AC06), Digoxina 0.25mg EV (C01AA05) y Nitroglicerina EV (C01DA02). Evolucion clinica favorable, cumpliendo criterios de alta. Alta con diagnostico de iamsest tratado (I21.4), indicandose Enalapril 10mg VO c/12h (C09AA02), Espironolactona 25mg VO c/24h (C03DA01), Nitroglicerina SL PRN (C01DA02) y Prasugrel 10mg VO c/24h 12m (B01AC22)."}
{"input": {"dx": ["Miocarditis (I40.9)"], "proc": ["Ecografia abdominal (88.76)", "Osteosintesis de cadera (79.35)"], "tto": ["Insulina cristalina segun esquema (A10AB01)", "Omeprazol 40mg EV c/12h (A02BC01)"], "evo": "Sin complicaciones postoperatorias, herida operatoria limpia", "dx_alta": ["Miocarditis resuelto (I40.9)"], "med": ["Hierro 100mg VO c/24h (B03AA07)", "Glibenclamida 5mg VO c/24h (A10BB01)", "Paracetamol 500mg VO c/8h PRN (N02BE01)", "Levotiroxina 50mcg VO c/24h (H03AA01)"]}, "output": "Se hospitaliza por miocarditis (I40.9). Se realiza ecografia abdominal (88.76), osteosintesis de cadera (79.35). Evoluciona con, sin complicaciones postoperatorias, herida operatoria limpia. Recibio tratamiento con Insulina cristalina segun esquema (A10AB01) y Omeprazol 40mg EV c/12h (A02BC01). Evolucion clinica favorable, cumpliendo criterios de alta. Alta con diagnostico de miocarditis resuelto (I40.9), indicandose Hierro 100mg VO c/24h (B03AA07), Glibenclamida 5mg VO c/24h (A10BB01), Paracetamol 500mg VO c/8h PRN (N02BE01) y Levotiroxina 50mcg VO c/24h (H03AA01)."}
{"input": {"dx": ["IAMSEST (I21.4)"], "proc": ["Coronariografia (K492)", "Angioplastia OM (36.06)"], "tto": ["Amiodarona 300mg EV (C01BD01)", "Enalapril 5mg VO (C09AA02)"], "evo": "Taquicardia ventricular sostenida, cardioversion electrica exitosa", "dx_alta": ["IAMSEST tratado (I21.4)"], "med": ["Amlodipino 5mg VO c/24h (C08CA01)", "Aspirina 100mg VO c/24h (B01AC06)", "Atorvastatina 40mg VO c/noche (C10AA05)", "Apixaban 5mg VO c/12h (B01AF02)"]}, "output": "Paciente que ingresa con cuadro de iamsest (I21.4). Se realiza coronariografia (K492) con hallazgo de lesion significativa, realizandose angioplastia om (36.06) con implante de stent farmacoactivo y flujo TIMI 3 final. En su evolucion, taquicardia ventricular sostenida, cardioversion electrica exitosa. Recibio tratamiento con Amiodarona 300mg EV (C01BD01) y Enalapril 5mg VO (C09AA02). Evolucion clinica favorable, cumpliendo criterios de alta. Alta con diagnostico de iamsest tratado (I21.4), indicandose Amlodipino 5mg VO c/24h (C08CA01), Aspirina 100mg VO c/24h (B01AC06), Atorvastatina 40mg VO c/noche (C10AA05) y Apixaban 5mg VO c/12h (B01AF02)."}
{"input": {"dx": ["Edema pulmonar agudo (J81)"], "proc": ["Angioplastia CX (35.04)"], "tto": ["Heparina EV infusion (B01AB01)", "Clopidogrel 300mg carga (B01AC04)", "Metoprolol 5mg EV (C07AB02)"], "evo": "SDST en II, III, aVF, coronarias sin lesiones obstructivas, sindrome de Tako-Tsubo", "dx_alta": ["Edema pulmonar agudo tratado (J81)"], "med": ["Atorvastatina 40mg VO c/noche (C10AA05)", "Clopidogrel 75mg VO c/24h 12m (B01AC04)", "Warfarina segun INR (B01AA03)", "Amlodipino 5mg VO c/24h (C08CA01)"]}, "output": "Se hospitaliza por edema pulmonar agudo (J81). Se realiza angioplastia cx (35.04). Evoluciona con, sdst en ii, iii, avf, coronarias sin lesiones obstructivas, sindrome de tako-tsubo. Recibio tratamiento con Heparina EV infusion (B01AB01), Clopidogrel 300mg carga (B01AC04) y Metoprolol 5mg EV (C07AB02). Evolucion satisfactoria, cumpliendo criterios de alta. Alta con diagnostico de edema pulmonar agudo tratado (J81), indicandose Atorvastatina 40mg VO c/noche (C10AA05), Clopidogrel 75mg VO c/24h 12m (B01AC04), Warfarina segun INR (B01AA03) y Amlodipino 5mg VO c/24h (C08CA01)."}
{"input": {"dx": ["Celulitis (L03.9)"], "proc": ["TAC de abdomen (88.01)"], "tto": ["Piperacilina/Tazobactam 4.5g EV c/8h (J01CR05)", "Ondansetron 8mg EV c/8h (A04AA01)", "Insulina cristalina segun esquema (A10AB01)", "Ceftriaxona 2g EV c/24h (J01DD04)"], "evo": "Cirugia programada sin complicaciones, alta precoz", "dx_alta": ["Celulitis resuelto (L03.9)"], "med": ["Sertralina 50mg VO c/24h (N06AB06)", "Metformina 850mg VO c/12h (A10BA02)", "Hierro 100mg VO c/24h (B03AA07)", "Salbutamol INH 2 puff c/6h PRN (R03AC02)"]}, "output": "Ingreso por celulitis (L03.9). Se realiza tac de abdomen (88.01). Presenta, cirugia programada sin complicaciones, alta precoz. Recibio tratamiento con Piperacilina/Tazobactam 4.5g EV c/8h (J01CR05), Ondansetron 8mg EV c/8h (A04AA01), Insulina cristalina segun esquema (A10AB01) y Ceftriaxona 2g EV c/24h (J01DD04). Presenta evolucion favorable, cumpliendo criterios de alta. Alta con diagnostico de celulitis resuelto (L03.9), indicandose Sertralina 50mg VO c/24h (N06AB06), Metformina 850mg VO c/12h (A10BA02), Hierro 100mg VO c/24h (B03AA07) y Salbutamol INH 2 puff c/6h PRN (R03AC02)."}
{"input": {"dx": ["Enfermedad coronaria de 2 vasos (I25.1)"], "proc": ["Coronariografia (K492)", "Angioplastia CD (36.06)"], "tto": ["Morfina 3mg EV (N02AA01)", "Metoprolol 5mg EV (C07AB02)", "Dobutamina EV (C01CA07)"], "evo": "Oclusion aguda de OM1, angioplastia exitosa con stent farmacoactivo, flujo TIMI 3 final", "dx_alta": ["Enfermedad coronaria de 2 vasos tratado (I25.1)"], "med": ["Apixaban 5mg VO c/12h (B01AF02)", "Atorvastatina 40mg VO c/noche (C10AA05)", "Ticagrelor 90mg VO c/12h 12m (B01AC24)", "Amlodipino 5mg VO c/24h (C08CA01)"]}, "output": "Se hospitaliza por enfermedad coronaria de 2 vasos (I25.1). Se realiza coronariografia (K492) evidenciando oclusion aguda, realizandose angioplastia cd (36.06) con implante de stent farmacoactivo y flujo TIMI 3 final. En su evolucion, oclusion aguda de om1, angioplastia exitosa con stent farmacoactivo, flujo timi 3 final. Recibio tratamiento con Morfina 3mg EV (N02AA01), Metoprolol 5mg EV (C07AB02) y Dobutamina EV (C01CA07). Evolucion clinica favorable, cumpliendo criterios de alta. Alta con diagnostico de enfermedad coronaria de 2 vasos tratado (I25.1), indicandose Apixaban 5mg VO c/12h (B01AF02), Atorvastatina 40mg VO c/noche (C10AA05), Ticagrelor 90mg VO c/12h 12m (B01AC24) y Amlodipino 5mg VO c/24h (C08CA01)."}
{"input": {"dx": ["Shock cardiogenico (R57.0)"], "proc": ["Angioplastia CD (89.50)"], "tto": ["Nitroglicerina EV (C01DA02)", "Enoxaparina 1mg/kg SC c/12h (B01AB05)", "Metoprolol 5mg EV (C07AB02)"], "evo": "Shock cardiogenico, requirio soporte con inotropicos, evolucion favorable", "dx_alta": ["Shock cardiogenico tratado (R57.0)"], "med": ["Isosorbide 20mg VO c/8h (C01DA08)", "Apixaban 5mg VO c/12h (B01AF02)", "Metoprolol 50mg VO c/12h (C07AB02)"]}, "output": "Ingresa por shock cardiogenico (R57.0). Se realiza angioplastia cd (89.50). En su evolucion, shock cardiogenico, requirio soporte con inotropicos, evolucion favorable. Recibio tratamiento con Nitroglicerina EV (C01DA02), Enoxaparina 1mg/kg SC c/12h (B01AB05) y Metoprolol 5mg EV (C07AB02). Presenta evolucion favorable, cumpliendo criterios de alta. Alta con diagnostico de shock cardiogenico tratado (R57.0), indicandose Isosorbide 20mg VO c/8h (C01DA08), Apixaban 5mg VO c/12h (B01AF02) y Metoprolol 50mg VO c/12h (C07AB02)."}
{"input": {"dx": ["Edema pulmonar agudo (J81)"], "proc": ["Angioplastia TCI (K493)"], "tto": ["Enalapril 5mg VO (C09AA02)", "Heparina EV infusion (B01AB01)", "Noradrenalina EV (C01CA03)", "Aspirina 300mg carga (B01AC06)"], "evo": "Oclusion aguda de DA distal, angioplastia exitosa con stent farmacoactivo, flujo TIMI 3 final", "dx_alta": ["Edema pulmonar agudo tratado (J81)"], "med": ["Amlodipino 5mg VO c/24h (C08CA01)", "Bisoprolol 5mg VO c/24h (C07AB07)", "Aspirina 100mg VO c/24h (B01AC06)"]}, "output": "Se hospitaliza por edema pulmonar agudo (J81). Se realiza angioplastia tci (K493). Durante la hospitalizacion, oclusion aguda de da distal, angioplastia exitosa con stent farmacoactivo, flujo timi 3 final. Recibio tratamiento con Enalapril 5mg VO (C09AA02), Heparina EV infusion (B01AB01), Noradrenalina EV (C01CA03) y Aspirina 300mg carga (B01AC06). Evolucion clinica favorable, cumpliendo criterios de alta. Alta con diagnostico de edema pulmonar agudo tratado (J81), indicandose Amlodipino 5mg VO c/24h (C08CA01), Bisoprolol 5mg VO c/24h (C07AB07) y Aspirina 100mg VO c/24h (B01AC06)."}
{"input": {"dx": ["Reestenosis intra-stent (I25.5)"], "proc": ["Valvuloplastia mitral (K493)"], "tto": ["Furosemida 80mg EV (C03CA01)", "Dobutamina EV (C01CA07)"], "evo": "Oclusion de OM2 con trombo, trombectomia por aspiracion mas stent", "dx_alta": ["Reestenosis intra-stent tratado (I25.5)"], "med": ["Amlodipino 5mg VO c/24h (C08CA01)", "Rosuvastatina 20mg VO c/noche (C10AA07)", "Apixaban 5mg VO c/12h (B01AF02)", "Losartan 50mg VO c/24h (C09CA01)", "Furosemida 40mg VO c/24h (C03CA01)"]}, "output": "Ingresa por reestenosis intra-stent (I25.5). Se realiza valvuloplastia mitral (K493). En su evolucion, oclusion de om2 con trombo, trombectomia por aspiracion mas stent. Recibio tratamiento con Furosemida 80mg EV (C03CA01) y Dobutamina EV (C01CA07). Evolucion satisfactoria, cumpliendo criterios de alta. Alta con diagnostico de reestenosis intra-stent tratado (I25.5), indicandose Amlodipino 5mg VO c/24h (C08CA01), Rosuvastatina 20mg VO c/noche (C10AA07), Apixaban 5mg VO c/12h (B01AF02), Losartan 50mg VO c/24h (C09CA01) y Furosemida 40mg VO c/24h (C03CA01)."}
{"input": {"dx": ["IAMCEST posterior (I21.2)"], "proc": ["Coronariografia (K492)"], "tto": ["Enalapril 5mg VO (C09AA02)", "Digoxina 0.25mg EV (C01AA05)", "Furosemida 80mg EV (C03CA01)", "Aspirina 300mg carga (B01AC06)"], "evo": "Edema pulmonar agudo por disfuncion sistolica, respuesta favorable a diureticos", "dx_alta": ["IAMCEST posterior tratado (I21.2)"], "med": ["Digoxina 0.125mg VO c/24h (C01AA05)", "Clopidogrel 75mg VO c/24h 12m (B01AC04)", "Nitroglicerina SL PRN (C01DA02)", "Amlodipino 5mg VO c/24h (C08CA01)"]}, "output": "Ingresa por iamcest posterior (I21.2). Se realiza coronariografia (K492). Durante la hospitalizacion, edema pulmonar agudo por disfuncion sistolica, respuesta favorable a diureticos. Recibio tratamiento con Enalapril 5mg VO (C09AA02), Digoxina 0.25mg EV (C01AA05), Furosemida 80mg EV (C03CA01) y Aspirina 300mg carga (B01AC06). Evolucion satisfactoria, cumpliendo criterios de alta. Alta con diagnostico de iamcest posterior tratado (I21.2), indicandose Digoxina 0.125mg VO c/24h (C01AA05), Clopidogrel 75mg VO c/24h 12m (B01AC04), Nitroglicerina SL PRN (C01DA02) y Amlodipino 5mg VO c/24h (C08CA01)."}
{"input": {"dx": ["Shock cardiogenico (R57.0)"], "proc": ["Coronariografia (89.64)"], "tto": ["Furosemida 80mg EV (C03CA01)", "Morfina 3mg EV (N02AA01)", "Heparina EV infusion (B01AB01)", "Enalapril 5mg VO (C09AA02)"], "evo": "Fibrilacion auricular de alta respuesta, cardioversion farmacologica exitosa", "dx_alta": ["Shock cardiogenico tratado (R57.0)"], "med": ["Carvedilol 6.25mg VO c/12h (C07AG02)", "Isosorbide 20mg VO c/8h (C01DA08)", "Prasugrel 10mg VO c/24h 12m (B01AC22)", "Metoprolol 50mg VO c/12h (C07AB02)"]}, "output": "Paciente que ingresa con cuadro de shock cardiogenico (R57.0). Se realiza coronariografia (89.64). Presenta, fibrilacion auricular de alta respuesta, cardioversion farmacologica exitosa. Recibio tratamiento con Furosemida 80mg EV (C03CA01), Morfina 3mg EV (N02AA01), Heparina EV infusion (B01AB01) y Enalapril 5mg VO (C09AA02). Evolucion satisfactoria, cumpliendo criterios de alta. Alta con diagnostico de shock cardiogenico tratado (R57.0), indicandose Carvedilol 6.25mg VO c/12h (C07AG02), Isosorbide 20mg VO c/8h (C01DA08), Prasugrel 10mg VO c/24h 12m (B01AC22) y Metoprolol 50mg VO c/12h (C07AB02)."}
{"input": {"dx": ["Sepsis (A41.9)"], "proc": ["Toracocentesis (34.91)"], "tto": ["Hidrocortisona 100mg EV c/8h (H02AB09)", "Ciprofloxacino 400mg EV c/12h (J01MA02)", "Ceftriaxona 2g EV c/24h (J01DD04)", "Tramadol 50mg EV c/8h (N02AX02)"], "evo": "Evolucion favorable con tratamiento medico, sin complicaciones", "dx_alta": ["Sepsis resuelto (A41.9)"], "med": ["Omeprazol 20mg VO c/24h (A02BC01)", "Clonazepam 0.5mg VO c/noche (N03AE01)", "Amoxicilina/Clavulanico 875mg VO c/12h 7d (J01CR02)", "Levotiroxina 50mcg VO c/24h (H03AA01)"]}, "output": "Ingresa por sepsis (A41.9). Se realiza toracocentesis (34.91). Evoluciona con, evolucion favorable con tratamiento medico, sin complicaciones. Recibio tratamiento con Hidrocortisona 100mg EV c/8h (H02AB09), Ciprofloxacino 400mg EV c/12h (J01MA02), Ceftriaxona 2g EV c/24h (J01DD04) y Tramadol 50mg EV c/8h (N02AX02). Evolucion clinica favorable, cumpliendo criterios de alta. Alta con diagnostico de sepsis resuelto (A41.9), indicandose Omeprazol 20mg VO c/24h (A02BC01), Clonazepam 0.5mg VO c/noche (N03AE01), Amoxicilina/Clavulanico 875mg VO c/12h 7d (J01CR02) y Levotiroxina 50mcg VO c/24h (H03AA01)."}
