{"input": {"dx": ["Angina inestable alto riesgo (I20.0)"], "proc": ["Coronariografia (K492)", "Angioplastia DA (K493)"], "tto": ["Levosimendan EV (C01CX08)", "Noradrenalina EV (C01CA03)", "Ticagrelor 180mg carga (B01AC24)"], "evo": "Enfermedad de multiples vasos, se deriva a cirugia cardiaca para bypass", "dx_alta": ["Angina inestable alto riesgo tratado (I20.0)"], "med": ["Carvedilol 6.25mg VO c/12h (C07AG02)", "Rosuvastatina 20mg VO c/noche (C10AA07)", "Bisoprolol 5mg VO c/24h (C07AB07)", "Warfarina segun INR (B01AA03)", "Metoprolol 50mg VO c/12h (C07AB02)"]}, "output": "Ingreso por angina inestable alto riesgo (I20.0). Se realiza coronariografia (K492) evidenciando oclusion aguda, realizandose angioplastia da (K493) con implante de stent farmacoactivo y flujo TIMI 3 final. Presenta, enfermedad de multiples vasos, se deriva a cirugia cardiaca para bypass. Recibio tratamiento con Levosimendan EV (C01CX08), Noradrenalina EV (C01CA03) y Ticagrelor 180mg carga (B01AC24). Evolucion satisfactoria, cumpliendo criterios de alta. Alta con diagnostico de angina inestable alto riesgo tratado (I20.0), indicandose Carvedilol 6.25mg VO c/12h (C07AG02), Rosuvastatina 20mg VO c/noche (C10AA07), Bisoprolol 5mg VO c/24h (C07AB07), Warfarina segun INR (B01AA03) y Metoprolol 50mg VO c/12h (C07AB02)."}
{"input": {"dx": ["Angina inestable (I20.0)"], "proc": ["Coronariografia (K492)", "Angioplastia TCI (K493)"], "tto": ["Enoxaparina 1mg/kg SC c/12h (B01AB05)", "Clopidogrel 300mg carga (B01AC04)", "Amiodarona 300mg EV (C01BD01)", "Aspirina 100mg (B01AC06)"], "evo": "Lesion severa de CD proximal, angioplastia con implante de stent sin complicaciones", "dx_alta": ["Angina inestable tratado (I20.0)"], "med": ["Losartan 50mg VO c/24h (C09CA01)", "Nitroglicerina SL PRN (C01DA02)", "Clopidogrel 75mg VO c/24h 12m (B01AC04)", "Apixaban 5mg VO c/12h (B01AF02)"]}, "output": "Ingreso por angina inestable (I20.0). Se realiza coronariografia (K492) encontrando lesion critica, realizandose angioplastia tci (K493) con implante de stent farmacoactivo y flujo TIMI 3 final. Durante la hospitalizacion, lesion severa de cd proximal, angioplastia con implante de stent sin complicaciones. Recibio tratamiento con Enoxaparina 1mg/kg SC c/12h (B01AB05), Clopidogrel 300mg carga (B01AC04), Amiodarona 300mg EV (C01BD01) y Aspirina 100mg (B01AC06). Evolucion clinica favorable, cumpliendo criterios de alta. Alta con diagnostico de angina inestable tratado (I20.0), indicandose Losartan 50mg VO c/24h (C09CA01), Nitroglicerina SL PRN (C01DA02), Clopidogrel 75mg VO c/24h 12m (B01AC04) y Apixaban 5mg VO c/12h (B01AF02)."}
{"input": {"dx": ["Shock cardiogenico (R57.0)"], "proc": ["Cateterismo derecho (K493)"], "tto": ["Ticagrelor 180mg carga (B01AC24)", "Clopidogrel 300mg carga (B01AC04)"], "evo": "Lesion critica de DA media, estabilizacion hemodinamica, angioplastia diferida", "dx_alta": ["Shock cardiogenico tratado (R57.0)"], "med": ["Bisoprolol 5mg VO c/24h (C07AB07)", "Digoxina 0.125mg VO c/24h (C01AA05)", "Amlodipino 5mg VO c/24h (C08CA01)"]}, "output": "Se hospitaliza por shock cardiogenico (R57.0). Se realiza cateterismo derecho (K493). Durante la hospitalizacion, lesion critica de da media, estabilizacion hemodinamica, angioplastia diferida. Recibio tratamiento con Ticagrelor 180mg carga (B01AC24) y Clopidogrel 300mg carga (B01AC04). Evolucion clinica favorable, cumpliendo criterios de alta. Alta con diagnostico de shock cardiogenico tratado (R57.0), indicandose Bisoprolol 5mg VO c/24h (C07AB07), Digoxina 0.125mg VO c/24h (C01AA05) y Amlodipino 5mg VO c/24h (C08CA01)."}
{"input": {"dx": ["Enfermedad de TCI (I25.1)"], "proc": ["Coronariografia (88.72)"], "tto": ["Enalapril 5mg VO (C09AA02)", "Prasugrel 60mg carga (B01AC22)", "Clopidogrel 600mg carga (B01AC04)", "Heparina EV infusion (B01AB01)"], "evo": "Estenosis aortica severa sintomatica, programada para TAVI", "dx_alta": ["Enfermedad de TCI tratado (I25.1)"], "med": ["Atorvastatina 40mg VO c/noche (C10AA05)", "Apixaban 5mg VO c/12h (B01AF02)", "Clopidogrel 75mg VO c/24h 12m (B01AC04)", "Carvedilol 6.25mg VO c/12h (C07AG02)", "Digoxina 0.125mg VO c/24h (C01AA05)"]}, "output": "Ingresa por enfermedad de tci (I25.1). Se realiza coronariografia (88.72). En su evolucion, estenosis aortica severa sintomatica, programada para tavi. Recibio tratamiento con Enalapril 5mg VO (C09AA02), Prasugrel 60mg carga (B01AC22), Clopidogrel 600mg carga (B01AC04) y Heparina EV infusion (B01AB01). Presenta evolucion favorable, cumpliendo criterios de alta. Alta con diagnostico de enfermedad de tci tratado (I25.1), indicandose Atorvastatina 40mg VO c/noche (C10AA05), Apixaban 5mg VO c/12h (B01AF02), Clopidogrel 75mg VO c/24h 12m (B01AC04), Carvedilol 6.25mg VO c/12h (C07AG02) y Digoxina 0.125mg VO c/24h (C01AA05)."}
{"input": {"dx": ["Hernia inguinal (K40.9)"], "proc": ["Hemodialisis (39.95)", "RMN cerebral (88.91)"], "tto": ["Salbutamol NBZ c/4h (R03AC02)", "Tramadol 50mg EV c/8h (N02AX02)", "Insulina cristalina segun esquema (A10AB01)"], "evo": "Evolucion favorable con tratamiento medico, sin complicaciones", "dx_alta": ["Hernia inguinal resuelto (K40.9)"], "med": ["Tramadol 50mg VO c/8h 7d (N02AX02)", "Sertralina 50mg VO c/24h (N06AB06)", "Prednisona 20mg VO c/24h (H02AB07)", "Budesonide/Formoterol INH c/12h (R03AK07)"]}, "output": "Se hospitaliza por hernia inguinal (K40.9). Se realiza hemodialisis (39.95), rmn cerebral (88.91). Presenta, evolucion favorable con tratamiento medico, sin complicaciones. Recibio tratamiento con Salbutamol NBZ c/4h (R03AC02), Tramadol 50mg EV c/8h (N02AX02) y Insulina cristalina segun esquema (A10AB01). Buena evolucion, cumpliendo criterios de alta. Alta con diagnostico de hernia inguinal resuelto (K40.9), indicandose Tramadol 50mg VO c/8h 7d (N02AX02), Sertralina 50mg VO c/24h (N06AB06), Prednisona 20mg VO c/24h (H02AB07) y Budesonide/Formoterol INH c/12h (R03AK07)."}
{"input": {"dx": ["IAMCEST anterolateral (I21.0)"], "proc": ["Coronariografia (K492)", "Angioplastia TCI (K493)"], "tto": ["Aspirina 100mg (B01AC06)", "Furosemida 80mg EV (C03CA01)", "Enalapril 5mg VO (C09AA02)"], "evo": "Lesion severa de OM1, angioplastia con implante de stent sin complicaciones", "dx_alta": ["IAMCEST anterolateral tratado (I21.0)"], "med": ["Enalapril 10mg VO c/12h (C09AA02)", "Losartan 50mg VO c/24h (C09CA01)", "Prasugrel 10mg VO c/24h 12m (B01AC22)", "Amlodipino 5mg VO c/24h (C08CA01)", "Rosuvastatina 20mg VO c/noche (C10AA07)"]}, "output": "Se hospitaliza por iamcest anterolateral (I21.0). Se realiza coronariografia (K492) con hallazgo de lesion significativa, realizandose angioplastia tci (K493) con implante de stent farmacoactivo y flujo TIMI 3 final. Evoluciona con, lesion severa de om1, angioplastia con implante de stent sin complicaciones. Recibio tratamiento con Aspirina 100mg (B01AC06), Furosemida 80mg EV (C03CA01) y Enalapril 5mg VO (C09AA02). Evolucion satisfactoria, cumpliendo criterios de alta. Alta con diagnostico de iamcest anterolateral tratado (I21.0), indicandose Enalapril 10mg VO c/12h (C09AA02), Losartan 50mg VO c/24h (C09CA01), Prasugrel 10mg VO c/24h 12m (B01AC22), Amlodipino 5mg VO c/24h (C08CA01) y Rosuvastatina 20mg VO c/noche (C10AA07)."}
{"input": {"dx": ["Hernia inguinal (K40.9)"], "proc": ["Trombolisis EV (99.10)", "Osteosintesis de cadera (79.35)"], "tto": ["Omeprazol 40mg EV c/12h (A02BC01)", "Insulina NPH 10UI SC c/12h (A10AC01)", "Ondansetron 8mg EV c/8h (A04AA01)", "Ceftriaxona 2g EV c/24h (J01DD04)"], "evo": "Respuesta adecuada al tratamiento antibiotico, afebril desde dia 2", "dx_alta": ["Hernia inguinal resuelto (K40.9)"], "med": ["Insulina NPH 10UI SC c/12h (A10AC01)", "Sertralina 50mg VO c/24h (N06AB06)", "Salbutamol INH 2 puff c/6h PRN (R03AC02)"]}, "output": "Ingreso por hernia inguinal (K40.9). Se realiza trombolisis ev (99.10), osteosintesis de cadera (79.35). Presenta, respuesta adecuada al tratamiento antibiotico, afebril desde dia 2. Recibio tratamiento con Omeprazol 40mg EV c/12h (A02BC01), Insulina NPH 10UI SC c/12h (A10AC01), Ondansetron 8mg EV c/8h (A04AA01) y Ceftriaxona 2g EV c/24h (J01DD04). Presenta evolucion favorable, cumpliendo criterios de alta. Alta con diagnostico de hernia inguinal resuelto (K40.9), indicandose Insulina NPH 10UI SC c/12h (A10AC01), Sertralina 50mg VO c/24h (N06AB06) y Salbutamol INH 2 puff c/6h PRN (R03AC02)."}
{"input": {"dx": ["Estenosis aortica severa (I35.0)"], "proc": ["Toracocentesis (34.91)"], "tto": ["Meropenem 1g EV c/8h (J01DH02)", "Piperacilina/Tazobactam 4.5g EV c/8h (J01CR05)"], "evo": "Respuesta adecuada al tratamiento antibiotico, afebril desde dia 2", "dx_alta": ["Estenosis aortica severa resuelto (I35.0)"], "med": ["Metformina 850mg VO c/12h (A10BA02)", "Vitamina D 1000UI VO c/24h (A11CC05)", "Salbutamol INH 2 puff c/6h PRN (R03AC02)", "Sertralina 50mg VO c/24h (N06AB06)"]}, "output": "Paciente que ingresa con cuadro de estenosis aortica severa (I35.0). Se realiza toracocentesis (34.91). Presenta, respuesta adecuada al tratamiento antibiotico, afebril desde dia 2. Recibio tratamiento con Meropenem 1g EV c/8h (J01DH02) y Piperacilina/Tazobactam 4.5g EV c/8h (J01CR05). Evolucion clinica favorable, cumpliendo criterios de alta. Alta con diagnostico de estenosis aortica severa resuelto (I35.0), indicandose Metformina 850mg VO c/12h (A10BA02), Vitamina D 1000UI VO c/24h (A11CC05), Salbutamol INH 2 puff c/6h PRN (R03AC02) y Sertralina 50mg VO c/24h (N06AB06)."}
{"input": {"dx": ["Apendicitis aguda (K35.8)"], "proc": ["Trombectomia mecanica (39.74)"], "tto": ["Tramadol 50mg EV c/8h (N02AX02)", "Morfina 3mg EV c/4h PRN (N02AA01)", "Ipratropio NBZ c/6h (R03BB01)", "Ceftriaxona 2g EV c/24h (J01DD04)"], "evo": "Manejo conservador exitoso, sin necesidad de cirugia", "dx_alta": ["Apendicitis aguda resuelto (K35.8)"], "med": ["Glibenclamida 5mg VO c/24h (A10BB01)", "Insulina NPH 10UI SC c/12h (A10AC01)"]}, "output": "Se hospitaliza por apendicitis aguda (K35.8). Se realiza trombectomia mecanica (39.74). En su evolucion, manejo conservador exitoso, sin necesidad de cirugia. Recibio tratamiento con Tramadol 50mg EV c/8h (N02AX02), Morfina 3mg EV c/4h PRN (N02AA01), Ipratropio NBZ c/6h (R03BB01) y Ceftriaxona 2g EV c/24h (J01DD04). Presenta evolucion favorable, cumpliendo criterios de alta. Alta con diagnostico de apendicitis aguda resuelto (K35.8), indicandose Glibenclamida 5mg VO c/24h (A10BB01) y Insulina NPH 10UI SC c/12h (A10AC01)."}
{"input": {"dx": ["IAMCEST lateral (I21.2)"], "proc": ["Coronariografia (K492)", "Angioplastia TCI (K493)"], "tto": ["Heparina EV infusion (B01AB01)", "Metoprolol 5mg EV (C07AB02)", "Morfina 3mg EV (N02AA01)", "Dobutamina EV (C01CA07)"], "evo": "Lesion critica de TCI, estabilizacion hemodinamica, angioplastia diferida", "dx_alta": ["IAMCEST lateral tratado (I21.2)"], "med": ["Espironolactona 25mg VO c/24h (C03DA01)", "Apixaban 5mg VO c/12h (B01AF02)", "Amlodipino 5mg VO c/24h (C08CA01)", "Rosuvastatina 20mg VO c/noche (C10AA07)"]}, "output": "Ingreso por iamcest lateral (I21.2). Se realiza coronariografia (K492) evidenciando oclusion aguda, realizandose angioplastia tci (K493) con implante de stent farmacoactivo y flujo TIMI 3 final. En su evolucion, lesion critica de tci, estabilizacion hemodinamica, angioplastia diferida. Recibio tratamiento con Heparina EV infusion (B01AB01), Metoprolol 5mg EV (C07AB02), Morfina 3mg EV (N02AA01) y Dobutamina EV (C01CA07). Presenta evolucion favorable, cumpliendo criterios de alta. Alta con diagnostico de iamcest lateral tratado (I21.2), indicandose Espironolactona 25mg VO c/24h (C03DA01), Apixaban 5mg VO c/12h (B01AF02), Amlodipino 5mg VO c/24h (C08CA01) y Rosuvastatina 20mg VO c/noche (C10AA07)."}
{"input": {"dx": ["Enfermedad coronaria de 3 vasos (I25.1)"], "proc": ["Coronariografia (K492)", "Angioplastia OM (K493)"], "tto": ["Morfina 3mg EV (N02AA01)", "Furosemida 40mg EV (C03CA01)", "Digoxina 0.25mg EV (C01AA05)", "Aspirina 100mg (B01AC06)"], "evo": "Bloqueo AV completo sintomatico, requirio marcapasos transitorio", "dx_alta": ["Enfermedad coronaria de 3 vasos tratado (I25.1)"], "med": ["Losartan 50mg VO c/24h (C09CA01)", "Aspirina 100mg VO c/24h (B01AC06)", "Isosorbide 20mg VO c/8h (C01DA08)", "Warfarina segun INR (B01AA03)"]}, "output": "Ingreso por enfermedad coronaria de 3 vasos (I25.1). Se realiza coronariografia (K492) encontrando lesion critica, realizandose angioplastia om (K493) con implante de stent farmacoactivo y flujo TIMI 3 final. Presenta, bloqueo av completo sintomatico, requirio marcapasos transitorio. Recibio tratamiento con Morfina 3mg EV (N02AA01), Furosemida 40mg EV (C03CA01), Digoxina 0.25mg EV (C01AA05) y Aspirina 100mg (B01AC06). Buena evolucion, cumpliendo criterios de alta. Alta con diagnostico de enfermedad coronaria de 3 vasos tratado (I25.1), indicandose Losartan 50mg VO c/24h (C09CA01), Aspirina 100mg VO c/24h (B01AC06), Isosorbide 20mg VO c/8h (C01DA08) y Warfarina segun INR (B01AA03)."}
{"input": {"dx": ["IAMSEST alto riesgo (I21.4)"], "proc": ["Coronariografia (K492)"], "tto": ["Clopidogrel 300mg carga (B01AC04)", "Ticagrelor 180mg carga (B01AC24)", "Metoprolol 5mg EV (C07AB02)"], "evo": "Edema pulmonar agudo por disfuncion sistolica, respuesta favorable a diureticos", "dx_alta": ["IAMSEST alto riesgo tratado (I21.4)"], "med": ["Espironolactona 25mg VO c/24h (C03DA01)", "Metoprolol 50mg VO c/12h (C07AB02)", "Warfarina segun INR (B01AA03)"]}, "output": "Ingreso por iamsest alto riesgo (I21.4). Se realiza coronariografia (K492). Presenta, edema pulmonar agudo por disfuncion sistolica, respuesta favorable a diureticos. Recibio tratamiento con Clopidogrel 300mg carga (B01AC04), Ticagrelor 180mg carga (B01AC24) y Metoprolol 5mg EV (C07AB02). Buena evolucion, cumpliendo criterios de alta. Alta con diagnostico de iamsest alto riesgo tratado (I21.4), indicandose Espironolactona 25mg VO c/24h (C03DA01), Metoprolol 50mg VO c/12h (C07AB02) y Warfarina segun INR (B01AA03)."}
{"input": {"dx": ["Estenosis aortica severa (I35.0)"], "proc": ["Colecistectomia laparoscopica (51.23)", "Colonoscopia (45.23)"], "tto": ["Morfina 3mg EV c/4h PRN (N02AA01)", "Ondansetron 8mg EV c/8h (A04AA01)", "Ceftriaxona 2g EV c/24h (J01DD04)", "N-acetilcisteina NBZ c/8h (R05CB01)"], "evo": "Mejoría clínica sostenida, cumple criterios de alta", "dx_alta": ["Estenosis aortica severa resuelto (I35.0)"], "med": ["Hierro 100mg VO c/24h (B03AA07)", "Glibenclamida 5mg VO c/24h (A10BB01)", "Ciprofloxacino 500mg VO c/12h 7d (J01MA02)"]}, "output": "Paciente que ingresa con cuadro de estenosis aortica severa (I35.0). Se realiza colecistectomia laparoscopica (51.23), colonoscopia (45.23). Evoluciona con, mejoría clínica sostenida, cumple criterios de alta. Recibio tratamiento con Morfina 3mg EV c/4h PRN (N02AA01), Ondansetron 8mg EV c/8h (A04AA01), Ceftriaxona 2g EV c/24h (J01DD04) y N-acetilcisteina NBZ c/8h (R05CB01). Presenta evolucion favorable, cumpliendo criterios de alta. Alta con diagnostico de estenosis aortica severa resuelto (I35.0), indicandose Hierro 100mg VO c/24h (B03AA07), Glibenclamida 5mg VO c/24h (A10BB01) y Ciprofloxacino 500mg VO c/12h 7d (J01MA02)."}
{"input": {"dx": ["Reestenosis intra-stent (I25.5)"], "proc": ["Angioplastia CX (35.05)"], "tto": ["Nitroglicerina EV (C01DA02)", "Metoprolol 5mg EV (C07AB02)", "Prasugrel 60mg carga (B01AC22)", "Ticagrelor 180mg carga (B01AC24)"], "evo": "Taquicardia ventricular sostenida, cardioversion electrica exitosa", "dx_alta": ["Reestenosis intra-stent tratado (I25.5)"], "med": ["Prasugrel 10mg VO c/24h 12m (B01AC22)", "Apixaban 5mg VO c/12h (B01AF02)", "Clopidogrel 75mg VO c/24h 12m (B01AC04)", "Warfarina segun INR (B01AA03)"]}, "output": "Se hospitaliza por reestenosis intra-stent (I25.5). Se realiza angioplastia cx (35.05). Evoluciona con, taquicardia ventricular sostenida, cardioversion electrica exitosa. Recibio tratamiento con Nitroglicerina EV (C01DA02), Metoprolol 5mg EV (C07AB02), Prasugrel 60mg carga (B01AC22) y Ticagrelor 180mg carga (B01AC24). Presenta evolucion favorable, cumpliendo criterios de alta. Alta con diagnostico de reestenosis intra-stent tratado (I25.5), indicandose Prasugrel 10mg VO c/24h 12m (B01AC22), Apixaban 5mg VO c/12h (B01AF02), Clopidogrel 75mg VO c/24h 12m (B01AC04) y Warfarina segun INR (B01AA03)."}
{"input": {"dx": ["Angina inestable alto riesgo (I20.0)"], "proc": ["Coronariografia (K492)", "Angioplastia CX (36.06)"], "tto": ["Heparina 5000UI EV (B01AB01)", "Furosemida 80mg EV (C03CA01)", "Enoxaparina 1mg/kg SC c/12h (B01AB05)"], "evo": "Lesion critica de diagonal, estabilizacion hemodinamica, angioplastia diferida", "dx_alta": ["Angina inestable alto riesgo tratado (I20.0)"], "med": ["Isosorbide 20mg VO c/8h (C01DA08)", "Digoxina 0.125mg VO c/24h (C01AA05)", "Nitroglicerina SL PRN (C01DA02)"]}, "output": "Paciente que ingresa con cuadro de angina inestable alto riesgo (I20.0). Se realiza coronariografia (K492) visualizando estenosis severa, realizandose angioplastia cx (36.06) con implante de stent farmacoactivo y flujo TIMI 3 final. Presenta, lesion critica de diagonal, estabilizacion hemodinamica, angioplastia diferida. Recibio tratamiento con Heparina 5000UI EV (B01AB01), Furosemida 80mg EV (C03CA01) y Enoxaparina 1mg/kg SC c/12h (B01AB05). Buena evolucion, cumpliendo criterios de alta. Alta con diagnostico de angina inestable alto riesgo tratado (I20.0), indicandose Isosorbide 20mg VO c/8h (C01DA08), Digoxina 0.125mg VO c/24h (C01AA05) y Nitroglicerina SL PRN (C01DA02)."}
{"input": {"dx": ["Reestenosis intra-stent (I25.5)"], "proc": ["Pericardiocentesis (K493)"], "tto": ["Dobutamina EV (C01CA07)", "Prasugrel 60mg carga (B01AC22)", "Amiodarona 300mg EV (C01BD01)"], "evo": "Shock cardiogenico, requirio soporte con inotropicos, evolucion favorable", "dx_alta": ["Reestenosis intra-stent tratado (I25.5)"], "med": ["Losartan 50mg VO c/24h (C09CA01)", "Metoprolol 50mg VO c/12h (C07AB02)", "Bisoprolol 5mg VO c/24h (C07AB07)", "Ticagrelor 90mg VO c/12h 12m (B01AC24)", "Amlodipino 5mg VO c/24h (C08CA01)"]}, "output": "Paciente que ingresa con cuadro de reestenosis intra-stent (I25.5). Se realiza pericardiocentesis (K493). Presenta, shock cardiogenico, requirio soporte con inotropicos, evolucion favorable. Recibio tratamiento con Dobutamina EV (C01CA07), Prasugrel 60mg carga (B01AC22) y Amiodarona 300mg EV (C01BD01). Evolucion clinica favorable, cumpliendo criterios de alta. Alta con diagnostico de reestenosis intra-stent tratado (I25.5), indicandose Losartan 50mg VO c/24h (C09CA01), Metoprolol 50mg VO c/12h (C07AB02), Bisoprolol 5mg VO c/24h (C07AB07), Ticagrelor 90mg VO c/12h 12m (B01AC24) y Amlodipino 5mg VO c/24h (C08CA01)."}
{"input": {"dx": ["Angina inestable (I20.0)"], "proc": ["Coronariografia (K492)", "Angioplastia OM (36.06)"], "tto": ["Amiodarona 300mg EV (C01BD01)", "Morfina 3mg EV (N02AA01)", "Noradrenalina EV (C01CA03)"], "evo": "Taquicardia ventricular sostenida, cardioversion electrica exitosa", "dx_alta": ["Angina inestable tratado (I20.0)"], "med": ["Apixaban 5mg VO c/12h (B01AF02)", "Aspirina 100mg VO c/24h (B01AC06)", "Rivaroxaban 20mg VO c/24h (B01AF01)"]}, "output": "Paciente que ingresa con cuadro de angina inestable (I20.0). Se realiza coronariografia (K492) visualizando estenosis severa, realizandose angioplastia om (36.06) con implante de stent farmacoactivo y flujo TIMI 3 final. Durante la hospitalizacion, taquicardia ventricular sostenida, cardioversion electrica exitosa. Recibio tratamiento con Amiodarona 300mg EV (C01BD01), Morfina 3mg EV (N02AA01) y Noradrenalina EV (C01CA03). Evolucion clinica favorable, cumpliendo criterios de alta. Alta con diagnostico de angina inestable tratado (I20.0), indicandose Apixaban 5mg VO c/12h (B01AF02), Aspirina 100mg VO c/24h (B01AC06) y Rivaroxaban 20mg VO c/24h (B01AF01)."}
{"input": {"dx": ["IAMCEST posterior (I21.2)"], "proc": ["Coronariografia (K492)"], "tto": ["Atorvastatina 80mg (C10AA05)", "Heparina EV infusion (B01AB01)", "Heparina 5000UI EV (B01AB01)"], "evo": "Estenosis aortica severa sintomatica, programada para TAVI", "dx_alta": ["IAMCEST posterior tratado (I21.2)"], "med": ["Prasugrel 10mg VO c/24h 12m (B01AC22)", "Rosuvastatina 20mg VO c/noche (C10AA07)", "Rivaroxaban 20mg VO c/24h (B01AF01)"]}, "output": "Ingresa por iamcest posterior (I21.2). Se realiza coronariografia (K492). Evoluciona con, estenosis aortica severa sintomatica, programada para tavi. Recibio tratamiento con Atorvastatina 80mg (C10AA05), Heparina EV infusion (B01AB01) y Heparina 5000UI EV (B01AB01). Buena evolucion, cumpliendo criterios de alta. Alta con diagnostico de iamcest posterior tratado (I21.2), indicandose Prasugrel 10mg VO c/24h 12m (B01AC22), Rosuvastatina 20mg VO c/noche (C10AA07) y Rivaroxaban 20mg VO c/24h (B01AF01)."}
{"input": {"dx": ["Angina inestable (I20.0)"], "proc": ["Coronariografia (K492)", "Angioplastia CD (K493)"], "tto": ["Aspirina 100mg (B01AC06)", "Heparina 5000UI EV (B01AB01)", "Heparina EV infusion (B01AB01)", "Digoxina 0.25mg EV (C01AA05)"], "evo": "Lesion critica de CX proximal, estabilizacion hemodinamica, angioplastia diferida", "dx_alta": ["Angina inestable tratado (I20.0)"], "med": ["Nitroglicerina SL PRN (C01DA02)", "Rosuvastatina 20mg VO c/noche (C10AA07)", "Digoxina 0.125mg VO c/24h (C01AA05)", "Furosemida 40mg VO c/24h (C03CA01)"]}, "output": "Paciente que ingresa con cuadro de angina inestable (I20.0). Se realiza coronariografia (K492) evidenciando oclusion aguda, realizandose angioplastia cd (K493) con implante de stent farmacoactivo y flujo TIMI 3 final. Evoluciona con, lesion critica de cx proximal, estabilizacion hemodinamica, angioplastia diferida. Recibio tratamiento con Aspirina 100mg (B01AC06), Heparina 5000UI EV (B01AB01), Heparina EV infusion (B01AB01) y Digoxina 0.25mg EV (C01AA05). Evolucion satisfactoria, cumpliendo criterios de alta. Alta con diagnostico de angina inestable tratado (I20.0), indicandose Nitroglicerina SL PRN (C01DA02), Rosuvastatina 20mg VO c/noche (C10AA07), Digoxina 0.125mg VO c/24h (C01AA05) y Furosemida 40mg VO c/24h (C03CA01)."}
{"input": {"dx": ["Insuficiencia cardiaca aguda (I50.9)"], "proc": ["Cardioversion electrica (37.80)"], "tto": ["Atorvastatina 80mg (C10AA05)", "Clopidogrel 300mg carga (B01AC04)", "Enoxaparina 60mg SC c/12h (B01AB05)"], "evo": "Bloqueo AV completo sintomatico, requirio marcapasos transitorio", "dx_alta": ["Insuficiencia cardiaca aguda tratado (I50.9)"], "med": ["Rosuvastatina 20mg VO c/noche (C10AA07)", "Rivaroxaban 20mg VO c/24h (B01AF01)", "Enalapril 10mg VO c/12h (C09AA02)", "Aspirina 100mg VO c/24h (B01AC06)"]}, "output": "Ingresa por insuficiencia cardiaca aguda (I50.9). Se realiza cardioversion electrica (37.80). En su evolucion, bloqueo av completo sintomatico, requirio marcapasos transitorio. Recibio tratamiento con Atorvastatina 80mg (C10AA05), Clopidogrel 300mg carga (B01AC04) y Enoxaparina 60mg SC c/12h (B01AB05). Buena evolucion, cumpliendo criterios de alta. Alta con diagnostico de insuficiencia cardiaca aguda tratado (I50.9), indicandose Rosuvastatina 20mg VO c/noche (C10AA07), Rivaroxaban 20mg VO c/24h (B01AF01), Enalapril 10mg VO c/12h (C09AA02) y Aspirina 100mg VO c/24h (B01AC06)."}
{"input": {"dx": ["Insuficiencia cardiaca aguda (I50.9)"], "proc": ["Coronariografia (35.04)"], "tto": ["Prasugrel 60mg carga (B01AC22)", "Heparina 5000UI EV (B01AB01)", "Furosemida 80mg EV (C03CA01)"], "evo": "Estenosis aortica severa sintomatica, programada para TAVI", "dx_alta": ["Insuficiencia cardiaca aguda tratado (I50.9)"], "med": ["Aspirina 100mg VO c/24h (B01AC06)", "Nitroglicerina SL PRN (C01DA02)", "Carvedilol 6.25mg VO c/12h (C07AG02)"]}, "output": "Paciente que ingresa con cuadro de insuficiencia cardiaca aguda (I50.9). Se realiza coronariografia (35.04). Evoluciona con, estenosis aortica severa sintomatica, programada para tavi. Recibio tratamiento con Prasugrel 60mg carga (B01AC22), Heparina 5000UI EV (B01AB01) y Furosemida 80mg EV (C03CA01). Evolucion satisfactoria, cumpliendo criterios de alta. Alta con diagnostico de insuficiencia cardiaca aguda tratado (I50.9), indicandose Aspirina 100mg VO c/24h (B01AC06), Nitroglicerina SL PRN (C01DA02) y Carvedilol 6.25mg VO c/12h (C07AG02)."}
{"input": {"dx": ["IAMCEST inferolateral (I21.1)"], "proc": ["Coronariografia (K492)", "Angioplastia TCI (36.06)"], "tto": ["Ticagrelor 180mg carga (B01AC24)", "Enoxaparina 60mg SC c/12h (B01AB05)"], "evo": "Fibrilacion auricular de alta respuesta, cardioversion farmacologica exitosa", "dx_alta": ["IAMCEST inferolateral tratado (I21.1)"], "med": ["Digoxina 0.125mg VO c/24h (C01AA05)", "Rosuvastatina 20mg VO c/noche (C10AA07)", "Enalapril 10mg VO c/12h (C09AA02)", "Isosorbide 20mg VO c/8h (C01DA08)", "Metoprolol 50mg VO c/12h (C07AB02)"]}, "output": "Paciente que ingresa con cuadro de iamcest inferolateral (I21.1). Se realiza coronariografia (K492) encontrando lesion critica, realizandose angioplastia tci (36.06) con implante de stent farmacoactivo y flujo TIMI 3 final. En su evolucion, fibrilacion auricular de alta respuesta, cardioversion farmacologica exitosa. Recibio tratamiento con Ticagrelor 180mg carga (B01AC24) y Enoxaparina 60mg SC c/12h (B01AB05). Evolucion clinica favorable, cumpliendo criterios de alta. Alta con diagnostico de iamcest inferolateral tratado (I21.1), indicandose Digoxina 0.125mg VO c/24h (C01AA05), Rosuvastatina 20mg VO c/noche (C10AA07), Enalapril 10mg VO c/12h (C09AA02), Isosorbide 20mg VO c/8h (C01DA08) y Metoprolol 50mg VO c/12h (C07AB02)."}
{"input": {"dx": ["Enfermedad de TCI (I25.1)"], "proc": ["Pericardiocentesis (89.41)"], "tto": ["Dobutamina EV (C01CA07)", "Metoprolol 5mg EV (C07AB02)", "Clopidogrel 600mg carga (B01AC04)", "Nitroglicerina EV (C01DA02)"], "evo": "Oclusion aguda de DA distal, angioplastia exitosa con stent farmacoactivo, flujo TIMI 3 final", "dx_alta": ["Enfermedad de TCI tratado (I25.1)"], "med": ["Aspirina 100mg VO c/24h (B01AC06)", "Apixaban 5mg VO c/12h (B01AF02)", "Prasugrel 10mg VO c/24h 12m (B01AC22)", "Enalapril 10mg VO c/12h (C09AA02)", "Rosuvastatina 20mg VO c/noche (C10AA07)"]}, "output": "Paciente que ingresa con cuadro de enfermedad de tci (I25.1). Se realiza pericardiocentesis (89.41). Evoluciona con, oclusion aguda de da distal, angioplastia exitosa con stent farmacoactivo, flujo timi 3 final. Recibio tratamiento con Dobutamina EV (C01CA07), Metoprolol 5mg EV (C07AB02), Clopidogrel 600mg carga (B01AC04) y Nitroglicerina EV (C01DA02). Presenta evolucion favorable, cumpliendo criterios de alta. Alta con diagnostico de enfermedad de tci tratado (I25.1), indicandose Aspirina 100mg VO c/24h (B01AC06), Apixaban 5mg VO c/12h (B01AF02), Prasugrel 10mg VO c/24h 12m (B01AC22), Enalapril 10mg VO c/12h (C09AA02) y Rosuvastatina 20mg VO c/noche (C10AA07)."}
{"input": {"dx": ["IAMCEST anteroseptal (I21.0)"], "proc": ["Coronariografia (K492)"], "tto": ["Nitroglicerina EV (C01DA02)", "Furosemida 80mg EV (C03CA01)"], "evo": "Enfermedad de multiples vasos, se deriva a cirugia cardiaca para bypass", "dx_alta": ["IAMCEST anteroseptal tratado (I21.0)"], "med": ["Clopidogrel 75mg VO c/24h 12m (B01AC04)", "Losartan 50mg VO c/24h (C09CA01)", "Ticagrelor 90mg VO c/12h 12m (B01AC24)", "Rivaroxaban 20mg VO c/24h (B01AF01)"]}, "output": "Ingresa por iamcest anteroseptal (I21.0). Se realiza coronariografia (K492). Presenta, enfermedad de multiples vasos, se deriva a cirugia cardiaca para bypass. Recibio tratamiento con Nitroglicerina EV (C01DA02) y Furosemida 80mg EV (C03CA01). Evolucion satisfactoria, cumpliendo criterios de alta. Alta con diagnostico de iamcest anteroseptal tratado (I21.0), indicandose Clopidogrel 75mg VO c/24h 12m (B01AC04), Losartan 50mg VO c/24h (C09CA01), Ticagrelor 90mg VO c/12h 12m (B01AC24) y Rivaroxaban 20mg VO c/24h (B01AF01)."}
{"input": {"dx": ["Reestenosis intra-stent (I25.5)"], "proc": ["Angioplastia TCI (88.72)"], "tto": ["Furosemida 40mg EV (C03CA01)", "Heparina 5000UI EV (B01AB01)", "Enoxaparina 1mg/kg SC c/12h (B01AB05)"], "evo": "Estenosis aortica severa sintomatica, programada para TAVI", "dx_alta": ["Reestenosis intra-stent tratado (I25.5)"], "med": ["Furosemida 40mg VO c/24h (C03CA01)", "Atorvastatina 40mg VO c/noche (C10AA05)", "Clopidogrel 75mg VO c/24h 12m (B01AC04)", "Warfarina segun INR (B01AA03)"]}, "output": "Ingreso por reestenosis intra-stent (I25.5). Se realiza angioplastia tci (88.72). Durante la hospitalizacion, estenosis aortica severa sintomatica, programada para tavi. Recibio tratamiento con Furosemida 40mg EV (C03CA01), Heparina 5000UI EV (B01AB01) y Enoxaparina 1mg/kg SC c/12h (B01AB05). Evolucion clinica favorable, cumpliendo criterios de alta. Alta con diagnostico de reestenosis intra-stent tratado (I25.5), indicandose Furosemida 40mg VO c/24h (C03CA01), Atorvastatina 40mg VO c/noche (C10AA05), Clopidogrel 75mg VO c/24h 12m (B01AC04) y Warfarina segun INR (B01AA03)."}
{"input": {"dx": ["Angina inestable (I20.0)"], "proc": ["Coronariografia (K492)", "Angioplastia CD (K493)"], "tto": ["Atorvastatina 80mg (C10AA05)", "Enalapril 5mg VO (C09AA02)", "Enoxaparina 1mg/kg SC c/12h (B01AB05)", "Ticagrelor 180mg carga (B01AC24)"], "evo": "Bloqueo AV completo sintomatico, requirio marcapasos transitorio", "dx_alta": ["Angina inestable tratado (I20.0)"], "med": ["Carvedilol 6.25mg VO c/12h (C07AG02)", "Clopidogrel 75mg VO c/24h 12m (B01AC04)", "Warfarina segun INR (B01AA03)"]}, "output": "Ingresa por angina inestable (I20.0). Se realiza coronariografia (K492) evidenciando oclusion aguda, realizandose angioplastia cd (K493) con implante de stent farmacoactivo y flujo TIMI 3 final. Evoluciona con, bloqueo av completo sintomatico, requirio marcapasos transitorio. Recibio tratamiento con Atorvastatina 80mg (C10AA05), Enalapril 5mg VO (C09AA02), Enoxaparina 1mg/kg SC c/12h (B01AB05) y Ticagrelor 180mg carga (B01AC24). Buena evolucion, cumpliendo criterios de alta. Alta con diagnostico de angina inestable tratado (I20.0), indicandose Carvedilol 6.25mg VO c/12h (C07AG02), Clopidogrel 75mg VO c/24h 12m (B01AC04) y Warfarina segun INR (B01AA03)."}
{"input": {"dx": ["IAMSEST alto riesgo (I21.4)"], "proc": ["Coronariografia (K492)", "Angioplastia TCI (K493)"], "tto": ["Heparina EV infusion (B01AB01)", "Noradrenalina EV (C01CA03)"], "evo": "Estenosis aortica severa sintomatica, programada para TAVI", "dx_alta": ["IAMSEST alto riesgo tratado (I21.4)"], "med": ["Digoxina 0.125mg VO c/24h (C01AA05)", "Rivaroxaban 20mg VO c/24h (B01AF01)", "Carvedilol 6.25mg VO c/12h (C07AG02)", "Ticagrelor 90mg VO c/12h 12m (B01AC24)", "Atorvastatina 40mg VO c/noche (C10AA05)"]}, "output": "Paciente que ingresa con cuadro de iamsest alto riesgo (I21.4). Se realiza coronariografia (K492) con hallazgo de lesion significativa, realizandose angioplastia tci (K493) con implante de stent farmacoactivo y flujo TIMI 3 final. Durante la hospitalizacion, estenosis aortica severa sintomatica, programada para tavi. Recibio tratamiento con Heparina EV infusion (B01AB01) y Noradrenalina EV (C01CA03). Buena evolucion, cumpliendo criterios de alta. Alta con diagnostico de iamsest alto riesgo tratado (I21.4), indicandose Digoxina 0.125mg VO c/24h (C01AA05), Rivaroxaban 20mg VO c/24h (B01AF01), Carvedilol 6.25mg VO c/12h (C07AG02), Ticagrelor 90mg VO c/12h 12m (B01AC24) y Atorvastatina 40mg VO c/noche (C10AA05)."}
{"input": {"dx": ["Hernia inguinal (K40.9)"], "proc": ["TAC de abdomen (88.01)"], "tto": ["N-acetilcisteina NBZ c/8h (R05CB01)", "Paracetamol 1g EV c/8h (N02BE01)", "Hidrocortisona 100mg EV c/8h (H02AB09)"], "evo": "Respuesta adecuada al tratamiento antibiotico, afebril desde dia 2", "dx_alta": ["Hernia inguinal resuelto (K40.9)"], "med": ["Vitamina D 1000UI VO c/24h (A11CC05)", "Insulina NPH 10UI SC c/12h (A10AC01)"]}, "output": "Se hospitaliza por hernia inguinal (K40.9). Se realiza tac de abdomen (88.01). Presenta, respuesta adecuada al tratamiento antibiotico, afebril desde dia 2. Recibio tratamiento con N-acetilcisteina NBZ c/8h (R05CB01), Paracetamol 1g EV c/8h (N02BE01) y Hidrocortisona 100mg EV c/8h (H02AB09). Evolucion satisfactoria, cumpliendo criterios de alta. Alta con diagnostico de hernia inguinal resuelto (K40.9), indicandose Vitamina D 1000UI VO c/24h (A11CC05) y Insulina NPH 10UI SC c/12h (A10AC01)."}
{"input": {"dx": ["Fibrilacion auricular (I48.9)"], "proc": ["Hemodialisis (39.95)", "Colonoscopia (45.23)"], "tto": ["Pantoprazol 40mg EV c/12h (A02BC02)", "Insulina NPH 10UI SC c/12h (A10AC01)", "Metronidazol 500mg EV c/8h (J01XD01)"], "evo": "Mejoría clínica sostenida, cumple criterios de alta", "dx_alta": ["Fibrilacion auricular resuelto (I48.9)"], "med": ["Sertralina 50mg VO c/24h (N06AB06)", "Vitamina D 1000UI VO c/24h (A11CC05)", "Glibenclamida 5mg VO c/24h (A10BB01)"]}, "output": "Paciente que ingresa con cuadro de fibrilacion auricular (I48.9). Se realiza hemodialisis (39.95), colonoscopia (45.23). Presenta, mejoría clínica sostenida, cumple criterios de alta. Recibio tratamiento con Pantoprazol 40mg EV c/12h (A02BC02), Insulina NPH 10UI SC c/12h (A10AC01) y Metronidazol 500mg EV c/8h (J01XD01). Buena evolucion, cumpliendo criterios de alta. Alta con diagnostico de fibrilacion auricular resuelto (I48.9), indicandose Sertralina 50mg VO c/24h (N06AB06), Vitamina D 1000UI VO c/24h (A11CC05) y Glibenclamida 5mg VO c/24h (A10BB01)."}
{"input": {"dx": ["Estenosis aortica severa (I35.0)"], "proc": ["Ecografia abdominal (88.76)"], "tto": ["Paracetamol 1g EV c/8h (N02BE01)", "Metronidazol 500mg EV c/8h (J01XD01)", "Ampicilina/Sulbactam 1.5g EV c/6h (J01CR01)", "Ceftriaxona 2g EV c/24h (J01DD04)"], "evo": "Mejoría clínica sostenida, cumple criterios de alta", "dx_alta": ["Estenosis aortica severa resuelto (I35.0)"], "med": ["Calcio 500mg VO c/12h (A12AA04)", "Omeprazol 20mg VO c/24h (A02BC01)", "Hierro 100mg VO c/24h (B03AA07)"]}, "output": "Paciente que ingresa con cuadro de estenosis aortica severa (I35.0). Se realiza ecografia abdominal (88.76). Durante la hospitalizacion, mejoría clínica sostenida, cumple criterios de alta. Recibio tratamiento con Paracetamol 1g EV c/8h (N02BE01), Metronidazol 500mg EV c/8h (J01XD01), Ampicilina/Sulbactam 1.5g EV c/6h (J01CR01) y Ceftriaxona 2g EV c/24h (J01DD04). Buena evolucion, cumpliendo criterios de alta. Alta con diagnostico de estenosis aortica severa resuelto (I35.0), indicandose Calcio 500mg VO c/12h (A12AA04), Omeprazol 20mg VO c/24h (A02BC01) y Hierro 100mg VO c/24h (B03AA07)."}
{"input": {"dx": ["Endocarditis infecciosa (I33.0)"], "proc": ["Ecografia abdominal (88.76)", "RMN cerebral (88.91)"], "tto": ["Insulina cristalina segun esquema (A10AB01)", "Insulina NPH 10UI SC c/12h (A10AC01)"], "evo": "Mejoría clínica sostenida, cumple criterios de alta", "dx_alta": ["Endocarditis infecciosa resuelto (I33.0)"], "med": ["Prednisona 20mg VO c/24h (H02AB07)", "Salbutamol INH 2 puff c/6h PRN (R03AC02)"]}, "output": "Ingreso por endocarditis infecciosa (I33.0). Se realiza ecografia abdominal (88.76), rmn cerebral (88.91). Presenta, mejoría clínica sostenida, cumple criterios de alta. Recibio tratamiento con Insulina cristalina segun esquema (A10AB01) y Insulina NPH 10UI SC c/12h (A10AC01). Presenta evolucion favorable, cumpliendo criterios de alta. Alta con diagnostico de endocarditis infecciosa resuelto (I33.0), indicandose Prednisona 20mg VO c/24h (H02AB07) y Salbutamol INH 2 puff c/6h PRN (R03AC02)."}
{"input": {"dx": ["IAMCEST lateral (I21.2)"], "proc": ["Coronariografia (K492)"], "tto": ["Aspirina 100mg (B01AC06)", "Heparina EV infusion (B01AB01)"], "evo": "SDST en I, aVL, coronarias sin lesiones obstructivas, sindrome de Tako-Tsubo", "dx_alta": ["IAMCEST lateral tratado (I21.2)"], "med": ["Prasugrel 10mg VO c/24h 12m (B01AC22)", "Clopidogrel 75mg VO c/24h 12m (B01AC04)", "Bisoprolol 5mg VO c/24h (C07AB07)"]}, "output": "Ingreso por iamcest lateral (I21.2). Se realiza coronariografia (K492). Presenta, sdst en i, avl, coronarias sin lesiones obstructivas, sindrome de tako-tsubo. Recibio tratamiento con Aspirina 100mg (B01AC06) y Heparina EV infusion (B01AB01). Presenta evolucion favorable, cumpliendo criterios de alta. Alta con diagnostico de iamcest lateral tratado (I21.2), indicandose Prasugrel 10mg VO c/24h 12m (B01AC22), Clopidogrel 75mg VO c/24h 12m (B01AC04) y Bisoprolol 5mg VO c/24h (C07AB07)."}
{"input": {"dx": ["Shock cardiogenico (R57.0)"], "proc": ["Angioplastia DA (K492)"], "tto": ["Levosimendan EV (C01CX08)", "Metoprolol 5mg EV (C07AB02)"], "evo": "Lesion severa de TCI, angioplastia con implante de stent sin complicaciones", "dx_alta": ["Shock cardiogenico tratado (R57.0)"], "med": ["Nitroglicerina SL PRN (C01DA02)", "Metoprolol 50mg VO c/12h (C07AB02)", "Carvedilol 6.25mg VO c/12h (C07AG02)", "Clopidogrel 75mg VO c/24h 12m (B01AC04)"]}, "output": "Se hospitaliza por shock cardiogenico (R57.0). Se realiza angioplastia da (K492). Durante la hospitalizacion, lesion severa de tci, angioplastia con implante de stent sin complicaciones. Recibio tratamiento con Levosimendan EV (C01CX08) y Metoprolol 5mg EV (C07AB02). Presenta evolucion favorable, cumpliendo criterios de alta. Alta con diagnostico de shock cardiogenico tratado (R57.0), indicandose Nitroglicerina SL PRN (C01DA02), Metoprolol 50mg VO c/12h (C07AB02), Carvedilol 6.25mg VO c/12h (C07AG02) y Clopidogrel 75mg VO c/24h 12m (B01AC04)."}
{"input": {"dx": ["Taquicardia ventricular (I47.2)"], "proc": ["Osteosintesis de cadera (79.35)"], "tto": ["Ondansetron 8mg EV c/8h (A04AA01)", "Morfina 3mg EV c/4h PRN (N02AA01)"], "evo": "Mejoría clínica sostenida, cumple criterios de alta", "dx_alta": ["Taquicardia ventricular resuelto (I47.2)"], "med": ["Glibenclamida 5mg VO c/24h (A10BB01)", "Sertralina 50mg VO c/24h (N06AB06)", "Insulina NPH 10UI SC c/12h (A10AC01)"]}, "output": "Paciente que ingresa con cuadro de taquicardia ventricular (I47.2). Se realiza osteosintesis de cadera (79.35). Evoluciona con, mejoría clínica sostenida, cumple criterios de alta. Recibio tratamiento con Ondansetron 8mg EV c/8h (A04AA01) y Morfina 3mg EV c/4h PRN (N02AA01). Presenta evolucion favorable, cumpliendo criterios de alta. Alta con diagnostico de taquicardia ventricular resuelto (I47.2), indicandose Glibenclamida 5mg VO c/24h (A10BB01), Sertralina 50mg VO c/24h (N06AB06) y Insulina NPH 10UI SC c/12h (A10AC01)."}
{"input": {"dx": ["Insuficiencia renal aguda (N17.9)"], "proc": ["Trombolisis EV (99.10)", "Angio TAC cerebral (88.38)"], "tto": ["Metamizol 1g EV c/8h (N02BB02)", "N-acetilcisteina NBZ c/8h (R05CB01)"], "evo": "Mejoría clínica sostenida, cumple criterios de alta", "dx_alta": ["Insuficiencia renal aguda resuelto (N17.9)"], "med": ["Clonazepam 0.5mg VO c/noche (N03AE01)", "Salbutamol INH 2 puff c/6h PRN (R03AC02)", "Metformina 850mg VO c/12h (A10BA02)"]}, "output": "Ingreso por insuficiencia renal aguda (N17.9). Se realiza trombolisis ev (99.10), angio tac cerebral (88.38). Presenta, mejoría clínica sostenida, cumple criterios de alta. Recibio tratamiento con Metamizol 1g EV c/8h (N02BB02) y N-acetilcisteina NBZ c/8h (R05CB01). Buena evolucion, cumpliendo criterios de alta. Alta con diagnostico de insuficiencia renal aguda resuelto (N17.9), indicandose Clonazepam 0.5mg VO c/noche (N03AE01), Salbutamol INH 2 puff c/6h PRN (R03AC02) y Metformina 850mg VO c/12h (A10BA02)."}
{"input": {"dx": ["Angina inestable alto riesgo (I20.0)"], "proc": ["Coronariografia (K492)", "Angioplastia TCI (36.06)"], "tto": ["Nitroglicerina EV (C01DA02)", "Dobutamina EV (C01CA07)", "Clopidogrel 300mg carga (B01AC04)", "Noradrenalina EV (C01CA03)"], "evo": "Taquicardia ventricular sostenida, cardioversion electrica exitosa", "dx_alta": ["Angina inestable alto riesgo tratado (I20.0)"], "med": ["Rosuvastatina 20mg VO c/noche (C10AA07)", "Carvedilol 6.25mg VO c/12h (C07AG02)", "Furosemida 40mg VO c/24h (C03CA01)", "Nitroglicerina SL PRN (C01DA02)", "Bisoprolol 5mg VO c/24h (C07AB07)"]}, "output": "Ingresa por angina inestable alto riesgo (I20.0). Se realiza coronariografia (K492) encontrando lesion critica, realizandose angioplastia tci (36.06) con implante de stent farmacoactivo y flujo TIMI 3 final. Presenta, taquicardia ventricular sostenida, cardioversion electrica exitosa. Recibio tratamiento con Nitroglicerina EV (C01DA02), Dobutamina EV (C01CA07), Clopidogrel 300mg carga (B01AC04) y Noradrenalina EV (C01CA03). Presenta evolucion favorable, cumpliendo criterios de alta. Alta con diagnostico de angina inestable alto riesgo tratado (I20.0), indicandose Rosuvastatina 20mg VO c/noche (C10AA07), Carvedilol 6.25mg VO c/12h (C07AG02), Furosemida 40mg VO c/24h (C03CA01), Nitroglicerina SL PRN (C01DA02) y Bisoprolol 5mg VO c/24h (C07AB07)."}
{"input": {"dx": ["Angina inestable (I20.0)"], "proc": ["Coronariografia (K492)"], "tto": ["Clopidogrel 600mg carga (B01AC04)", "Nitroglicerina EV (C01DA02)"], "evo": "Oclusion aguda de ramus intermedio, angioplastia exitosa con stent farmacoactivo, flujo TIMI 3 final", "dx_alta": ["Angina inestable tratado (I20.0)"], "med": ["Amlodipino 5mg VO c/24h (C08CA01)", "Nitroglicerina SL PRN (C01DA02)", "Rivaroxaban 20mg VO c/24h (B01AF01)", "Prasugrel 10mg VO c/24h 12m (B01AC22)", "Clopidogrel 75mg VO c/24h 12m (B01AC04)"]}, "output": "Ingreso por angina inestable (I20.0). Se realiza coronariografia (K492). Presenta, oclusion aguda de ramus intermedio, angioplastia exitosa con stent farmacoactivo, flujo timi 3 final. Recibio tratamiento con Clopidogrel 600mg carga (B01AC04) y Nitroglicerina EV (C01DA02). Evolucion clinica favorable, cumpliendo criterios de alta. Alta con diagnostico de angina inestable tratado (I20.0), indicandose Amlodipino 5mg VO c/24h (C08CA01), Nitroglicerina SL PRN (C01DA02), Rivaroxaban 20mg VO c/24h (B01AF01), Prasugrel 10mg VO c/24h 12m (B01AC22) y Clopidogrel 75mg VO c/24h 12m (B01AC04)."}
{"input": {"dx": ["Angina estable (I20.8)"], "proc": ["Coronariografia (K492)", "Angioplastia CD (K493)"], "tto": ["Prasugrel 60mg carga (B01AC22)", "Enoxaparina 60mg SC c/12h (B01AB05)", "Noradrenalina EV (C01CA03)"], "evo": "Fibrilacion auricular de alta respuesta, cardioversion farmacologica exitosa", "dx_alta": ["Angina estable tratado (I20.8)"], "med": ["Ticagrelor 90mg VO c/12h 12m (B01AC24)", "Losartan 50mg VO c/24h (C09CA01)", "Espironolactona 25mg VO c/24h (C03DA01)", "Apixaban 5mg VO c/12h (B01AF02)", "Nitroglicerina SL PRN (C01DA02)"]}, "output": "Ingresa por angina estable (I20.8). Se realiza coronariografia (K492) visualizando estenosis severa, realizandose angioplastia cd (K493) con implante de stent farmacoactivo y flujo TIMI 3 final. Durante la hospitalizacion, fibrilacion auricular de alta respuesta, cardioversion farmacologica exitosa. Recibio tratamiento con Prasugrel 60mg carga (B01AC22), Enoxaparina 60mg SC c/12h (B01AB05) y Noradrenalina EV (C01CA03). Evolucion satisfactoria, cumpliendo criterios de alta. Alta con diagnostico de angina estable tratado (I20.8), indicandose Ticagrelor 90mg VO c/12h 12m (B01AC24), Losartan 50mg VO c/24h (C09CA01), Espironolactona 25mg VO c/24h (C03DA01), Apixaban 5mg VO c/12h (B01AF02) y Nitroglicerina SL PRN (C01DA02)."}
{"input": {"dx": ["IAMCEST inferior (I21.1)"], "proc": ["Coronariografia (K492)", "Angioplastia CX (36.06)"], "tto": ["Furosemida 80mg EV (C03CA01)", "Enoxaparina 1mg/kg SC c/12h (B01AB05)", "Clopidogrel 300mg carga (B01AC04)"], "evo": "Pericarditis aguda con derrame leve, manejo antiinflamatorio", "dx_alta": ["IAMCEST inferior tratado (I21.1)"], "med": ["Bisoprolol 5mg VO c/24h (C07AB07)", "Clopidogrel 75mg VO c/24h 12m (B01AC04)", "Enalapril 10mg VO c/12h (C09AA02)"]}, "output": "Ingresa por iamcest inferior (I21.1). Se realiza coronariografia (K492) visualizando estenosis severa, realizandose angioplastia cx (36.06) con implante de stent farmacoactivo y flujo TIMI 3 final. En su evolucion, pericarditis aguda con derrame leve, manejo antiinflamatorio. Recibio tratamiento con Furosemida 80mg EV (C03CA01), Enoxaparina 1mg/kg SC c/12h (B01AB05) y Clopidogrel 300mg carga (B01AC04). Buena evolucion, cumpliendo criterios de alta. Alta con diagnostico de iamcest inferior tratado (I21.1), indicandose Bisoprolol 5mg VO c/24h (C07AB07), Clopidogrel 75mg VO c/24h 12m (B01AC04) y Enalapril 10mg VO c/12h (C09AA02)."}
{"input": {"dx": ["IAMSEST (I21.4)"], "proc": ["Coronariografia (K492)"], "tto": ["Furosemida 40mg EV (C03CA01)", "Amiodarona 300mg EV (C01BD01)", "Dobutamina EV (C01CA07)", "Noradrenalina EV (C01CA03)"], "evo": "Taquicardia ventricular sostenida, cardioversion electrica exitosa", "dx_alta": ["IAMSEST tratado (I21.4)"], "med": ["Enalapril 10mg VO c/12h (C09AA02)", "Bisoprolol 5mg VO c/24h (C07AB07)", "Rivaroxaban 20mg VO c/24h (B01AF01)", "Nitroglicerina SL PRN (C01DA02)"]}, "output": "Se hospitaliza por iamsest (I21.4). Se realiza coronariografia (K492). Durante la hospitalizacion, taquicardia ventricular sostenida, cardioversion electrica exitosa. Recibio tratamiento con Furosemida 40mg EV (C03CA01), Amiodarona 300mg EV (C01BD01), Dobutamina EV (C01CA07) y Noradrenalina EV (C01CA03). Evolucion satisfactoria, cumpliendo criterios de alta. Alta con diagnostico de iamsest tratado (I21.4), indicandose Enalapril 10mg VO c/12h (C09AA02), Bisoprolol 5mg VO c/24h (C07AB07), Rivaroxaban 20mg VO c/24h (B01AF01) y Nitroglicerina SL PRN (C01DA02)."}
{"input": {"dx": ["IAMCEST inferior (I21.1)"], "proc": ["Coronariografia (K492)", "Angioplastia CX (K493)"], "tto": ["Enalapril 5mg VO (C09AA02)", "Furosemida 80mg EV (C03CA01)", "Aspirina 300mg carga (B01AC06)"], "evo": "Estenosis aortica severa sintomatica, programada para TAVI", "dx_alta": ["IAMCEST inferior tratado (I21.1)"], "med": ["Warfarina segun INR (B01AA03)", "Espironolactona 25mg VO c/24h (C03DA01)", "Bisoprolol 5mg VO c/24h (C07AB07)", "Digoxina 0.125mg VO c/24h (C01AA05)", "Atorvastatina 40mg VO c/noche (C10AA05)"]}, "output": "Paciente que ingresa con cuadro de iamcest inferior (I21.1). Se realiza coronariografia (K492) encontrando lesion critica, realizandose angioplastia cx (K493) con implante de stent farmacoactivo y flujo TIMI 3 final. Presenta, estenosis aortica severa sintomatica, programada para tavi. Recibio tratamiento con Enalapril 5mg VO (C09AA02), Furosemida 80mg EV (C03CA01) y Aspirina 300mg carga (B01AC06). Evolucion satisfactoria, cumpliendo criterios de alta. Alta con diagnostico de iamcest inferior tratado (I21.1), indicandose Warfarina segun INR (B01AA03), Espironolactona 25mg VO c/24h (C03DA01), Bisoprolol 5mg VO c/24h (C07AB07), Digoxina 0.125mg VO c/24h (C01AA05) y Atorvastatina 40mg VO c/noche (C10AA05)."}
{"input": {"dx": ["Edema pulmonar agudo (J81)"], "proc": ["Angioplastia DA (K493)"], "tto": ["Furosemida 80mg EV (C03CA01)", "Morfina 3mg EV (N02AA01)", "Clopidogrel 600mg carga (B01AC04)", "Nitroglicerina EV (C01DA02)"], "evo": "Lesion critica de OM2, estabilizacion hemodinamica, angioplastia diferida", "dx_alta": ["Edema pulmonar agudo tratado (J81)"], "med": ["Apixaban 5mg VO c/12h (B01AF02)", "Carvedilol 6.25mg VO c/12h (C07AG02)", "Furosemida 40mg VO c/24h (C03CA01)", "Rivaroxaban 20mg VO c/24h (B01AF01)"]}, "output": "Ingreso por edema pulmonar agudo (J81). Se realiza angioplastia da (K493). Durante la hospitalizacion, lesion critica de om2, estabilizacion hemodinamica, angioplastia diferida. Recibio tratamiento con Furosemida 80mg EV (C03CA01), Morfina 3mg EV (N02AA01), Clopidogrel 600mg carga (B01AC04) y Nitroglicerina EV (C01DA02). Evolucion clinica favorable, cumpliendo criterios de alta. Alta con diagnostico de edema pulmonar agudo tratado (J81), indicandose Apixaban 5mg VO c/12h (B01AF02), Carvedilol 6.25mg VO c/12h (C07AG02), Furosemida 40mg VO c/24h (C03CA01) y Rivaroxaban 20mg VO c/24h (B01AF01)."}
{"input": {"dx": ["Angina estable (I20.8)"], "proc": ["Coronariografia (K492)"], "tto": ["Enoxaparina 60mg SC c/12h (B01AB05)", "Enoxaparina 1mg/kg SC c/12h (B01AB05)", "Heparina EV infusion (B01AB01)", "Clopidogrel 300mg carga (B01AC04)"], "evo": "Edema pulmonar agudo por disfuncion sistolica, respuesta favorable a diureticos", "dx_alta": ["Angina estable tratado (I20.8)"], "med": ["Losartan 50mg VO c/24h (C09CA01)", "Prasugrel 10mg VO c/24h 12m (B01AC22)", "Enalapril 10mg VO c/12h (C09AA02)"]}, "output": "Ingreso por angina estable (I20.8). Se realiza coronariografia (K492). Evoluciona con, edema pulmonar agudo por disfuncion sistolica, respuesta favorable a diureticos. Recibio tratamiento con Enoxaparina 60mg SC c/12h (B01AB05), Enoxaparina 1mg/kg SC c/12h (B01AB05), Heparina EV infusion (B01AB01) y Clopidogrel 300mg carga (B01AC04). Presenta evolucion favorable, cumpliendo criterios de alta. Alta con diagnostico de angina estable tratado (I20.8), indicandose Losartan 50mg VO c/24h (C09CA01), Prasugrel 10mg VO c/24h 12m (B01AC22) y Enalapril 10mg VO c/12h (C09AA02)."}
{"input": {"dx": ["Insuficiencia cardiaca aguda (I50.9)"], "proc": ["Ecocardiograma (88.72)"], "tto": ["Enalapril 5mg VO (C09AA02)", "Ticagrelor 180mg carga (B01AC24)", "Atorvastatina 80mg (C10AA05)", "Metoprolol 5mg EV (C07AB02)"], "evo": "Edema pulmonar agudo por disfuncion sistolica, respuesta favorable a diureticos", "dx_alta": ["Insuficiencia cardiaca aguda tratado (I50.9)"], "med": ["Aspirina 100mg VO c/24h (B01AC06)", "Bisoprolol 5mg VO c/24h (C07AB07)", "Amlodipino 5mg VO c/24h (C08CA01)", "Clopidogrel 75mg VO c/24h 12m (B01AC04)", "Rosuvastatina 20mg VO c/noche (C10AA07)"]}, "output": "Paciente que ingresa con cuadro de insuficiencia cardiaca aguda (I50.9). Se realiza ecocardiograma (88.72). Durante la hospitalizacion, edema pulmonar agudo por disfuncion sistolica, respuesta favorable a diureticos. Recibio tratamiento con Enalapril 5mg VO (C09AA02), Ticagrelor 180mg carga (B01AC24), Atorvastatina 80mg (C10AA05) y Metoprolol 5mg EV (C07AB02). Buena evolucion, cumpliendo criterios de alta. Alta con diagnostico de insuficiencia cardiaca aguda tratado (I50.9), indicandose Aspirina 100mg VO c/24h (B01AC06), Bisoprolol 5mg VO c/24h (C07AB07), Amlodipino 5mg VO c/24h (C08CA01), Clopidogrel 75mg VO c/24h 12m (B01AC04) y Rosuvastatina 20mg VO c/noche (C10AA07)."}
{"input": {"dx": ["Shock cardiogenico (R57.0)"], "proc": ["Test de esfuerzo (K493)"], "tto": ["Levosimendan EV (C01CX08)", "Heparina 5000UI EV (B01AB01)", "Enoxaparina 60mg SC c/12h (B01AB05)"], "evo": "Fibrilacion auricular de alta respuesta, cardioversion farmacologica exitosa", "dx_alta": ["Shock cardiogenico tratado (R57.0)"], "med": ["Carvedilol 6.25mg VO c/12h (C07AG02)", "Prasugrel 10mg VO c/24h 12m (B01AC22)", "Aspirina 100mg VO c/24h (B01AC06)", "Enalapril 10mg VO c/12h (C09AA02)", "Bisoprolol 5mg VO c/24h (C07AB07)"]}, "output": "Paciente que ingresa con cuadro de shock cardiogenico (R57.0). Se realiza test de esfuerzo (K493). Evoluciona con, fibrilacion auricular de alta respuesta, cardioversion farmacologica exitosa. Recibio tratamiento con Levosimendan EV (C01CX08), Heparina 5000UI EV (B01AB01) y Enoxaparina 60mg SC c/12h (B01AB05). Presenta evolucion favorable, cumpliendo criterios de alta. Alta con diagnostico de shock cardiogenico tratado (R57.0), indicandose Carvedilol 6.25mg VO c/12h (C07AG02), Prasugrel 10mg VO c/24h 12m (B01AC22), Aspirina 100mg VO c/24h (B01AC06), Enalapril 10mg VO c/12h (C09AA02) y Bisoprolol 5mg VO c/24h (C07AB07)."}
{"input": {"dx": ["Neumonia adquirida comunidad (J18.9)"], "proc": ["Colecistectomia laparoscopica (51.23)"], "tto": ["Insulina cristalina segun esquema (A10AB01)", "Metronidazol 500mg EV c/8h (J01XD01)"], "evo": "Mejoría clínica sostenida, cumple criterios de alta", "dx_alta": ["Neumonia adquirida comunidad resuelto (J18.9)"], "med": ["Omeprazol 20mg VO c/24h (A02BC01)", "Paracetamol 500mg VO c/8h PRN (N02BE01)", "Insulina NPH 10UI SC c/12h (A10AC01)", "Calcio 500mg VO c/12h (A12AA04)"]}, "output": "Se hospitaliza por neumonia adquirida comunidad (J18.9). Se realiza colecistectomia laparoscopica (51.23). Presenta, mejoría clínica sostenida, cumple criterios de alta. Recibio tratamiento con Insulina cristalina segun esquema (A10AB01) y Metronidazol 500mg EV c/8h (J01XD01). Evolucion satisfactoria, cumpliendo criterios de alta. Alta con diagnostico de neumonia adquirida comunidad resuelto (J18.9), indicandose Omeprazol 20mg VO c/24h (A02BC01), Paracetamol 500mg VO c/8h PRN (N02BE01), Insulina NPH 10UI SC c/12h (A10AC01) y Calcio 500mg VO c/12h (A12AA04)."}
{"input": {"dx": ["IAMCEST inferolateral (I21.1)"], "proc": ["Coronariografia (K492)"], "tto": ["Morfina 3mg EV (N02AA01)", "Levosimendan EV (C01CX08)", "Prasugrel 60mg carga (B01AC22)", "Clopidogrel 300mg carga (B01AC04)"], "evo": "Taquicardia ventricular sostenida, cardioversion electrica exitosa", "dx_alta": ["IAMCEST inferolateral tratado (I21.1)"], "med": ["Rosuvastatina 20mg VO c/noche (C10AA07)", "Bisoprolol 5mg VO c/24h (C07AB07)", "Aspirina 100mg VO c/24h (B01AC06)", "Digoxina 0.125mg VO c/24h (C01AA05)", "Atorvastatina 40mg VO c/noche (C10AA05)"]}, "output": "Paciente que ingresa con cuadro de iamcest inferolateral (I21.1). Se realiza coronariografia (K492). Presenta, taquicardia ventricular sostenida, cardioversion electrica exitosa. Recibio tratamiento con Morfina 3mg EV (N02AA01), Levosimendan EV (C01CX08), Prasugrel 60mg carga (B01AC22) y Clopidogrel 300mg carga (B01AC04). Evolucion satisfactoria, cumpliendo criterios de alta. Alta con diagnostico de iamcest inferolateral tratado (I21.1), indicandose Rosuvastatina 20mg VO c/noche (C10AA07), Bisoprolol 5mg VO c/24h (C07AB07), Aspirina 100mg VO c/24h (B01AC06), Digoxina 0.125mg VO c/24h (C01AA05) y Atorvastatina 40mg VO c/noche (C10AA05)."}
{"input": {"dx": ["IAMCEST lateral (I21.2)"], "proc": ["Coronariografia (K492)", "Angioplastia OM (K493)"], "tto": ["Clopidogrel 300mg carga (B01AC04)", "Noradrenalina EV (C01CA03)", "Aspirina 300mg carga (B01AC06)"], "evo": "Fibrilacion auricular de alta respuesta, cardioversion farmacologica exitosa", "dx_alta": ["IAMCEST lateral tratado (I21.2)"], "med": ["Furosemida 40mg VO c/24h (C03CA01)", "Nitroglicerina SL PRN (C01DA02)", "Rivaroxaban 20mg VO c/24h (B01AF01)", "Warfarina segun INR (B01AA03)"]}, "output": "Paciente que ingresa con cuadro de iamcest lateral (I21.2). Se realiza coronariografia (K492) evidenciando oclusion aguda, realizandose angioplastia om (K493) con implante de stent farmacoactivo y flujo TIMI 3 final. En su evolucion, fibrilacion auricular de alta respuesta, cardioversion farmacologica exitosa. Recibio tratamiento con Clopidogrel 300mg carga (B01AC04), Noradrenalina EV (C01CA03) y Aspirina 300mg carga (B01AC06). Buena evolucion, cumpliendo criterios de alta. Alta con diagnostico de iamcest lateral tratado (I21.2), indicandose Furosemida 40mg VO c/24h (C03CA01), Nitroglicerina SL PRN (C01DA02), Rivaroxaban 20mg VO c/24h (B01AF01) y Warfarina segun INR (B01AA03)."}
{"input": {"dx": ["Trombosis de stent (I21.0)"], "proc": ["Angioplastia CX (89.64)"], "tto": ["Levosimendan EV (C01CX08)", "Noradrenalina EV (C01CA03)"], "evo": "Oclusion de CX proximal con trombo, trombectomia por aspiracion mas stent", "dx_alta": ["Trombosis de stent tratado (I21.0)"], "med": ["Nitroglicerina SL PRN (C01DA02)", "Prasugrel 10mg VO c/24h 12m (B01AC22)", "Apixaban 5mg VO c/12h (B01AF02)", "Losartan 50mg VO c/24h (C09CA01)", "Rivaroxaban 20mg VO c/24h (B01AF01)"]}, "output": "Ingresa por trombosis de stent (I21.0). Se realiza angioplastia cx (89.64). Presenta, oclusion de cx proximal con trombo, trombectomia por aspiracion mas stent. Recibio tratamiento con Levosimendan EV (C01CX08) y Noradrenalina EV (C01CA03). Evolucion satisfactoria, cumpliendo criterios de alta. Alta con diagnostico de trombosis de stent tratado (I21.0), indicandose Nitroglicerina SL PRN (C01DA02), Prasugrel 10mg VO c/24h 12m (B01AC22), Apixaban 5mg VO c/12h (B01AF02), Losartan 50mg VO c/24h (C09CA01) y Rivaroxaban 20mg VO c/24h (B01AF01)."}
{"input": {"dx": ["Insuficiencia mitral severa (I34.0)"], "proc": ["Broncoscopia (33.22)", "Colonoscopia (45.23)"], "tto": ["Ondansetron 8mg EV c/8h (A04AA01)", "Paracetamol 1g EV c/8h (N02BE01)"], "evo": "Procedimiento sin complicaciones, buena tolerancia oral", "dx_alta": ["Insuficiencia mitral severa resuelto (I34.0)"], "med": ["Levotiroxina 50mcg VO c/24h (H03AA01)", "Insulina NPH 10UI SC c/12h (A10AC01)"]}, "output": "Paciente que ingresa con cuadro de insuficiencia mitral severa (I34.0). Se realiza broncoscopia (33.22), colonoscopia (45.23). En su evolucion, procedimiento sin complicaciones, buena tolerancia oral. Recibio tratamiento con Ondansetron 8mg EV c/8h (A04AA01) y Paracetamol 1g EV c/8h (N02BE01). Presenta evolucion favorable, cumpliendo criterios de alta. Alta con diagnostico de insuficiencia mitral severa resuelto (I34.0), indicandose Levotiroxina 50mcg VO c/24h (H03AA01) y Insulina NPH 10UI SC c/12h (A10AC01)."}
{"input": {"dx": ["Reestenosis intra-stent (I25.5)"], "proc": ["Angioplastia CX (35.05)"], "tto": ["Metoprolol 5mg EV (C07AB02)", "Levosimendan EV (C01CX08)", "Morfina 3mg EV (N02AA01)", "Aspirina 100mg (B01AC06)"], "evo": "Fibrilacion auricular de alta respuesta, cardioversion farmacologica exitosa", "dx_alta": ["Reestenosis intra-stent tratado (I25.5)"], "med": ["Apixaban 5mg VO c/12h (B01AF02)", "Warfarina segun INR (B01AA03)", "Atorvastatina 40mg VO c/noche (C10AA05)"]}, "output": "Ingresa por reestenosis intra-stent (I25.5). Se realiza angioplastia cx (35.05). Evoluciona con, fibrilacion auricular de alta respuesta, cardioversion farmacologica exitosa. Recibio tratamiento con Metoprolol 5mg EV (C07AB02), Levosimendan EV (C01CX08), Morfina 3mg EV (N02AA01) y Aspirina 100mg (B01AC06). Presenta evolucion favorable, cumpliendo criterios de alta. Alta con diagnostico de reestenosis intra-stent tratado (I25.5), indicandose Apixaban 5mg VO c/12h (B01AF02), Warfarina segun INR (B01AA03) y Atorvastatina 40mg VO c/noche (C10AA05)."}
{"input": {"dx": ["Crisis hipertensiva (I10)"], "proc": ["Apendicectomia (47.09)"], "tto": ["Metoclopramida 10mg EV c/8h (A03FA01)", "Metamizol 1g EV c/8h (N02BB02)"], "evo": "Resolucion del cuadro agudo, alta con seguimiento ambulatorio", "dx_alta": ["Crisis hipertensiva resuelto (I10)"], "med": ["Vitamina D 1000UI VO c/24h (A11CC05)", "Salbutamol INH 2 puff c/6h PRN (R03AC02)", "Calcio 500mg VO c/12h (A12AA04)", "Sertralina 50mg VO c/24h (N06AB06)"]}, "output": "Paciente que ingresa con cuadro de crisis hipertensiva (I10). Se realiza apendicectomia (47.09). Evoluciona con, resolucion del cuadro agudo, alta con seguimiento ambulatorio. Recibio tratamiento con Metoclopramida 10mg EV c/8h (A03FA01) y Metamizol 1g EV c/8h (N02BB02). Evolucion satisfactoria, cumpliendo criterios de alta. Alta con diagnostico de crisis hipertensiva resuelto (I10), indicandose Vitamina D 1000UI VO c/24h (A11CC05), Salbutamol INH 2 puff c/6h PRN (R03AC02), Calcio 500mg VO c/12h (A12AA04) y Sertralina 50mg VO c/24h (N06AB06)."}
{"input": {"dx": ["Hemorragia digestiva alta (K92.2)"], "proc": ["Paracentesis (54.91)", "RMN cerebral (88.91)"], "tto": ["Salbutamol NBZ c/4h (R03AC02)", "Ipratropio NBZ c/6h (R03BB01)", "Hidrocortisona 100mg EV c/8h (H02AB09)", "Insulina cristalina segun esquema (A10AB01)"], "evo": "Evolucion favorable con tratamiento medico, sin complicaciones", "dx_alta": ["Hemorragia digestiva alta resuelto (K92.2)"], "med": ["Amoxicilina/Clavulanico 875mg VO c/12h 7d (J01CR02)", "Calcio 500mg VO c/12h (A12AA04)", "Clonazepam 0.5mg VO c/noche (N03AE01)", "Acido folico 1mg VO c/24h (B03BB01)"]}, "output": "Ingresa por hemorragia digestiva alta (K92.2). Se realiza paracentesis (54.91), rmn cerebral (88.91). En su evolucion, evolucion favorable con tratamiento medico, sin complicaciones. Recibio tratamiento con Salbutamol NBZ c/4h (R03AC02), Ipratropio NBZ c/6h (R03BB01), Hidrocortisona 100mg EV c/8h (H02AB09) y Insulina cristalina segun esquema (A10AB01). Evolucion satisfactoria, cumpliendo criterios de alta. Alta con diagnostico de hemorragia digestiva alta resuelto (K92.2), indicandose Amoxicilina/Clavulanico 875mg VO c/12h 7d (J01CR02), Calcio 500mg VO c/12h (A12AA04), Clonazepam 0.5mg VO c/noche (N03AE01) y Acido folico 1mg VO c/24h (B03BB01)."}
{"input": {"dx": ["Flutter auricular (I48.0)"], "proc": ["Osteosintesis de cadera (79.35)", "TAC de abdomen (88.01)"], "tto": ["Ampicilina/Sulbactam 1.5g EV c/6h (J01CR01)", "Metronidazol 500mg EV c/8h (J01XD01)"], "evo": "Control de sintomas con tratamiento medico optimizado", "dx_alta": ["Flutter auricular resuelto (I48.0)"], "med": ["Prednisona 20mg VO c/24h (H02AB07)", "Calcio 500mg VO c/12h (A12AA04)", "Metformina 850mg VO c/12h (A10BA02)"]}, "output": "Ingreso por flutter auricular (I48.0). Se realiza osteosintesis de cadera (79.35), tac de abdomen (88.01). Presenta, control de sintomas con tratamiento medico optimizado. Recibio tratamiento con Ampicilina/Sulbactam 1.5g EV c/6h (J01CR01) y Metronidazol 500mg EV c/8h (J01XD01). Presenta evolucion favorable, cumpliendo criterios de alta. Alta con diagnostico de flutter auricular resuelto (I48.0), indicandose Prednisona 20mg VO c/24h (H02AB07), Calcio 500mg VO c/12h (A12AA04) y Metformina 850mg VO c/12h (A10BA02)."}
{"input": {"dx": ["IAMCEST anteroseptal (I21.0)"], "proc": ["Coronariografia (K492)", "Angioplastia TCI (K493)"], "tto": ["Enalapril 5mg VO (C09AA02)", "Enoxaparina 1mg/kg SC c/12h (B01AB05)", "Aspirina 100mg (B01AC06)", "Noradrenalina EV (C01CA03)"], "evo": "Pericarditis aguda con derrame leve, manejo antiinflamatorio", "dx_alta": ["IAMCEST anteroseptal tratado (I21.0)"], "med": ["Metoprolol 50mg VO c/12h (C07AB02)", "Losartan 50mg VO c/24h (C09CA01)", "Furosemida 40mg VO c/24h (C03CA01)", "Aspirina 100mg VO c/24h (B01AC06)"]}, "output": "Paciente que ingresa con cuadro de iamcest anteroseptal (I21.0). Se realiza coronariografia (K492) con hallazgo de lesion significativa, realizandose angioplastia tci (K493) con implante de stent farmacoactivo y flujo TIMI 3 final. En su evolucion, pericarditis aguda con derrame leve, manejo antiinflamatorio. Recibio tratamiento con Enalapril 5mg VO (C09AA02), Enoxaparina 1mg/kg SC c/12h (B01AB05), Aspirina 100mg (B01AC06) y Noradrenalina EV (C01CA03). Evolucion satisfactoria, cumpliendo criterios de alta. Alta con diagnostico de iamcest anteroseptal tratado (I21.0), indicandose Metoprolol 50mg VO c/12h (C07AB02), Losartan 50mg VO c/24h (C09CA01), Furosemida 40mg VO c/24h (C03CA01) y Aspirina 100mg VO c/24h (B01AC06)."}
{"input": {"dx": ["Angina inestable alto riesgo (I20.0)"], "proc": ["Coronariografia (K492)", "Angioplastia CD (K493)"], "tto": ["Enoxaparina 1mg/kg SC c/12h (B01AB05)", "Amiodarona 300mg EV (C01BD01)"], "evo": "Shock cardiogenico, requirio soporte con inotropicos, evolucion favorable", "dx_alta": ["Angina inestable alto riesgo tratado (I20.0)"], "med": ["Bisoprolol 5mg VO c/24h (C07AB07)", "Amlodipino 5mg VO c/24h (C08CA01)", "Apixaban 5mg VO c/12h (B01AF02)", "Digoxina 0.125mg VO c/24h (C01AA05)", "Isosorbide 20mg VO c/8h (C01DA08)"]}, "output": "Ingresa por angina inestable alto riesgo (I20.0). Se realiza coronariografia (K492) evidenciando oclusion aguda, realizandose angioplastia cd (K493) con implante de stent farmacoactivo y flujo TIMI 3 final. Presenta, shock cardiogenico, requirio soporte con inotropicos, evolucion favorable. Recibio tratamiento con Enoxaparina 1mg/kg SC c/12h (B01AB05) y Amiodarona 300mg EV (C01BD01). Evolucion clinica favorable, cumpliendo criterios de alta. Alta con diagnostico de angina inestable alto riesgo tratado (I20.0), indicandose Bisoprolol 5mg VO c/24h (C07AB07), Amlodipino 5mg VO c/24h (C08CA01), Apixaban 5mg VO c/12h (B01AF02), Digoxina 0.125mg VO c/24h (C01AA05) y Isosorbide 20mg VO c/8h (C01DA08)."}
{"input": {"dx": ["IAMCEST anteroseptal (I21.0)"], "proc": ["Coronariografia (K492)"], "tto": ["Heparina EV infusion (B01AB01)", "Furosemida 80mg EV (C03CA01)", "Prasugrel 60mg carga (B01AC22)", "Amiodarona 300mg EV (C01BD01)"], "evo": "Enfermedad de multiples vasos, se deriva a cirugia cardiaca para bypass", "dx_alta": ["IAMCEST anteroseptal tratado (I21.0)"], "med": ["Rivaroxaban 20mg VO c/24h (B01AF01)", "Warfarina segun INR (B01AA03)", "Aspirina 100mg VO c/24h (B01AC06)"]}, "output": "Se hospitaliza por iamcest anteroseptal (I21.0). Se realiza coronariografia (K492). Durante la hospitalizacion, enfermedad de multiples vasos, se deriva a cirugia cardiaca para bypass. Recibio tratamiento con Heparina EV infusion (B01AB01), Furosemida 80mg EV (C03CA01), Prasugrel 60mg carga (B01AC22) y Amiodarona 300mg EV (C01BD01). Evolucion satisfactoria, cumpliendo criterios de alta. Alta con diagnostico de iamcest anteroseptal tratado (I21.0), indicandose Rivaroxaban 20mg VO c/24h (B01AF01), Warfarina segun INR (B01AA03) y Aspirina 100mg VO c/24h (B01AC06)."}
{"input": {"dx": ["Reestenosis intra-stent (I25.5)"], "proc": ["Coronariografia (35.04)"], "tto": ["Clopidogrel 600mg carga (B01AC04)", "Noradrenalina EV (C01CA03)"], "evo": "Shock cardiogenico, requirio soporte con inotropicos, evolucion favorable", "dx_alta": ["Reestenosis intra-stent tratado (I25.5)"], "med": ["Furosemida 40mg VO c/24h (C03CA01)", "Ticagrelor 90mg VO c/12h 12m (B01AC24)", "Aspirina 100mg VO c/24h (B01AC06)", "Atorvastatina 40mg VO c/noche (C10AA05)"]}, "output": "Se hospitaliza por reestenosis intra-stent (I25.5). Se realiza coronariografia (35.04). En su evolucion, shock cardiogenico, requirio soporte con inotropicos, evolucion favorable. Recibio tratamiento con Clopidogrel 600mg carga (B01AC04) y Noradrenalina EV (C01CA03). Presenta evolucion favorable, cumpliendo criterios de alta. Alta con diagnostico de reestenosis intra-stent tratado (I25.5), indicandose Furosemida 40mg VO c/24h (C03CA01), Ticagrelor 90mg VO c/12h 12m (B01AC24), Aspirina 100mg VO c/24h (B01AC06) y Atorvastatina 40mg VO c/noche (C10AA05)."}
{"input": {"dx": ["IAMCEST inferior (I21.1)"], "proc": ["Coronariografia (K492)", "Angioplastia DA (K493)"], "tto": ["Digoxina 0.25mg EV (C01AA05)", "Noradrenalina EV (C01CA03)"], "evo": "Edema pulmonar agudo por disfuncion sistolica, respuesta favorable a diureticos", "dx_alta": ["IAMCEST inferior tratado (I21.1)"], "med": ["Clopidogrel 75mg VO c/24h 12m (B01AC04)", "Prasugrel 10mg VO c/24h 12m (B01AC22)", "Metoprolol 50mg VO c/12h (C07AB02)"]}, "output": "Paciente que ingresa con cuadro de iamcest inferior (I21.1). Se realiza coronariografia (K492) evidenciando oclusion aguda, realizandose angioplastia da (K493) con implante de stent farmacoactivo y flujo TIMI 3 final. Presenta, edema pulmonar agudo por disfuncion sistolica, respuesta favorable a diureticos. Recibio tratamiento con Digoxina 0.25mg EV (C01AA05) y Noradrenalina EV (C01CA03). Evolucion clinica favorable, cumpliendo criterios de alta. Alta con diagnostico de iamcest inferior tratado (I21.1), indicandose Clopidogrel 75mg VO c/24h 12m (B01AC04), Prasugrel 10mg VO c/24h 12m (B01AC22) y Metoprolol 50mg VO c/12h (C07AB02)."}
{"input": {"dx": ["Obstruccion intestinal (K56.6)"], "proc": ["TAC de abdomen (88.01)", "Ecografia abdominal (88.76)"], "tto": ["Piperacilina/Tazobactam 4.5g EV c/8h (J01CR05)", "Vancomicina 1g EV c/12h (J01XA01)", "Meropenem 1g EV c/8h (J01DH02)"], "evo": "Respuesta adecuada al tratamiento antibiotico, afebril desde dia 2", "dx_alta": ["Obstruccion intestinal resuelto (K56.6)"], "med": ["Sertralina 50mg VO c/24h (N06AB06)", "Tramadol 50mg VO c/8h 7d (N02AX02)", "Prednisona 20mg VO c/24h (H02AB07)"]}, "output": "Ingreso por obstruccion intestinal (K56.6). Se realiza tac de abdomen (88.01), ecografia abdominal (88.76). En su evolucion, respuesta adecuada al tratamiento antibiotico, afebril desde dia 2. Recibio tratamiento con Piperacilina/Tazobactam 4.5g EV c/8h (J01CR05), Vancomicina 1g EV c/12h (J01XA01) y Meropenem 1g EV c/8h (J01DH02). Presenta evolucion favorable, cumpliendo criterios de alta. Alta con diagnostico de obstruccion intestinal resuelto (K56.6), indicandose Sertralina 50mg VO c/24h (N06AB06), Tramadol 50mg VO c/8h 7d (N02AX02) y Prednisona 20mg VO c/24h (H02AB07)."}
{"input": {"dx": ["IAMSEST alto riesgo (I21.4)"], "proc": ["Coronariografia (K492)", "Angioplastia TCI (K493)"], "tto": ["Clopidogrel 600mg carga (B01AC04)", "Dobutamina EV (C01CA07)", "Heparina EV infusion (B01AB01)", "Enoxaparina 1mg/kg SC c/12h (B01AB05)"], "evo": "Edema pulmonar agudo por disfuncion sistolica, respuesta favorable a diureticos", "dx_alta": ["IAMSEST alto riesgo tratado (I21.4)"], "med": ["Espironolactona 25mg VO c/24h (C03DA01)", "Enalapril 10mg VO c/12h (C09AA02)", "Metoprolol 50mg VO c/12h (C07AB02)"]}, "output": "Se hospitaliza por iamsest alto riesgo (I21.4). Se realiza coronariografia (K492) visualizando estenosis severa, realizandose angioplastia tci (K493) con implante de stent farmacoactivo y flujo TIMI 3 final. Presenta, edema pulmonar agudo por disfuncion sistolica, respuesta favorable a diureticos. Recibio tratamiento con Clopidogrel 600mg carga (B01AC04), Dobutamina EV (C01CA07), Heparina EV infusion (B01AB01) y Enoxaparina 1mg/kg SC c/12h (B01AB05). Evolucion clinica favorable, cumpliendo criterios de alta. Alta con diagnostico de iamsest alto riesgo tratado (I21.4), indicandose Espironolactona 25mg VO c/24h (C03DA01), Enalapril 10mg VO c/12h (C09AA02) y Metoprolol 50mg VO c/12h (C07AB02)."}
{"input": {"dx": ["Reestenosis intra-stent (I25.5)"], "proc": ["TAVI (35.04)"], "tto": ["Aspirina 100mg (B01AC06)", "Dobutamina EV (C01CA07)", "Clopidogrel 300mg carga (B01AC04)"], "evo": "Pericarditis aguda con derrame leve, manejo antiinflamatorio", "dx_alta": ["Reestenosis intra-stent tratado (I25.5)"], "med": ["Prasugrel 10mg VO c/24h 12m (B01AC22)", "Aspirina 100mg VO c/24h (B01AC06)", "Furosemida 40mg VO c/24h (C03CA01)"]}, "output": "Ingresa por reestenosis intra-stent (I25.5). Se realiza tavi (35.04). En su evolucion, pericarditis aguda con derrame leve, manejo antiinflamatorio. Recibio tratamiento con Aspirina 100mg (B01AC06), Dobutamina EV (C01CA07) y Clopidogrel 300mg carga (B01AC04). Evolucion satisfactoria, cumpliendo criterios de alta. Alta con diagnostico de reestenosis intra-stent tratado (I25.5), indicandose Prasugrel 10mg VO c/24h 12m (B01AC22), Aspirina 100mg VO c/24h (B01AC06) y Furosemida 40mg VO c/24h (C03CA01)."}
{"input": {"dx": ["Angina inestable alto riesgo (I20.0)"], "proc": ["Coronariografia (K492)", "Angioplastia CD (K493)"], "tto": ["Clopidogrel 600mg carga (B01AC04)", "Prasugrel 60mg carga (B01AC22)", "Ticagrelor 180mg carga (B01AC24)", "Enoxaparina 60mg SC c/12h (B01AB05)"], "evo": "Enfermedad de multiples vasos, se deriva a cirugia cardiaca para bypass", "dx_alta": ["Angina inestable alto riesgo tratado (I20.0)"], "med": ["Losartan 50mg VO c/24h (C09CA01)", "Aspirina 100mg VO c/24h (B01AC06)", "Prasugrel 10mg VO c/24h 12m (B01AC22)", "Digoxina 0.125mg VO c/24h (C01AA05)", "Amlodipino 5mg VO c/24h (C08CA01)"]}, "output": "Ingreso por angina inestable alto riesgo (I20.0). Se realiza coronariografia (K492) encontrando lesion critica, realizandose angioplastia cd (K493) con implante de stent farmacoactivo y flujo TIMI 3 final. En su evolucion, enfermedad de multiples vasos, se deriva a cirugia cardiaca para bypass. Recibio tratamiento con Clopidogrel 600mg carga (B01AC04), Prasugrel 60mg carga (B01AC22), Ticagrelor 180mg carga (B01AC24) y Enoxaparina 60mg SC c/12h (B01AB05). Evolucion clinica favorable, cumpliendo criterios de alta. Alta con diagnostico de angina inestable alto riesgo tratado (I20.0), indicandose Losartan 50mg VO c/24h (C09CA01), Aspirina 100mg VO c/24h (B01AC06), Prasugrel 10mg VO c/24h 12m (B01AC22), Digoxina 0.125mg VO c/24h (C01AA05) y Amlodipino 5mg VO c/24h (C08CA01)."}
{"input": {"dx": ["Angina inestable alto riesgo (I20.0)"], "proc": ["Coronariografia (K492)", "Angioplastia TCI (36.06)"], "tto": ["Levosimendan EV (C01CX08)", "Aspirina 300mg carga (B01AC06)"], "evo": "Bloqueo AV completo sintomatico, requirio marcapasos transitorio", "dx_alta": ["Angina inestable alto riesgo tratado (I20.0)"], "med": ["Losartan 50mg VO c/24h (C09CA01)", "Furosemida 40mg VO c/24h (C03CA01)", "Metoprolol 50mg VO c/12h (C07AB02)", "Clopidogrel 75mg VO c/24h 12m (B01AC04)", "Enalapril 10mg VO c/12h (C09AA02)"]}, "output": "Se hospitaliza por angina inestable alto riesgo (I20.0). Se realiza coronariografia (K492) encontrando lesion critica, realizandose angioplastia tci (36.06) con implante de stent farmacoactivo y flujo TIMI 3 final. En su evolucion, bloqueo av completo sintomatico, requirio marcapasos transitorio. Recibio tratamiento con Levosimendan EV (C01CX08) y Aspirina 300mg carga (B01AC06). Buena evolucion, cumpliendo criterios de alta. Alta con diagnostico de angina inestable alto riesgo tratado (I20.0), indicandose Losartan 50mg VO c/24h (C09CA01), Furosemida 40mg VO c/24h (C03CA01), Metoprolol 50mg VO c/12h (C07AB02), Clopidogrel 75mg VO c/24h 12m (B01AC04) y Enalapril 10mg VO c/12h (C09AA02)."}
{"input": {"dx": ["Celulitis (L03.9)"], "proc": ["Ecografia abdominal (88.76)", "Colonoscopia (45.23)"], "tto": ["Omeprazol 40mg EV c/12h (A02BC01)", "Piperacilina/Tazobactam 4.5g EV c/8h (J01CR05)", "Meropenem 1g EV c/8h (J01DH02)"], "evo": "Mejoría clínica sostenida, cumple criterios de alta", "dx_alta": ["Celulitis resuelto (L03.9)"], "med": ["Hierro 100mg VO c/24h (B03AA07)", "Metformina 850mg VO c/12h (A10BA02)"]}, "output": "Ingresa por celulitis (L03.9). Se realiza ecografia abdominal (88.76), colonoscopia (45.23). Presenta, mejoría clínica sostenida, cumple criterios de alta. Recibio tratamiento con Omeprazol 40mg EV c/12h (A02BC01), Piperacilina/Tazobactam 4.5g EV c/8h (J01CR05) y Meropenem 1g EV c/8h (J01DH02). Buena evolucion, cumpliendo criterios de alta. Alta con diagnostico de celulitis resuelto (L03.9), indicandose Hierro 100mg VO c/24h (B03AA07) y Metformina 850mg VO c/12h (A10BA02)."}
{"input": {"dx": ["Estenosis aortica severa (I35.0)"], "proc": ["Ecografia abdominal (88.76)", "Trombectomia mecanica (39.74)"], "tto": ["Vancomicina 1g EV c/12h (J01XA01)", "Metronidazol 500mg EV c/8h (J01XD01)"], "evo": "Cirugia programada sin complicaciones, alta precoz", "dx_alta": ["Estenosis aortica severa resuelto (I35.0)"], "med": ["Clonazepam 0.5mg VO c/noche (N03AE01)", "Prednisona 20mg VO c/24h (H02AB07)"]}, "output": "Paciente que ingresa con cuadro de estenosis aortica severa (I35.0). Se realiza ecografia abdominal (88.76), trombectomia mecanica (39.74). Durante la hospitalizacion, cirugia programada sin complicaciones, alta precoz. Recibio tratamiento con Vancomicina 1g EV c/12h (J01XA01) y Metronidazol 500mg EV c/8h (J01XD01). Buena evolucion, cumpliendo criterios de alta. Alta con diagnostico de estenosis aortica severa resuelto (I35.0), indicandose Clonazepam 0.5mg VO c/noche (N03AE01) y Prednisona 20mg VO c/24h (H02AB07)."}
{"input": {"dx": ["Hernia inguinal (K40.9)"], "proc": ["Ecografia abdominal (88.76)"], "tto": ["Insulina cristalina segun esquema (A10AB01)", "Omeprazol 40mg EV c/12h (A02BC01)", "Insulina NPH 10UI SC c/12h (A10AC01)"], "evo": "Mejoría clínica sostenida, cumple criterios de alta", "dx_alta": ["Hernia inguinal resuelto (K40.9)"], "med": ["Glibenclamida 5mg VO c/24h (A10BB01)", "Salbutamol INH 2 puff c/6h PRN (R03AC02)"]}, "output": "Ingreso por hernia inguinal (K40.9). Se realiza ecografia abdominal (88.76). Presenta, mejoría clínica sostenida, cumple criterios de alta. Recibio tratamiento con Insulina cristalina segun esquema (A10AB01), Omeprazol 40mg EV c/12h (A02BC01) y Insulina NPH 10UI SC c/12h (A10AC01). Buena evolucion, cumpliendo criterios de alta. Alta con diagnostico de hernia inguinal resuelto (K40.9), indicandose Glibenclamida 5mg VO c/24h (A10BB01) y Salbutamol INH 2 puff c/6h PRN (R03AC02)."}
{"input": {"dx": ["IAMCEST posterior (I21.2)"], "proc": ["Coronariografia (K492)", "Angioplastia OM (K493)"], "tto": ["Heparina EV infusion (B01AB01)", "Amiodarona 300mg EV (C01BD01)"], "evo": "Fibrilacion auricular de alta respuesta, cardioversion farmacologica exitosa", "dx_alta": ["IAMCEST posterior tratado (I21.2)"], "med": ["Aspirina 100mg VO c/24h (B01AC06)", "Enalapril 10mg VO c/12h (C09AA02)", "Clopidogrel 75mg VO c/24h 12m (B01AC04)"]}, "output": "Ingresa por iamcest posterior (I21.2). Se realiza coronariografia (K492) visualizando estenosis severa, realizandose angioplastia om (K493) con implante de stent farmacoactivo y flujo TIMI 3 final. Evoluciona con, fibrilacion auricular de alta respuesta, cardioversion farmacologica exitosa. Recibio tratamiento con Heparina EV infusion (B01AB01) y Amiodarona 300mg EV (C01BD01). Presenta evolucion favorable, cumpliendo criterios de alta. Alta con diagnostico de iamcest posterior tratado (I21.2), indicandose Aspirina 100mg VO c/24h (B01AC06), Enalapril 10mg VO c/12h (C09AA02) y Clopidogrel 75mg VO c/24h 12m (B01AC04)."}
{"input": {"dx": ["Angina inestable (I20.0)"], "proc": ["Coronariografia (K492)"], "tto": ["Levosimendan EV (C01CX08)", "Clopidogrel 600mg carga (B01AC04)", "Nitroglicerina EV (C01DA02)"], "evo": "SDST en II, III, aVF, coronarias sin lesiones obstructivas, sindrome de Tako-Tsubo", "dx_alta": ["Angina inestable tratado (I20.0)"], "med": ["Nitroglicerina SL PRN (C01DA02)", "Losartan 50mg VO c/24h (C09CA01)", "Furosemida 40mg VO c/24h (C03CA01)", "Prasugrel 10mg VO c/24h 12m (B01AC22)"]}, "output": "Se hospitaliza por angina inestable (I20.0). Se realiza coronariografia (K492). En su evolucion, sdst en ii, iii, avf, coronarias sin lesiones obstructivas, sindrome de tako-tsubo. Recibio tratamiento con Levosimendan EV (C01CX08), Clopidogrel 600mg carga (B01AC04) y Nitroglicerina EV (C01DA02). Evolucion clinica favorable, cumpliendo criterios de alta. Alta con diagnostico de angina inestable tratado (I20.0), indicandose Nitroglicerina SL PRN (C01DA02), Losartan 50mg VO c/24h (C09CA01), Furosemida 40mg VO c/24h (C03CA01) y Prasugrel 10mg VO c/24h 12m (B01AC22)."}
{"input": {"dx": ["IAMCEST anterior (I21.0)"], "proc": ["Coronariografia (K492)", "Angioplastia OM (K493)"], "tto": ["Atorvastatina 80mg (C10AA05)", "Morfina 3mg EV (N02AA01)"], "evo": "Taquicardia ventricular sostenida, cardioversion electrica exitosa", "dx_alta": ["IAMCEST anterior tratado (I21.0)"], "med": ["Enalapril 10mg VO c/12h (C09AA02)", "Isosorbide 20mg VO c/8h (C01DA08)", "Atorvastatina 40mg VO c/noche (C10AA05)"]}, "output": "Paciente que ingresa con cuadro de iamcest anterior (I21.0). Se realiza coronariografia (K492) encontrando lesion critica, realizandose angioplastia om (K493) con implante de stent farmacoactivo y flujo TIMI 3 final. Presenta, taquicardia ventricular sostenida, cardioversion electrica exitosa. Recibio tratamiento con Atorvastatina 80mg (C10AA05) y Morfina 3mg EV (N02AA01). Buena evolucion, cumpliendo criterios de alta. Alta con diagnostico de iamcest anterior tratado (I21.0), indicandose Enalapril 10mg VO c/12h (C09AA02), Isosorbide 20mg VO c/8h (C01DA08) y Atorvastatina 40mg VO c/noche (C10AA05)."}
{"input": {"dx": ["IAMCEST inferior (I21.1)"], "proc": ["Coronariografia (K492)"], "tto": ["Digoxina 0.25mg EV (C01AA05)", "Heparina EV infusion (B01AB01)", "Enoxaparina 1mg/kg SC c/12h (B01AB05)"], "evo": "Fibrilacion auricular de alta respuesta, cardioversion farmacologica exitosa", "dx_alta": ["IAMCEST inferior tratado (I21.1)"], "med": ["Bisoprolol 5mg VO c/24h (C07AB07)", "Apixaban 5mg VO c/12h (B01AF02)", "Furosemida 40mg VO c/24h (C03CA01)", "Carvedilol 6.25mg VO c/12h (C07AG02)"]}, "output": "Se hospitaliza por iamcest inferior (I21.1). Se realiza coronariografia (K492). Presenta, fibrilacion auricular de alta respuesta, cardioversion farmacologica exitosa. Recibio tratamiento con Digoxina 0.25mg EV (C01AA05), Heparina EV infusion (B01AB01) y Enoxaparina 1mg/kg SC c/12h (B01AB05). Evolucion clinica favorable, cumpliendo criterios de alta. Alta con diagnostico de iamcest inferior tratado (I21.1), indicandose Bisoprolol 5mg VO c/24h (C07AB07), Apixaban 5mg VO c/12h (B01AF02), Furosemida 40mg VO c/24h (C03CA01) y Carvedilol 6.25mg VO c/12h (C07AG02)."}
{"input": {"dx": ["Apendicitis aguda (K35.8)"], "proc": ["Trombolisis EV (99.10)"], "tto": ["Paracetamol 1g EV c/8h (N02BE01)", "Metoclopramida 10mg EV c/8h (A03FA01)", "Metronidazol 500mg EV c/8h (J01XD01)", "Ondansetron 8mg EV c/8h (A04AA01)"], "evo": "Resolucion del cuadro agudo, alta con seguimiento ambulatorio", "dx_alta": ["Apendicitis aguda resuelto (K35.8)"], "med": ["Calcio 500mg VO c/12h (A12AA04)", "Vitamina D 1000UI VO c/24h (A11CC05)", "Insulina NPH 10UI SC c/12h (A10AC01)"]}, "output": "Paciente que ingresa con cuadro de apendicitis aguda (K35.8). Se realiza trombolisis ev (99.10). En su evolucion, resolucion del cuadro agudo, alta con seguimiento ambulatorio. Recibio tratamiento con Paracetamol 1g EV c/8h (N02BE01), Metoclopramida 10mg EV c/8h (A03FA01), Metronidazol 500mg EV c/8h (J01XD01) y Ondansetron 8mg EV c/8h (A04AA01). Buena evolucion, cumpliendo criterios de alta. Alta con diagnostico de apendicitis aguda resuelto (K35.8), indicandose Calcio 500mg VO c/12h (A12AA04), Vitamina D 1000UI VO c/24h (A11CC05) y Insulina NPH 10UI SC c/12h (A10AC01)."}
{"input": {"dx": ["Hipertension arterial severa (I10)"], "proc": ["Paracentesis (54.91)"], "tto": ["Metronidazol 500mg EV c/8h (J01XD01)", "Insulina NPH 10UI SC c/12h (A10AC01)", "Omeprazol 40mg EV c/12h (A02BC01)"], "evo": "Respuesta adecuada al tratamiento antibiotico, afebril desde dia 2", "dx_alta": ["Hipertension arterial severa resuelto (I10)"], "med": ["Amoxicilina/Clavulanico 875mg VO c/12h 7d (J01CR02)", "Budesonide/Formoterol INH c/12h (R03AK07)", "Vitamina D 1000UI VO c/24h (A11CC05)"]}, "output": "Ingreso por hipertension arterial severa (I10). Se realiza paracentesis (54.91). En su evolucion, respuesta adecuada al tratamiento antibiotico, afebril desde dia 2. Recibio tratamiento con Metronidazol 500mg EV c/8h (J01XD01), Insulina NPH 10UI SC c/12h (A10AC01) y Omeprazol 40mg EV c/12h (A02BC01). Buena evolucion, cumpliendo criterios de alta. Alta con diagnostico de hipertension arterial severa resuelto (I10), indicandose Amoxicilina/Clavulanico 875mg VO c/12h 7d (J01CR02), Budesonide/Formoterol INH c/12h (R03AK07) y Vitamina D 1000UI VO c/24h (A11CC05)."}
{"input": {"dx": ["Hemorragia digestiva alta (K92.2)"], "proc": ["Osteosintesis de cadera (79.35)"], "tto": ["Meropenem 1g EV c/8h (J01DH02)", "Ondansetron 8mg EV c/8h (A04AA01)"], "evo": "Estabilizacion clinica progresiva, sin eventos adversos", "dx_alta": ["Hemorragia digestiva alta resuelto (K92.2)"], "med": ["Tramadol 50mg VO c/8h 7d (N02AX02)", "Prednisona 20mg VO c/24h (H02AB07)", "Calcio 500mg VO c/12h (A12AA04)", "Glibenclamida 5mg VO c/24h (A10BB01)"]}, "output": "Ingreso por hemorragia digestiva alta (K92.2). Se realiza osteosintesis de cadera (79.35). En su evolucion, estabilizacion clinica progresiva, sin eventos adversos. Recibio tratamiento con Meropenem 1g EV c/8h (J01DH02) y Ondansetron 8mg EV c/8h (A04AA01). Evolucion clinica favorable, cumpliendo criterios de alta. Alta con diagnostico de hemorragia digestiva alta resuelto (K92.2), indicandose Tramadol 50mg VO c/8h 7d (N02AX02), Prednisona 20mg VO c/24h (H02AB07), Calcio 500mg VO c/12h (A12AA04) y Glibenclamida 5mg VO c/24h (A10BB01)."}
{"input": {"dx": ["Reestenosis intra-stent (I25.5)"], "proc": ["Implante de DAI (K493)"], "tto": ["Clopidogrel 600mg carga (B01AC04)", "Noradrenalina EV (C01CA03)", "Furosemida 80mg EV (C03CA01)"], "evo": "Estenosis aortica severa sintomatica, programada para TAVI", "dx_alta": ["Reestenosis intra-stent tratado (I25.5)"], "med": ["Nitroglicerina SL PRN (C01DA02)", "Atorvastatina 40mg VO c/noche (C10AA05)", "Apixaban 5mg VO c/12h (B01AF02)", "Ticagrelor 90mg VO c/12h 12m (B01AC24)"]}, "output": "Ingreso por reestenosis intra-stent (I25.5). Se realiza implante de dai (K493). Durante la hospitalizacion, estenosis aortica severa sintomatica, programada para tavi. Recibio tratamiento con Clopidogrel 600mg carga (B01AC04), Noradrenalina EV (C01CA03) y Furosemida 80mg EV (C03CA01). Evolucion satisfactoria, cumpliendo criterios de alta. Alta con diagnostico de reestenosis intra-stent tratado (I25.5), indicandose Nitroglicerina SL PRN (C01DA02), Atorvastatina 40mg VO c/noche (C10AA05), Apixaban 5mg VO c/12h (B01AF02) y Ticagrelor 90mg VO c/12h 12m (B01AC24)."}
{"input": {"dx": ["IAMCEST posterior (I21.2)"], "proc": ["Coronariografia (K492)", "Angioplastia CD (36.06)"], "tto": ["Enoxaparina 60mg SC c/12h (B01AB05)", "Dobutamina EV (C01CA07)", "Enoxaparina 1mg/kg SC c/12h (B01AB05)"], "evo": "Shock cardiogenico, requirio soporte con inotropicos, evolucion favorable", "dx_alta": ["IAMCEST posterior tratado (I21.2)"], "med": ["Espironolactona 25mg VO c/24h (C03DA01)", "Clopidogrel 75mg VO c/24h 12m (B01AC04)", "Ticagrelor 90mg VO c/12h 12m (B01AC24)", "Warfarina segun INR (B01AA03)"]}, "output": "Paciente que ingresa con cuadro de iamcest posterior (I21.2). Se realiza coronariografia (K492) encontrando lesion critica, realizandose angioplastia cd (36.06) con implante de stent farmacoactivo y flujo TIMI 3 final. En su evolucion, shock cardiogenico, requirio soporte con inotropicos, evolucion favorable. Recibio tratamiento con Enoxaparina 60mg SC c/12h (B01AB05), Dobutamina EV (C01CA07) y Enoxaparina 1mg/kg SC c/12h (B01AB05). Evolucion clinica favorable, cumpliendo criterios de alta. Alta con diagnostico de iamcest posterior tratado (I21.2), indicandose Espironolactona 25mg VO c/24h (C03DA01), Clopidogrel 75mg VO c/24h 12m (B01AC04), Ticagrelor 90mg VO c/12h 12m (B01AC24) y Warfarina segun INR (B01AA03)."}
{"input": {"dx": ["Angina inestable (I20.0)"], "proc": ["Coronariografia (K492)", "Angioplastia OM (36.06)"], "tto": ["Clopidogrel 600mg carga (B01AC04)", "Digoxina 0.25mg EV (C01AA05)"], "evo": "Lesion critica de CD media, estabilizacion hemodinamica, angioplastia diferida", "dx_alta": ["Angina inestable tratado (I20.0)"], "med": ["Enalapril 10mg VO c/12h (C09AA02)", "Metoprolol 50mg VO c/12h (C07AB02)", "Carvedilol 6.25mg VO c/12h (C07AG02)", "Ticagrelor 90mg VO c/12h 12m (B01AC24)", "Aspirina 100mg VO c/24h (B01AC06)"]}, "output": "Ingreso por angina inestable (I20.0). Se realiza coronariografia (K492) evidenciando oclusion aguda, realizandose angioplastia om (36.06) con implante de stent farmacoactivo y flujo TIMI 3 final. Presenta, lesion critica de cd media, estabilizacion hemodinamica, angioplastia diferida. Recibio tratamiento con Clopidogrel 600mg carga (B01AC04) y Digoxina 0.25mg EV (C01AA05). Presenta evolucion favorable, cumpliendo criterios de alta. Alta con diagnostico de angina inestable tratado (I20.0), indicandose Enalapril 10mg VO c/12h (C09AA02), Metoprolol 50mg VO c/12h (C07AB02), Carvedilol 6.25mg VO c/12h (C07AG02), Ticagrelor 90mg VO c/12h 12m (B01AC24) y Aspirina 100mg VO c/24h (B01AC06)."}
{"input": {"dx": ["Insuficiencia cardiaca aguda (I50.9)"], "proc": ["Angioplastia (K492)"], "tto": ["Atorvastatina 80mg (C10AA05)", "Morfina 3mg EV (N02AA01)", "Enoxaparina 1mg/kg SC c/12h (B01AB05)", "Prasugrel 60mg carga (B01AC22)"], "evo": "Oclusion aguda de CD proximal, angioplastia exitosa con stent farmacoactivo, flujo TIMI 3 final", "dx_alta": ["Insuficiencia cardiaca aguda tratado (I50.9)"], "med": ["Isosorbide 20mg VO c/8h (C01DA08)", "Bisoprolol 5mg VO c/24h (C07AB07)", "Losartan 50mg VO c/24h (C09CA01)", "Digoxina 0.125mg VO c/24h (C01AA05)", "Amlodipino 5mg VO c/24h (C08CA01)"]}, "output": "Ingreso por insuficiencia cardiaca aguda (I50.9). Se realiza angioplastia (K492). Evoluciona con, oclusion aguda de cd proximal, angioplastia exitosa con stent farmacoactivo, flujo timi 3 final. Recibio tratamiento con Atorvastatina 80mg (C10AA05), Morfina 3mg EV (N02AA01), Enoxaparina 1mg/kg SC c/12h (B01AB05) y Prasugrel 60mg carga (B01AC22). Evolucion clinica favorable, cumpliendo criterios de alta. Alta con diagnostico de insuficiencia cardiaca aguda tratado (I50.9), indicandose Isosorbide 20mg VO c/8h (C01DA08), Bisoprolol 5mg VO c/24h (C07AB07), Losartan 50mg VO c/24h (C09CA01), Digoxina 0.125mg VO c/24h (C01AA05) y Amlodipino 5mg VO c/24h (C08CA01)."}
{"input": {"dx": ["Reestenosis intra-stent (I25.5)"], "proc": ["Angioplastia CX (88.72)"], "tto": ["Furosemida 40mg EV (C03CA01)", "Morfina 3mg EV (N02AA01)", "Furosemida 80mg EV (C03CA01)", "Aspirina 300mg carga (B01AC06)"], "evo": "Enfermedad de multiples vasos, se deriva a cirugia cardiaca para bypass", "dx_alta": ["Reestenosis intra-stent tratado (I25.5)"], "med": ["Aspirina 100mg VO c/24h (B01AC06)", "Ticagrelor 90mg VO c/12h 12m (B01AC24)", "Digoxina 0.125mg VO c/24h (C01AA05)"]}, "output": "Paciente que ingresa con cuadro de reestenosis intra-stent (I25.5). Se realiza angioplastia cx (88.72). Evoluciona con, enfermedad de multiples vasos, se deriva a cirugia cardiaca para bypass. Recibio tratamiento con Furosemida 40mg EV (C03CA01), Morfina 3mg EV (N02AA01), Furosemida 80mg EV (C03CA01) y Aspirina 300mg carga (B01AC06). Evolucion satisfactoria, cumpliendo criterios de alta. Alta con diagnostico de reestenosis intra-stent tratado (I25.5), indicandose Aspirina 100mg VO c/24h (B01AC06), Ticagrelor 90mg VO c/12h 12m (B01AC24) y Digoxina 0.125mg VO c/24h (C01AA05)."}
{"input": {"dx": ["Sincope (R55)"], "proc": ["Colonoscopia (45.23)"], "tto": ["Ciprofloxacino 400mg EV c/12h (J01MA02)", "Metronidazol 500mg EV c/8h (J01XD01)", "N-acetilcisteina NBZ c/8h (R05CB01)", "Metamizol 1g EV c/8h (N02BB02)"], "evo": "Resolucion del cuadro agudo, alta con seguimiento ambulatorio", "dx_alta": ["Sincope resuelto (R55)"], "med": ["Acido folico 1mg VO c/24h (B03BB01)", "Calcio 500mg VO c/12h (A12AA04)", "Hierro 100mg VO c/24h (B03AA07)", "Metformina 850mg VO c/12h (A10BA02)"]}, "output": "Paciente que ingresa con cuadro de sincope (R55). Se realiza colonoscopia (45.23). En su evolucion, resolucion del cuadro agudo, alta con seguimiento ambulatorio. Recibio tratamiento con Ciprofloxacino 400mg EV c/12h (J01MA02), Metronidazol 500mg EV c/8h (J01XD01), N-acetilcisteina NBZ c/8h (R05CB01) y Metamizol 1g EV c/8h (N02BB02). Evolucion satisfactoria, cumpliendo criterios de alta. Alta con diagnostico de sincope resuelto (R55), indicandose Acido folico 1mg VO c/24h (B03BB01), Calcio 500mg VO c/12h (A12AA04), Hierro 100mg VO c/24h (B03AA07) y Metformina 850mg VO c/12h (A10BA02)."}
{"input": {"dx": ["Edema pulmonar agudo (J81)"], "proc": ["Valvuloplastia mitral (89.50)"], "tto": ["Enalapril 5mg VO (C09AA02)", "Ticagrelor 180mg carga (B01AC24)", "Furosemida 80mg EV (C03CA01)", "Atorvastatina 80mg (C10AA05)"], "evo": "Edema pulmonar agudo por disfuncion sistolica, respuesta favorable a diureticos", "dx_alta": ["Edema pulmonar agudo tratado (J81)"], "med": ["Isosorbide 20mg VO c/8h (C01DA08)", "Espironolactona 25mg VO c/24h (C03DA01)", "Carvedilol 6.25mg VO c/12h (C07AG02)"]}, "output": "Ingresa por edema pulmonar agudo (J81). Se realiza valvuloplastia mitral (89.50). Evoluciona con, edema pulmonar agudo por disfuncion sistolica, respuesta favorable a diureticos. Recibio tratamiento con Enalapril 5mg VO (C09AA02), Ticagrelor 180mg carga (B01AC24), Furosemida 80mg EV (C03CA01) y Atorvastatina 80mg (C10AA05). Presenta evolucion favorable, cumpliendo criterios de alta. Alta con diagnostico de edema pulmonar agudo tratado (J81), indicandose Isosorbide 20mg VO c/8h (C01DA08), Espironolactona 25mg VO c/24h (C03DA01) y Carvedilol 6.25mg VO c/12h (C07AG02)."}
{"input": {"dx": ["Trombosis de stent (I21.0)"], "proc": ["Test de esfuerzo (37.0)"], "tto": ["Enoxaparina 60mg SC c/12h (B01AB05)", "Enalapril 5mg VO (C09AA02)", "Dobutamina EV (C01CA07)", "Clopidogrel 300mg carga (B01AC04)"], "evo": "Bloqueo AV completo sintomatico, requirio marcapasos transitorio", "dx_alta": ["Trombosis de stent tratado (I21.0)"], "med": ["Nitroglicerina SL PRN (C01DA02)", "Isosorbide 20mg VO c/8h (C01DA08)", "Enalapril 10mg VO c/12h (C09AA02)", "Clopidogrel 75mg VO c/24h 12m (B01AC04)", "Losartan 50mg VO c/24h (C09CA01)"]}, "output": "Ingresa por trombosis de stent (I21.0). Se realiza test de esfuerzo (37.0). Evoluciona con, bloqueo av completo sintomatico, requirio marcapasos transitorio. Recibio tratamiento con Enoxaparina 60mg SC c/12h (B01AB05), Enalapril 5mg VO (C09AA02), Dobutamina EV (C01CA07) y Clopidogrel 300mg carga (B01AC04). Evolucion satisfactoria, cumpliendo criterios de alta. Alta con diagnostico de trombosis de stent tratado (I21.0), indicandose Nitroglicerina SL PRN (C01DA02), Isosorbide 20mg VO c/8h (C01DA08), Enalapril 10mg VO c/12h (C09AA02), Clopidogrel 75mg VO c/24h 12m (B01AC04) y Losartan 50mg VO c/24h (C09CA01)."}
{"input": {"dx": ["Reestenosis intra-stent (I25.5)"], "proc": ["Ablacion por radiofrecuencia (89.64)"], "tto": ["Prasugrel 60mg carga (B01AC22)", "Aspirina 100mg (B01AC06)", "Heparina EV infusion (B01AB01)"], "evo": "Pericarditis aguda con derrame leve, manejo antiinflamatorio", "dx_alta": ["Reestenosis intra-stent tratado (I25.5)"], "med": ["Isosorbide 20mg VO c/8h (C01DA08)", "Rosuvastatina 20mg VO c/noche (C10AA07)", "Clopidogrel 75mg VO c/24h 12m (B01AC04)", "Espironolactona 25mg VO c/24h (C03DA01)", "Apixaban 5mg VO c/12h (B01AF02)"]}, "output": "Ingresa por reestenosis intra-stent (I25.5). Se realiza ablacion por radiofrecuencia (89.64). Presenta, pericarditis aguda con derrame leve, manejo antiinflamatorio. Recibio tratamiento con Prasugrel 60mg carga (B01AC22), Aspirina 100mg (B01AC06) y Heparina EV infusion (B01AB01). Presenta evolucion favorable, cumpliendo criterios de alta. Alta con diagnostico de reestenosis intra-stent tratado (I25.5), indicandose Isosorbide 20mg VO c/8h (C01DA08), Rosuvastatina 20mg VO c/noche (C10AA07), Clopidogrel 75mg VO c/24h 12m (B01AC04), Espironolactona 25mg VO c/24h (C03DA01) y Apixaban 5mg VO c/12h (B01AF02)."}
{"input": {"dx": ["IAMCEST lateral (I21.2)"], "proc": ["Coronariografia (K492)"], "tto": ["Ticagrelor 180mg carga (B01AC24)", "Aspirina 300mg carga (B01AC06)"], "evo": "Edema pulmonar agudo por disfuncion sistolica, respuesta favorable a diureticos", "dx_alta": ["IAMCEST lateral tratado (I21.2)"], "med": ["Aspirina 100mg VO c/24h (B01AC06)", "Prasugrel 10mg VO c/24h 12m (B01AC22)", "Apixaban 5mg VO c/12h (B01AF02)", "Rivaroxaban 20mg VO c/24h (B01AF01)"]}, "output": "Ingreso por iamcest lateral (I21.2). Se realiza coronariografia (K492). Presenta, edema pulmonar agudo por disfuncion sistolica, respuesta favorable a diureticos. Recibio tratamiento con Ticagrelor 180mg carga (B01AC24) y Aspirina 300mg carga (B01AC06). Evolucion clinica favorable, cumpliendo criterios de alta. Alta con diagnostico de iamcest lateral tratado (I21.2), indicandose Aspirina 100mg VO c/24h (B01AC06), Prasugrel 10mg VO c/24h 12m (B01AC22), Apixaban 5mg VO c/12h (B01AF02) y Rivaroxaban 20mg VO c/24h (B01AF01)."}
{"input": {"dx": ["IAMSEST (I21.4)"], "proc": ["Coronariografia (K492)", "Angioplastia OM (K493)"], "tto": ["Enoxaparina 60mg SC c/12h (B01AB05)", "Aspirina 300mg carga (B01AC06)", "Dobutamina EV (C01CA07)"], "evo": "Oclusion de TCI con trombo, trombectomia por aspiracion mas stent", "dx_alta": ["IAMSEST tratado (I21.4)"], "med": ["Atorvastatina 40mg VO c/noche (C10AA05)", "Furosemida 40mg VO c/24h (C03CA01)", "Apixaban 5mg VO c/12h (B01AF02)", "Warfarina segun INR (B01AA03)"]}, "output": "Se hospitaliza por iamsest (I21.4). Se realiza coronariografia (K492) encontrando lesion critica, realizandose angioplastia om (K493) con implante de stent farmacoactivo y flujo TIMI 3 final. Presenta, oclusion de tci con trombo, trombectomia por aspiracion mas stent. Recibio tratamiento con Enoxaparina 60mg SC c/12h (B01AB05), Aspirina 300mg carga (B01AC06) y Dobutamina EV (C01CA07). Presenta evolucion favorable, cumpliendo criterios de alta. Alta con diagnostico de iamsest tratado (I21.4), indicandose Atorvastatina 40mg VO c/noche (C10AA05), Furosemida 40mg VO c/24h (C03CA01), Apixaban 5mg VO c/12h (B01AF02) y Warfarina segun INR (B01AA03)."}
{"input": {"dx": ["Enfermedad de TCI (I25.1)"], "proc": ["Implante de DAI (35.04)"], "tto": ["Metoprolol 5mg EV (C07AB02)", "Atorvastatina 80mg (C10AA05)", "Clopidogrel 300mg carga (B01AC04)"], "evo": "Fibrilacion auricular de alta respuesta, cardioversion farmacologica exitosa", "dx_alta": ["Enfermedad de TCI tratado (I25.1)"], "med": ["Rosuvastatina 20mg VO c/noche (C10AA07)", "Rivaroxaban 20mg VO c/24h (B01AF01)", "Amlodipino 5mg VO c/24h (C08CA01)", "Metoprolol 50mg VO c/12h (C07AB02)"]}, "output": "Ingresa por enfermedad de tci (I25.1). Se realiza implante de dai (35.04). Presenta, fibrilacion auricular de alta respuesta, cardioversion farmacologica exitosa. Recibio tratamiento con Metoprolol 5mg EV (C07AB02), Atorvastatina 80mg (C10AA05) y Clopidogrel 300mg carga (B01AC04). Evolucion satisfactoria, cumpliendo criterios de alta. Alta con diagnostico de enfermedad de tci tratado (I25.1), indicandose Rosuvastatina 20mg VO c/noche (C10AA07), Rivaroxaban 20mg VO c/24h (B01AF01), Amlodipino 5mg VO c/24h (C08CA01) y Metoprolol 50mg VO c/12h (C07AB02)."}
{"input": {"dx": ["Angina inestable alto riesgo (I20.0)"], "proc": ["Coronariografia (K492)", "Angioplastia DA (K493)"], "tto": ["Levosimendan EV (C01CX08)", "Morfina 3mg EV (N02AA01)", "Furosemida 80mg EV (C03CA01)", "Dobutamina EV (C01CA07)"], "evo": "Shock cardiogenico, requirio soporte con inotropicos, evolucion favorable", "dx_alta": ["Angina inestable alto riesgo tratado (I20.0)"], "med": ["Rosuvastatina 20mg VO c/noche (C10AA07)", "Prasugrel 10mg VO c/24h 12m (B01AC22)", "Digoxina 0.125mg VO c/24h (C01AA05)", "Bisoprolol 5mg VO c/24h (C07AB07)"]}, "output": "Ingreso por angina inestable alto riesgo (I20.0). Se realiza coronariografia (K492) evidenciando oclusion aguda, realizandose angioplastia da (K493) con implante de stent farmacoactivo y flujo TIMI 3 final. En su evolucion, shock cardiogenico, requirio soporte con inotropicos, evolucion favorable. Recibio tratamiento con Levosimendan EV (C01CX08), Morfina 3mg EV (N02AA01), Furosemida 80mg EV (C03CA01) y Dobutamina EV (C01CA07). Buena evolucion, cumpliendo criterios de alta. Alta con diagnostico de angina inestable alto riesgo tratado (I20.0), indicandose Rosuvastatina 20mg VO c/noche (C10AA07), Prasugrel 10mg VO c/24h 12m (B01AC22), Digoxina 0.125mg VO c/24h (C01AA05) y Bisoprolol 5mg VO c/24h (C07AB07)."}
{"input": {"dx": ["IAMCEST inferolateral (I21.1)"], "proc": ["Coronariografia (K492)", "Angioplastia DA (K493)"], "tto": ["Heparina 5000UI EV (B01AB01)", "Furosemida 80mg EV (C03CA01)"], "evo": "Lesion severa de OM1, angioplastia con implante de stent sin complicaciones", "dx_alta": ["IAMCEST inferolateral tratado (I21.1)"], "med": ["Furosemida 40mg VO c/24h (C03CA01)", "Carvedilol 6.25mg VO c/12h (C07AG02)", "Atorvastatina 40mg VO c/noche (C10AA05)", "Enalapril 10mg VO c/12h (C09AA02)", "Rosuvastatina 20mg VO c/noche (C10AA07)"]}, "output": "Paciente que ingresa con cuadro de iamcest inferolateral (I21.1). Se realiza coronariografia (K492) encontrando lesion critica, realizandose angioplastia da (K493) con implante de stent farmacoactivo y flujo TIMI 3 final. Durante la hospitalizacion, lesion severa de om1, angioplastia con implante de stent sin complicaciones. Recibio tratamiento con Heparina 5000UI EV (B01AB01) y Furosemida 80mg EV (C03CA01). Presenta evolucion favorable, cumpliendo criterios de alta. Alta con diagnostico de iamcest inferolateral tratado (I21.1), indicandose Furosemida 40mg VO c/24h (C03CA01), Carvedilol 6.25mg VO c/12h (C07AG02), Atorvastatina 40mg VO c/noche (C10AA05), Enalapril 10mg VO c/12h (C09AA02) y Rosuvastatina 20mg VO c/noche (C10AA07)."}
{"input": {"dx": ["Shock cardiogenico (R57.0)"], "proc": ["Ecocardiograma (K493)"], "tto": ["Enoxaparina 1mg/kg SC c/12h (B01AB05)", "Enoxaparina 60mg SC c/12h (B01AB05)", "Dobutamina EV (C01CA07)", "Aspirina 300mg carga (B01AC06)"], "evo": "Fibrilacion auricular de alta respuesta, cardioversion farmacologica exitosa", "dx_alta": ["Shock cardiogenico tratado (R57.0)"], "med": ["Prasugrel 10mg VO c/24h 12m (B01AC22)", "Apixaban 5mg VO c/12h (B01AF02)", "Rosuvastatina 20mg VO c/noche (C10AA07)"]}, "output": "Se hospitaliza por shock cardiogenico (R57.0). Se realiza ecocardiograma (K493). Evoluciona con, fibrilacion auricular de alta respuesta, cardioversion farmacologica exitosa. Recibio tratamiento con Enoxaparina 1mg/kg SC c/12h (B01AB05), Enoxaparina 60mg SC c/12h (B01AB05), Dobutamina EV (C01CA07) y Aspirina 300mg carga (B01AC06). Presenta evolucion favorable, cumpliendo criterios de alta. Alta con diagnostico de shock cardiogenico tratado (R57.0), indicandose Prasugrel 10mg VO c/24h 12m (B01AC22), Apixaban 5mg VO c/12h (B01AF02) y Rosuvastatina 20mg VO c/noche (C10AA07)."}
{"input": {"dx": ["IAMSEST alto riesgo (I21.4)"], "proc": ["Coronariografia (K492)", "Angioplastia CX (36.06)"], "tto": ["Enoxaparina 60mg SC c/12h (B01AB05)", "Ticagrelor 180mg carga (B01AC24)"], "evo": "Estenosis aortica severa sintomatica, programada para TAVI", "dx_alta": ["IAMSEST alto riesgo tratado (I21.4)"], "med": ["Losartan 50mg VO c/24h (C09CA01)", "Clopidogrel 75mg VO c/24h 12m (B01AC04)", "Rosuvastatina 20mg VO c/noche (C10AA07)", "Nitroglicerina SL PRN (C01DA02)"]}, "output": "Paciente que ingresa con cuadro de iamsest alto riesgo (I21.4). Se realiza coronariografia (K492) con hallazgo de lesion significativa, realizandose angioplastia cx (36.06) con implante de stent farmacoactivo y flujo TIMI 3 final. Durante la hospitalizacion, estenosis aortica severa sintomatica, programada para tavi. Recibio tratamiento con Enoxaparina 60mg SC c/12h (B01AB05) y Ticagrelor 180mg carga (B01AC24). Evolucion satisfactoria, cumpliendo criterios de alta. Alta con diagnostico de iamsest alto riesgo tratado (I21.4), indicandose Losartan 50mg VO c/24h (C09CA01), Clopidogrel 75mg VO c/24h 12m (B01AC04), Rosuvastatina 20mg VO c/noche (C10AA07) y Nitroglicerina SL PRN (C01DA02)."}
{"input": {"dx": ["Miocarditis (I40.9)"], "proc": ["Colecistectomia laparoscopica (51.23)", "Trombectomia mecanica (39.74)"], "tto": ["Paracetamol 1g EV c/8h (N02BE01)", "Hidrocortisona 100mg EV c/8h (H02AB09)"], "evo": "Control de sintomas con tratamiento medico optimizado", "dx_alta": ["Miocarditis resuelto (I40.9)"], "med": ["Amoxicilina/Clavulanico 875mg VO c/12h 7d (J01CR02)", "Calcio 500mg VO c/12h (A12AA04)"]}, "output": "Se hospitaliza por miocarditis (I40.9). Se realiza colecistectomia laparoscopica (51.23), trombectomia mecanica (39.74). Durante la hospitalizacion, control de sintomas con tratamiento medico optimizado. Recibio tratamiento con Paracetamol 1g EV c/8h (N02BE01) y Hidrocortisona 100mg EV c/8h (H02AB09). Presenta evolucion favorable, cumpliendo criterios de alta. Alta con diagnostico de miocarditis resuelto (I40.9), indicandose Amoxicilina/Clavulanico 875mg VO c/12h 7d (J01CR02) y Calcio 500mg VO c/12h (A12AA04)."}
{"input": {"dx": ["Edema pulmonar agudo (J81)"], "proc": ["Test de esfuerzo (37.0)"], "tto": ["Metoprolol 5mg EV (C07AB02)", "Aspirina 300mg carga (B01AC06)"], "evo": "Shock cardiogenico, requirio soporte con inotropicos, evolucion favorable", "dx_alta": ["Edema pulmonar agudo tratado (J81)"], "med": ["Bisoprolol 5mg VO c/24h (C07AB07)", "Rosuvastatina 20mg VO c/noche (C10AA07)", "Rivaroxaban 20mg VO c/24h (B01AF01)"]}, "output": "Se hospitaliza por edema pulmonar agudo (J81). Se realiza test de esfuerzo (37.0). Evoluciona con, shock cardiogenico, requirio soporte con inotropicos, evolucion favorable. Recibio tratamiento con Metoprolol 5mg EV (C07AB02) y Aspirina 300mg carga (B01AC06). Presenta evolucion favorable, cumpliendo criterios de alta. Alta con diagnostico de edema pulmonar agudo tratado (J81), indicandose Bisoprolol 5mg VO c/24h (C07AB07), Rosuvastatina 20mg VO c/noche (C10AA07) y Rivaroxaban 20mg VO c/24h (B01AF01)."}
{"input": {"dx": ["Reestenosis intra-stent (I25.5)"], "proc": ["Valvuloplastia mitral (89.64)"], "tto": ["Enoxaparina 60mg SC c/12h (B01AB05)", "Atorvastatina 80mg (C10AA05)", "Clopidogrel 300mg carga (B01AC04)"], "evo": "Oclusion aguda de CX distal, angioplastia exitosa con stent farmacoactivo, flujo TIMI 3 final", "dx_alta": ["Reestenosis intra-stent tratado (I25.5)"], "med": ["Isosorbide 20mg VO c/8h (C01DA08)", "Nitroglicerina SL PRN (C01DA02)", "Carvedilol 6.25mg VO c/12h (C07AG02)"]}, "output": "Se hospitaliza por reestenosis intra-stent (I25.5). Se realiza valvuloplastia mitral (89.64). Presenta, oclusion aguda de cx distal, angioplastia exitosa con stent farmacoactivo, flujo timi 3 final. Recibio tratamiento con Enoxaparina 60mg SC c/12h (B01AB05), Atorvastatina 80mg (C10AA05) y Clopidogrel 300mg carga (B01AC04). Evolucion satisfactoria, cumpliendo criterios de alta. Alta con diagnostico de reestenosis intra-stent tratado (I25.5), indicandose Isosorbide 20mg VO c/8h (C01DA08), Nitroglicerina SL PRN (C01DA02) y Carvedilol 6.25mg VO c/12h (C07AG02)."}
{"input": {"dx": ["IAMCEST lateral (I21.2)"], "proc": ["Coronariografia (K492)", "Angioplastia CX (K493)"], "tto": ["Prasugrel 60mg carga (B01AC22)", "Levosimendan EV (C01CX08)", "Clopidogrel 600mg carga (B01AC04)"], "evo": "Oclusion de OM1 con trombo, trombectomia por aspiracion mas stent", "dx_alta": ["IAMCEST lateral tratado (I21.2)"], "med": ["Warfarina segun INR (B01AA03)", "Enalapril 10mg VO c/12h (C09AA02)", "Bisoprolol 5mg VO c/24h (C07AB07)", "Prasugrel 10mg VO c/24h 12m (B01AC22)"]}, "output": "Se hospitaliza por iamcest lateral (I21.2). Se realiza coronariografia (K492) con hallazgo de lesion significativa, realizandose angioplastia cx (K493) con implante de stent farmacoactivo y flujo TIMI 3 final. Durante la hospitalizacion, oclusion de om1 con trombo, trombectomia por aspiracion mas stent. Recibio tratamiento con Prasugrel 60mg carga (B01AC22), Levosimendan EV (C01CX08) y Clopidogrel 600mg carga (B01AC04). Evolucion satisfactoria, cumpliendo criterios de alta. Alta con diagnostico de iamcest lateral tratado (I21.2), indicandose Warfarina segun INR (B01AA03), Enalapril 10mg VO c/12h (C09AA02), Bisoprolol 5mg VO c/24h (C07AB07) y Prasugrel 10mg VO c/24h 12m (B01AC22)."}
{"input": {"dx": ["Sincope (R55)"], "proc": ["Apendicectomia (47.09)"], "tto": ["Salbutamol NBZ c/4h (R03AC02)", "Morfina 3mg EV c/4h PRN (N02AA01)"], "evo": "Resolucion del cuadro agudo, alta con seguimiento ambulatorio", "dx_alta": ["Sincope resuelto (R55)"], "med": ["Tramadol 50mg VO c/8h 7d (N02AX02)", "Prednisona 20mg VO c/24h (H02AB07)", "Vitamina D 1000UI VO c/24h (A11CC05)"]}, "output": "Ingreso por sincope (R55). Se realiza apendicectomia (47.09). Durante la hospitalizacion, resolucion del cuadro agudo, alta con seguimiento ambulatorio. Recibio tratamiento con Salbutamol NBZ c/4h (R03AC02) y Morfina 3mg EV c/4h PRN (N02AA01). Presenta evolucion favorable, cumpliendo criterios de alta. Alta con diagnostico de sincope resuelto (R55), indicandose Tramadol 50mg VO c/8h 7d (N02AX02), Prednisona 20mg VO c/24h (H02AB07) y Vitamina D 1000UI VO c/24h (A11CC05)."}
{"input": {"dx": ["Angina inestable alto riesgo (I20.0)"], "proc": ["Coronariografia (K492)", "Angioplastia DA (36.06)"], "tto": ["Clopidogrel 600mg carga (B01AC04)", "Levosimendan EV (C01CX08)"], "evo": "Shock cardiogenico, requirio soporte con inotropicos, evolucion favorable", "dx_alta": ["Angina inestable alto riesgo tratado (I20.0)"], "med": ["Nitroglicerina SL PRN (C01DA02)", "Rivaroxaban 20mg VO c/24h (B01AF01)", "Atorvastatina 40mg VO c/noche (C10AA05)", "Ticagrelor 90mg VO c/12h 12m (B01AC24)", "Clopidogrel 75mg VO c/24h 12m (B01AC04)"]}, "output": "Paciente que ingresa con cuadro de angina inestable alto riesgo (I20.0). Se realiza coronariografia (K492) con hallazgo de lesion significativa, realizandose angioplastia da (36.06) con implante de stent farmacoactivo y flujo TIMI 3 final. Durante la hospitalizacion, shock cardiogenico, requirio soporte con inotropicos, evolucion favorable. Recibio tratamiento con Clopidogrel 600mg carga (B01AC04) y Levosimendan EV (C01CX08). Evolucion satisfactoria, cumpliendo criterios de alta. Alta con diagnostico de angina inestable alto riesgo tratado (I20.0), indicandose Nitroglicerina SL PRN (C01DA02), Rivaroxaban 20mg VO c/24h (B01AF01), Atorvastatina 40mg VO c/noche (C10AA05), Ticagrelor 90mg VO c/12h 12m (B01AC24) y Clopidogrel 75mg VO c/24h 12m (B01AC04)."}
{"input": {"dx": ["Hemorragia digestiva alta (K92.2)"], "proc": ["Hernioplastia inguinal (53.00)"], "tto": ["N-acetilcisteina NBZ c/8h (R05CB01)", "Paracetamol 1g EV c/8h (N02BE01)", "Omeprazol 40mg EV c/12h (A02BC01)", "Metamizol 1g EV c/8h (N02BB02)"], "evo": "Evolucion favorable con tratamiento medico, sin complicaciones", "dx_alta": ["Hemorragia digestiva alta resuelto (K92.2)"], "med": ["Amoxicilina/Clavulanico 875mg VO c/12h 7d (J01CR02)", "Calcio 500mg VO c/12h (A12AA04)", "Metformina 850mg VO c/12h (A10BA02)"]}, "output": "Ingresa por hemorragia digestiva alta (K92.2). Se realiza hernioplastia inguinal (53.00). Durante la hospitalizacion, evolucion favorable con tratamiento medico, sin complicaciones. Recibio tratamiento con N-acetilcisteina NBZ c/8h (R05CB01), Paracetamol 1g EV c/8h (N02BE01), Omeprazol 40mg EV c/12h (A02BC01) y Metamizol 1g EV c/8h (N02BB02). Presenta evolucion favorable, cumpliendo criterios de alta. Alta con diagnostico de hemorragia digestiva alta resuelto (K92.2), indicandose Amoxicilina/Clavulanico 875mg VO c/12h 7d (J01CR02), Calcio 500mg VO c/12h (A12AA04) y Metformina 850mg VO c/12h (A10BA02)."}
{"input": {"dx": ["Shock cardiogenico (R57.0)"], "proc": ["Holter ECG (K493)"], "tto": ["Furosemida 80mg EV (C03CA01)", "Nitroglicerina EV (C01DA02)"], "evo": "Estenosis aortica severa sintomatica, programada para TAVI", "dx_alta": ["Shock cardiogenico tratado (R57.0)"], "med": ["Prasugrel 10mg VO c/24h 12m (B01AC22)", "Isosorbide 20mg VO c/8h (C01DA08)", "Nitroglicerina SL PRN (C01DA02)", "Rivaroxaban 20mg VO c/24h (B01AF01)"]}, "output": "Se hospitaliza por shock cardiogenico (R57.0). Se realiza holter ecg (K493). En su evolucion, estenosis aortica severa sintomatica, programada para tavi. Recibio tratamiento con Furosemida 80mg EV (C03CA01) y Nitroglicerina EV (C01DA02). Presenta evolucion favorable, cumpliendo criterios de alta. Alta con diagnostico de shock cardiogenico tratado (R57.0), indicandose Prasugrel 10mg VO c/24h 12m (B01AC22), Isosorbide 20mg VO c/8h (C01DA08), Nitroglicerina SL PRN (C01DA02) y Rivaroxaban 20mg VO c/24h (B01AF01)."}
{"input": {"dx": ["Angina inestable alto riesgo (I20.0)"], "proc": ["Coronariografia (K492)"], "tto": ["Aspirina 300mg carga (B01AC06)", "Furosemida 80mg EV (C03CA01)", "Aspirina 100mg (B01AC06)"], "evo": "Pericarditis aguda con derrame leve, manejo antiinflamatorio", "dx_alta": ["Angina inestable alto riesgo tratado (I20.0)"], "med": ["Furosemida 40mg VO c/24h (C03CA01)", "Atorvastatina 40mg VO c/noche (C10AA05)", "Clopidogrel 75mg VO c/24h 12m (B01AC04)"]}, "output": "Paciente que ingresa con cuadro de angina inestable alto riesgo (I20.0). Se realiza coronariografia (K492). Durante la hospitalizacion, pericarditis aguda con derrame leve, manejo antiinflamatorio. Recibio tratamiento con Aspirina 300mg carga (B01AC06), Furosemida 80mg EV (C03CA01) y Aspirina 100mg (B01AC06). Evolucion satisfactoria, cumpliendo criterios de alta. Alta con diagnostico de angina inestable alto riesgo tratado (I20.0), indicandose Furosemida 40mg VO c/24h (C03CA01), Atorvastatina 40mg VO c/noche (C10AA05) y Clopidogrel 75mg VO c/24h 12m (B01AC04)."}
{"input": {"dx": ["Fibrilacion auricular (I48.9)"], "proc": ["Ecografia abdominal (88.76)", "TAC de torax (87.41)"], "tto": ["Metamizol 1g EV c/8h (N02BB02)", "Metoclopramida 10mg EV c/8h (A03FA01)"], "evo": "Sin complicaciones postoperatorias, herida operatoria limpia", "dx_alta": ["Fibrilacion auricular resuelto (I48.9)"], "med": ["Acido folico 1mg VO c/24h (B03BB01)", "Vitamina D 1000UI VO c/24h (A11CC05)", "Ciprofloxacino 500mg VO c/12h 7d (J01MA02)"]}, "output": "Paciente que ingresa con cuadro de fibrilacion auricular (I48.9). Se realiza ecografia abdominal (88.76), tac de torax (87.41). En su evolucion, sin complicaciones postoperatorias, herida operatoria limpia. Recibio tratamiento con Metamizol 1g EV c/8h (N02BB02) y Metoclopramida 10mg EV c/8h (A03FA01). Buena evolucion, cumpliendo criterios de alta. Alta con diagnostico de fibrilacion auricular resuelto (I48.9), indicandose Acido folico 1mg VO c/24h (B03BB01), Vitamina D 1000UI VO c/24h (A11CC05) y Ciprofloxacino 500mg VO c/12h 7d (J01MA02)."}
{"input": {"dx": ["Enfermedad coronaria de 3 vasos (I25.1)"], "proc": ["Coronariografia (K492)", "Angioplastia CD (K493)"], "tto": ["Aspirina 100mg (B01AC06)", "Metoprolol 5mg EV (C07AB02)", "Dobutamina EV (C01CA07)", "Enoxaparina 60mg SC c/12h (B01AB05)"], "evo": "Shock cardiogenico, requirio soporte con inotropicos, evolucion favorable", "dx_alta": ["Enfermedad coronaria de 3 vasos tratado (I25.1)"], "med": ["Aspirina 100mg VO c/24h (B01AC06)", "Nitroglicerina SL PRN (C01DA02)", "Atorvastatina 40mg VO c/noche (C10AA05)", "Warfarina segun INR (B01AA03)"]}, "output": "Ingresa por enfermedad coronaria de 3 vasos (I25.1). Se realiza coronariografia (K492) encontrando lesion critica, realizandose angioplastia cd (K493) con implante de stent farmacoactivo y flujo TIMI 3 final. Presenta, shock cardiogenico, requirio soporte con inotropicos, evolucion favorable. Recibio tratamiento con Aspirina 100mg (B01AC06), Metoprolol 5mg EV (C07AB02), Dobutamina EV (C01CA07) y Enoxaparina 60mg SC c/12h (B01AB05). Evolucion clinica favorable, cumpliendo criterios de alta. Alta con diagnostico de enfermedad coronaria de 3 vasos tratado (I25.1), indicandose Aspirina 100mg VO c/24h (B01AC06), Nitroglicerina SL PRN (C01DA02), Atorvastatina 40mg VO c/noche (C10AA05) y Warfarina segun INR (B01AA03)."}
{"input": {"dx": ["IAMCEST anterolateral (I21.0)"], "proc": ["Coronariografia (K492)", "Angioplastia CD (K493)"], "tto": ["Digoxina 0.25mg EV (C01AA05)", "Metoprolol 5mg EV (C07AB02)"], "evo": "Bloqueo AV completo sintomatico, requirio marcapasos transitorio", "dx_alta": ["IAMCEST anterolateral tratado (I21.0)"], "med": ["Clopidogrel 75mg VO c/24h 12m (B01AC04)", "Digoxina 0.125mg VO c/24h (C01AA05)", "Carvedilol 6.25mg VO c/12h (C07AG02)", "Enalapril 10mg VO c/12h (C09AA02)", "Warfarina segun INR (B01AA03)"]}, "output": "Ingreso por iamcest anterolateral (I21.0). Se realiza coronariografia (K492) visualizando estenosis severa, realizandose angioplastia cd (K493) con implante de stent farmacoactivo y flujo TIMI 3 final. Presenta, bloqueo av completo sintomatico, requirio marcapasos transitorio. Recibio tratamiento con Digoxina 0.25mg EV (C01AA05) y Metoprolol 5mg EV (C07AB02). Evolucion satisfactoria, cumpliendo criterios de alta. Alta con diagnostico de iamcest anterolateral tratado (I21.0), indicandose Clopidogrel 75mg VO c/24h 12m (B01AC04), Digoxina 0.125mg VO c/24h (C01AA05), Carvedilol 6.25mg VO c/12h (C07AG02), Enalapril 10mg VO c/12h (C09AA02) y Warfarina segun INR (B01AA03)."}
{"input": {"dx": ["IAMCEST inferior (I21.1)"], "proc": ["Coronariografia (K492)", "Angioplastia CD (K493)"], "tto": ["Metoprolol 5mg EV (C07AB02)", "Enalapril 5mg VO (C09AA02)"], "evo": "Lesion severa de DA media, angioplastia con implante de stent sin complicaciones", "dx_alta": ["IAMCEST inferior tratado (I21.1)"], "med": ["Furosemida 40mg VO c/24h (C03CA01)", "Isosorbide 20mg VO c/8h (C01DA08)", "Losartan 50mg VO c/24h (C09CA01)", "Metoprolol 50mg VO c/12h (C07AB02)", "Warfarina segun INR (B01AA03)"]}, "output": "Se hospitaliza por iamcest inferior (I21.1). Se realiza coronariografia (K492) evidenciando oclusion aguda, realizandose angioplastia cd (K493) con implante de stent farmacoactivo y flujo TIMI 3 final. Durante la hospitalizacion, lesion severa de da media, angioplastia con implante de stent sin complicaciones. Recibio tratamiento con Metoprolol 5mg EV (C07AB02) y Enalapril 5mg VO (C09AA02). Buena evolucion, cumpliendo criterios de alta. Alta con diagnostico de iamcest inferior tratado (I21.1), indicandose Furosemida 40mg VO c/24h (C03CA01), Isosorbide 20mg VO c/8h (C01DA08), Losartan 50mg VO c/24h (C09CA01), Metoprolol 50mg VO c/12h (C07AB02) y Warfarina segun INR (B01AA03)."}
{"input": {"dx": ["IAMSEST (I21.4)"], "proc": ["Coronariografia (K492)", "Angioplastia CD (36.06)"], "tto": ["Enoxaparina 60mg SC c/12h (B01AB05)", "Metoprolol 5mg EV (C07AB02)"], "evo": "Edema pulmonar agudo por disfuncion sistolica, respuesta favorable a diureticos", "dx_alta": ["IAMSEST tratado (I21.4)"], "med": ["Rivaroxaban 20mg VO c/24h (B01AF01)", "Warfarina segun INR (B01AA03)", "Furosemida 40mg VO c/24h (C03CA01)", "Apixaban 5mg VO c/12h (B01AF02)"]}, "output": "Ingreso por iamsest (I21.4). Se realiza coronariografia (K492) visualizando estenosis severa, realizandose angioplastia cd (36.06) con implante de stent farmacoactivo y flujo TIMI 3 final. En su evolucion, edema pulmonar agudo por disfuncion sistolica, respuesta favorable a diureticos. Recibio tratamiento con Enoxaparina 60mg SC c/12h (B01AB05) y Metoprolol 5mg EV (C07AB02). Evolucion satisfactoria, cumpliendo criterios de alta. Alta con diagnostico de iamsest tratado (I21.4), indicandose Rivaroxaban 20mg VO c/24h (B01AF01), Warfarina segun INR (B01AA03), Furosemida 40mg VO c/24h (C03CA01) y Apixaban 5mg VO c/12h (B01AF02)."}
{"input": {"dx": ["Colecistitis aguda (K81.0)"], "proc": ["Broncoscopia (33.22)", "Apendicectomia (47.09)"], "tto": ["Paracetamol 1g EV c/8h (N02BE01)", "Pantoprazol 40mg EV c/12h (A02BC02)", "Salbutamol NBZ c/4h (R03AC02)"], "evo": "Evolucion favorable con tratamiento medico, sin complicaciones", "dx_alta": ["Colecistitis aguda resuelto (K81.0)"], "med": ["Ciprofloxacino 500mg VO c/12h 7d (J01MA02)", "Amoxicilina/Clavulanico 875mg VO c/12h 7d (J01CR02)", "Calcio 500mg VO c/12h (A12AA04)"]}, "output": "Ingreso por colecistitis aguda (K81.0). Se realiza broncoscopia (33.22), apendicectomia (47.09). Evoluciona con, evolucion favorable con tratamiento medico, sin complicaciones. Recibio tratamiento con Paracetamol 1g EV c/8h (N02BE01), Pantoprazol 40mg EV c/12h (A02BC02) y Salbutamol NBZ c/4h (R03AC02). Evolucion clinica favorable, cumpliendo criterios de alta. Alta con diagnostico de colecistitis aguda resuelto (K81.0), indicandose Ciprofloxacino 500mg VO c/12h 7d (J01MA02), Amoxicilina/Clavulanico 875mg VO c/12h 7d (J01CR02) y Calcio 500mg VO c/12h (A12AA04)."}
{"input": {"dx": ["Endocarditis infecciosa (I33.0)"], "proc": ["Colecistectomia laparoscopica (51.23)", "Osteosintesis de cadera (79.35)"], "tto": ["Hidrocortisona 100mg EV c/8h (H02AB09)", "Morfina 3mg EV c/4h PRN (N02AA01)", "Metoclopramida 10mg EV c/8h (A03FA01)", "Ciprofloxacino 400mg EV c/12h (J01MA02)"], "evo": "Mejoría clínica sostenida, cumple criterios de alta", "dx_alta": ["Endocarditis infecciosa resuelto (I33.0)"], "med": ["Glibenclamida 5mg VO c/24h (A10BB01)", "Vitamina D 1000UI VO c/24h (A11CC05)", "Calcio 500mg VO c/12h (A12AA04)"]}, "output": "Se hospitaliza por endocarditis infecciosa (I33.0). Se realiza colecistectomia laparoscopica (51.23), osteosintesis de cadera (79.35). Durante la hospitalizacion, mejoría clínica sostenida, cumple criterios de alta. Recibio tratamiento con Hidrocortisona 100mg EV c/8h (H02AB09), Morfina 3mg EV c/4h PRN (N02AA01), Metoclopramida 10mg EV c/8h (A03FA01) y Ciprofloxacino 400mg EV c/12h (J01MA02). Evolucion satisfactoria, cumpliendo criterios de alta. Alta con diagnostico de endocarditis infecciosa resuelto (I33.0), indicandose Glibenclamida 5mg VO c/24h (A10BB01), Vitamina D 1000UI VO c/24h (A11CC05) y Calcio 500mg VO c/12h (A12AA04)."}
{"input": {"dx": ["Endocarditis infecciosa (I33.0)"], "proc": ["Paracentesis (54.91)"], "tto": ["Salbutamol NBZ c/4h (R03AC02)", "Morfina 3mg EV c/4h PRN (N02AA01)", "N-acetilcisteina NBZ c/8h (R05CB01)"], "evo": "Procedimiento sin complicaciones, buena tolerancia oral", "dx_alta": ["Endocarditis infecciosa resuelto (I33.0)"], "med": ["Omeprazol 20mg VO c/24h (A02BC01)", "Acido folico 1mg VO c/24h (B03BB01)", "Paracetamol 500mg VO c/8h PRN (N02BE01)", "Sertralina 50mg VO c/24h (N06AB06)"]}, "output": "Ingreso por endocarditis infecciosa (I33.0). Se realiza paracentesis (54.91). Durante la hospitalizacion, procedimiento sin complicaciones, buena tolerancia oral. Recibio tratamiento con Salbutamol NBZ c/4h (R03AC02), Morfina 3mg EV c/4h PRN (N02AA01) y N-acetilcisteina NBZ c/8h (R05CB01). Evolucion satisfactoria, cumpliendo criterios de alta. Alta con diagnostico de endocarditis infecciosa resuelto (I33.0), indicandose Omeprazol 20mg VO c/24h (A02BC01), Acido folico 1mg VO c/24h (B03BB01), Paracetamol 500mg VO c/8h PRN (N02BE01) y Sertralina 50mg VO c/24h (N06AB06)."}
{"input": {"dx": ["Reestenosis intra-stent (I25.5)"], "proc": ["Angioplastia CD (37.0)"], "tto": ["Clopidogrel 300mg carga (B01AC04)", "Enoxaparina 60mg SC c/12h (B01AB05)", "Atorvastatina 80mg (C10AA05)"], "evo": "Estenosis aortica severa sintomatica, programada para TAVI", "dx_alta": ["Reestenosis intra-stent tratado (I25.5)"], "med": ["Rivaroxaban 20mg VO c/24h (B01AF01)", "Carvedilol 6.25mg VO c/12h (C07AG02)", "Enalapril 10mg VO c/12h (C09AA02)"]}, "output": "Paciente que ingresa con cuadro de reestenosis intra-stent (I25.5). Se realiza angioplastia cd (37.0). Durante la hospitalizacion, estenosis aortica severa sintomatica, programada para tavi. Recibio tratamiento con Clopidogrel 300mg carga (B01AC04), Enoxaparina 60mg SC c/12h (B01AB05) y Atorvastatina 80mg (C10AA05). Presenta evolucion favorable, cumpliendo criterios de alta. Alta con diagnostico de reestenosis intra-stent tratado (I25.5), indicandose Rivaroxaban 20mg VO c/24h (B01AF01), Carvedilol 6.25mg VO c/12h (C07AG02) y Enalapril 10mg VO c/12h (C09AA02)."}
{"input": {"dx": ["Angina inestable (I20.0)"], "proc": ["Coronariografia (K492)"], "tto": ["Noradrenalina EV (C01CA03)", "Heparina 5000UI EV (B01AB01)", "Amiodarona 300mg EV (C01BD01)"], "evo": "Bloqueo AV completo sintomatico, requirio marcapasos transitorio", "dx_alta": ["Angina inestable tratado (I20.0)"], "med": ["Carvedilol 6.25mg VO c/12h (C07AG02)", "Furosemida 40mg VO c/24h (C03CA01)", "Aspirina 100mg VO c/24h (B01AC06)"]}, "output": "Ingresa por angina inestable (I20.0). Se realiza coronariografia (K492). Evoluciona con, bloqueo av completo sintomatico, requirio marcapasos transitorio. Recibio tratamiento con Noradrenalina EV (C01CA03), Heparina 5000UI EV (B01AB01) y Amiodarona 300mg EV (C01BD01). Buena evolucion, cumpliendo criterios de alta. Alta con diagnostico de angina inestable tratado (I20.0), indicandose Carvedilol 6.25mg VO c/12h (C07AG02), Furosemida 40mg VO c/24h (C03CA01) y Aspirina 100mg VO c/24h (B01AC06)."}
{"input": {"dx": ["Angina inestable (I20.0)"], "proc": ["Coronariografia (K492)", "Angioplastia CX (K493)"], "tto": ["Enoxaparina 60mg SC c/12h (B01AB05)", "Dobutamina EV (C01CA07)", "Nitroglicerina EV (C01DA02)", "Heparina EV infusion (B01AB01)"], "evo": "Taquicardia ventricular sostenida, cardioversion electrica exitosa", "dx_alta": ["Angina inestable tratado (I20.0)"], "med": ["Prasugrel 10mg VO c/24h 12m (B01AC22)", "Bisoprolol 5mg VO c/24h (C07AB07)", "Carvedilol 6.25mg VO c/12h (C07AG02)"]}, "output": "Ingreso por angina inestable (I20.0). Se realiza coronariografia (K492) encontrando lesion critica, realizandose angioplastia cx (K493) con implante de stent farmacoactivo y flujo TIMI 3 final. Presenta, taquicardia ventricular sostenida, cardioversion electrica exitosa. Recibio tratamiento con Enoxaparina 60mg SC c/12h (B01AB05), Dobutamina EV (C01CA07), Nitroglicerina EV (C01DA02) y Heparina EV infusion (B01AB01). Buena evolucion, cumpliendo criterios de alta. Alta con diagnostico de angina inestable tratado (I20.0), indicandose Prasugrel 10mg VO c/24h 12m (B01AC22), Bisoprolol 5mg VO c/24h (C07AB07) y Carvedilol 6.25mg VO c/12h (C07AG02)."}
{"input": {"dx": ["Insuficiencia cardiaca aguda (I50.9)"], "proc": ["Angioplastia DA (88.72)"], "tto": ["Nitroglicerina EV (C01DA02)", "Clopidogrel 300mg carga (B01AC04)"], "evo": "Taquicardia ventricular sostenida, cardioversion electrica exitosa", "dx_alta": ["Insuficiencia cardiaca aguda tratado (I50.9)"], "med": ["Isosorbide 20mg VO c/8h (C01DA08)", "Warfarina segun INR (B01AA03)", "Atorvastatina 40mg VO c/noche (C10AA05)", "Losartan 50mg VO c/24h (C09CA01)", "Carvedilol 6.25mg VO c/12h (C07AG02)"]}, "output": "Se hospitaliza por insuficiencia cardiaca aguda (I50.9). Se realiza angioplastia da (88.72). Evoluciona con, taquicardia ventricular sostenida, cardioversion electrica exitosa. Recibio tratamiento con Nitroglicerina EV (C01DA02) y Clopidogrel 300mg carga (B01AC04). Buena evolucion, cumpliendo criterios de alta. Alta con diagnostico de insuficiencia cardiaca aguda tratado (I50.9), indicandose Isosorbide 20mg VO c/8h (C01DA08), Warfarina segun INR (B01AA03), Atorvastatina 40mg VO c/noche (C10AA05), Losartan 50mg VO c/24h (C09CA01) y Carvedilol 6.25mg VO c/12h (C07AG02)."}
{"input": {"dx": ["Angina estable (I20.8)"], "proc": ["Coronariografia (K492)", "Angioplastia TCI (K493)"], "tto": ["Atorvastatina 80mg (C10AA05)", "Digoxina 0.25mg EV (C01AA05)", "Prasugrel 60mg carga (B01AC22)"], "evo": "Bloqueo AV completo sintomatico, requirio marcapasos transitorio", "dx_alta": ["Angina estable tratado (I20.8)"], "med": ["Ticagrelor 90mg VO c/12h 12m (B01AC24)", "Warfarina segun INR (B01AA03)", "Furosemida 40mg VO c/24h (C03CA01)", "Digoxina 0.125mg VO c/24h (C01AA05)", "Amlodipino 5mg VO c/24h (C08CA01)"]}, "output": "Ingreso por angina estable (I20.8). Se realiza coronariografia (K492) evidenciando oclusion aguda, realizandose angioplastia tci (K493) con implante de stent farmacoactivo y flujo TIMI 3 final. Presenta, bloqueo av completo sintomatico, requirio marcapasos transitorio. Recibio tratamiento con Atorvastatina 80mg (C10AA05), Digoxina 0.25mg EV (C01AA05) y Prasugrel 60mg carga (B01AC22). Presenta evolucion favorable, cumpliendo criterios de alta. Alta con diagnostico de angina estable tratado (I20.8), indicandose Ticagrelor 90mg VO c/12h 12m (B01AC24), Warfarina segun INR (B01AA03), Furosemida 40mg VO c/24h (C03CA01), Digoxina 0.125mg VO c/24h (C01AA05) y Amlodipino 5mg VO c/24h (C08CA01)."}
{"input": {"dx": ["IAMSEST alto riesgo (I21.4)"], "proc": ["Coronariografia (K492)"], "tto": ["Metoprolol 5mg EV (C07AB02)", "Aspirina 300mg carga (B01AC06)"], "evo": "SDST en V1-V4, coronarias sin lesiones obstructivas, sindrome de Tako-Tsubo", "dx_alta": ["IAMSEST alto riesgo tratado (I21.4)"], "med": ["Metoprolol 50mg VO c/12h (C07AB02)", "Nitroglicerina SL PRN (C01DA02)", "Rivaroxaban 20mg VO c/24h (B01AF01)", "Espironolactona 25mg VO c/24h (C03DA01)"]}, "output": "Se hospitaliza por iamsest alto riesgo (I21.4). Se realiza coronariografia (K492). Evoluciona con, sdst en v1-v4, coronarias sin lesiones obstructivas, sindrome de tako-tsubo. Recibio tratamiento con Metoprolol 5mg EV (C07AB02) y Aspirina 300mg carga (B01AC06). Evolucion satisfactoria, cumpliendo criterios de alta. Alta con diagnostico de iamsest alto riesgo tratado (I21.4), indicandose Metoprolol 50mg VO c/12h (C07AB02), Nitroglicerina SL PRN (C01DA02), Rivaroxaban 20mg VO c/24h (B01AF01) y Espironolactona 25mg VO c/24h (C03DA01)."}
{"input": {"dx": ["Fibrilacion auricular (I48.9)"], "proc": ["Apendicectomia (47.09)", "Ecografia abdominal (88.76)"], "tto": ["Morfina 3mg EV c/4h PRN (N02AA01)", "Insulina cristalina segun esquema (A10AB01)"], "evo": "Estabilizacion clinica progresiva, sin eventos adversos", "dx_alta": ["Fibrilacion auricular resuelto (I48.9)"], "med": ["Salbutamol INH 2 puff c/6h PRN (R03AC02)", "Sertralina 50mg VO c/24h (N06AB06)", "Vitamina D 1000UI VO c/24h (A11CC05)"]}, "output": "Ingreso por fibrilacion auricular (I48.9). Se realiza apendicectomia (47.09), ecografia abdominal (88.76). Evoluciona con, estabilizacion clinica progresiva, sin eventos adversos. Recibio tratamiento con Morfina 3mg EV c/4h PRN (N02AA01) y Insulina cristalina segun esquema (A10AB01). Buena evolucion, cumpliendo criterios de alta. Alta con diagnostico de fibrilacion auricular resuelto (I48.9), indicandose Salbutamol INH 2 puff c/6h PRN (R03AC02), Sertralina 50mg VO c/24h (N06AB06) y Vitamina D 1000UI VO c/24h (A11CC05)."}
{"input": {"dx": ["Angina inestable (I20.0)"], "proc": ["Coronariografia (K492)"], "tto": ["Clopidogrel 300mg carga (B01AC04)", "Metoprolol 5mg EV (C07AB02)", "Morfina 3mg EV (N02AA01)"], "evo": "Enfermedad de multiples vasos, se deriva a cirugia cardiaca para bypass", "dx_alta": ["Angina inestable tratado (I20.0)"], "med": ["Enalapril 10mg VO c/12h (C09AA02)", "Furosemida 40mg VO c/24h (C03CA01)", "Apixaban 5mg VO c/12h (B01AF02)", "Nitroglicerina SL PRN (C01DA02)"]}, "output": "Se hospitaliza por angina inestable (I20.0). Se realiza coronariografia (K492). En su evolucion, enfermedad de multiples vasos, se deriva a cirugia cardiaca para bypass. Recibio tratamiento con Clopidogrel 300mg carga (B01AC04), Metoprolol 5mg EV (C07AB02) y Morfina 3mg EV (N02AA01). Evolucion clinica favorable, cumpliendo criterios de alta. Alta con diagnostico de angina inestable tratado (I20.0), indicandose Enalapril 10mg VO c/12h (C09AA02), Furosemida 40mg VO c/24h (C03CA01), Apixaban 5mg VO c/12h (B01AF02) y Nitroglicerina SL PRN (C01DA02)."}
{"input": {"dx": ["Pancreatitis aguda (K85.9)"], "proc": ["Colecistectomia laparoscopica (51.23)"], "tto": ["Ondansetron 8mg EV c/8h (A04AA01)", "Pantoprazol 40mg EV c/12h (A02BC02)"], "evo": "Estabilizacion clinica progresiva, sin eventos adversos", "dx_alta": ["Pancreatitis aguda resuelto (K85.9)"], "med": ["Ciprofloxacino 500mg VO c/12h 7d (J01MA02)", "Calcio 500mg VO c/12h (A12AA04)", "Levotiroxina 50mcg VO c/24h (H03AA01)", "Metformina 850mg VO c/12h (A10BA02)"]}, "output": "Paciente que ingresa con cuadro de pancreatitis aguda (K85.9). Se realiza colecistectomia laparoscopica (51.23). En su evolucion, estabilizacion clinica progresiva, sin eventos adversos. Recibio tratamiento con Ondansetron 8mg EV c/8h (A04AA01) y Pantoprazol 40mg EV c/12h (A02BC02). Presenta evolucion favorable, cumpliendo criterios de alta. Alta con diagnostico de pancreatitis aguda resuelto (K85.9), indicandose Ciprofloxacino 500mg VO c/12h 7d (J01MA02), Calcio 500mg VO c/12h (A12AA04), Levotiroxina 50mcg VO c/24h (H03AA01) y Metformina 850mg VO c/12h (A10BA02)."}
{"input": {"dx": ["Angina estable (I20.8)"], "proc": ["Coronariografia (K492)"], "tto": ["Atorvastatina 80mg (C10AA05)", "Aspirina 100mg (B01AC06)", "Prasugrel 60mg carga (B01AC22)"], "evo": "Lesion severa de DA proximal, angioplastia con implante de stent sin complicaciones", "dx_alta": ["Angina estable tratado (I20.8)"], "med": ["Rivaroxaban 20mg VO c/24h (B01AF01)", "Furosemida 40mg VO c/24h (C03CA01)", "Losartan 50mg VO c/24h (C09CA01)", "Digoxina 0.125mg VO c/24h (C01AA05)"]}, "output": "Ingresa por angina estable (I20.8). Se realiza coronariografia (K492). Presenta, lesion severa de da proximal, angioplastia con implante de stent sin complicaciones. Recibio tratamiento con Atorvastatina 80mg (C10AA05), Aspirina 100mg (B01AC06) y Prasugrel 60mg carga (B01AC22). Buena evolucion, cumpliendo criterios de alta. Alta con diagnostico de angina estable tratado (I20.8), indicandose Rivaroxaban 20mg VO c/24h (B01AF01), Furosemida 40mg VO c/24h (C03CA01), Losartan 50mg VO c/24h (C09CA01) y Digoxina 0.125mg VO c/24h (C01AA05)."}
{"input": {"dx": ["Angina inestable (I20.0)"], "proc": ["Coronariografia (K492)", "Angioplastia OM (K493)"], "tto": ["Amiodarona 300mg EV (C01BD01)", "Nitroglicerina EV (C01DA02)", "Enoxaparina 1mg/kg SC c/12h (B01AB05)", "Metoprolol 5mg EV (C07AB02)"], "evo": "Oclusion aguda de DA distal, angioplastia exitosa con stent farmacoactivo, flujo TIMI 3 final", "dx_alta": ["Angina inestable tratado (I20.0)"], "med": ["Enalapril 10mg VO c/12h (C09AA02)", "Aspirina 100mg VO c/24h (B01AC06)", "Bisoprolol 5mg VO c/24h (C07AB07)"]}, "output": "Paciente que ingresa con cuadro de angina inestable (I20.0). Se realiza coronariografia (K492) con hallazgo de lesion significativa, realizandose angioplastia om (K493) con implante de stent farmacoactivo y flujo TIMI 3 final. Presenta, oclusion aguda de da distal, angioplastia exitosa con stent farmacoactivo, flujo timi 3 final. Recibio tratamiento con Amiodarona 300mg EV (C01BD01), Nitroglicerina EV (C01DA02), Enoxaparina 1mg/kg SC c/12h (B01AB05) y Metoprolol 5mg EV (C07AB02). Presenta evolucion favorable, cumpliendo criterios de alta. Alta con diagnostico de angina inestable tratado (I20.0), indicandose Enalapril 10mg VO c/12h (C09AA02), Aspirina 100mg VO c/24h (B01AC06) y Bisoprolol 5mg VO c/24h (C07AB07)."}
{"input": {"dx": ["Shock cardiogenico (R57.0)"], "proc": ["Ecocardiograma (35.05)"], "tto": ["Ticagrelor 180mg carga (B01AC24)", "Clopidogrel 600mg carga (B01AC04)"], "evo": "Oclusion aguda de DA media, angioplastia exitosa con stent farmacoactivo, flujo TIMI 3 final", "dx_alta": ["Shock cardiogenico tratado (R57.0)"], "med": ["Ticagrelor 90mg VO c/12h 12m (B01AC24)", "Amlodipino 5mg VO c/24h (C08CA01)", "Bisoprolol 5mg VO c/24h (C07AB07)", "Warfarina segun INR (B01AA03)"]}, "output": "Ingreso por shock cardiogenico (R57.0). Se realiza ecocardiograma (35.05). Presenta, oclusion aguda de da media, angioplastia exitosa con stent farmacoactivo, flujo timi 3 final. Recibio tratamiento con Ticagrelor 180mg carga (B01AC24) y Clopidogrel 600mg carga (B01AC04). Presenta evolucion favorable, cumpliendo criterios de alta. Alta con diagnostico de shock cardiogenico tratado (R57.0), indicandose Ticagrelor 90mg VO c/12h 12m (B01AC24), Amlodipino 5mg VO c/24h (C08CA01), Bisoprolol 5mg VO c/24h (C07AB07) y Warfarina segun INR (B01AA03)."}
{"input": {"dx": ["Diseccion aortica (I71.0)"], "proc": ["Colonoscopia (45.23)", "Angio TAC cerebral (88.38)"], "tto": ["Meropenem 1g EV c/8h (J01DH02)", "Vancomicina 1g EV c/12h (J01XA01)", "Omeprazol 40mg EV c/12h (A02BC01)"], "evo": "Cirugia programada sin complicaciones, alta precoz", "dx_alta": ["Diseccion aortica resuelto (I71.0)"], "med": ["Budesonide/Formoterol INH c/12h (R03AK07)", "Prednisona 20mg VO c/24h (H02AB07)", "Calcio 500mg VO c/12h (A12AA04)"]}, "output": "Ingresa por diseccion aortica (I71.0). Se realiza colonoscopia (45.23), angio tac cerebral (88.38). En su evolucion, cirugia programada sin complicaciones, alta precoz. Recibio tratamiento con Meropenem 1g EV c/8h (J01DH02), Vancomicina 1g EV c/12h (J01XA01) y Omeprazol 40mg EV c/12h (A02BC01). Evolucion satisfactoria, cumpliendo criterios de alta. Alta con diagnostico de diseccion aortica resuelto (I71.0), indicandose Budesonide/Formoterol INH c/12h (R03AK07), Prednisona 20mg VO c/24h (H02AB07) y Calcio 500mg VO c/12h (A12AA04)."}
{"input": {"dx": ["Crisis hipertensiva (I10)"], "proc": ["Toracocentesis (34.91)", "Colecistectomia laparoscopica (51.23)"], "tto": ["Ciprofloxacino 400mg EV c/12h (J01MA02)", "N-acetilcisteina NBZ c/8h (R05CB01)", "Paracetamol 1g EV c/8h (N02BE01)", "Metoclopramida 10mg EV c/8h (A03FA01)"], "evo": "Procedimiento sin complicaciones, buena tolerancia oral", "dx_alta": ["Crisis hipertensiva resuelto (I10)"], "med": ["Prednisona 20mg VO c/24h (H02AB07)", "Vitamina D 1000UI VO c/24h (A11CC05)"]}, "output": "Se hospitaliza por crisis hipertensiva (I10). Se realiza toracocentesis (34.91), colecistectomia laparoscopica (51.23). Durante la hospitalizacion, procedimiento sin complicaciones, buena tolerancia oral. Recibio tratamiento con Ciprofloxacino 400mg EV c/12h (J01MA02), N-acetilcisteina NBZ c/8h (R05CB01), Paracetamol 1g EV c/8h (N02BE01) y Metoclopramida 10mg EV c/8h (A03FA01). Evolucion satisfactoria, cumpliendo criterios de alta. Alta con diagnostico de crisis hipertensiva resuelto (I10), indicandose Prednisona 20mg VO c/24h (H02AB07) y Vitamina D 1000UI VO c/24h (A11CC05)."}
{"input": {"dx": ["Enfermedad coronaria de 3 vasos (I25.1)"], "proc": ["Coronariografia (K492)", "Angioplastia CX (36.06)"], "tto": ["Atorvastatina 80mg (C10AA05)", "Amiodarona 300mg EV (C01BD01)"], "evo": "Pericarditis aguda con derrame leve, manejo antiinflamatorio", "dx_alta": ["Enfermedad coronaria de 3 vasos tratado (I25.1)"], "med": ["Apixaban 5mg VO c/12h (B01AF02)", "Bisoprolol 5mg VO c/24h (C07AB07)", "Enalapril 10mg VO c/12h (C09AA02)"]}, "output": "Ingreso por enfermedad coronaria de 3 vasos (I25.1). Se realiza coronariografia (K492) encontrando lesion critica, realizandose angioplastia cx (36.06) con implante de stent farmacoactivo y flujo TIMI 3 final. Presenta, pericarditis aguda con derrame leve, manejo antiinflamatorio. Recibio tratamiento con Atorvastatina 80mg (C10AA05) y Amiodarona 300mg EV (C01BD01). Buena evolucion, cumpliendo criterios de alta. Alta con diagnostico de enfermedad coronaria de 3 vasos tratado (I25.1), indicandose Apixaban 5mg VO c/12h (B01AF02), Bisoprolol 5mg VO c/24h (C07AB07) y Enalapril 10mg VO c/12h (C09AA02)."}
{"input": {"dx": ["Enfermedad de TCI (I25.1)"], "proc": ["Holter ECG (K492)"], "tto": ["Aspirina 300mg carga (B01AC06)", "Ticagrelor 180mg carga (B01AC24)"], "evo": "Enfermedad de multiples vasos, se deriva a cirugia cardiaca para bypass", "dx_alta": ["Enfermedad de TCI tratado (I25.1)"], "med": ["Enalapril 10mg VO c/12h (C09AA02)", "Metoprolol 50mg VO c/12h (C07AB02)", "Apixaban 5mg VO c/12h (B01AF02)"]}, "output": "Ingreso por enfermedad de tci (I25.1). Se realiza holter ecg (K492). En su evolucion, enfermedad de multiples vasos, se deriva a cirugia cardiaca para bypass. Recibio tratamiento con Aspirina 300mg carga (B01AC06) y Ticagrelor 180mg carga (B01AC24). Presenta evolucion favorable, cumpliendo criterios de alta. Alta con diagnostico de enfermedad de tci tratado (I25.1), indicandose Enalapril 10mg VO c/12h (C09AA02), Metoprolol 50mg VO c/12h (C07AB02) y Apixaban 5mg VO c/12h (B01AF02)."}
{"input": {"dx": ["IAMSEST alto riesgo (I21.4)"], "proc": ["Coronariografia (K492)", "Angioplastia DA (36.06)"], "tto": ["Metoprolol 5mg EV (C07AB02)", "Noradrenalina EV (C01CA03)", "Furosemida 80mg EV (C03CA01)", "Ticagrelor 180mg carga (B01AC24)"], "evo": "Shock cardiogenico, requirio soporte con inotropicos, evolucion favorable", "dx_alta": ["IAMSEST alto riesgo tratado (I21.4)"], "med": ["Prasugrel 10mg VO c/24h 12m (B01AC22)", "Carvedilol 6.25mg VO c/12h (C07AG02)", "Amlodipino 5mg VO c/24h (C08CA01)", "Aspirina 100mg VO c/24h (B01AC06)", "Rosuvastatina 20mg VO c/noche (C10AA07)"]}, "output": "Paciente que ingresa con cuadro de iamsest alto riesgo (I21.4). Se realiza coronariografia (K492) encontrando lesion critica, realizandose angioplastia da (36.06) con implante de stent farmacoactivo y flujo TIMI 3 final. En su evolucion, shock cardiogenico, requirio soporte con inotropicos, evolucion favorable. Recibio tratamiento con Metoprolol 5mg EV (C07AB02), Noradrenalina EV (C01CA03), Furosemida 80mg EV (C03CA01) y Ticagrelor 180mg carga (B01AC24). Buena evolucion, cumpliendo criterios de alta. Alta con diagnostico de iamsest alto riesgo tratado (I21.4), indicandose Prasugrel 10mg VO c/24h 12m (B01AC22), Carvedilol 6.25mg VO c/12h (C07AG02), Amlodipino 5mg VO c/24h (C08CA01), Aspirina 100mg VO c/24h (B01AC06) y Rosuvastatina 20mg VO c/noche (C10AA07)."}
{"input": {"dx": ["IAMCEST anteroseptal (I21.0)"], "proc": ["Coronariografia (K492)", "Angioplastia DA (36.06)"], "tto": ["Furosemida 80mg EV (C03CA01)", "Levosimendan EV (C01CX08)", "Morfina 3mg EV (N02AA01)"], "evo": "Oclusion aguda de CD media, angioplastia exitosa con stent farmacoactivo, flujo TIMI 3 final", "dx_alta": ["IAMCEST anteroseptal tratado (I21.0)"], "med": ["Ticagrelor 90mg VO c/12h 12m (B01AC24)", "Amlodipino 5mg VO c/24h (C08CA01)", "Warfarina segun INR (B01AA03)", "Apixaban 5mg VO c/12h (B01AF02)", "Prasugrel 10mg VO c/24h 12m (B01AC22)"]}, "output": "Paciente que ingresa con cuadro de iamcest anteroseptal (I21.0). Se realiza coronariografia (K492) visualizando estenosis severa, realizandose angioplastia da (36.06) con implante de stent farmacoactivo y flujo TIMI 3 final. Presenta, oclusion aguda de cd media, angioplastia exitosa con stent farmacoactivo, flujo timi 3 final. Recibio tratamiento con Furosemida 80mg EV (C03CA01), Levosimendan EV (C01CX08) y Morfina 3mg EV (N02AA01). Buena evolucion, cumpliendo criterios de alta. Alta con diagnostico de iamcest anteroseptal tratado (I21.0), indicandose Ticagrelor 90mg VO c/12h 12m (B01AC24), Amlodipino 5mg VO c/24h (C08CA01), Warfarina segun INR (B01AA03), Apixaban 5mg VO c/12h (B01AF02) y Prasugrel 10mg VO c/24h 12m (B01AC22)."}
{"input": {"dx": ["Angina estable (I20.8)"], "proc": ["Coronariografia (K492)"], "tto": ["Morfina 3mg EV (N02AA01)", "Aspirina 300mg carga (B01AC06)", "Heparina 5000UI EV (B01AB01)", "Enalapril 5mg VO (C09AA02)"], "evo": "Enfermedad de multiples vasos, se deriva a cirugia cardiaca para bypass", "dx_alta": ["Angina estable tratado (I20.8)"], "med": ["Losartan 50mg VO c/24h (C09CA01)", "Apixaban 5mg VO c/12h (B01AF02)", "Prasugrel 10mg VO c/24h 12m (B01AC22)", "Warfarina segun INR (B01AA03)"]}, "output": "Paciente que ingresa con cuadro de angina estable (I20.8). Se realiza coronariografia (K492). En su evolucion, enfermedad de multiples vasos, se deriva a cirugia cardiaca para bypass. Recibio tratamiento con Morfina 3mg EV (N02AA01), Aspirina 300mg carga (B01AC06), Heparina 5000UI EV (B01AB01) y Enalapril 5mg VO (C09AA02). Evolucion clinica favorable, cumpliendo criterios de alta. Alta con diagnostico de angina estable tratado (I20.8), indicandose Losartan 50mg VO c/24h (C09CA01), Apixaban 5mg VO c/12h (B01AF02), Prasugrel 10mg VO c/24h 12m (B01AC22) y Warfarina segun INR (B01AA03)."}
{"input": {"dx": ["Asma bronquial exacerbada (J45.9)"], "proc": ["Angio TAC cerebral (88.38)"], "tto": ["Metoclopramida 10mg EV c/8h (A03FA01)", "Ondansetron 8mg EV c/8h (A04AA01)", "Paracetamol 1g EV c/8h (N02BE01)"], "evo": "Evolucion favorable con tratamiento medico, sin complicaciones", "dx_alta": ["Asma bronquial exacerbada resuelto (J45.9)"], "med": ["Budesonide/Formoterol INH c/12h (R03AK07)", "Prednisona 20mg VO c/24h (H02AB07)", "Sertralina 50mg VO c/24h (N06AB06)"]}, "output": "Paciente que ingresa con cuadro de asma bronquial exacerbada (J45.9). Se realiza angio tac cerebral (88.38). Evoluciona con, evolucion favorable con tratamiento medico, sin complicaciones. Recibio tratamiento con Metoclopramida 10mg EV c/8h (A03FA01), Ondansetron 8mg EV c/8h (A04AA01) y Paracetamol 1g EV c/8h (N02BE01). Buena evolucion, cumpliendo criterios de alta. Alta con diagnostico de asma bronquial exacerbada resuelto (J45.9), indicandose Budesonide/Formoterol INH c/12h (R03AK07), Prednisona 20mg VO c/24h (H02AB07) y Sertralina 50mg VO c/24h (N06AB06)."}
{"input": {"dx": ["Angina inestable (I20.0)"], "proc": ["Coronariografia (K492)"], "tto": ["Clopidogrel 300mg carga (B01AC04)", "Aspirina 300mg carga (B01AC06)"], "evo": "Pericarditis aguda con derrame leve, manejo antiinflamatorio", "dx_alta": ["Angina inestable tratado (I20.0)"], "med": ["Rivaroxaban 20mg VO c/24h (B01AF01)", "Warfarina segun INR (B01AA03)", "Digoxina 0.125mg VO c/24h (C01AA05)", "Ticagrelor 90mg VO c/12h 12m (B01AC24)"]}, "output": "Ingreso por angina inestable (I20.0). Se realiza coronariografia (K492). Durante la hospitalizacion, pericarditis aguda con derrame leve, manejo antiinflamatorio. Recibio tratamiento con Clopidogrel 300mg carga (B01AC04) y Aspirina 300mg carga (B01AC06). Presenta evolucion favorable, cumpliendo criterios de alta. Alta con diagnostico de angina inestable tratado (I20.0), indicandose Rivaroxaban 20mg VO c/24h (B01AF01), Warfarina segun INR (B01AA03), Digoxina 0.125mg VO c/24h (C01AA05) y Ticagrelor 90mg VO c/12h 12m (B01AC24)."}
{"input": {"dx": ["Reestenosis intra-stent (I25.5)"], "proc": ["Cateterismo derecho (K493)"], "tto": ["Enoxaparina 1mg/kg SC c/12h (B01AB05)", "Heparina EV infusion (B01AB01)"], "evo": "Estenosis aortica severa sintomatica, programada para TAVI", "dx_alta": ["Reestenosis intra-stent tratado (I25.5)"], "med": ["Clopidogrel 75mg VO c/24h 12m (B01AC04)", "Espironolactona 25mg VO c/24h (C03DA01)", "Prasugrel 10mg VO c/24h 12m (B01AC22)", "Rosuvastatina 20mg VO c/noche (C10AA07)", "Digoxina 0.125mg VO c/24h (C01AA05)"]}, "output": "Ingresa por reestenosis intra-stent (I25.5). Se realiza cateterismo derecho (K493). Presenta, estenosis aortica severa sintomatica, programada para tavi. Recibio tratamiento con Enoxaparina 1mg/kg SC c/12h (B01AB05) y Heparina EV infusion (B01AB01). Presenta evolucion favorable, cumpliendo criterios de alta. Alta con diagnostico de reestenosis intra-stent tratado (I25.5), indicandose Clopidogrel 75mg VO c/24h 12m (B01AC04), Espironolactona 25mg VO c/24h (C03DA01), Prasugrel 10mg VO c/24h 12m (B01AC22), Rosuvastatina 20mg VO c/noche (C10AA07) y Digoxina 0.125mg VO c/24h (C01AA05)."}
{"input": {"dx": ["Fractura de cadera (S72.0)"], "proc": ["Apendicectomia (47.09)"], "tto": ["Tramadol 50mg EV c/8h (N02AX02)", "Metamizol 1g EV c/8h (N02BB02)", "Vancomicina 1g EV c/12h (J01XA01)", "Omeprazol 40mg EV c/12h (A02BC01)"], "evo": "Respuesta adecuada al tratamiento antibiotico, afebril desde dia 2", "dx_alta": ["Fractura de cadera resuelto (S72.0)"], "med": ["Levotiroxina 50mcg VO c/24h (H03AA01)", "Budesonide/Formoterol INH c/12h (R03AK07)"]}, "output": "Se hospitaliza por fractura de cadera (S72.0). Se realiza apendicectomia (47.09). En su evolucion, respuesta adecuada al tratamiento antibiotico, afebril desde dia 2. Recibio tratamiento con Tramadol 50mg EV c/8h (N02AX02), Metamizol 1g EV c/8h (N02BB02), Vancomicina 1g EV c/12h (J01XA01) y Omeprazol 40mg EV c/12h (A02BC01). Evolucion clinica favorable, cumpliendo criterios de alta. Alta con diagnostico de fractura de cadera resuelto (S72.0), indicandose Levotiroxina 50mcg VO c/24h (H03AA01) y Budesonide/Formoterol INH c/12h (R03AK07)."}
{"input": {"dx": ["IAMCEST lateral (I21.2)"], "proc": ["Coronariografia (K492)"], "tto": ["Heparina 5000UI EV (B01AB01)", "Enalapril 5mg VO (C09AA02)", "Clopidogrel 600mg carga (B01AC04)", "Prasugrel 60mg carga (B01AC22)"], "evo": "Oclusion de OM1 con trombo, trombectomia por aspiracion mas stent", "dx_alta": ["IAMCEST lateral tratado (I21.2)"], "med": ["Prasugrel 10mg VO c/24h 12m (B01AC22)", "Warfarina segun INR (B01AA03)", "Amlodipino 5mg VO c/24h (C08CA01)", "Espironolactona 25mg VO c/24h (C03DA01)", "Carvedilol 6.25mg VO c/12h (C07AG02)"]}, "output": "Paciente que ingresa con cuadro de iamcest lateral (I21.2). Se realiza coronariografia (K492). Evoluciona con, oclusion de om1 con trombo, trombectomia por aspiracion mas stent. Recibio tratamiento con Heparina 5000UI EV (B01AB01), Enalapril 5mg VO (C09AA02), Clopidogrel 600mg carga (B01AC04) y Prasugrel 60mg carga (B01AC22). Presenta evolucion favorable, cumpliendo criterios de alta. Alta con diagnostico de iamcest lateral tratado (I21.2), indicandose Prasugrel 10mg VO c/24h 12m (B01AC22), Warfarina segun INR (B01AA03), Amlodipino 5mg VO c/24h (C08CA01), Espironolactona 25mg VO c/24h (C03DA01) y Carvedilol 6.25mg VO c/12h (C07AG02)."}
{"input": {"dx": ["Angina estable (I20.8)"], "proc": ["Coronariografia (K492)", "Angioplastia TCI (K493)"], "tto": ["Clopidogrel 300mg carga (B01AC04)", "Furosemida 80mg EV (C03CA01)", "Enoxaparina 1mg/kg SC c/12h (B01AB05)", "Nitroglicerina EV (C01DA02)"], "evo": "Lesion severa de TCI, angioplastia con implante de stent sin complicaciones", "dx_alta": ["Angina estable tratado (I20.8)"], "med": ["Rivaroxaban 20mg VO c/24h (B01AF01)", "Espironolactona 25mg VO c/24h (C03DA01)", "Carvedilol 6.25mg VO c/12h (C07AG02)", "Enalapril 10mg VO c/12h (C09AA02)", "Clopidogrel 75mg VO c/24h 12m (B01AC04)"]}, "output": "Ingresa por angina estable (I20.8). Se realiza coronariografia (K492) visualizando estenosis severa, realizandose angioplastia tci (K493) con implante de stent farmacoactivo y flujo TIMI 3 final. Evoluciona con, lesion severa de tci, angioplastia con implante de stent sin complicaciones. Recibio tratamiento con Clopidogrel 300mg carga (B01AC04), Furosemida 80mg EV (C03CA01), Enoxaparina 1mg/kg SC c/12h (B01AB05) y Nitroglicerina EV (C01DA02). Presenta evolucion favorable, cumpliendo criterios de alta. Alta con diagnostico de angina estable tratado (I20.8), indicandose Rivaroxaban 20mg VO c/24h (B01AF01), Espironolactona 25mg VO c/24h (C03DA01), Carvedilol 6.25mg VO c/12h (C07AG02), Enalapril 10mg VO c/12h (C09AA02) y Clopidogrel 75mg VO c/24h 12m (B01AC04)."}
{"input": {"dx": ["Enfermedad de TCI (I25.1)"], "proc": ["Cardioversion electrica (37.0)"], "tto": ["Atorvastatina 80mg (C10AA05)", "Furosemida 80mg EV (C03CA01)"], "evo": "Enfermedad de multiples vasos, se deriva a cirugia cardiaca para bypass", "dx_alta": ["Enfermedad de TCI tratado (I25.1)"], "med": ["Espironolactona 25mg VO c/24h (C03DA01)", "Carvedilol 6.25mg VO c/12h (C07AG02)", "Apixaban 5mg VO c/12h (B01AF02)"]}, "output": "Ingresa por enfermedad de tci (I25.1). Se realiza cardioversion electrica (37.0). Evoluciona con, enfermedad de multiples vasos, se deriva a cirugia cardiaca para bypass. Recibio tratamiento con Atorvastatina 80mg (C10AA05) y Furosemida 80mg EV (C03CA01). Presenta evolucion favorable, cumpliendo criterios de alta. Alta con diagnostico de enfermedad de tci tratado (I25.1), indicandose Espironolactona 25mg VO c/24h (C03DA01), Carvedilol 6.25mg VO c/12h (C07AG02) y Apixaban 5mg VO c/12h (B01AF02)."}
{"input": {"dx": ["Trombosis de stent (I21.0)"], "proc": ["Angioplastia DA (K493)"], "tto": ["Furosemida 40mg EV (C03CA01)", "Noradrenalina EV (C01CA03)"], "evo": "Lesion severa de ramus intermedio, angioplastia con implante de stent sin complicaciones", "dx_alta": ["Trombosis de stent tratado (I21.0)"], "med": ["Carvedilol 6.25mg VO c/12h (C07AG02)", "Warfarina segun INR (B01AA03)", "Losartan 50mg VO c/24h (C09CA01)"]}, "output": "Paciente que ingresa con cuadro de trombosis de stent (I21.0). Se realiza angioplastia da (K493). Evoluciona con, lesion severa de ramus intermedio, angioplastia con implante de stent sin complicaciones. Recibio tratamiento con Furosemida 40mg EV (C03CA01) y Noradrenalina EV (C01CA03). Presenta evolucion favorable, cumpliendo criterios de alta. Alta con diagnostico de trombosis de stent tratado (I21.0), indicandose Carvedilol 6.25mg VO c/12h (C07AG02), Warfarina segun INR (B01AA03) y Losartan 50mg VO c/24h (C09CA01)."}
{"input": {"dx": ["Enfermedad coronaria de 3 vasos (I25.1)"], "proc": ["Coronariografia (K492)", "Angioplastia CX (36.06)"], "tto": ["Furosemida 40mg EV (C03CA01)", "Morfina 3mg EV (N02AA01)", "Metoprolol 5mg EV (C07AB02)", "Digoxina 0.25mg EV (C01AA05)"], "evo": "Edema pulmonar agudo por disfuncion sistolica, respuesta favorable a diureticos", "dx_alta": ["Enfermedad coronaria de 3 vasos tratado (I25.1)"], "med": ["Rosuvastatina 20mg VO c/noche (C10AA07)", "Rivaroxaban 20mg VO c/24h (B01AF01)", "Furosemida 40mg VO c/24h (C03CA01)", "Prasugrel 10mg VO c/24h 12m (B01AC22)", "Amlodipino 5mg VO c/24h (C08CA01)"]}, "output": "Se hospitaliza por enfermedad coronaria de 3 vasos (I25.1). Se realiza coronariografia (K492) con hallazgo de lesion significativa, realizandose angioplastia cx (36.06) con implante de stent farmacoactivo y flujo TIMI 3 final. Evoluciona con, edema pulmonar agudo por disfuncion sistolica, respuesta favorable a diureticos. Recibio tratamiento con Furosemida 40mg EV (C03CA01), Morfina 3mg EV (N02AA01), Metoprolol 5mg EV (C07AB02) y Digoxina 0.25mg EV (C01AA05). Evolucion clinica favorable, cumpliendo criterios de alta. Alta con diagnostico de enfermedad coronaria de 3 vasos tratado (I25.1), indicandose Rosuvastatina 20mg VO c/noche (C10AA07), Rivaroxaban 20mg VO c/24h (B01AF01), Furosemida 40mg VO c/24h (C03CA01), Prasugrel 10mg VO c/24h 12m (B01AC22) y Amlodipino 5mg VO c/24h (C08CA01)."}
{"input": {"dx": ["IAMCEST anteroseptal (I21.0)"], "proc": ["Coronariografia (K492)"], "tto": ["Heparina EV infusion (B01AB01)", "Enoxaparina 60mg SC c/12h (B01AB05)", "Metoprolol 5mg EV (C07AB02)", "Digoxina 0.25mg EV (C01AA05)"], "evo": "Oclusion aguda de DA distal, angioplastia exitosa con stent farmacoactivo, flujo TIMI 3 final", "dx_alta": ["IAMCEST anteroseptal tratado (I21.0)"], "med": ["Losartan 50mg VO c/24h (C09CA01)", "Rivaroxaban 20mg VO c/24h (B01AF01)", "Enalapril 10mg VO c/12h (C09AA02)", "Prasugrel 10mg VO c/24h 12m (B01AC22)", "Ticagrelor 90mg VO c/12h 12m (B01AC24)"]}, "output": "Ingreso por iamcest anteroseptal (I21.0). Se realiza coronariografia (K492). Evoluciona con, oclusion aguda de da distal, angioplastia exitosa con stent farmacoactivo, flujo timi 3 final. Recibio tratamiento con Heparina EV infusion (B01AB01), Enoxaparina 60mg SC c/12h (B01AB05), Metoprolol 5mg EV (C07AB02) y Digoxina 0.25mg EV (C01AA05). Evolucion clinica favorable, cumpliendo criterios de alta. Alta con diagnostico de iamcest anteroseptal tratado (I21.0), indicandose Losartan 50mg VO c/24h (C09CA01), Rivaroxaban 20mg VO c/24h (B01AF01), Enalapril 10mg VO c/12h (C09AA02), Prasugrel 10mg VO c/24h 12m (B01AC22) y Ticagrelor 90mg VO c/12h 12m (B01AC24)."}
{"input": {"dx": ["Reestenosis intra-stent (I25.5)"], "proc": ["Valvuloplastia mitral (35.05)"], "tto": ["Atorvastatina 80mg (C10AA05)", "Nitroglicerina EV (C01DA02)", "Heparina 5000UI EV (B01AB01)"], "evo": "Estenosis aortica severa sintomatica, programada para TAVI", "dx_alta": ["Reestenosis intra-stent tratado (I25.5)"], "med": ["Bisoprolol 5mg VO c/24h (C07AB07)", "Furosemida 40mg VO c/24h (C03CA01)", "Losartan 50mg VO c/24h (C09CA01)"]}, "output": "Ingreso por reestenosis intra-stent (I25.5). Se realiza valvuloplastia mitral (35.05). Evoluciona con, estenosis aortica severa sintomatica, programada para tavi. Recibio tratamiento con Atorvastatina 80mg (C10AA05), Nitroglicerina EV (C01DA02) y Heparina 5000UI EV (B01AB01). Evolucion satisfactoria, cumpliendo criterios de alta. Alta con diagnostico de reestenosis intra-stent tratado (I25.5), indicandose Bisoprolol 5mg VO c/24h (C07AB07), Furosemida 40mg VO c/24h (C03CA01) y Losartan 50mg VO c/24h (C09CA01)."}
{"input": {"dx": ["IAMCEST inferolateral (I21.1)"], "proc": ["Coronariografia (K492)", "Angioplastia CX (K493)"], "tto": ["Furosemida 80mg EV (C03CA01)", "Aspirina 300mg carga (B01AC06)", "Prasugrel 60mg carga (B01AC22)"], "evo": "Pericarditis aguda con derrame leve, manejo antiinflamatorio", "dx_alta": ["IAMCEST inferolateral tratado (I21.1)"], "med": ["Isosorbide 20mg VO c/8h (C01DA08)", "Espironolactona 25mg VO c/24h (C03DA01)", "Nitroglicerina SL PRN (C01DA02)"]}, "output": "Ingreso por iamcest inferolateral (I21.1). Se realiza coronariografia (K492) con hallazgo de lesion significativa, realizandose angioplastia cx (K493) con implante de stent farmacoactivo y flujo TIMI 3 final. En su evolucion, pericarditis aguda con derrame leve, manejo antiinflamatorio. Recibio tratamiento con Furosemida 80mg EV (C03CA01), Aspirina 300mg carga (B01AC06) y Prasugrel 60mg carga (B01AC22). Presenta evolucion favorable, cumpliendo criterios de alta. Alta con diagnostico de iamcest inferolateral tratado (I21.1), indicandose Isosorbide 20mg VO c/8h (C01DA08), Espironolactona 25mg VO c/24h (C03DA01) y Nitroglicerina SL PRN (C01DA02)."}
{"input": {"dx": ["Reestenosis intra-stent (I25.5)"], "proc": ["Implante de DAI (37.80)"], "tto": ["Nitroglicerina EV (C01DA02)", "Heparina EV infusion (B01AB01)", "Heparina 5000UI EV (B01AB01)"], "evo": "Edema pulmonar agudo por disfuncion sistolica, respuesta favorable a diureticos", "dx_alta": ["Reestenosis intra-stent tratado (I25.5)"], "med": ["Carvedilol 6.25mg VO c/12h (C07AG02)", "Isosorbide 20mg VO c/8h (C01DA08)", "Aspirina 100mg VO c/24h (B01AC06)", "Losartan 50mg VO c/24h (C09CA01)"]}, "output": "Ingreso por reestenosis intra-stent (I25.5). Se realiza implante de dai (37.80). Durante la hospitalizacion, edema pulmonar agudo por disfuncion sistolica, respuesta favorable a diureticos. Recibio tratamiento con Nitroglicerina EV (C01DA02), Heparina EV infusion (B01AB01) y Heparina 5000UI EV (B01AB01). Evolucion satisfactoria, cumpliendo criterios de alta. Alta con diagnostico de reestenosis intra-stent tratado (I25.5), indicandose Carvedilol 6.25mg VO c/12h (C07AG02), Isosorbide 20mg VO c/8h (C01DA08), Aspirina 100mg VO c/24h (B01AC06) y Losartan 50mg VO c/24h (C09CA01)."}
{"input": {"dx": ["Angina estable (I20.8)"], "proc": ["Coronariografia (K492)", "Angioplastia DA (K493)"], "tto": ["Clopidogrel 300mg carga (B01AC04)", "Levosimendan EV (C01CX08)"], "evo": "Enfermedad de multiples vasos, se deriva a cirugia cardiaca para bypass", "dx_alta": ["Angina estable tratado (I20.8)"], "med": ["Ticagrelor 90mg VO c/12h 12m (B01AC24)", "Enalapril 10mg VO c/12h (C09AA02)", "Prasugrel 10mg VO c/24h 12m (B01AC22)", "Losartan 50mg VO c/24h (C09CA01)", "Apixaban 5mg VO c/12h (B01AF02)"]}, "output": "Ingresa por angina estable (I20.8). Se realiza coronariografia (K492) visualizando estenosis severa, realizandose angioplastia da (K493) con implante de stent farmacoactivo y flujo TIMI 3 final. Durante la hospitalizacion, enfermedad de multiples vasos, se deriva a cirugia cardiaca para bypass. Recibio tratamiento con Clopidogrel 300mg carga (B01AC04) y Levosimendan EV (C01CX08). Evolucion satisfactoria, cumpliendo criterios de alta. Alta con diagnostico de angina estable tratado (I20.8), indicandose Ticagrelor 90mg VO c/12h 12m (B01AC24), Enalapril 10mg VO c/12h (C09AA02), Prasugrel 10mg VO c/24h 12m (B01AC22), Losartan 50mg VO c/24h (C09CA01) y Apixaban 5mg VO c/12h (B01AF02)."}
{"input": {"dx": ["Enfermedad coronaria de 3 vasos (I25.1)"], "proc": ["Coronariografia (K492)", "Angioplastia TCI (36.06)"], "tto": ["Metoprolol 5mg EV (C07AB02)", "Noradrenalina EV (C01CA03)"], "evo": "Oclusion aguda de CX proximal, angioplastia exitosa con stent farmacoactivo, flujo TIMI 3 final", "dx_alta": ["Enfermedad coronaria de 3 vasos tratado (I25.1)"], "med": ["Bisoprolol 5mg VO c/24h (C07AB07)", "Losartan 50mg VO c/24h (C09CA01)", "Prasugrel 10mg VO c/24h 12m (B01AC22)", "Espironolactona 25mg VO c/24h (C03DA01)", "Nitroglicerina SL PRN (C01DA02)"]}, "output": "Paciente que ingresa con cuadro de enfermedad coronaria de 3 vasos (I25.1). Se realiza coronariografia (K492) visualizando estenosis severa, realizandose angioplastia tci (36.06) con implante de stent farmacoactivo y flujo TIMI 3 final. Evoluciona con, oclusion aguda de cx proximal, angioplastia exitosa con stent farmacoactivo, flujo timi 3 final. Recibio tratamiento con Metoprolol 5mg EV (C07AB02) y Noradrenalina EV (C01CA03). Buena evolucion, cumpliendo criterios de alta. Alta con diagnostico de enfermedad coronaria de 3 vasos tratado (I25.1), indicandose Bisoprolol 5mg VO c/24h (C07AB07), Losartan 50mg VO c/24h (C09CA01), Prasugrel 10mg VO c/24h 12m (B01AC22), Espironolactona 25mg VO c/24h (C03DA01) y Nitroglicerina SL PRN (C01DA02)."}
{"input": {"dx": ["Angina inestable (I20.0)"], "proc": ["Coronariografia (K492)", "Angioplastia TCI (K493)"], "tto": ["Levosimendan EV (C01CX08)", "Enoxaparina 60mg SC c/12h (B01AB05)", "Atorvastatina 80mg (C10AA05)"], "evo": "SDST en II, III, aVF, coronarias sin lesiones obstructivas, sindrome de Tako-Tsubo", "dx_alta": ["Angina inestable tratado (I20.0)"], "med": ["Enalapril 10mg VO c/12h (C09AA02)", "Isosorbide 20mg VO c/8h (C01DA08)", "Bisoprolol 5mg VO c/24h (C07AB07)"]}, "output": "Paciente que ingresa con cuadro de angina inestable (I20.0). Se realiza coronariografia (K492) encontrando lesion critica, realizandose angioplastia tci (K493) con implante de stent farmacoactivo y flujo TIMI 3 final. Durante la hospitalizacion, sdst en ii, iii, avf, coronarias sin lesiones obstructivas, sindrome de tako-tsubo. Recibio tratamiento con Levosimendan EV (C01CX08), Enoxaparina 60mg SC c/12h (B01AB05) y Atorvastatina 80mg (C10AA05). Buena evolucion, cumpliendo criterios de alta. Alta con diagnostico de angina inestable tratado (I20.0), indicandose Enalapril 10mg VO c/12h (C09AA02), Isosorbide 20mg VO c/8h (C01DA08) y Bisoprolol 5mg VO c/24h (C07AB07)."}
{"input": {"dx": ["Edema pulmonar agudo (J81)"], "proc": ["TAVI (35.04)"], "tto": ["Clopidogrel 600mg carga (B01AC04)", "Morfina 3mg EV (N02AA01)", "Enoxaparina 60mg SC c/12h (B01AB05)"], "evo": "Shock cardiogenico, requirio soporte con inotropicos, evolucion favorable", "dx_alta": ["Edema pulmonar agudo tratado (J81)"], "med": ["Metoprolol 50mg VO c/12h (C07AB02)", "Nitroglicerina SL PRN (C01DA02)", "Losartan 50mg VO c/24h (C09CA01)", "Warfarina segun INR (B01AA03)"]}, "output": "Ingreso por edema pulmonar agudo (J81). Se realiza tavi (35.04). Evoluciona con, shock cardiogenico, requirio soporte con inotropicos, evolucion favorable. Recibio tratamiento con Clopidogrel 600mg carga (B01AC04), Morfina 3mg EV (N02AA01) y Enoxaparina 60mg SC c/12h (B01AB05). Buena evolucion, cumpliendo criterios de alta. Alta con diagnostico de edema pulmonar agudo tratado (J81), indicandose Metoprolol 50mg VO c/12h (C07AB02), Nitroglicerina SL PRN (C01DA02), Losartan 50mg VO c/24h (C09CA01) y Warfarina segun INR (B01AA03)."}
{"input": {"dx": ["Enfermedad de TCI (I25.1)"], "proc": ["Angioplastia TCI (K492)"], "tto": ["Enalapril 5mg VO (C09AA02)", "Aspirina 100mg (B01AC06)", "Noradrenalina EV (C01CA03)", "Metoprolol 5mg EV (C07AB02)"], "evo": "SDST en I, aVL, coronarias sin lesiones obstructivas, sindrome de Tako-Tsubo", "dx_alta": ["Enfermedad de TCI tratado (I25.1)"], "med": ["Nitroglicerina SL PRN (C01DA02)", "Metoprolol 50mg VO c/12h (C07AB02)", "Clopidogrel 75mg VO c/24h 12m (B01AC04)", "Amlodipino 5mg VO c/24h (C08CA01)"]}, "output": "Paciente que ingresa con cuadro de enfermedad de tci (I25.1). Se realiza angioplastia tci (K492). Presenta, sdst en i, avl, coronarias sin lesiones obstructivas, sindrome de tako-tsubo. Recibio tratamiento con Enalapril 5mg VO (C09AA02), Aspirina 100mg (B01AC06), Noradrenalina EV (C01CA03) y Metoprolol 5mg EV (C07AB02). Evolucion satisfactoria, cumpliendo criterios de alta. Alta con diagnostico de enfermedad de tci tratado (I25.1), indicandose Nitroglicerina SL PRN (C01DA02), Metoprolol 50mg VO c/12h (C07AB02), Clopidogrel 75mg VO c/24h 12m (B01AC04) y Amlodipino 5mg VO c/24h (C08CA01)."}
{"input": {"dx": ["IAMCEST anteroseptal (I21.0)"], "proc": ["Coronariografia (K492)", "Angioplastia CX (36.06)"], "tto": ["Nitroglicerina EV (C01DA02)", "Enoxaparina 60mg SC c/12h (B01AB05)", "Levosimendan EV (C01CX08)"], "evo": "SDST en II, III, aVF, coronarias sin lesiones obstructivas, sindrome de Tako-Tsubo", "dx_alta": ["IAMCEST anteroseptal tratado (I21.0)"], "med": ["Apixaban 5mg VO c/12h (B01AF02)", "Rosuvastatina 20mg VO c/noche (C10AA07)", "Atorvastatina 40mg VO c/noche (C10AA05)", "Bisoprolol 5mg VO c/24h (C07AB07)"]}, "output": "Paciente que ingresa con cuadro de iamcest anteroseptal (I21.0). Se realiza coronariografia (K492) encontrando lesion critica, realizandose angioplastia cx (36.06) con implante de stent farmacoactivo y flujo TIMI 3 final. En su evolucion, sdst en ii, iii, avf, coronarias sin lesiones obstructivas, sindrome de tako-tsubo. Recibio tratamiento con Nitroglicerina EV (C01DA02), Enoxaparina 60mg SC c/12h (B01AB05) y Levosimendan EV (C01CX08). Evolucion clinica favorable, cumpliendo criterios de alta. Alta con diagnostico de iamcest anteroseptal tratado (I21.0), indicandose Apixaban 5mg VO c/12h (B01AF02), Rosuvastatina 20mg VO c/noche (C10AA07), Atorvastatina 40mg VO c/noche (C10AA05) y Bisoprolol 5mg VO c/24h (C07AB07)."}
{"input": {"dx": ["Angina inestable (I20.0)"], "proc": ["Coronariografia (K492)", "Angioplastia OM (36.06)"], "tto": ["Levosimendan EV (C01CX08)", "Heparina EV infusion (B01AB01)", "Clopidogrel 600mg carga (B01AC04)"], "evo": "Oclusion de CD media con trombo, trombectomia por aspiracion mas stent", "dx_alta": ["Angina inestable tratado (I20.0)"], "med": ["Rosuvastatina 20mg VO c/noche (C10AA07)", "Digoxina 0.125mg VO c/24h (C01AA05)", "Nitroglicerina SL PRN (C01DA02)"]}, "output": "Paciente que ingresa con cuadro de angina inestable (I20.0). Se realiza coronariografia (K492) encontrando lesion critica, realizandose angioplastia om (36.06) con implante de stent farmacoactivo y flujo TIMI 3 final. Evoluciona con, oclusion de cd media con trombo, trombectomia por aspiracion mas stent. Recibio tratamiento con Levosimendan EV (C01CX08), Heparina EV infusion (B01AB01) y Clopidogrel 600mg carga (B01AC04). Presenta evolucion favorable, cumpliendo criterios de alta. Alta con diagnostico de angina inestable tratado (I20.0), indicandose Rosuvastatina 20mg VO c/noche (C10AA07), Digoxina 0.125mg VO c/24h (C01AA05) y Nitroglicerina SL PRN (C01DA02)."}
{"input": {"dx": ["IAMCEST lateral (I21.2)"], "proc": ["Coronariografia (K492)", "Angioplastia CX (K493)"], "tto": ["Morfina 3mg EV (N02AA01)", "Digoxina 0.25mg EV (C01AA05)", "Enoxaparina 60mg SC c/12h (B01AB05)"], "evo": "Fibrilacion auricular de alta respuesta, cardioversion farmacologica exitosa", "dx_alta": ["IAMCEST lateral tratado (I21.2)"], "med": ["Prasugrel 10mg VO c/24h 12m (B01AC22)", "Isosorbide 20mg VO c/8h (C01DA08)", "Amlodipino 5mg VO c/24h (C08CA01)"]}, "output": "Ingresa por iamcest lateral (I21.2). Se realiza coronariografia (K492) visualizando estenosis severa, realizandose angioplastia cx (K493) con implante de stent farmacoactivo y flujo TIMI 3 final. Evoluciona con, fibrilacion auricular de alta respuesta, cardioversion farmacologica exitosa. Recibio tratamiento con Morfina 3mg EV (N02AA01), Digoxina 0.25mg EV (C01AA05) y Enoxaparina 60mg SC c/12h (B01AB05). Presenta evolucion favorable, cumpliendo criterios de alta. Alta con diagnostico de iamcest lateral tratado (I21.2), indicandose Prasugrel 10mg VO c/24h 12m (B01AC22), Isosorbide 20mg VO c/8h (C01DA08) y Amlodipino 5mg VO c/24h (C08CA01)."}
{"input": {"dx": ["IAMCEST posterior (I21.2)"], "proc": ["Coronariografia (K492)", "Angioplastia CX (36.06)"], "tto": ["Furosemida 40mg EV (C03CA01)", "Clopidogrel 300mg carga (B01AC04)", "Furosemida 80mg EV (C03CA01)", "Clopidogrel 600mg carga (B01AC04)"], "evo": "Oclusion de DA media con trombo, trombectomia por aspiracion mas stent", "dx_alta": ["IAMCEST posterior tratado (I21.2)"], "med": ["Rosuvastatina 20mg VO c/noche (C10AA07)", "Furosemida 40mg VO c/24h (C03CA01)", "Metoprolol 50mg VO c/12h (C07AB02)"]}, "output": "Se hospitaliza por iamcest posterior (I21.2). Se realiza coronariografia (K492) encontrando lesion critica, realizandose angioplastia cx (36.06) con implante de stent farmacoactivo y flujo TIMI 3 final. Evoluciona con, oclusion de da media con trombo, trombectomia por aspiracion mas stent. Recibio tratamiento con Furosemida 40mg EV (C03CA01), Clopidogrel 300mg carga (B01AC04), Furosemida 80mg EV (C03CA01) y Clopidogrel 600mg carga (B01AC04). Buena evolucion, cumpliendo criterios de alta. Alta con diagnostico de iamcest posterior tratado (I21.2), indicandose Rosuvastatina 20mg VO c/noche (C10AA07), Furosemida 40mg VO c/24h (C03CA01) y Metoprolol 50mg VO c/12h (C07AB02)."}
{"input": {"dx": ["IAMCEST posterior (I21.2)"], "proc": ["Coronariografia (K492)", "Angioplastia TCI (36.06)"], "tto": ["Clopidogrel 300mg carga (B01AC04)", "Ticagrelor 180mg carga (B01AC24)", "Aspirina 300mg carga (B01AC06)", "Morfina 3mg EV (N02AA01)"], "evo": "Bloqueo AV completo sintomatico, requirio marcapasos transitorio", "dx_alta": ["IAMCEST posterior tratado (I21.2)"], "med": ["Aspirina 100mg VO c/24h (B01AC06)", "Clopidogrel 75mg VO c/24h 12m (B01AC04)", "Isosorbide 20mg VO c/8h (C01DA08)", "Atorvastatina 40mg VO c/noche (C10AA05)"]}, "output": "Se hospitaliza por iamcest posterior (I21.2). Se realiza coronariografia (K492) con hallazgo de lesion significativa, realizandose angioplastia tci (36.06) con implante de stent farmacoactivo y flujo TIMI 3 final. Presenta, bloqueo av completo sintomatico, requirio marcapasos transitorio. Recibio tratamiento con Clopidogrel 300mg carga (B01AC04), Ticagrelor 180mg carga (B01AC24), Aspirina 300mg carga (B01AC06) y Morfina 3mg EV (N02AA01). Buena evolucion, cumpliendo criterios de alta. Alta con diagnostico de iamcest posterior tratado (I21.2), indicandose Aspirina 100mg VO c/24h (B01AC06), Clopidogrel 75mg VO c/24h 12m (B01AC04), Isosorbide 20mg VO c/8h (C01DA08) y Atorvastatina 40mg VO c/noche (C10AA05)."}
{"input": {"dx": ["Apendicitis aguda (K35.8)"], "proc": ["Hernioplastia inguinal (53.00)"], "tto": ["Meropenem 1g EV c/8h (J01DH02)", "Omeprazol 40mg EV c/12h (A02BC01)", "N-acetilcisteina NBZ c/8h (R05CB01)"], "evo": "Cirugia programada sin complicaciones, alta precoz", "dx_alta": ["Apendicitis aguda resuelto (K35.8)"], "med": ["Tramadol 50mg VO c/8h 7d (N02AX02)", "Insulina NPH 10UI SC c/12h (A10AC01)", "Prednisona 20mg VO c/24h (H02AB07)"]}, "output": "Paciente que ingresa con cuadro de apendicitis aguda (K35.8). Se realiza hernioplastia inguinal (53.00). En su evolucion, cirugia programada sin complicaciones, alta precoz. Recibio tratamiento con Meropenem 1g EV c/8h (J01DH02), Omeprazol 40mg EV c/12h (A02BC01) y N-acetilcisteina NBZ c/8h (R05CB01). Evolucion satisfactoria, cumpliendo criterios de alta. Alta con diagnostico de apendicitis aguda resuelto (K35.8), indicandose Tramadol 50mg VO c/8h 7d (N02AX02), Insulina NPH 10UI SC c/12h (A10AC01) y Prednisona 20mg VO c/24h (H02AB07)."}
{"input": {"dx": ["Enfermedad coronaria de 3 vasos (I25.1)"], "proc": ["Coronariografia (K492)", "Angioplastia CX (K493)"], "tto": ["Metoprolol 5mg EV (C07AB02)", "Furosemida 80mg EV (C03CA01)", "Nitroglicerina EV (C01DA02)"], "evo": "Pericarditis aguda con derrame leve, manejo antiinflamatorio", "dx_alta": ["Enfermedad coronaria de 3 vasos tratado (I25.1)"], "med": ["Rosuvastatina 20mg VO c/noche (C10AA07)", "Amlodipino 5mg VO c/24h (C08CA01)", "Ticagrelor 90mg VO c/12h 12m (B01AC24)"]}, "output": "Se hospitaliza por enfermedad coronaria de 3 vasos (I25.1). Se realiza coronariografia (K492) con hallazgo de lesion significativa, realizandose angioplastia cx (K493) con implante de stent farmacoactivo y flujo TIMI 3 final. Presenta, pericarditis aguda con derrame leve, manejo antiinflamatorio. Recibio tratamiento con Metoprolol 5mg EV (C07AB02), Furosemida 80mg EV (C03CA01) y Nitroglicerina EV (C01DA02). Evolucion satisfactoria, cumpliendo criterios de alta. Alta con diagnostico de enfermedad coronaria de 3 vasos tratado (I25.1), indicandose Rosuvastatina 20mg VO c/noche (C10AA07), Amlodipino 5mg VO c/24h (C08CA01) y Ticagrelor 90mg VO c/12h 12m (B01AC24)."}
{"input": {"dx": ["IAMCEST inferior (I21.1)"], "proc": ["Coronariografia (K492)", "Angioplastia CD (36.06)"], "tto": ["Aspirina 300mg carga (B01AC06)", "Heparina 5000UI EV (B01AB01)", "Furosemida 40mg EV (C03CA01)", "Clopidogrel 600mg carga (B01AC04)"], "evo": "Shock cardiogenico, requirio soporte con inotropicos, evolucion favorable", "dx_alta": ["IAMCEST inferior tratado (I21.1)"], "med": ["Ticagrelor 90mg VO c/12h 12m (B01AC24)", "Prasugrel 10mg VO c/24h 12m (B01AC22)", "Apixaban 5mg VO c/12h (B01AF02)", "Atorvastatina 40mg VO c/noche (C10AA05)", "Rivaroxaban 20mg VO c/24h (B01AF01)"]}, "output": "Ingreso por iamcest inferior (I21.1). Se realiza coronariografia (K492) visualizando estenosis severa, realizandose angioplastia cd (36.06) con implante de stent farmacoactivo y flujo TIMI 3 final. Evoluciona con, shock cardiogenico, requirio soporte con inotropicos, evolucion favorable. Recibio tratamiento con Aspirina 300mg carga (B01AC06), Heparina 5000UI EV (B01AB01), Furosemida 40mg EV (C03CA01) y Clopidogrel 600mg carga (B01AC04). Evolucion satisfactoria, cumpliendo criterios de alta. Alta con diagnostico de iamcest inferior tratado (I21.1), indicandose Ticagrelor 90mg VO c/12h 12m (B01AC24), Prasugrel 10mg VO c/24h 12m (B01AC22), Apixaban 5mg VO c/12h (B01AF02), Atorvastatina 40mg VO c/noche (C10AA05) y Rivaroxaban 20mg VO c/24h (B01AF01)."}
{"input": {"dx": ["Sincope (R55)"], "proc": ["Colecistectomia laparoscopica (51.23)", "Paracentesis (54.91)"], "tto": ["Tramadol 50mg EV c/8h (N02AX02)", "Metoclopramida 10mg EV c/8h (A03FA01)", "Ciprofloxacino 400mg EV c/12h (J01MA02)"], "evo": "Estabilizacion clinica progresiva, sin eventos adversos", "dx_alta": ["Sincope resuelto (R55)"], "med": ["Hierro 100mg VO c/24h (B03AA07)", "Sertralina 50mg VO c/24h (N06AB06)"]}, "output": "Paciente que ingresa con cuadro de sincope (R55). Se realiza colecistectomia laparoscopica (51.23), paracentesis (54.91). Durante la hospitalizacion, estabilizacion clinica progresiva, sin eventos adversos. Recibio tratamiento con Tramadol 50mg EV c/8h (N02AX02), Metoclopramida 10mg EV c/8h (A03FA01) y Ciprofloxacino 400mg EV c/12h (J01MA02). Presenta evolucion favorable, cumpliendo criterios de alta. Alta con diagnostico de sincope resuelto (R55), indicandose Hierro 100mg VO c/24h (B03AA07) y Sertralina 50mg VO c/24h (N06AB06)."}
{"input": {"dx": ["Colecistitis aguda (K81.0)"], "proc": ["Ecografia abdominal (88.76)"], "tto": ["Tramadol 50mg EV c/8h (N02AX02)", "Ceftriaxona 2g EV c/24h (J01DD04)", "Metamizol 1g EV c/8h (N02BB02)"], "evo": "Evolucion favorable con tratamiento medico, sin complicaciones", "dx_alta": ["Colecistitis aguda resuelto (K81.0)"], "med": ["Acido folico 1mg VO c/24h (B03BB01)", "Levotiroxina 50mcg VO c/24h (H03AA01)", "Ciprofloxacino 500mg VO c/12h 7d (J01MA02)"]}, "output": "Ingresa por colecistitis aguda (K81.0). Se realiza ecografia abdominal (88.76). Presenta, evolucion favorable con tratamiento medico, sin complicaciones. Recibio tratamiento con Tramadol 50mg EV c/8h (N02AX02), Ceftriaxona 2g EV c/24h (J01DD04) y Metamizol 1g EV c/8h (N02BB02). Evolucion clinica favorable, cumpliendo criterios de alta. Alta con diagnostico de colecistitis aguda resuelto (K81.0), indicandose Acido folico 1mg VO c/24h (B03BB01), Levotiroxina 50mcg VO c/24h (H03AA01) y Ciprofloxacino 500mg VO c/12h 7d (J01MA02)."}
{"input": {"dx": ["Bloqueo AV completo (I44.2)"], "proc": ["Osteosintesis de cadera (79.35)"], "tto": ["Metronidazol 500mg EV c/8h (J01XD01)", "Insulina NPH 10UI SC c/12h (A10AC01)", "Ondansetron 8mg EV c/8h (A04AA01)"], "evo": "Manejo conservador exitoso, sin necesidad de cirugia", "dx_alta": ["Bloqueo AV completo resuelto (I44.2)"], "med": ["Glibenclamida 5mg VO c/24h (A10BB01)", "Sertralina 50mg VO c/24h (N06AB06)", "Levotiroxina 50mcg VO c/24h (H03AA01)", "Ciprofloxacino 500mg VO c/12h 7d (J01MA02)"]}, "output": "Ingreso por bloqueo av completo (I44.2). Se realiza osteosintesis de cadera (79.35). Evoluciona con, manejo conservador exitoso, sin necesidad de cirugia. Recibio tratamiento con Metronidazol 500mg EV c/8h (J01XD01), Insulina NPH 10UI SC c/12h (A10AC01) y Ondansetron 8mg EV c/8h (A04AA01). Evolucion clinica favorable, cumpliendo criterios de alta. Alta con diagnostico de bloqueo av completo resuelto (I44.2), indicandose Glibenclamida 5mg VO c/24h (A10BB01), Sertralina 50mg VO c/24h (N06AB06), Levotiroxina 50mcg VO c/24h (H03AA01) y Ciprofloxacino 500mg VO c/12h 7d (J01MA02)."}
{"input": {"dx": ["IAMCEST anterolateral (I21.0)"], "proc": ["Coronariografia (K492)", "Angioplastia CX (K493)"], "tto": ["Aspirina 100mg (B01AC06)", "Furosemida 80mg EV (C03CA01)", "Aspirina 300mg carga (B01AC06)"], "evo": "Oclusion aguda de CD media, angioplastia exitosa con stent farmacoactivo, flujo TIMI 3 final", "dx_alta": ["IAMCEST anterolateral tratado (I21.0)"], "med": ["Digoxina 0.125mg VO c/24h (C01AA05)", "Furosemida 40mg VO c/24h (C03CA01)", "Atorvastatina 40mg VO c/noche (C10AA05)"]}, "output": "Se hospitaliza por iamcest anterolateral (I21.0). Se realiza coronariografia (K492) con hallazgo de lesion significativa, realizandose angioplastia cx (K493) con implante de stent farmacoactivo y flujo TIMI 3 final. Durante la hospitalizacion, oclusion aguda de cd media, angioplastia exitosa con stent farmacoactivo, flujo timi 3 final. Recibio tratamiento con Aspirina 100mg (B01AC06), Furosemida 80mg EV (C03CA01) y Aspirina 300mg carga (B01AC06). Presenta evolucion favorable, cumpliendo criterios de alta. Alta con diagnostico de iamcest anterolateral tratado (I21.0), indicandose Digoxina 0.125mg VO c/24h (C01AA05), Furosemida 40mg VO c/24h (C03CA01) y Atorvastatina 40mg VO c/noche (C10AA05)."}
{"input": {"dx": ["Angina inestable alto riesgo (I20.0)"], "proc": ["Coronariografia (K492)", "Angioplastia TCI (K493)"], "tto": ["Furosemida 40mg EV (C03CA01)", "Furosemida 80mg EV (C03CA01)", "Dobutamina EV (C01CA07)", "Ticagrelor 180mg carga (B01AC24)"], "evo": "Lesion severa de DA media, angioplastia con implante de stent sin complicaciones", "dx_alta": ["Angina inestable alto riesgo tratado (I20.0)"], "med": ["Clopidogrel 75mg VO c/24h 12m (B01AC04)", "Losartan 50mg VO c/24h (C09CA01)", "Atorvastatina 40mg VO c/noche (C10AA05)"]}, "output": "Ingreso por angina inestable alto riesgo (I20.0). Se realiza coronariografia (K492) visualizando estenosis severa, realizandose angioplastia tci (K493) con implante de stent farmacoactivo y flujo TIMI 3 final. Durante la hospitalizacion, lesion severa de da media, angioplastia con implante de stent sin complicaciones. Recibio tratamiento con Furosemida 40mg EV (C03CA01), Furosemida 80mg EV (C03CA01), Dobutamina EV (C01CA07) y Ticagrelor 180mg carga (B01AC24). Presenta evolucion favorable, cumpliendo criterios de alta. Alta con diagnostico de angina inestable alto riesgo tratado (I20.0), indicandose Clopidogrel 75mg VO c/24h 12m (B01AC04), Losartan 50mg VO c/24h (C09CA01) y Atorvastatina 40mg VO c/noche (C10AA05)."}
{"input": {"dx": ["Shock cardiogenico (R57.0)"], "proc": ["Implante de DAI (99.62)"], "tto": ["Digoxina 0.25mg EV (C01AA05)", "Morfina 3mg EV (N02AA01)", "Aspirina 300mg carga (B01AC06)"], "evo": "Taquicardia ventricular sostenida, cardioversion electrica exitosa", "dx_alta": ["Shock cardiogenico tratado (R57.0)"], "med": ["Rosuvastatina 20mg VO c/noche (C10AA07)", "Apixaban 5mg VO c/12h (B01AF02)", "Amlodipino 5mg VO c/24h (C08CA01)"]}, "output": "Ingreso por shock cardiogenico (R57.0). Se realiza implante de dai (99.62). Presenta, taquicardia ventricular sostenida, cardioversion electrica exitosa. Recibio tratamiento con Digoxina 0.25mg EV (C01AA05), Morfina 3mg EV (N02AA01) y Aspirina 300mg carga (B01AC06). Evolucion satisfactoria, cumpliendo criterios de alta. Alta con diagnostico de shock cardiogenico tratado (R57.0), indicandose Rosuvastatina 20mg VO c/noche (C10AA07), Apixaban 5mg VO c/12h (B01AF02) y Amlodipino 5mg VO c/24h (C08CA01)."}
{"input": {"dx": ["Angina inestable alto riesgo (I20.0)"], "proc": ["Coronariografia (K492)", "Angioplastia TCI (K493)"], "tto": ["Enoxaparina 1mg/kg SC c/12h (B01AB05)", "Nitroglicerina EV (C01DA02)", "Heparina EV infusion (B01AB01)"], "evo": "Oclusion de TCI con trombo, trombectomia por aspiracion mas stent", "dx_alta": ["Angina inestable alto riesgo tratado (I20.0)"], "med": ["Carvedilol 6.25mg VO c/12h (C07AG02)", "Metoprolol 50mg VO c/12h (C07AB02)", "Enalapril 10mg VO c/12h (C09AA02)", "Rosuvastatina 20mg VO c/noche (C10AA07)", "Amlodipino 5mg VO c/24h (C08CA01)"]}, "output": "Se hospitaliza por angina inestable alto riesgo (I20.0). Se realiza coronariografia (K492) con hallazgo de lesion significativa, realizandose angioplastia tci (K493) con implante de stent farmacoactivo y flujo TIMI 3 final. En su evolucion, oclusion de tci con trombo, trombectomia por aspiracion mas stent. Recibio tratamiento con Enoxaparina 1mg/kg SC c/12h (B01AB05), Nitroglicerina EV (C01DA02) y Heparina EV infusion (B01AB01). Buena evolucion, cumpliendo criterios de alta. Alta con diagnostico de angina inestable alto riesgo tratado (I20.0), indicandose Carvedilol 6.25mg VO c/12h (C07AG02), Metoprolol 50mg VO c/12h (C07AB02), Enalapril 10mg VO c/12h (C09AA02), Rosuvastatina 20mg VO c/noche (C10AA07) y Amlodipino 5mg VO c/24h (C08CA01)."}
{"input": {"dx": ["Neumonia adquirida comunidad (J18.9)"], "proc": ["Trombolisis EV (99.10)"], "tto": ["Tramadol 50mg EV c/8h (N02AX02)", "Paracetamol 1g EV c/8h (N02BE01)"], "evo": "Evolucion favorable con tratamiento medico, sin complicaciones", "dx_alta": ["Neumonia adquirida comunidad resuelto (J18.9)"], "med": ["Metformina 850mg VO c/12h (A10BA02)", "Paracetamol 500mg VO c/8h PRN (N02BE01)"]}, "output": "Ingreso por neumonia adquirida comunidad (J18.9). Se realiza trombolisis ev (99.10). Presenta, evolucion favorable con tratamiento medico, sin complicaciones. Recibio tratamiento con Tramadol 50mg EV c/8h (N02AX02) y Paracetamol 1g EV c/8h (N02BE01). Evolucion clinica favorable, cumpliendo criterios de alta. Alta con diagnostico de neumonia adquirida comunidad resuelto (J18.9), indicandose Metformina 850mg VO c/12h (A10BA02) y Paracetamol 500mg VO c/8h PRN (N02BE01)."}
{"input": {"dx": ["Crisis hipertensiva (I10)"], "proc": ["Trombectomia mecanica (39.74)"], "tto": ["Metronidazol 500mg EV c/8h (J01XD01)", "Vancomicina 1g EV c/12h (J01XA01)"], "evo": "Mejoría clínica sostenida, cumple criterios de alta", "dx_alta": ["Crisis hipertensiva resuelto (I10)"], "med": ["Calcio 500mg VO c/12h (A12AA04)", "Vitamina D 1000UI VO c/24h (A11CC05)", "Amoxicilina/Clavulanico 875mg VO c/12h 7d (J01CR02)"]}, "output": "Paciente que ingresa con cuadro de crisis hipertensiva (I10). Se realiza trombectomia mecanica (39.74). Durante la hospitalizacion, mejoría clínica sostenida, cumple criterios de alta. Recibio tratamiento con Metronidazol 500mg EV c/8h (J01XD01) y Vancomicina 1g EV c/12h (J01XA01). Buena evolucion, cumpliendo criterios de alta. Alta con diagnostico de crisis hipertensiva resuelto (I10), indicandose Calcio 500mg VO c/12h (A12AA04), Vitamina D 1000UI VO c/24h (A11CC05) y Amoxicilina/Clavulanico 875mg VO c/12h 7d (J01CR02)."}
{"input": {"dx": ["Angina inestable (I20.0)"], "proc": ["Coronariografia (K492)"], "tto": ["Enalapril 5mg VO (C09AA02)", "Ticagrelor 180mg carga (B01AC24)"], "evo": "Edema pulmonar agudo por disfuncion sistolica, respuesta favorable a diureticos", "dx_alta": ["Angina inestable tratado (I20.0)"], "med": ["Isosorbide 20mg VO c/8h (C01DA08)", "Aspirina 100mg VO c/24h (B01AC06)", "Amlodipino 5mg VO c/24h (C08CA01)"]}, "output": "Paciente que ingresa con cuadro de angina inestable (I20.0). Se realiza coronariografia (K492). Evoluciona con, edema pulmonar agudo por disfuncion sistolica, respuesta favorable a diureticos. Recibio tratamiento con Enalapril 5mg VO (C09AA02) y Ticagrelor 180mg carga (B01AC24). Presenta evolucion favorable, cumpliendo criterios de alta. Alta con diagnostico de angina inestable tratado (I20.0), indicandose Isosorbide 20mg VO c/8h (C01DA08), Aspirina 100mg VO c/24h (B01AC06) y Amlodipino 5mg VO c/24h (C08CA01)."}
{"input": {"dx": ["Reestenosis intra-stent (I25.5)"], "proc": ["Angioplastia CD (37.34)"], "tto": ["Prasugrel 60mg carga (B01AC22)", "Digoxina 0.25mg EV (C01AA05)"], "evo": "Shock cardiogenico, requirio soporte con inotropicos, evolucion favorable", "dx_alta": ["Reestenosis intra-stent tratado (I25.5)"], "med": ["Isosorbide 20mg VO c/8h (C01DA08)", "Prasugrel 10mg VO c/24h 12m (B01AC22)", "Losartan 50mg VO c/24h (C09CA01)", "Rivaroxaban 20mg VO c/24h (B01AF01)"]}, "output": "Ingresa por reestenosis intra-stent (I25.5). Se realiza angioplastia cd (37.34). Durante la hospitalizacion, shock cardiogenico, requirio soporte con inotropicos, evolucion favorable. Recibio tratamiento con Prasugrel 60mg carga (B01AC22) y Digoxina 0.25mg EV (C01AA05). Evolucion satisfactoria, cumpliendo criterios de alta. Alta con diagnostico de reestenosis intra-stent tratado (I25.5), indicandose Isosorbide 20mg VO c/8h (C01DA08), Prasugrel 10mg VO c/24h 12m (B01AC22), Losartan 50mg VO c/24h (C09CA01) y Rivaroxaban 20mg VO c/24h (B01AF01)."}
{"input": {"dx": ["Apendicitis aguda (K35.8)"], "proc": ["Trombolisis EV (99.10)", "Broncoscopia (33.22)"], "tto": ["Omeprazol 40mg EV c/12h (A02BC01)", "Piperacilina/Tazobactam 4.5g EV c/8h (J01CR05)", "Pantoprazol 40mg EV c/12h (A02BC02)", "Metronidazol 500mg EV c/8h (J01XD01)"], "evo": "Estabilizacion clinica progresiva, sin eventos adversos", "dx_alta": ["Apendicitis aguda resuelto (K35.8)"], "med": ["Ciprofloxacino 500mg VO c/12h 7d (J01MA02)", "Glibenclamida 5mg VO c/24h (A10BB01)", "Paracetamol 500mg VO c/8h PRN (N02BE01)", "Hierro 100mg VO c/24h (B03AA07)"]}, "output": "Se hospitaliza por apendicitis aguda (K35.8). Se realiza trombolisis ev (99.10), broncoscopia (33.22). Presenta, estabilizacion clinica progresiva, sin eventos adversos. Recibio tratamiento con Omeprazol 40mg EV c/12h (A02BC01), Piperacilina/Tazobactam 4.5g EV c/8h (J01CR05), Pantoprazol 40mg EV c/12h (A02BC02) y Metronidazol 500mg EV c/8h (J01XD01). Presenta evolucion favorable, cumpliendo criterios de alta. Alta con diagnostico de apendicitis aguda resuelto (K35.8), indicandose Ciprofloxacino 500mg VO c/12h 7d (J01MA02), Glibenclamida 5mg VO c/24h (A10BB01), Paracetamol 500mg VO c/8h PRN (N02BE01) y Hierro 100mg VO c/24h (B03AA07)."}
{"input": {"dx": ["Asma bronquial exacerbada (J45.9)"], "proc": ["Ecografia abdominal (88.76)", "RMN cerebral (88.91)"], "tto": ["Metamizol 1g EV c/8h (N02BB02)", "Morfina 3mg EV c/4h PRN (N02AA01)", "Meropenem 1g EV c/8h (J01DH02)"], "evo": "Respuesta adecuada al tratamiento antibiotico, afebril desde dia 2", "dx_alta": ["Asma bronquial exacerbada resuelto (J45.9)"], "med": ["Glibenclamida 5mg VO c/24h (A10BB01)", "Metformina 850mg VO c/12h (A10BA02)"]}, "output": "Ingreso por asma bronquial exacerbada (J45.9). Se realiza ecografia abdominal (88.76), rmn cerebral (88.91). Evoluciona con, respuesta adecuada al tratamiento antibiotico, afebril desde dia 2. Recibio tratamiento con Metamizol 1g EV c/8h (N02BB02), Morfina 3mg EV c/4h PRN (N02AA01) y Meropenem 1g EV c/8h (J01DH02). Buena evolucion, cumpliendo criterios de alta. Alta con diagnostico de asma bronquial exacerbada resuelto (J45.9), indicandose Glibenclamida 5mg VO c/24h (A10BB01) y Metformina 850mg VO c/12h (A10BA02)."}
{"input": {"dx": ["IAMCEST anteroseptal (I21.0)"], "proc": ["Coronariografia (K492)"], "tto": ["Furosemida 80mg EV (C03CA01)", "Prasugrel 60mg carga (B01AC22)", "Digoxina 0.25mg EV (C01AA05)"], "evo": "Edema pulmonar agudo por disfuncion sistolica, respuesta favorable a diureticos", "dx_alta": ["IAMCEST anteroseptal tratado (I21.0)"], "med": ["Prasugrel 10mg VO c/24h 12m (B01AC22)", "Carvedilol 6.25mg VO c/12h (C07AG02)", "Amlodipino 5mg VO c/24h (C08CA01)", "Warfarina segun INR (B01AA03)", "Espironolactona 25mg VO c/24h (C03DA01)"]}, "output": "Ingreso por iamcest anteroseptal (I21.0). Se realiza coronariografia (K492). Evoluciona con, edema pulmonar agudo por disfuncion sistolica, respuesta favorable a diureticos. Recibio tratamiento con Furosemida 80mg EV (C03CA01), Prasugrel 60mg carga (B01AC22) y Digoxina 0.25mg EV (C01AA05). Evolucion satisfactoria, cumpliendo criterios de alta. Alta con diagnostico de iamcest anteroseptal tratado (I21.0), indicandose Prasugrel 10mg VO c/24h 12m (B01AC22), Carvedilol 6.25mg VO c/12h (C07AG02), Amlodipino 5mg VO c/24h (C08CA01), Warfarina segun INR (B01AA03) y Espironolactona 25mg VO c/24h (C03DA01)."}
{"input": {"dx": ["Shock cardiogenico (R57.0)"], "proc": ["Cateterismo derecho (K493)"], "tto": ["Morfina 3mg EV (N02AA01)", "Dobutamina EV (C01CA07)", "Aspirina 100mg (B01AC06)"], "evo": "Fibrilacion auricular de alta respuesta, cardioversion farmacologica exitosa", "dx_alta": ["Shock cardiogenico tratado (R57.0)"], "med": ["Clopidogrel 75mg VO c/24h 12m (B01AC04)", "Amlodipino 5mg VO c/24h (C08CA01)", "Losartan 50mg VO c/24h (C09CA01)"]}, "output": "Ingreso por shock cardiogenico (R57.0). Se realiza cateterismo derecho (K493). En su evolucion, fibrilacion auricular de alta respuesta, cardioversion farmacologica exitosa. Recibio tratamiento con Morfina 3mg EV (N02AA01), Dobutamina EV (C01CA07) y Aspirina 100mg (B01AC06). Evolucion clinica favorable, cumpliendo criterios de alta. Alta con diagnostico de shock cardiogenico tratado (R57.0), indicandose Clopidogrel 75mg VO c/24h 12m (B01AC04), Amlodipino 5mg VO c/24h (C08CA01) y Losartan 50mg VO c/24h (C09CA01)."}
{"input": {"dx": ["EPOC exacerbado (J44.1)"], "proc": ["Toracocentesis (34.91)"], "tto": ["Ciprofloxacino 400mg EV c/12h (J01MA02)", "Metoclopramida 10mg EV c/8h (A03FA01)", "Insulina NPH 10UI SC c/12h (A10AC01)"], "evo": "Cirugia programada sin complicaciones, alta precoz", "dx_alta": ["EPOC exacerbado resuelto (J44.1)"], "med": ["Ciprofloxacino 500mg VO c/12h 7d (J01MA02)", "Prednisona 20mg VO c/24h (H02AB07)"]}, "output": "Paciente que ingresa con cuadro de epoc exacerbado (J44.1). Se realiza toracocentesis (34.91). Evoluciona con, cirugia programada sin complicaciones, alta precoz. Recibio tratamiento con Ciprofloxacino 400mg EV c/12h (J01MA02), Metoclopramida 10mg EV c/8h (A03FA01) y Insulina NPH 10UI SC c/12h (A10AC01). Buena evolucion, cumpliendo criterios de alta. Alta con diagnostico de epoc exacerbado resuelto (J44.1), indicandose Ciprofloxacino 500mg VO c/12h 7d (J01MA02) y Prednisona 20mg VO c/24h (H02AB07)."}
{"input": {"dx": ["Insuficiencia cardiaca aguda (I50.9)"], "proc": ["Angioplastia DA (K493)"], "tto": ["Enoxaparina 1mg/kg SC c/12h (B01AB05)", "Enalapril 5mg VO (C09AA02)", "Furosemida 80mg EV (C03CA01)", "Amiodarona 300mg EV (C01BD01)"], "evo": "Shock cardiogenico, requirio soporte con inotropicos, evolucion favorable", "dx_alta": ["Insuficiencia cardiaca aguda tratado (I50.9)"], "med": ["Carvedilol 6.25mg VO c/12h (C07AG02)", "Rosuvastatina 20mg VO c/noche (C10AA07)", "Ticagrelor 90mg VO c/12h 12m (B01AC24)", "Amlodipino 5mg VO c/24h (C08CA01)"]}, "output": "Ingresa por insuficiencia cardiaca aguda (I50.9). Se realiza angioplastia da (K493). Durante la hospitalizacion, shock cardiogenico, requirio soporte con inotropicos, evolucion favorable. Recibio tratamiento con Enoxaparina 1mg/kg SC c/12h (B01AB05), Enalapril 5mg VO (C09AA02), Furosemida 80mg EV (C03CA01) y Amiodarona 300mg EV (C01BD01). Evolucion satisfactoria, cumpliendo criterios de alta. Alta con diagnostico de insuficiencia cardiaca aguda tratado (I50.9), indicandose Carvedilol 6.25mg VO c/12h (C07AG02), Rosuvastatina 20mg VO c/noche (C10AA07), Ticagrelor 90mg VO c/12h 12m (B01AC24) y Amlodipino 5mg VO c/24h (C08CA01)."}
{"input": {"dx": ["IAMCEST inferolateral (I21.1)"], "proc": ["Coronariografia (K492)", "Angioplastia DA (K493)"], "tto": ["Prasugrel 60mg carga (B01AC22)", "Nitroglicerina EV (C01DA02)", "Noradrenalina EV (C01CA03)"], "evo": "Pericarditis aguda con derrame leve, manejo antiinflamatorio", "dx_alta": ["IAMCEST inferolateral tratado (I21.1)"], "med": ["Rosuvastatina 20mg VO c/noche (C10AA07)", "Losartan 50mg VO c/24h (C09CA01)", "Apixaban 5mg VO c/12h (B01AF02)", "Warfarina segun INR (B01AA03)", "Nitroglicerina SL PRN (C01DA02)"]}, "output": "Ingresa por iamcest inferolateral (I21.1). Se realiza coronariografia (K492) visualizando estenosis severa, realizandose angioplastia da (K493) con implante de stent farmacoactivo y flujo TIMI 3 final. Durante la hospitalizacion, pericarditis aguda con derrame leve, manejo antiinflamatorio. Recibio tratamiento con Prasugrel 60mg carga (B01AC22), Nitroglicerina EV (C01DA02) y Noradrenalina EV (C01CA03). Evolucion satisfactoria, cumpliendo criterios de alta. Alta con diagnostico de iamcest inferolateral tratado (I21.1), indicandose Rosuvastatina 20mg VO c/noche (C10AA07), Losartan 50mg VO c/24h (C09CA01), Apixaban 5mg VO c/12h (B01AF02), Warfarina segun INR (B01AA03) y Nitroglicerina SL PRN (C01DA02)."}
{"input": {"dx": ["IAMCEST anterior (I21.0)"], "proc": ["Coronariografia (K492)", "Angioplastia DA (K493)"], "tto": ["Metoprolol 5mg EV (C07AB02)", "Amiodarona 300mg EV (C01BD01)", "Furosemida 40mg EV (C03CA01)", "Digoxina 0.25mg EV (C01AA05)"], "evo": "Pericarditis aguda con derrame leve, manejo antiinflamatorio", "dx_alta": ["IAMCEST anterior tratado (I21.0)"], "med": ["Digoxina 0.125mg VO c/24h (C01AA05)", "Carvedilol 6.25mg VO c/12h (C07AG02)", "Bisoprolol 5mg VO c/24h (C07AB07)", "Enalapril 10mg VO c/12h (C09AA02)"]}, "output": "Ingresa por iamcest anterior (I21.0). Se realiza coronariografia (K492) evidenciando oclusion aguda, realizandose angioplastia da (K493) con implante de stent farmacoactivo y flujo TIMI 3 final. En su evolucion, pericarditis aguda con derrame leve, manejo antiinflamatorio. Recibio tratamiento con Metoprolol 5mg EV (C07AB02), Amiodarona 300mg EV (C01BD01), Furosemida 40mg EV (C03CA01) y Digoxina 0.25mg EV (C01AA05). Presenta evolucion favorable, cumpliendo criterios de alta. Alta con diagnostico de iamcest anterior tratado (I21.0), indicandose Digoxina 0.125mg VO c/24h (C01AA05), Carvedilol 6.25mg VO c/12h (C07AG02), Bisoprolol 5mg VO c/24h (C07AB07) y Enalapril 10mg VO c/12h (C09AA02)."}
{"input": {"dx": ["IAMCEST anterior (I21.0)"], "proc": ["Coronariografia (K492)", "Angioplastia CD (K493)"], "tto": ["Metoprolol 5mg EV (C07AB02)", "Levosimendan EV (C01CX08)"], "evo": "Oclusion de diagonal con trombo, trombectomia por aspiracion mas stent", "dx_alta": ["IAMCEST anterior tratado (I21.0)"], "med": ["Nitroglicerina SL PRN (C01DA02)", "Warfarina segun INR (B01AA03)", "Ticagrelor 90mg VO c/12h 12m (B01AC24)", "Enalapril 10mg VO c/12h (C09AA02)"]}, "output": "Ingreso por iamcest anterior (I21.0). Se realiza coronariografia (K492) evidenciando oclusion aguda, realizandose angioplastia cd (K493) con implante de stent farmacoactivo y flujo TIMI 3 final. Evoluciona con, oclusion de diagonal con trombo, trombectomia por aspiracion mas stent. Recibio tratamiento con Metoprolol 5mg EV (C07AB02) y Levosimendan EV (C01CX08). Evolucion satisfactoria, cumpliendo criterios de alta. Alta con diagnostico de iamcest anterior tratado (I21.0), indicandose Nitroglicerina SL PRN (C01DA02), Warfarina segun INR (B01AA03), Ticagrelor 90mg VO c/12h 12m (B01AC24) y Enalapril 10mg VO c/12h (C09AA02)."}
{"input": {"dx": ["IAMCEST inferolateral (I21.1)"], "proc": ["Coronariografia (K492)", "Angioplastia TCI (36.06)"], "tto": ["Heparina 5000UI EV (B01AB01)", "Amiodarona 300mg EV (C01BD01)", "Noradrenalina EV (C01CA03)"], "evo": "SDST en II, III, aVF, coronarias sin lesiones obstructivas, sindrome de Tako-Tsubo", "dx_alta": ["IAMCEST inferolateral tratado (I21.1)"], "med": ["Bisoprolol 5mg VO c/24h (C07AB07)", "Clopidogrel 75mg VO c/24h 12m (B01AC04)", "Losartan 50mg VO c/24h (C09CA01)", "Aspirina 100mg VO c/24h (B01AC06)", "Prasugrel 10mg VO c/24h 12m (B01AC22)"]}, "output": "Ingreso por iamcest inferolateral (I21.1). Se realiza coronariografia (K492) con hallazgo de lesion significativa, realizandose angioplastia tci (36.06) con implante de stent farmacoactivo y flujo TIMI 3 final. Evoluciona con, sdst en ii, iii, avf, coronarias sin lesiones obstructivas, sindrome de tako-tsubo. Recibio tratamiento con Heparina 5000UI EV (B01AB01), Amiodarona 300mg EV (C01BD01) y Noradrenalina EV (C01CA03). Buena evolucion, cumpliendo criterios de alta. Alta con diagnostico de iamcest inferolateral tratado (I21.1), indicandose Bisoprolol 5mg VO c/24h (C07AB07), Clopidogrel 75mg VO c/24h 12m (B01AC04), Losartan 50mg VO c/24h (C09CA01), Aspirina 100mg VO c/24h (B01AC06) y Prasugrel 10mg VO c/24h 12m (B01AC22)."}
{"input": {"dx": ["Enfermedad coronaria de 2 vasos (I25.1)"], "proc": ["Coronariografia (K492)", "Angioplastia OM (36.06)"], "tto": ["Heparina EV infusion (B01AB01)", "Enalapril 5mg VO (C09AA02)"], "evo": "Oclusion aguda de CX distal, angioplastia exitosa con stent farmacoactivo, flujo TIMI 3 final", "dx_alta": ["Enfermedad coronaria de 2 vasos tratado (I25.1)"], "med": ["Nitroglicerina SL PRN (C01DA02)", "Ticagrelor 90mg VO c/12h 12m (B01AC24)", "Rosuvastatina 20mg VO c/noche (C10AA07)", "Metoprolol 50mg VO c/12h (C07AB02)"]}, "output": "Ingreso por enfermedad coronaria de 2 vasos (I25.1). Se realiza coronariografia (K492) encontrando lesion critica, realizandose angioplastia om (36.06) con implante de stent farmacoactivo y flujo TIMI 3 final. Evoluciona con, oclusion aguda de cx distal, angioplastia exitosa con stent farmacoactivo, flujo timi 3 final. Recibio tratamiento con Heparina EV infusion (B01AB01) y Enalapril 5mg VO (C09AA02). Buena evolucion, cumpliendo criterios de alta. Alta con diagnostico de enfermedad coronaria de 2 vasos tratado (I25.1), indicandose Nitroglicerina SL PRN (C01DA02), Ticagrelor 90mg VO c/12h 12m (B01AC24), Rosuvastatina 20mg VO c/noche (C10AA07) y Metoprolol 50mg VO c/12h (C07AB02)."}
{"input": {"dx": ["Enfermedad coronaria de 3 vasos (I25.1)"], "proc": ["Coronariografia (K492)"], "tto": ["Clopidogrel 600mg carga (B01AC04)", "Metoprolol 5mg EV (C07AB02)", "Morfina 3mg EV (N02AA01)"], "evo": "Bloqueo AV completo sintomatico, requirio marcapasos transitorio", "dx_alta": ["Enfermedad coronaria de 3 vasos tratado (I25.1)"], "med": ["Isosorbide 20mg VO c/8h (C01DA08)", "Losartan 50mg VO c/24h (C09CA01)", "Furosemida 40mg VO c/24h (C03CA01)"]}, "output": "Paciente que ingresa con cuadro de enfermedad coronaria de 3 vasos (I25.1). Se realiza coronariografia (K492). Presenta, bloqueo av completo sintomatico, requirio marcapasos transitorio. Recibio tratamiento con Clopidogrel 600mg carga (B01AC04), Metoprolol 5mg EV (C07AB02) y Morfina 3mg EV (N02AA01). Evolucion satisfactoria, cumpliendo criterios de alta. Alta con diagnostico de enfermedad coronaria de 3 vasos tratado (I25.1), indicandose Isosorbide 20mg VO c/8h (C01DA08), Losartan 50mg VO c/24h (C09CA01) y Furosemida 40mg VO c/24h (C03CA01)."}
{"input": {"dx": ["ACV isquemico (I63.9)"], "proc": ["Trombectomia mecanica (39.74)", "Colecistectomia laparoscopica (51.23)"], "tto": ["Tramadol 50mg EV c/8h (N02AX02)", "Ampicilina/Sulbactam 1.5g EV c/6h (J01CR01)", "Metoclopramida 10mg EV c/8h (A03FA01)", "Insulina NPH 10UI SC c/12h (A10AC01)"], "evo": "Procedimiento sin complicaciones, buena tolerancia oral", "dx_alta": ["ACV isquemico resuelto (I63.9)"], "med": ["Glibenclamida 5mg VO c/24h (A10BB01)", "Metformina 850mg VO c/12h (A10BA02)"]}, "output": "Ingreso por acv isquemico (I63.9). Se realiza trombectomia mecanica (39.74), colecistectomia laparoscopica (51.23). Durante la hospitalizacion, procedimiento sin complicaciones, buena tolerancia oral. Recibio tratamiento con Tramadol 50mg EV c/8h (N02AX02), Ampicilina/Sulbactam 1.5g EV c/6h (J01CR01), Metoclopramida 10mg EV c/8h (A03FA01) y Insulina NPH 10UI SC c/12h (A10AC01). Evolucion satisfactoria, cumpliendo criterios de alta. Alta con diagnostico de acv isquemico resuelto (I63.9), indicandose Glibenclamida 5mg VO c/24h (A10BB01) y Metformina 850mg VO c/12h (A10BA02)."}
{"input": {"dx": ["Neumonia adquirida comunidad (J18.9)"], "proc": ["Hernioplastia inguinal (53.00)", "Apendicectomia (47.09)"], "tto": ["Pantoprazol 40mg EV c/12h (A02BC02)", "Omeprazol 40mg EV c/12h (A02BC01)", "Vancomicina 1g EV c/12h (J01XA01)", "Ceftriaxona 2g EV c/24h (J01DD04)"], "evo": "Estabilizacion clinica progresiva, sin eventos adversos", "dx_alta": ["Neumonia adquirida comunidad resuelto (J18.9)"], "med": ["Metformina 850mg VO c/12h (A10BA02)", "Sertralina 50mg VO c/24h (N06AB06)", "Paracetamol 500mg VO c/8h PRN (N02BE01)", "Hierro 100mg VO c/24h (B03AA07)"]}, "output": "Ingresa por neumonia adquirida comunidad (J18.9). Se realiza hernioplastia inguinal (53.00), apendicectomia (47.09). Presenta, estabilizacion clinica progresiva, sin eventos adversos. Recibio tratamiento con Pantoprazol 40mg EV c/12h (A02BC02), Omeprazol 40mg EV c/12h (A02BC01), Vancomicina 1g EV c/12h (J01XA01) y Ceftriaxona 2g EV c/24h (J01DD04). Evolucion satisfactoria, cumpliendo criterios de alta. Alta con diagnostico de neumonia adquirida comunidad resuelto (J18.9), indicandose Metformina 850mg VO c/12h (A10BA02), Sertralina 50mg VO c/24h (N06AB06), Paracetamol 500mg VO c/8h PRN (N02BE01) y Hierro 100mg VO c/24h (B03AA07)."}
{"input": {"dx": ["IAMSEST (I21.4)"], "proc": ["Coronariografia (K492)"], "tto": ["Metoprolol 5mg EV (C07AB02)", "Ticagrelor 180mg carga (B01AC24)"], "evo": "Lesion critica de CX proximal, estabilizacion hemodinamica, angioplastia diferida", "dx_alta": ["IAMSEST tratado (I21.4)"], "med": ["Rosuvastatina 20mg VO c/noche (C10AA07)", "Rivaroxaban 20mg VO c/24h (B01AF01)", "Amlodipino 5mg VO c/24h (C08CA01)", "Prasugrel 10mg VO c/24h 12m (B01AC22)", "Clopidogrel 75mg VO c/24h 12m (B01AC04)"]}, "output": "Ingreso por iamsest (I21.4). Se realiza coronariografia (K492). Evoluciona con, lesion critica de cx proximal, estabilizacion hemodinamica, angioplastia diferida. Recibio tratamiento con Metoprolol 5mg EV (C07AB02) y Ticagrelor 180mg carga (B01AC24). Presenta evolucion favorable, cumpliendo criterios de alta. Alta con diagnostico de iamsest tratado (I21.4), indicandose Rosuvastatina 20mg VO c/noche (C10AA07), Rivaroxaban 20mg VO c/24h (B01AF01), Amlodipino 5mg VO c/24h (C08CA01), Prasugrel 10mg VO c/24h 12m (B01AC22) y Clopidogrel 75mg VO c/24h 12m (B01AC04)."}
{"input": {"dx": ["Fractura de cadera (S72.0)"], "proc": ["TAC de abdomen (88.01)"], "tto": ["Ondansetron 8mg EV c/8h (A04AA01)", "Metamizol 1g EV c/8h (N02BB02)", "N-acetilcisteina NBZ c/8h (R05CB01)", "Tramadol 50mg EV c/8h (N02AX02)"], "evo": "Estabilizacion clinica progresiva, sin eventos adversos", "dx_alta": ["Fractura de cadera resuelto (S72.0)"], "med": ["Prednisona 20mg VO c/24h (H02AB07)", "Calcio 500mg VO c/12h (A12AA04)"]}, "output": "Ingreso por fractura de cadera (S72.0). Se realiza tac de abdomen (88.01). Durante la hospitalizacion, estabilizacion clinica progresiva, sin eventos adversos. Recibio tratamiento con Ondansetron 8mg EV c/8h (A04AA01), Metamizol 1g EV c/8h (N02BB02), N-acetilcisteina NBZ c/8h (R05CB01) y Tramadol 50mg EV c/8h (N02AX02). Evolucion clinica favorable, cumpliendo criterios de alta. Alta con diagnostico de fractura de cadera resuelto (S72.0), indicandose Prednisona 20mg VO c/24h (H02AB07) y Calcio 500mg VO c/12h (A12AA04)."}
{"input": {"dx": ["Angina inestable alto riesgo (I20.0)"], "proc": ["Coronariografia (K492)", "Angioplastia DA (K493)"], "tto": ["Furosemida 80mg EV (C03CA01)", "Heparina 5000UI EV (B01AB01)", "Clopidogrel 300mg carga (B01AC04)"], "evo": "Estenosis aortica severa sintomatica, programada para TAVI", "dx_alta": ["Angina inestable alto riesgo tratado (I20.0)"], "med": ["Amlodipino 5mg VO c/24h (C08CA01)", "Apixaban 5mg VO c/12h (B01AF02)", "Ticagrelor 90mg VO c/12h 12m (B01AC24)", "Rosuvastatina 20mg VO c/noche (C10AA07)"]}, "output": "Se hospitaliza por angina inestable alto riesgo (I20.0). Se realiza coronariografia (K492) con hallazgo de lesion significativa, realizandose angioplastia da (K493) con implante de stent farmacoactivo y flujo TIMI 3 final. Presenta, estenosis aortica severa sintomatica, programada para tavi. Recibio tratamiento con Furosemida 80mg EV (C03CA01), Heparina 5000UI EV (B01AB01) y Clopidogrel 300mg carga (B01AC04). Evolucion clinica favorable, cumpliendo criterios de alta. Alta con diagnostico de angina inestable alto riesgo tratado (I20.0), indicandose Amlodipino 5mg VO c/24h (C08CA01), Apixaban 5mg VO c/12h (B01AF02), Ticagrelor 90mg VO c/12h 12m (B01AC24) y Rosuvastatina 20mg VO c/noche (C10AA07)."}
{"input": {"dx": ["Trombosis de stent (I21.0)"], "proc": ["Cateterismo derecho (89.50)"], "tto": ["Furosemida 80mg EV (C03CA01)", "Amiodarona 300mg EV (C01BD01)"], "evo": "Taquicardia ventricular sostenida, cardioversion electrica exitosa", "dx_alta": ["Trombosis de stent tratado (I21.0)"], "med": ["Furosemida 40mg VO c/24h (C03CA01)", "Rivaroxaban 20mg VO c/24h (B01AF01)", "Aspirina 100mg VO c/24h (B01AC06)"]}, "output": "Ingresa por trombosis de stent (I21.0). Se realiza cateterismo derecho (89.50). Durante la hospitalizacion, taquicardia ventricular sostenida, cardioversion electrica exitosa. Recibio tratamiento con Furosemida 80mg EV (C03CA01) y Amiodarona 300mg EV (C01BD01). Buena evolucion, cumpliendo criterios de alta. Alta con diagnostico de trombosis de stent tratado (I21.0), indicandose Furosemida 40mg VO c/24h (C03CA01), Rivaroxaban 20mg VO c/24h (B01AF01) y Aspirina 100mg VO c/24h (B01AC06)."}
{"input": {"dx": ["IAMCEST inferolateral (I21.1)"], "proc": ["Coronariografia (K492)", "Angioplastia TCI (K493)"], "tto": ["Levosimendan EV (C01CX08)", "Aspirina 300mg carga (B01AC06)", "Noradrenalina EV (C01CA03)", "Heparina EV infusion (B01AB01)"], "evo": "Shock cardiogenico, requirio soporte con inotropicos, evolucion favorable", "dx_alta": ["IAMCEST inferolateral tratado (I21.1)"], "med": ["Metoprolol 50mg VO c/12h (C07AB02)", "Bisoprolol 5mg VO c/24h (C07AB07)", "Nitroglicerina SL PRN (C01DA02)", "Enalapril 10mg VO c/12h (C09AA02)"]}, "output": "Se hospitaliza por iamcest inferolateral (I21.1). Se realiza coronariografia (K492) visualizando estenosis severa, realizandose angioplastia tci (K493) con implante de stent farmacoactivo y flujo TIMI 3 final. Durante la hospitalizacion, shock cardiogenico, requirio soporte con inotropicos, evolucion favorable. Recibio tratamiento con Levosimendan EV (C01CX08), Aspirina 300mg carga (B01AC06), Noradrenalina EV (C01CA03) y Heparina EV infusion (B01AB01). Buena evolucion, cumpliendo criterios de alta. Alta con diagnostico de iamcest inferolateral tratado (I21.1), indicandose Metoprolol 50mg VO c/12h (C07AB02), Bisoprolol 5mg VO c/24h (C07AB07), Nitroglicerina SL PRN (C01DA02) y Enalapril 10mg VO c/12h (C09AA02)."}
{"input": {"dx": ["Hemorragia digestiva alta (K92.2)"], "proc": ["RMN cerebral (88.91)"], "tto": ["N-acetilcisteina NBZ c/8h (R05CB01)", "Tramadol 50mg EV c/8h (N02AX02)", "Hidrocortisona 100mg EV c/8h (H02AB09)"], "evo": "Sin complicaciones postoperatorias, herida operatoria limpia", "dx_alta": ["Hemorragia digestiva alta resuelto (K92.2)"], "med": ["Calcio 500mg VO c/12h (A12AA04)", "Budesonide/Formoterol INH c/12h (R03AK07)", "Hierro 100mg VO c/24h (B03AA07)", "Vitamina D 1000UI VO c/24h (A11CC05)"]}, "output": "Paciente que ingresa con cuadro de hemorragia digestiva alta (K92.2). Se realiza rmn cerebral (88.91). Presenta, sin complicaciones postoperatorias, herida operatoria limpia. Recibio tratamiento con N-acetilcisteina NBZ c/8h (R05CB01), Tramadol 50mg EV c/8h (N02AX02) y Hidrocortisona 100mg EV c/8h (H02AB09). Presenta evolucion favorable, cumpliendo criterios de alta. Alta con diagnostico de hemorragia digestiva alta resuelto (K92.2), indicandose Calcio 500mg VO c/12h (A12AA04), Budesonide/Formoterol INH c/12h (R03AK07), Hierro 100mg VO c/24h (B03AA07) y Vitamina D 1000UI VO c/24h (A11CC05)."}
{"input": {"dx": ["Angina inestable alto riesgo (I20.0)"], "proc": ["Coronariografia (K492)", "Angioplastia CD (36.06)"], "tto": ["Enoxaparina 60mg SC c/12h (B01AB05)", "Enalapril 5mg VO (C09AA02)"], "evo": "Taquicardia ventricular sostenida, cardioversion electrica exitosa", "dx_alta": ["Angina inestable alto riesgo tratado (I20.0)"], "med": ["Apixaban 5mg VO c/12h (B01AF02)", "Aspirina 100mg VO c/24h (B01AC06)", "Isosorbide 20mg VO c/8h (C01DA08)", "Rosuvastatina 20mg VO c/noche (C10AA07)"]}, "output": "Paciente que ingresa con cuadro de angina inestable alto riesgo (I20.0). Se realiza coronariografia (K492) visualizando estenosis severa, realizandose angioplastia cd (36.06) con implante de stent farmacoactivo y flujo TIMI 3 final. Evoluciona con, taquicardia ventricular sostenida, cardioversion electrica exitosa. Recibio tratamiento con Enoxaparina 60mg SC c/12h (B01AB05) y Enalapril 5mg VO (C09AA02). Presenta evolucion favorable, cumpliendo criterios de alta. Alta con diagnostico de angina inestable alto riesgo tratado (I20.0), indicandose Apixaban 5mg VO c/12h (B01AF02), Aspirina 100mg VO c/24h (B01AC06), Isosorbide 20mg VO c/8h (C01DA08) y Rosuvastatina 20mg VO c/noche (C10AA07)."}
{"input": {"dx": ["ACV isquemico (I63.9)"], "proc": ["Broncoscopia (33.22)", "Hemodialisis (39.95)"], "tto": ["Pantoprazol 40mg EV c/12h (A02BC02)", "Ondansetron 8mg EV c/8h (A04AA01)"], "evo": "Resolucion del cuadro agudo, alta con seguimiento ambulatorio", "dx_alta": ["ACV isquemico resuelto (I63.9)"], "med": ["Omeprazol 20mg VO c/24h (A02BC01)", "Calcio 500mg VO c/12h (A12AA04)", "Salbutamol INH 2 puff c/6h PRN (R03AC02)"]}, "output": "Paciente que ingresa con cuadro de acv isquemico (I63.9). Se realiza broncoscopia (33.22), hemodialisis (39.95). En su evolucion, resolucion del cuadro agudo, alta con seguimiento ambulatorio. Recibio tratamiento con Pantoprazol 40mg EV c/12h (A02BC02) y Ondansetron 8mg EV c/8h (A04AA01). Buena evolucion, cumpliendo criterios de alta. Alta con diagnostico de acv isquemico resuelto (I63.9), indicandose Omeprazol 20mg VO c/24h (A02BC01), Calcio 500mg VO c/12h (A12AA04) y Salbutamol INH 2 puff c/6h PRN (R03AC02)."}
{"input": {"dx": ["Edema pulmonar agudo (J81)"], "proc": ["Angioplastia CX (37.94)"], "tto": ["Clopidogrel 300mg carga (B01AC04)", "Enoxaparina 1mg/kg SC c/12h (B01AB05)", "Nitroglicerina EV (C01DA02)", "Enalapril 5mg VO (C09AA02)"], "evo": "Edema pulmonar agudo por disfuncion sistolica, respuesta favorable a diureticos", "dx_alta": ["Edema pulmonar agudo tratado (J81)"], "med": ["Prasugrel 10mg VO c/24h 12m (B01AC22)", "Rivaroxaban 20mg VO c/24h (B01AF01)", "Metoprolol 50mg VO c/12h (C07AB02)", "Nitroglicerina SL PRN (C01DA02)"]}, "output": "Ingresa por edema pulmonar agudo (J81). Se realiza angioplastia cx (37.94). Durante la hospitalizacion, edema pulmonar agudo por disfuncion sistolica, respuesta favorable a diureticos. Recibio tratamiento con Clopidogrel 300mg carga (B01AC04), Enoxaparina 1mg/kg SC c/12h (B01AB05), Nitroglicerina EV (C01DA02) y Enalapril 5mg VO (C09AA02). Presenta evolucion favorable, cumpliendo criterios de alta. Alta con diagnostico de edema pulmonar agudo tratado (J81), indicandose Prasugrel 10mg VO c/24h 12m (B01AC22), Rivaroxaban 20mg VO c/24h (B01AF01), Metoprolol 50mg VO c/12h (C07AB02) y Nitroglicerina SL PRN (C01DA02)."}
{"input": {"dx": ["IAMCEST anteroseptal (I21.0)"], "proc": ["Coronariografia (K492)", "Angioplastia TCI (K493)"], "tto": ["Digoxina 0.25mg EV (C01AA05)", "Enalapril 5mg VO (C09AA02)", "Furosemida 40mg EV (C03CA01)"], "evo": "Edema pulmonar agudo por disfuncion sistolica, respuesta favorable a diureticos", "dx_alta": ["IAMCEST anteroseptal tratado (I21.0)"], "med": ["Rosuvastatina 20mg VO c/noche (C10AA07)", "Isosorbide 20mg VO c/8h (C01DA08)", "Espironolactona 25mg VO c/24h (C03DA01)", "Metoprolol 50mg VO c/12h (C07AB02)"]}, "output": "Ingreso por iamcest anteroseptal (I21.0). Se realiza coronariografia (K492) con hallazgo de lesion significativa, realizandose angioplastia tci (K493) con implante de stent farmacoactivo y flujo TIMI 3 final. Evoluciona con, edema pulmonar agudo por disfuncion sistolica, respuesta favorable a diureticos. Recibio tratamiento con Digoxina 0.25mg EV (C01AA05), Enalapril 5mg VO (C09AA02) y Furosemida 40mg EV (C03CA01). Evolucion clinica favorable, cumpliendo criterios de alta. Alta con diagnostico de iamcest anteroseptal tratado (I21.0), indicandose Rosuvastatina 20mg VO c/noche (C10AA07), Isosorbide 20mg VO c/8h (C01DA08), Espironolactona 25mg VO c/24h (C03DA01) y Metoprolol 50mg VO c/12h (C07AB02)."}
{"input": {"dx": ["IAMCEST anteroseptal (I21.0)"], "proc": ["Coronariografia (K492)", "Angioplastia TCI (K493)"], "tto": ["Enalapril 5mg VO (C09AA02)", "Enoxaparina 1mg/kg SC c/12h (B01AB05)", "Clopidogrel 600mg carga (B01AC04)", "Amiodarona 300mg EV (C01BD01)"], "evo": "Bloqueo AV completo sintomatico, requirio marcapasos transitorio", "dx_alta": ["IAMCEST anteroseptal tratado (I21.0)"], "med": ["Carvedilol 6.25mg VO c/12h (C07AG02)", "Prasugrel 10mg VO c/24h 12m (B01AC22)", "Metoprolol 50mg VO c/12h (C07AB02)", "Isosorbide 20mg VO c/8h (C01DA08)", "Amlodipino 5mg VO c/24h (C08CA01)"]}, "output": "Se hospitaliza por iamcest anteroseptal (I21.0). Se realiza coronariografia (K492) visualizando estenosis severa, realizandose angioplastia tci (K493) con implante de stent farmacoactivo y flujo TIMI 3 final. Durante la hospitalizacion, bloqueo av completo sintomatico, requirio marcapasos transitorio. Recibio tratamiento con Enalapril 5mg VO (C09AA02), Enoxaparina 1mg/kg SC c/12h (B01AB05), Clopidogrel 600mg carga (B01AC04) y Amiodarona 300mg EV (C01BD01). Evolucion clinica favorable, cumpliendo criterios de alta. Alta con diagnostico de iamcest anteroseptal tratado (I21.0), indicandose Carvedilol 6.25mg VO c/12h (C07AG02), Prasugrel 10mg VO c/24h 12m (B01AC22), Metoprolol 50mg VO c/12h (C07AB02), Isosorbide 20mg VO c/8h (C01DA08) y Amlodipino 5mg VO c/24h (C08CA01)."}
{"input": {"dx": ["Angina inestable (I20.0)"], "proc": ["Coronariografia (K492)", "Angioplastia CX (36.06)"], "tto": ["Heparina 5000UI EV (B01AB01)", "Aspirina 300mg carga (B01AC06)", "Noradrenalina EV (C01CA03)"], "evo": "Fibrilacion auricular de alta respuesta, cardioversion farmacologica exitosa", "dx_alta": ["Angina inestable tratado (I20.0)"], "med": ["Warfarina segun INR (B01AA03)", "Apixaban 5mg VO c/12h (B01AF02)", "Espironolactona 25mg VO c/24h (C03DA01)", "Aspirina 100mg VO c/24h (B01AC06)"]}, "output": "Ingresa por angina inestable (I20.0). Se realiza coronariografia (K492) visualizando estenosis severa, realizandose angioplastia cx (36.06) con implante de stent farmacoactivo y flujo TIMI 3 final. Durante la hospitalizacion, fibrilacion auricular de alta respuesta, cardioversion farmacologica exitosa. Recibio tratamiento con Heparina 5000UI EV (B01AB01), Aspirina 300mg carga (B01AC06) y Noradrenalina EV (C01CA03). Presenta evolucion favorable, cumpliendo criterios de alta. Alta con diagnostico de angina inestable tratado (I20.0), indicandose Warfarina segun INR (B01AA03), Apixaban 5mg VO c/12h (B01AF02), Espironolactona 25mg VO c/24h (C03DA01) y Aspirina 100mg VO c/24h (B01AC06)."}
{"input": {"dx": ["Edema pulmonar agudo (J81)"], "proc": ["Cardioversion electrica (37.0)"], "tto": ["Furosemida 40mg EV (C03CA01)", "Metoprolol 5mg EV (C07AB02)", "Dobutamina EV (C01CA07)"], "evo": "Oclusion de DA distal con trombo, trombectomia por aspiracion mas stent", "dx_alta": ["Edema pulmonar agudo tratado (J81)"], "med": ["Furosemida 40mg VO c/24h (C03CA01)", "Digoxina 0.125mg VO c/24h (C01AA05)", "Isosorbide 20mg VO c/8h (C01DA08)", "Rivaroxaban 20mg VO c/24h (B01AF01)", "Losartan 50mg VO c/24h (C09CA01)"]}, "output": "Ingresa por edema pulmonar agudo (J81). Se realiza cardioversion electrica (37.0). Evoluciona con, oclusion de da distal con trombo, trombectomia por aspiracion mas stent. Recibio tratamiento con Furosemida 40mg EV (C03CA01), Metoprolol 5mg EV (C07AB02) y Dobutamina EV (C01CA07). Evolucion satisfactoria, cumpliendo criterios de alta. Alta con diagnostico de edema pulmonar agudo tratado (J81), indicandose Furosemida 40mg VO c/24h (C03CA01), Digoxina 0.125mg VO c/24h (C01AA05), Isosorbide 20mg VO c/8h (C01DA08), Rivaroxaban 20mg VO c/24h (B01AF01) y Losartan 50mg VO c/24h (C09CA01)."}
{"input": {"dx": ["Enfermedad coronaria de 2 vasos (I25.1)"], "proc": ["Coronariografia (K492)", "Angioplastia DA (36.06)"], "tto": ["Ticagrelor 180mg carga (B01AC24)", "Levosimendan EV (C01CX08)", "Enoxaparina 60mg SC c/12h (B01AB05)", "Aspirina 100mg (B01AC06)"], "evo": "Pericarditis aguda con derrame leve, manejo antiinflamatorio", "dx_alta": ["Enfermedad coronaria de 2 vasos tratado (I25.1)"], "med": ["Enalapril 10mg VO c/12h (C09AA02)", "Nitroglicerina SL PRN (C01DA02)", "Prasugrel 10mg VO c/24h 12m (B01AC22)", "Ticagrelor 90mg VO c/12h 12m (B01AC24)", "Warfarina segun INR (B01AA03)"]}, "output": "Ingresa por enfermedad coronaria de 2 vasos (I25.1). Se realiza coronariografia (K492) evidenciando oclusion aguda, realizandose angioplastia da (36.06) con implante de stent farmacoactivo y flujo TIMI 3 final. Evoluciona con, pericarditis aguda con derrame leve, manejo antiinflamatorio. Recibio tratamiento con Ticagrelor 180mg carga (B01AC24), Levosimendan EV (C01CX08), Enoxaparina 60mg SC c/12h (B01AB05) y Aspirina 100mg (B01AC06). Presenta evolucion favorable, cumpliendo criterios de alta. Alta con diagnostico de enfermedad coronaria de 2 vasos tratado (I25.1), indicandose Enalapril 10mg VO c/12h (C09AA02), Nitroglicerina SL PRN (C01DA02), Prasugrel 10mg VO c/24h 12m (B01AC22), Ticagrelor 90mg VO c/12h 12m (B01AC24) y Warfarina segun INR (B01AA03)."}
{"input": {"dx": ["Insuficiencia cardiaca aguda (I50.9)"], "proc": ["Angioplastia TCI (K492)"], "tto": ["Clopidogrel 600mg carga (B01AC04)", "Clopidogrel 300mg carga (B01AC04)", "Noradrenalina EV (C01CA03)"], "evo": "Bloqueo AV completo sintomatico, requirio marcapasos transitorio", "dx_alta": ["Insuficiencia cardiaca aguda tratado (I50.9)"], "med": ["Losartan 50mg VO c/24h (C09CA01)", "Bisoprolol 5mg VO c/24h (C07AB07)", "Clopidogrel 75mg VO c/24h 12m (B01AC04)", "Espironolactona 25mg VO c/24h (C03DA01)", "Aspirina 100mg VO c/24h (B01AC06)"]}, "output": "Se hospitaliza por insuficiencia cardiaca aguda (I50.9). Se realiza angioplastia tci (K492). Evoluciona con, bloqueo av completo sintomatico, requirio marcapasos transitorio. Recibio tratamiento con Clopidogrel 600mg carga (B01AC04), Clopidogrel 300mg carga (B01AC04) y Noradrenalina EV (C01CA03). Evolucion clinica favorable, cumpliendo criterios de alta. Alta con diagnostico de insuficiencia cardiaca aguda tratado (I50.9), indicandose Losartan 50mg VO c/24h (C09CA01), Bisoprolol 5mg VO c/24h (C07AB07), Clopidogrel 75mg VO c/24h 12m (B01AC04), Espironolactona 25mg VO c/24h (C03DA01) y Aspirina 100mg VO c/24h (B01AC06)."}
{"input": {"dx": ["Trombosis de stent (I21.0)"], "proc": ["Ablacion por radiofrecuencia (37.94)"], "tto": ["Enoxaparina 60mg SC c/12h (B01AB05)", "Enoxaparina 1mg/kg SC c/12h (B01AB05)", "Atorvastatina 80mg (C10AA05)"], "evo": "Oclusion de CD media con trombo, trombectomia por aspiracion mas stent", "dx_alta": ["Trombosis de stent tratado (I21.0)"], "med": ["Rosuvastatina 20mg VO c/noche (C10AA07)", "Ticagrelor 90mg VO c/12h 12m (B01AC24)", "Rivaroxaban 20mg VO c/24h (B01AF01)"]}, "output": "Se hospitaliza por trombosis de stent (I21.0). Se realiza ablacion por radiofrecuencia (37.94). Evoluciona con, oclusion de cd media con trombo, trombectomia por aspiracion mas stent. Recibio tratamiento con Enoxaparina 60mg SC c/12h (B01AB05), Enoxaparina 1mg/kg SC c/12h (B01AB05) y Atorvastatina 80mg (C10AA05). Evolucion clinica favorable, cumpliendo criterios de alta. Alta con diagnostico de trombosis de stent tratado (I21.0), indicandose Rosuvastatina 20mg VO c/noche (C10AA07), Ticagrelor 90mg VO c/12h 12m (B01AC24) y Rivaroxaban 20mg VO c/24h (B01AF01)."}
{"input": {"dx": ["Angina inestable alto riesgo (I20.0)"], "proc": ["Coronariografia (K492)"], "tto": ["Heparina EV infusion (B01AB01)", "Prasugrel 60mg carga (B01AC22)", "Furosemida 40mg EV (C03CA01)", "Enoxaparina 1mg/kg SC c/12h (B01AB05)"], "evo": "Lesion critica de DA distal, estabilizacion hemodinamica, angioplastia diferida", "dx_alta": ["Angina inestable alto riesgo tratado (I20.0)"], "med": ["Rosuvastatina 20mg VO c/noche (C10AA07)", "Bisoprolol 5mg VO c/24h (C07AB07)", "Prasugrel 10mg VO c/24h 12m (B01AC22)", "Clopidogrel 75mg VO c/24h 12m (B01AC04)"]}, "output": "Paciente que ingresa con cuadro de angina inestable alto riesgo (I20.0). Se realiza coronariografia (K492). En su evolucion, lesion critica de da distal, estabilizacion hemodinamica, angioplastia diferida. Recibio tratamiento con Heparina EV infusion (B01AB01), Prasugrel 60mg carga (B01AC22), Furosemida 40mg EV (C03CA01) y Enoxaparina 1mg/kg SC c/12h (B01AB05). Evolucion clinica favorable, cumpliendo criterios de alta. Alta con diagnostico de angina inestable alto riesgo tratado (I20.0), indicandose Rosuvastatina 20mg VO c/noche (C10AA07), Bisoprolol 5mg VO c/24h (C07AB07), Prasugrel 10mg VO c/24h 12m (B01AC22) y Clopidogrel 75mg VO c/24h 12m (B01AC04)."}
{"input": {"dx": ["Trombosis de stent (I21.0)"], "proc": ["Implante de DAI (K493)"], "tto": ["Heparina EV infusion (B01AB01)", "Nitroglicerina EV (C01DA02)", "Amiodarona 300mg EV (C01BD01)"], "evo": "Taquicardia ventricular sostenida, cardioversion electrica exitosa", "dx_alta": ["Trombosis de stent tratado (I21.0)"], "med": ["Aspirina 100mg VO c/24h (B01AC06)", "Metoprolol 50mg VO c/12h (C07AB02)", "Atorvastatina 40mg VO c/noche (C10AA05)", "Digoxina 0.125mg VO c/24h (C01AA05)"]}, "output": "Se hospitaliza por trombosis de stent (I21.0). Se realiza implante de dai (K493). Durante la hospitalizacion, taquicardia ventricular sostenida, cardioversion electrica exitosa. Recibio tratamiento con Heparina EV infusion (B01AB01), Nitroglicerina EV (C01DA02) y Amiodarona 300mg EV (C01BD01). Evolucion clinica favorable, cumpliendo criterios de alta. Alta con diagnostico de trombosis de stent tratado (I21.0), indicandose Aspirina 100mg VO c/24h (B01AC06), Metoprolol 50mg VO c/12h (C07AB02), Atorvastatina 40mg VO c/noche (C10AA05) y Digoxina 0.125mg VO c/24h (C01AA05)."}
{"input": {"dx": ["Colecistitis aguda (K81.0)"], "proc": ["Toracocentesis (34.91)"], "tto": ["Ciprofloxacino 400mg EV c/12h (J01MA02)", "Metronidazol 500mg EV c/8h (J01XD01)", "Metoclopramida 10mg EV c/8h (A03FA01)", "Insulina cristalina segun esquema (A10AB01)"], "evo": "Manejo conservador exitoso, sin necesidad de cirugia", "dx_alta": ["Colecistitis aguda resuelto (K81.0)"], "med": ["Budesonide/Formoterol INH c/12h (R03AK07)", "Metformina 850mg VO c/12h (A10BA02)"]}, "output": "Paciente que ingresa con cuadro de colecistitis aguda (K81.0). Se realiza toracocentesis (34.91). Evoluciona con, manejo conservador exitoso, sin necesidad de cirugia. Recibio tratamiento con Ciprofloxacino 400mg EV c/12h (J01MA02), Metronidazol 500mg EV c/8h (J01XD01), Metoclopramida 10mg EV c/8h (A03FA01) y Insulina cristalina segun esquema (A10AB01). Evolucion satisfactoria, cumpliendo criterios de alta. Alta con diagnostico de colecistitis aguda resuelto (K81.0), indicandose Budesonide/Formoterol INH c/12h (R03AK07) y Metformina 850mg VO c/12h (A10BA02)."}
{"input": {"dx": ["Enfermedad de TCI (I25.1)"], "proc": ["Cardioversion electrica (K493)"], "tto": ["Heparina EV infusion (B01AB01)", "Metoprolol 5mg EV (C07AB02)"], "evo": "Enfermedad de multiples vasos, se deriva a cirugia cardiaca para bypass", "dx_alta": ["Enfermedad de TCI tratado (I25.1)"], "med": ["Bisoprolol 5mg VO c/24h (C07AB07)", "Carvedilol 6.25mg VO c/12h (C07AG02)", "Warfarina segun INR (B01AA03)", "Amlodipino 5mg VO c/24h (C08CA01)", "Enalapril 10mg VO c/12h (C09AA02)"]}, "output": "Ingresa por enfermedad de tci (I25.1). Se realiza cardioversion electrica (K493). En su evolucion, enfermedad de multiples vasos, se deriva a cirugia cardiaca para bypass. Recibio tratamiento con Heparina EV infusion (B01AB01) y Metoprolol 5mg EV (C07AB02). Presenta evolucion favorable, cumpliendo criterios de alta. Alta con diagnostico de enfermedad de tci tratado (I25.1), indicandose Bisoprolol 5mg VO c/24h (C07AB07), Carvedilol 6.25mg VO c/12h (C07AG02), Warfarina segun INR (B01AA03), Amlodipino 5mg VO c/24h (C08CA01) y Enalapril 10mg VO c/12h (C09AA02)."}
{"input": {"dx": ["Enfermedad coronaria de 2 vasos (I25.1)"], "proc": ["Coronariografia (K492)", "Angioplastia CD (36.06)"], "tto": ["Clopidogrel 600mg carga (B01AC04)", "Dobutamina EV (C01CA07)", "Enalapril 5mg VO (C09AA02)"], "evo": "Estenosis aortica severa sintomatica, programada para TAVI", "dx_alta": ["Enfermedad coronaria de 2 vasos tratado (I25.1)"], "med": ["Rosuvastatina 20mg VO c/noche (C10AA07)", "Furosemida 40mg VO c/24h (C03CA01)", "Digoxina 0.125mg VO c/24h (C01AA05)", "Atorvastatina 40mg VO c/noche (C10AA05)", "Losartan 50mg VO c/24h (C09CA01)"]}, "output": "Se hospitaliza por enfermedad coronaria de 2 vasos (I25.1). Se realiza coronariografia (K492) evidenciando oclusion aguda, realizandose angioplastia cd (36.06) con implante de stent farmacoactivo y flujo TIMI 3 final. Evoluciona con, estenosis aortica severa sintomatica, programada para tavi. Recibio tratamiento con Clopidogrel 600mg carga (B01AC04), Dobutamina EV (C01CA07) y Enalapril 5mg VO (C09AA02). Buena evolucion, cumpliendo criterios de alta. Alta con diagnostico de enfermedad coronaria de 2 vasos tratado (I25.1), indicandose Rosuvastatina 20mg VO c/noche (C10AA07), Furosemida 40mg VO c/24h (C03CA01), Digoxina 0.125mg VO c/24h (C01AA05), Atorvastatina 40mg VO c/noche (C10AA05) y Losartan 50mg VO c/24h (C09CA01)."}
{"input": {"dx": ["IAMCEST anteroseptal (I21.0)"], "proc": ["Coronariografia (K492)", "Angioplastia DA (36.06)"], "tto": ["Heparina 5000UI EV (B01AB01)", "Digoxina 0.25mg EV (C01AA05)"], "evo": "Oclusion de CX distal con trombo, trombectomia por aspiracion mas stent", "dx_alta": ["IAMCEST anteroseptal tratado (I21.0)"], "med": ["Espironolactona 25mg VO c/24h (C03DA01)", "Bisoprolol 5mg VO c/24h (C07AB07)", "Nitroglicerina SL PRN (C01DA02)", "Ticagrelor 90mg VO c/12h 12m (B01AC24)", "Amlodipino 5mg VO c/24h (C08CA01)"]}, "output": "Ingresa por iamcest anteroseptal (I21.0). Se realiza coronariografia (K492) con hallazgo de lesion significativa, realizandose angioplastia da (36.06) con implante de stent farmacoactivo y flujo TIMI 3 final. Durante la hospitalizacion, oclusion de cx distal con trombo, trombectomia por aspiracion mas stent. Recibio tratamiento con Heparina 5000UI EV (B01AB01) y Digoxina 0.25mg EV (C01AA05). Buena evolucion, cumpliendo criterios de alta. Alta con diagnostico de iamcest anteroseptal tratado (I21.0), indicandose Espironolactona 25mg VO c/24h (C03DA01), Bisoprolol 5mg VO c/24h (C07AB07), Nitroglicerina SL PRN (C01DA02), Ticagrelor 90mg VO c/12h 12m (B01AC24) y Amlodipino 5mg VO c/24h (C08CA01)."}
{"input": {"dx": ["Hipertension arterial severa (I10)"], "proc": ["RMN cerebral (88.91)", "Colecistectomia laparoscopica (51.23)"], "tto": ["Omeprazol 40mg EV c/12h (A02BC01)", "Ondansetron 8mg EV c/8h (A04AA01)", "Metronidazol 500mg EV c/8h (J01XD01)", "Vancomicina 1g EV c/12h (J01XA01)"], "evo": "Manejo conservador exitoso, sin necesidad de cirugia", "dx_alta": ["Hipertension arterial severa resuelto (I10)"], "med": ["Omeprazol 20mg VO c/24h (A02BC01)", "Insulina NPH 10UI SC c/12h (A10AC01)", "Sertralina 50mg VO c/24h (N06AB06)"]}, "output": "Se hospitaliza por hipertension arterial severa (I10). Se realiza rmn cerebral (88.91), colecistectomia laparoscopica (51.23). Presenta, manejo conservador exitoso, sin necesidad de cirugia. Recibio tratamiento con Omeprazol 40mg EV c/12h (A02BC01), Ondansetron 8mg EV c/8h (A04AA01), Metronidazol 500mg EV c/8h (J01XD01) y Vancomicina 1g EV c/12h (J01XA01). Evolucion clinica favorable, cumpliendo criterios de alta. Alta con diagnostico de hipertension arterial severa resuelto (I10), indicandose Omeprazol 20mg VO c/24h (A02BC01), Insulina NPH 10UI SC c/12h (A10AC01) y Sertralina 50mg VO c/24h (N06AB06)."}
{"input": {"dx": ["Shock cardiogenico (R57.0)"], "proc": ["Cardioversion electrica (89.50)"], "tto": ["Metoprolol 5mg EV (C07AB02)", "Morfina 3mg EV (N02AA01)"], "evo": "Oclusion aguda de CD media, angioplastia exitosa con stent farmacoactivo, flujo TIMI 3 final", "dx_alta": ["Shock cardiogenico tratado (R57.0)"], "med": ["Digoxina 0.125mg VO c/24h (C01AA05)", "Warfarina segun INR (B01AA03)", "Aspirina 100mg VO c/24h (B01AC06)", "Isosorbide 20mg VO c/8h (C01DA08)", "Bisoprolol 5mg VO c/24h (C07AB07)"]}, "output": "Ingresa por shock cardiogenico (R57.0). Se realiza cardioversion electrica (89.50). Presenta, oclusion aguda de cd media, angioplastia exitosa con stent farmacoactivo, flujo timi 3 final. Recibio tratamiento con Metoprolol 5mg EV (C07AB02) y Morfina 3mg EV (N02AA01). Evolucion satisfactoria, cumpliendo criterios de alta. Alta con diagnostico de shock cardiogenico tratado (R57.0), indicandose Digoxina 0.125mg VO c/24h (C01AA05), Warfarina segun INR (B01AA03), Aspirina 100mg VO c/24h (B01AC06), Isosorbide 20mg VO c/8h (C01DA08) y Bisoprolol 5mg VO c/24h (C07AB07)."}
{"input": {"dx": ["IAMCEST anterolateral (I21.0)"], "proc": ["Coronariografia (K492)", "Angioplastia OM (K493)"], "tto": ["Noradrenalina EV (C01CA03)", "Aspirina 300mg carga (B01AC06)"], "evo": "Pericarditis aguda con derrame leve, manejo antiinflamatorio", "dx_alta": ["IAMCEST anterolateral tratado (I21.0)"], "med": ["Isosorbide 20mg VO c/8h (C01DA08)", "Atorvastatina 40mg VO c/noche (C10AA05)", "Amlodipino 5mg VO c/24h (C08CA01)", "Rosuvastatina 20mg VO c/noche (C10AA07)"]}, "output": "Paciente que ingresa con cuadro de iamcest anterolateral (I21.0). Se realiza coronariografia (K492) encontrando lesion critica, realizandose angioplastia om (K493) con implante de stent farmacoactivo y flujo TIMI 3 final. Presenta, pericarditis aguda con derrame leve, manejo antiinflamatorio. Recibio tratamiento con Noradrenalina EV (C01CA03) y Aspirina 300mg carga (B01AC06). Evolucion satisfactoria, cumpliendo criterios de alta. Alta con diagnostico de iamcest anterolateral tratado (I21.0), indicandose Isosorbide 20mg VO c/8h (C01DA08), Atorvastatina 40mg VO c/noche (C10AA05), Amlodipino 5mg VO c/24h (C08CA01) y Rosuvastatina 20mg VO c/noche (C10AA07)."}
{"input": {"dx": ["Enfermedad coronaria de 3 vasos (I25.1)"], "proc": ["Coronariografia (K492)", "Angioplastia DA (36.06)"], "tto": ["Furosemida 80mg EV (C03CA01)", "Ticagrelor 180mg carga (B01AC24)", "Enoxaparina 1mg/kg SC c/12h (B01AB05)"], "evo": "Shock cardiogenico, requirio soporte con inotropicos, evolucion favorable", "dx_alta": ["Enfermedad coronaria de 3 vasos tratado (I25.1)"], "med": ["Carvedilol 6.25mg VO c/12h (C07AG02)", "Amlodipino 5mg VO c/24h (C08CA01)", "Clopidogrel 75mg VO c/24h 12m (B01AC04)", "Atorvastatina 40mg VO c/noche (C10AA05)"]}, "output": "Ingresa por enfermedad coronaria de 3 vasos (I25.1). Se realiza coronariografia (K492) visualizando estenosis severa, realizandose angioplastia da (36.06) con implante de stent farmacoactivo y flujo TIMI 3 final. Evoluciona con, shock cardiogenico, requirio soporte con inotropicos, evolucion favorable. Recibio tratamiento con Furosemida 80mg EV (C03CA01), Ticagrelor 180mg carga (B01AC24) y Enoxaparina 1mg/kg SC c/12h (B01AB05). Evolucion satisfactoria, cumpliendo criterios de alta. Alta con diagnostico de enfermedad coronaria de 3 vasos tratado (I25.1), indicandose Carvedilol 6.25mg VO c/12h (C07AG02), Amlodipino 5mg VO c/24h (C08CA01), Clopidogrel 75mg VO c/24h 12m (B01AC04) y Atorvastatina 40mg VO c/noche (C10AA05)."}
{"input": {"dx": ["Enfermedad coronaria de 2 vasos (I25.1)"], "proc": ["Coronariografia (K492)"], "tto": ["Noradrenalina EV (C01CA03)", "Heparina 5000UI EV (B01AB01)"], "evo": "Pericarditis aguda con derrame leve, manejo antiinflamatorio", "dx_alta": ["Enfermedad coronaria de 2 vasos tratado (I25.1)"], "med": ["Atorvastatina 40mg VO c/noche (C10AA05)", "Warfarina segun INR (B01AA03)", "Apixaban 5mg VO c/12h (B01AF02)"]}, "output": "Se hospitaliza por enfermedad coronaria de 2 vasos (I25.1). Se realiza coronariografia (K492). Presenta, pericarditis aguda con derrame leve, manejo antiinflamatorio. Recibio tratamiento con Noradrenalina EV (C01CA03) y Heparina 5000UI EV (B01AB01). Presenta evolucion favorable, cumpliendo criterios de alta. Alta con diagnostico de enfermedad coronaria de 2 vasos tratado (I25.1), indicandose Atorvastatina 40mg VO c/noche (C10AA05), Warfarina segun INR (B01AA03) y Apixaban 5mg VO c/12h (B01AF02)."}
{"input": {"dx": ["IAMCEST posterior (I21.2)"], "proc": ["Coronariografia (K492)"], "tto": ["Heparina 5000UI EV (B01AB01)", "Noradrenalina EV (C01CA03)", "Levosimendan EV (C01CX08)"], "evo": "Lesion critica de CD media, estabilizacion hemodinamica, angioplastia diferida", "dx_alta": ["IAMCEST posterior tratado (I21.2)"], "med": ["Espironolactona 25mg VO c/24h (C03DA01)", "Atorvastatina 40mg VO c/noche (C10AA05)", "Losartan 50mg VO c/24h (C09CA01)"]}, "output": "Ingresa por iamcest posterior (I21.2). Se realiza coronariografia (K492). Presenta, lesion critica de cd media, estabilizacion hemodinamica, angioplastia diferida. Recibio tratamiento con Heparina 5000UI EV (B01AB01), Noradrenalina EV (C01CA03) y Levosimendan EV (C01CX08). Evolucion clinica favorable, cumpliendo criterios de alta. Alta con diagnostico de iamcest posterior tratado (I21.2), indicandose Espironolactona 25mg VO c/24h (C03DA01), Atorvastatina 40mg VO c/noche (C10AA05) y Losartan 50mg VO c/24h (C09CA01)."}
{"input": {"dx": ["Hernia inguinal (K40.9)"], "proc": ["Endoscopia digestiva alta (45.13)", "Trombolisis EV (99.10)"], "tto": ["Ondansetron 8mg EV c/8h (A04AA01)", "Metoclopramida 10mg EV c/8h (A03FA01)", "Pantoprazol 40mg EV c/12h (A02BC02)", "Salbutamol NBZ c/4h (R03AC02)"], "evo": "Control de sintomas con tratamiento medico optimizado", "dx_alta": ["Hernia inguinal resuelto (K40.9)"], "med": ["Tramadol 50mg VO c/8h 7d (N02AX02)", "Ciprofloxacino 500mg VO c/12h 7d (J01MA02)", "Paracetamol 500mg VO c/8h PRN (N02BE01)"]}, "output": "Ingreso por hernia inguinal (K40.9). Se realiza endoscopia digestiva alta (45.13), trombolisis ev (99.10). Durante la hospitalizacion, control de sintomas con tratamiento medico optimizado. Recibio tratamiento con Ondansetron 8mg EV c/8h (A04AA01), Metoclopramida 10mg EV c/8h (A03FA01), Pantoprazol 40mg EV c/12h (A02BC02) y Salbutamol NBZ c/4h (R03AC02). Buena evolucion, cumpliendo criterios de alta. Alta con diagnostico de hernia inguinal resuelto (K40.9), indicandose Tramadol 50mg VO c/8h 7d (N02AX02), Ciprofloxacino 500mg VO c/12h 7d (J01MA02) y Paracetamol 500mg VO c/8h PRN (N02BE01)."}
{"input": {"dx": ["Enfermedad coronaria de 3 vasos (I25.1)"], "proc": ["Coronariografia (K492)"], "tto": ["Heparina EV infusion (B01AB01)", "Atorvastatina 80mg (C10AA05)", "Prasugrel 60mg carga (B01AC22)", "Furosemida 40mg EV (C03CA01)"], "evo": "Fibrilacion auricular de alta respuesta, cardioversion farmacologica exitosa", "dx_alta": ["Enfermedad coronaria de 3 vasos tratado (I25.1)"], "med": ["Atorvastatina 40mg VO c/noche (C10AA05)", "Aspirina 100mg VO c/24h (B01AC06)", "Furosemida 40mg VO c/24h (C03CA01)", "Bisoprolol 5mg VO c/24h (C07AB07)"]}, "output": "Ingreso por enfermedad coronaria de 3 vasos (I25.1). Se realiza coronariografia (K492). Evoluciona con, fibrilacion auricular de alta respuesta, cardioversion farmacologica exitosa. Recibio tratamiento con Heparina EV infusion (B01AB01), Atorvastatina 80mg (C10AA05), Prasugrel 60mg carga (B01AC22) y Furosemida 40mg EV (C03CA01). Presenta evolucion favorable, cumpliendo criterios de alta. Alta con diagnostico de enfermedad coronaria de 3 vasos tratado (I25.1), indicandose Atorvastatina 40mg VO c/noche (C10AA05), Aspirina 100mg VO c/24h (B01AC06), Furosemida 40mg VO c/24h (C03CA01) y Bisoprolol 5mg VO c/24h (C07AB07)."}
{"input": {"dx": ["IAMCEST anterior (I21.0)"], "proc": ["Coronariografia (K492)", "Angioplastia CX (K493)"], "tto": ["Enoxaparina 1mg/kg SC c/12h (B01AB05)", "Heparina 5000UI EV (B01AB01)"], "evo": "Edema pulmonar agudo por disfuncion sistolica, respuesta favorable a diureticos", "dx_alta": ["IAMCEST anterior tratado (I21.0)"], "med": ["Warfarina segun INR (B01AA03)", "Isosorbide 20mg VO c/8h (C01DA08)", "Rivaroxaban 20mg VO c/24h (B01AF01)", "Amlodipino 5mg VO c/24h (C08CA01)", "Rosuvastatina 20mg VO c/noche (C10AA07)"]}, "output": "Se hospitaliza por iamcest anterior (I21.0). Se realiza coronariografia (K492) con hallazgo de lesion significativa, realizandose angioplastia cx (K493) con implante de stent farmacoactivo y flujo TIMI 3 final. Evoluciona con, edema pulmonar agudo por disfuncion sistolica, respuesta favorable a diureticos. Recibio tratamiento con Enoxaparina 1mg/kg SC c/12h (B01AB05) y Heparina 5000UI EV (B01AB01). Evolucion satisfactoria, cumpliendo criterios de alta. Alta con diagnostico de iamcest anterior tratado (I21.0), indicandose Warfarina segun INR (B01AA03), Isosorbide 20mg VO c/8h (C01DA08), Rivaroxaban 20mg VO c/24h (B01AF01), Amlodipino 5mg VO c/24h (C08CA01) y Rosuvastatina 20mg VO c/noche (C10AA07)."}
{"input": {"dx": ["IAMCEST anteroseptal (I21.0)"], "proc": ["Coronariografia (K492)", "Angioplastia DA (K493)"], "tto": ["Noradrenalina EV (C01CA03)", "Furosemida 80mg EV (C03CA01)", "Enalapril 5mg VO (C09AA02)"], "evo": "Shock cardiogenico, requirio soporte con inotropicos, evolucion favorable", "dx_alta": ["IAMCEST anteroseptal tratado (I21.0)"], "med": ["Nitroglicerina SL PRN (C01DA02)", "Rivaroxaban 20mg VO c/24h (B01AF01)", "Isosorbide 20mg VO c/8h (C01DA08)", "Espironolactona 25mg VO c/24h (C03DA01)", "Enalapril 10mg VO c/12h (C09AA02)"]}, "output": "Se hospitaliza por iamcest anteroseptal (I21.0). Se realiza coronariografia (K492) visualizando estenosis severa, realizandose angioplastia da (K493) con implante de stent farmacoactivo y flujo TIMI 3 final. Presenta, shock cardiogenico, requirio soporte con inotropicos, evolucion favorable. Recibio tratamiento con Noradrenalina EV (C01CA03), Furosemida 80mg EV (C03CA01) y Enalapril 5mg VO (C09AA02). Presenta evolucion favorable, cumpliendo criterios de alta. Alta con diagnostico de iamcest anteroseptal tratado (I21.0), indicandose Nitroglicerina SL PRN (C01DA02), Rivaroxaban 20mg VO c/24h (B01AF01), Isosorbide 20mg VO c/8h (C01DA08), Espironolactona 25mg VO c/24h (C03DA01) y Enalapril 10mg VO c/12h (C09AA02)."}
{"input": {"dx": ["IAMCEST anteroseptal (I21.0)"], "proc": ["Coronariografia (K492)"], "tto": ["Atorvastatina 80mg (C10AA05)", "Heparina EV infusion (B01AB01)", "Furosemida 80mg EV (C03CA01)", "Morfina 3mg EV (N02AA01)"], "evo": "SDST en V1-V6, coronarias sin lesiones obstructivas, sindrome de Tako-Tsubo", "dx_alta": ["IAMCEST anteroseptal tratado (I21.0)"], "med": ["Losartan 50mg VO c/24h (C09CA01)", "Warfarina segun INR (B01AA03)", "Espironolactona 25mg VO c/24h (C03DA01)"]}, "output": "Ingreso por iamcest anteroseptal (I21.0). Se realiza coronariografia (K492). Presenta, sdst en v1-v6, coronarias sin lesiones obstructivas, sindrome de tako-tsubo. Recibio tratamiento con Atorvastatina 80mg (C10AA05), Heparina EV infusion (B01AB01), Furosemida 80mg EV (C03CA01) y Morfina 3mg EV (N02AA01). Buena evolucion, cumpliendo criterios de alta. Alta con diagnostico de iamcest anteroseptal tratado (I21.0), indicandose Losartan 50mg VO c/24h (C09CA01), Warfarina segun INR (B01AA03) y Espironolactona 25mg VO c/24h (C03DA01)."}
{"input": {"dx": ["Enfermedad coronaria de 3 vasos (I25.1)"], "proc": ["Coronariografia (K492)", "Angioplastia DA (36.06)"], "tto": ["Metoprolol 5mg EV (C07AB02)", "Clopidogrel 300mg carga (B01AC04)"], "evo": "Oclusion aguda de diagonal, angioplastia exitosa con stent farmacoactivo, flujo TIMI 3 final", "dx_alta": ["Enfermedad coronaria de 3 vasos tratado (I25.1)"], "med": ["Atorvastatina 40mg VO c/noche (C10AA05)", "Furosemida 40mg VO c/24h (C03CA01)", "Warfarina segun INR (B01AA03)", "Digoxina 0.125mg VO c/24h (C01AA05)", "Espironolactona 25mg VO c/24h (C03DA01)"]}, "output": "Se hospitaliza por enfermedad coronaria de 3 vasos (I25.1). Se realiza coronariografia (K492) con hallazgo de lesion significativa, realizandose angioplastia da (36.06) con implante de stent farmacoactivo y flujo TIMI 3 final. En su evolucion, oclusion aguda de diagonal, angioplastia exitosa con stent farmacoactivo, flujo timi 3 final. Recibio tratamiento con Metoprolol 5mg EV (C07AB02) y Clopidogrel 300mg carga (B01AC04). Evolucion satisfactoria, cumpliendo criterios de alta. Alta con diagnostico de enfermedad coronaria de 3 vasos tratado (I25.1), indicandose Atorvastatina 40mg VO c/noche (C10AA05), Furosemida 40mg VO c/24h (C03CA01), Warfarina segun INR (B01AA03), Digoxina 0.125mg VO c/24h (C01AA05) y Espironolactona 25mg VO c/24h (C03DA01)."}
{"input": {"dx": ["IAMCEST anterior (I21.0)"], "proc": ["Coronariografia (K492)", "Angioplastia DA (36.06)"], "tto": ["Atorvastatina 80mg (C10AA05)", "Enoxaparina 1mg/kg SC c/12h (B01AB05)"], "evo": "Oclusion de CD media con trombo, trombectomia por aspiracion mas stent", "dx_alta": ["IAMCEST anterior tratado (I21.0)"], "med": ["Isosorbide 20mg VO c/8h (C01DA08)", "Carvedilol 6.25mg VO c/12h (C07AG02)", "Clopidogrel 75mg VO c/24h 12m (B01AC04)"]}, "output": "Ingresa por iamcest anterior (I21.0). Se realiza coronariografia (K492) evidenciando oclusion aguda, realizandose angioplastia da (36.06) con implante de stent farmacoactivo y flujo TIMI 3 final. En su evolucion, oclusion de cd media con trombo, trombectomia por aspiracion mas stent. Recibio tratamiento con Atorvastatina 80mg (C10AA05) y Enoxaparina 1mg/kg SC c/12h (B01AB05). Buena evolucion, cumpliendo criterios de alta. Alta con diagnostico de iamcest anterior tratado (I21.0), indicandose Isosorbide 20mg VO c/8h (C01DA08), Carvedilol 6.25mg VO c/12h (C07AG02) y Clopidogrel 75mg VO c/24h 12m (B01AC04)."}
{"input": {"dx": ["IAMSEST alto riesgo (I21.4)"], "proc": ["Coronariografia (K492)", "Angioplastia CX (K493)"], "tto": ["Clopidogrel 600mg carga (B01AC04)", "Heparina 5000UI EV (B01AB01)"], "evo": "Oclusion de CD media con trombo, trombectomia por aspiracion mas stent", "dx_alta": ["IAMSEST alto riesgo tratado (I21.4)"], "med": ["Rivaroxaban 20mg VO c/24h (B01AF01)", "Bisoprolol 5mg VO c/24h (C07AB07)", "Prasugrel 10mg VO c/24h 12m (B01AC22)"]}, "output": "Se hospitaliza por iamsest alto riesgo (I21.4). Se realiza coronariografia (K492) evidenciando oclusion aguda, realizandose angioplastia cx (K493) con implante de stent farmacoactivo y flujo TIMI 3 final. Presenta, oclusion de cd media con trombo, trombectomia por aspiracion mas stent. Recibio tratamiento con Clopidogrel 600mg carga (B01AC04) y Heparina 5000UI EV (B01AB01). Evolucion satisfactoria, cumpliendo criterios de alta. Alta con diagnostico de iamsest alto riesgo tratado (I21.4), indicandose Rivaroxaban 20mg VO c/24h (B01AF01), Bisoprolol 5mg VO c/24h (C07AB07) y Prasugrel 10mg VO c/24h 12m (B01AC22)."}
{"input": {"dx": ["Angina estable (I20.8)"], "proc": ["Coronariografia (K492)", "Angioplastia OM (36.06)"], "tto": ["Enoxaparina 60mg SC c/12h (B01AB05)", "Enoxaparina 1mg/kg SC c/12h (B01AB05)", "Aspirina 300mg carga (B01AC06)", "Clopidogrel 600mg carga (B01AC04)"], "evo": "SDST en I, aVL, coronarias sin lesiones obstructivas, sindrome de Tako-Tsubo", "dx_alta": ["Angina estable tratado (I20.8)"], "med": ["Carvedilol 6.25mg VO c/12h (C07AG02)", "Losartan 50mg VO c/24h (C09CA01)", "Metoprolol 50mg VO c/12h (C07AB02)", "Atorvastatina 40mg VO c/noche (C10AA05)", "Clopidogrel 75mg VO c/24h 12m (B01AC04)"]}, "output": "Paciente que ingresa con cuadro de angina estable (I20.8). Se realiza coronariografia (K492) visualizando estenosis severa, realizandose angioplastia om (36.06) con implante de stent farmacoactivo y flujo TIMI 3 final. En su evolucion, sdst en i, avl, coronarias sin lesiones obstructivas, sindrome de tako-tsubo. Recibio tratamiento con Enoxaparina 60mg SC c/12h (B01AB05), Enoxaparina 1mg/kg SC c/12h (B01AB05), Aspirina 300mg carga (B01AC06) y Clopidogrel 600mg carga (B01AC04). Buena evolucion, cumpliendo criterios de alta. Alta con diagnostico de angina estable tratado (I20.8), indicandose Carvedilol 6.25mg VO c/12h (C07AG02), Losartan 50mg VO c/24h (C09CA01), Metoprolol 50mg VO c/12h (C07AB02), Atorvastatina 40mg VO c/noche (C10AA05) y Clopidogrel 75mg VO c/24h 12m (B01AC04)."}
{"input": {"dx": ["IAMSEST alto riesgo (I21.4)"], "proc": ["Coronariografia (K492)", "Angioplastia OM (36.06)"], "tto": ["Enoxaparina 60mg SC c/12h (B01AB05)", "Metoprolol 5mg EV (C07AB02)"], "evo": "Estenosis aortica severa sintomatica, programada para TAVI", "dx_alta": ["IAMSEST alto riesgo tratado (I21.4)"], "med": ["Apixaban 5mg VO c/12h (B01AF02)", "Amlodipino 5mg VO c/24h (C08CA01)", "Bisoprolol 5mg VO c/24h (C07AB07)"]}, "output": "Se hospitaliza por iamsest alto riesgo (I21.4). Se realiza coronariografia (K492) con hallazgo de lesion significativa, realizandose angioplastia om (36.06) con implante de stent farmacoactivo y flujo TIMI 3 final. Evoluciona con, estenosis aortica severa sintomatica, programada para tavi. Recibio tratamiento con Enoxaparina 60mg SC c/12h (B01AB05) y Metoprolol 5mg EV (C07AB02). Evolucion clinica favorable, cumpliendo criterios de alta. Alta con diagnostico de iamsest alto riesgo tratado (I21.4), indicandose Apixaban 5mg VO c/12h (B01AF02), Amlodipino 5mg VO c/24h (C08CA01) y Bisoprolol 5mg VO c/24h (C07AB07)."}
{"input": {"dx": ["Angina estable (I20.8)"], "proc": ["Coronariografia (K492)", "Angioplastia TCI (36.06)"], "tto": ["Ticagrelor 180mg carga (B01AC24)", "Noradrenalina EV (C01CA03)", "Furosemida 40mg EV (C03CA01)"], "evo": "Shock cardiogenico, requirio soporte con inotropicos, evolucion favorable", "dx_alta": ["Angina estable tratado (I20.8)"], "med": ["Atorvastatina 40mg VO c/noche (C10AA05)", "Warfarina segun INR (B01AA03)", "Furosemida 40mg VO c/24h (C03CA01)"]}, "output": "Paciente que ingresa con cuadro de angina estable (I20.8). Se realiza coronariografia (K492) con hallazgo de lesion significativa, realizandose angioplastia tci (36.06) con implante de stent farmacoactivo y flujo TIMI 3 final. En su evolucion, shock cardiogenico, requirio soporte con inotropicos, evolucion favorable. Recibio tratamiento con Ticagrelor 180mg carga (B01AC24), Noradrenalina EV (C01CA03) y Furosemida 40mg EV (C03CA01). Buena evolucion, cumpliendo criterios de alta. Alta con diagnostico de angina estable tratado (I20.8), indicandose Atorvastatina 40mg VO c/noche (C10AA05), Warfarina segun INR (B01AA03) y Furosemida 40mg VO c/24h (C03CA01)."}
{"input": {"dx": ["Enfermedad coronaria de 2 vasos (I25.1)"], "proc": ["Coronariografia (K492)", "Angioplastia CX (36.06)"], "tto": ["Enoxaparina 60mg SC c/12h (B01AB05)", "Aspirina 300mg carga (B01AC06)", "Prasugrel 60mg carga (B01AC22)", "Amiodarona 300mg EV (C01BD01)"], "evo": "Taquicardia ventricular sostenida, cardioversion electrica exitosa", "dx_alta": ["Enfermedad coronaria de 2 vasos tratado (I25.1)"], "med": ["Clopidogrel 75mg VO c/24h 12m (B01AC04)", "Furosemida 40mg VO c/24h (C03CA01)", "Amlodipino 5mg VO c/24h (C08CA01)", "Losartan 50mg VO c/24h (C09CA01)", "Metoprolol 50mg VO c/12h (C07AB02)"]}, "output": "Ingreso por enfermedad coronaria de 2 vasos (I25.1). Se realiza coronariografia (K492) con hallazgo de lesion significativa, realizandose angioplastia cx (36.06) con implante de stent farmacoactivo y flujo TIMI 3 final. Evoluciona con, taquicardia ventricular sostenida, cardioversion electrica exitosa. Recibio tratamiento con Enoxaparina 60mg SC c/12h (B01AB05), Aspirina 300mg carga (B01AC06), Prasugrel 60mg carga (B01AC22) y Amiodarona 300mg EV (C01BD01). Evolucion satisfactoria, cumpliendo criterios de alta. Alta con diagnostico de enfermedad coronaria de 2 vasos tratado (I25.1), indicandose Clopidogrel 75mg VO c/24h 12m (B01AC04), Furosemida 40mg VO c/24h (C03CA01), Amlodipino 5mg VO c/24h (C08CA01), Losartan 50mg VO c/24h (C09CA01) y Metoprolol 50mg VO c/12h (C07AB02)."}
{"input": {"dx": ["Reestenosis intra-stent (I25.5)"], "proc": ["Ablacion por radiofrecuencia (89.41)"], "tto": ["Heparina 5000UI EV (B01AB01)", "Aspirina 100mg (B01AC06)", "Amiodarona 300mg EV (C01BD01)"], "evo": "SDST en V1-V4, coronarias sin lesiones obstructivas, sindrome de Tako-Tsubo", "dx_alta": ["Reestenosis intra-stent tratado (I25.5)"], "med": ["Ticagrelor 90mg VO c/12h 12m (B01AC24)", "Enalapril 10mg VO c/12h (C09AA02)", "Amlodipino 5mg VO c/24h (C08CA01)", "Nitroglicerina SL PRN (C01DA02)"]}, "output": "Ingresa por reestenosis intra-stent (I25.5). Se realiza ablacion por radiofrecuencia (89.41). Presenta, sdst en v1-v4, coronarias sin lesiones obstructivas, sindrome de tako-tsubo. Recibio tratamiento con Heparina 5000UI EV (B01AB01), Aspirina 100mg (B01AC06) y Amiodarona 300mg EV (C01BD01). Evolucion clinica favorable, cumpliendo criterios de alta. Alta con diagnostico de reestenosis intra-stent tratado (I25.5), indicandose Ticagrelor 90mg VO c/12h 12m (B01AC24), Enalapril 10mg VO c/12h (C09AA02), Amlodipino 5mg VO c/24h (C08CA01) y Nitroglicerina SL PRN (C01DA02)."}
{"input": {"dx": ["IAMCEST lateral (I21.2)"], "proc": ["Coronariografia (K492)", "Angioplastia OM (K493)"], "tto": ["Clopidogrel 600mg carga (B01AC04)", "Digoxina 0.25mg EV (C01AA05)", "Nitroglicerina EV (C01DA02)"], "evo": "Enfermedad de multiples vasos, se deriva a cirugia cardiaca para bypass", "dx_alta": ["IAMCEST lateral tratado (I21.2)"], "med": ["Digoxina 0.125mg VO c/24h (C01AA05)", "Rivaroxaban 20mg VO c/24h (B01AF01)", "Nitroglicerina SL PRN (C01DA02)"]}, "output": "Se hospitaliza por iamcest lateral (I21.2). Se realiza coronariografia (K492) encontrando lesion critica, realizandose angioplastia om (K493) con implante de stent farmacoactivo y flujo TIMI 3 final. Presenta, enfermedad de multiples vasos, se deriva a cirugia cardiaca para bypass. Recibio tratamiento con Clopidogrel 600mg carga (B01AC04), Digoxina 0.25mg EV (C01AA05) y Nitroglicerina EV (C01DA02). Buena evolucion, cumpliendo criterios de alta. Alta con diagnostico de iamcest lateral tratado (I21.2), indicandose Digoxina 0.125mg VO c/24h (C01AA05), Rivaroxaban 20mg VO c/24h (B01AF01) y Nitroglicerina SL PRN (C01DA02)."}
{"input": {"dx": ["Fractura de cadera (S72.0)"], "proc": ["RMN cerebral (88.91)", "TAC de torax (87.41)"], "tto": ["N-acetilcisteina NBZ c/8h (R05CB01)", "Insulina cristalina segun esquema (A10AB01)", "Paracetamol 1g EV c/8h (N02BE01)"], "evo": "Control de sintomas con tratamiento medico optimizado", "dx_alta": ["Fractura de cadera resuelto (S72.0)"], "med": ["Insulina NPH 10UI SC c/12h (A10AC01)", "Glibenclamida 5mg VO c/24h (A10BB01)"]}, "output": "Ingreso por fractura de cadera (S72.0). Se realiza rmn cerebral (88.91), tac de torax (87.41). En su evolucion, control de sintomas con tratamiento medico optimizado. Recibio tratamiento con N-acetilcisteina NBZ c/8h (R05CB01), Insulina cristalina segun esquema (A10AB01) y Paracetamol 1g EV c/8h (N02BE01). Evolucion satisfactoria, cumpliendo criterios de alta. Alta con diagnostico de fractura de cadera resuelto (S72.0), indicandose Insulina NPH 10UI SC c/12h (A10AC01) y Glibenclamida 5mg VO c/24h (A10BB01)."}
{"input": {"dx": ["Diabetes mellitus descompensada (E11.9)"], "proc": ["Ecografia abdominal (88.76)", "Paracentesis (54.91)"], "tto": ["Ciprofloxacino 400mg EV c/12h (J01MA02)", "N-acetilcisteina NBZ c/8h (R05CB01)"], "evo": "Manejo conservador exitoso, sin necesidad de cirugia", "dx_alta": ["Diabetes mellitus descompensada resuelto (E11.9)"], "med": ["Calcio 500mg VO c/12h (A12AA04)", "Omeprazol 20mg VO c/24h (A02BC01)", "Budesonide/Formoterol INH c/12h (R03AK07)"]}, "output": "Paciente que ingresa con cuadro de diabetes mellitus descompensada (E11.9). Se realiza ecografia abdominal (88.76), paracentesis (54.91). En su evolucion, manejo conservador exitoso, sin necesidad de cirugia. Recibio tratamiento con Ciprofloxacino 400mg EV c/12h (J01MA02) y N-acetilcisteina NBZ c/8h (R05CB01). Buena evolucion, cumpliendo criterios de alta. Alta con diagnostico de diabetes mellitus descompensada resuelto (E11.9), indicandose Calcio 500mg VO c/12h (A12AA04), Omeprazol 20mg VO c/24h (A02BC01) y Budesonide/Formoterol INH c/12h (R03AK07)."}
{"input": {"dx": ["Fibrilacion auricular (I48.9)"], "proc": ["Hemodialisis (39.95)", "Paracentesis (54.91)"], "tto": ["Ciprofloxacino 400mg EV c/12h (J01MA02)", "N-acetilcisteina NBZ c/8h (R05CB01)"], "evo": "Control de sintomas con tratamiento medico optimizado", "dx_alta": ["Fibrilacion auricular resuelto (I48.9)"], "med": ["Sertralina 50mg VO c/24h (N06AB06)", "Prednisona 20mg VO c/24h (H02AB07)", "Salbutamol INH 2 puff c/6h PRN (R03AC02)", "Clonazepam 0.5mg VO c/noche (N03AE01)"]}, "output": "Ingresa por fibrilacion auricular (I48.9). Se realiza hemodialisis (39.95), paracentesis (54.91). Durante la hospitalizacion, control de sintomas con tratamiento medico optimizado. Recibio tratamiento con Ciprofloxacino 400mg EV c/12h (J01MA02) y N-acetilcisteina NBZ c/8h (R05CB01). Evolucion clinica favorable, cumpliendo criterios de alta. Alta con diagnostico de fibrilacion auricular resuelto (I48.9), indicandose Sertralina 50mg VO c/24h (N06AB06), Prednisona 20mg VO c/24h (H02AB07), Salbutamol INH 2 puff c/6h PRN (R03AC02) y Clonazepam 0.5mg VO c/noche (N03AE01)."}
{"input": {"dx": ["Angina inestable alto riesgo (I20.0)"], "proc": ["Coronariografia (K492)", "Angioplastia OM (36.06)"], "tto": ["Clopidogrel 600mg carga (B01AC04)", "Furosemida 40mg EV (C03CA01)", "Enoxaparina 60mg SC c/12h (B01AB05)"], "evo": "Taquicardia ventricular sostenida, cardioversion electrica exitosa", "dx_alta": ["Angina inestable alto riesgo tratado (I20.0)"], "med": ["Prasugrel 10mg VO c/24h 12m (B01AC22)", "Losartan 50mg VO c/24h (C09CA01)", "Furosemida 40mg VO c/24h (C03CA01)", "Enalapril 10mg VO c/12h (C09AA02)"]}, "output": "Ingresa por angina inestable alto riesgo (I20.0). Se realiza coronariografia (K492) evidenciando oclusion aguda, realizandose angioplastia om (36.06) con implante de stent farmacoactivo y flujo TIMI 3 final. Durante la hospitalizacion, taquicardia ventricular sostenida, cardioversion electrica exitosa. Recibio tratamiento con Clopidogrel 600mg carga (B01AC04), Furosemida 40mg EV (C03CA01) y Enoxaparina 60mg SC c/12h (B01AB05). Evolucion clinica favorable, cumpliendo criterios de alta. Alta con diagnostico de angina inestable alto riesgo tratado (I20.0), indicandose Prasugrel 10mg VO c/24h 12m (B01AC22), Losartan 50mg VO c/24h (C09CA01), Furosemida 40mg VO c/24h (C03CA01) y Enalapril 10mg VO c/12h (C09AA02)."}
{"input": {"dx": ["Shock cardiogenico (R57.0)"], "proc": ["Valvuloplastia mitral (K492)"], "tto": ["Clopidogrel 600mg carga (B01AC04)", "Enoxaparina 60mg SC c/12h (B01AB05)"], "evo": "Fibrilacion auricular de alta respuesta, cardioversion farmacologica exitosa", "dx_alta": ["Shock cardiogenico tratado (R57.0)"], "med": ["Enalapril 10mg VO c/12h (C09AA02)", "Amlodipino 5mg VO c/24h (C08CA01)", "Ticagrelor 90mg VO c/12h 12m (B01AC24)"]}, "output": "Ingreso por shock cardiogenico (R57.0). Se realiza valvuloplastia mitral (K492). Durante la hospitalizacion, fibrilacion auricular de alta respuesta, cardioversion farmacologica exitosa. Recibio tratamiento con Clopidogrel 600mg carga (B01AC04) y Enoxaparina 60mg SC c/12h (B01AB05). Buena evolucion, cumpliendo criterios de alta. Alta con diagnostico de shock cardiogenico tratado (R57.0), indicandose Enalapril 10mg VO c/12h (C09AA02), Amlodipino 5mg VO c/24h (C08CA01) y Ticagrelor 90mg VO c/12h 12m (B01AC24)."}
{"input": {"dx": ["IAMCEST inferolateral (I21.1)"], "proc": ["Coronariografia (K492)", "Angioplastia TCI (36.06)"], "tto": ["Enoxaparina 1mg/kg SC c/12h (B01AB05)", "Aspirina 300mg carga (B01AC06)"], "evo": "Taquicardia ventricular sostenida, cardioversion electrica exitosa", "dx_alta": ["IAMCEST inferolateral tratado (I21.1)"], "med": ["Ticagrelor 90mg VO c/12h 12m (B01AC24)", "Bisoprolol 5mg VO c/24h (C07AB07)", "Warfarina segun INR (B01AA03)", "Rivaroxaban 20mg VO c/24h (B01AF01)", "Nitroglicerina SL PRN (C01DA02)"]}, "output": "Se hospitaliza por iamcest inferolateral (I21.1). Se realiza coronariografia (K492) con hallazgo de lesion significativa, realizandose angioplastia tci (36.06) con implante de stent farmacoactivo y flujo TIMI 3 final. Evoluciona con, taquicardia ventricular sostenida, cardioversion electrica exitosa. Recibio tratamiento con Enoxaparina 1mg/kg SC c/12h (B01AB05) y Aspirina 300mg carga (B01AC06). Evolucion clinica favorable, cumpliendo criterios de alta. Alta con diagnostico de iamcest inferolateral tratado (I21.1), indicandose Ticagrelor 90mg VO c/12h 12m (B01AC24), Bisoprolol 5mg VO c/24h (C07AB07), Warfarina segun INR (B01AA03), Rivaroxaban 20mg VO c/24h (B01AF01) y Nitroglicerina SL PRN (C01DA02)."}
{"input": {"dx": ["Angina inestable (I20.0)"], "proc": ["Coronariografia (K492)", "Angioplastia OM (36.06)"], "tto": ["Clopidogrel 600mg carga (B01AC04)", "Heparina 5000UI EV (B01AB01)", "Aspirina 300mg carga (B01AC06)"], "evo": "Bloqueo AV completo sintomatico, requirio marcapasos transitorio", "dx_alta": ["Angina inestable tratado (I20.0)"], "med": ["Atorvastatina 40mg VO c/noche (C10AA05)", "Amlodipino 5mg VO c/24h (C08CA01)", "Losartan 50mg VO c/24h (C09CA01)", "Espironolactona 25mg VO c/24h (C03DA01)", "Furosemida 40mg VO c/24h (C03CA01)"]}, "output": "Ingreso por angina inestable (I20.0). Se realiza coronariografia (K492) encontrando lesion critica, realizandose angioplastia om (36.06) con implante de stent farmacoactivo y flujo TIMI 3 final. Durante la hospitalizacion, bloqueo av completo sintomatico, requirio marcapasos transitorio. Recibio tratamiento con Clopidogrel 600mg carga (B01AC04), Heparina 5000UI EV (B01AB01) y Aspirina 300mg carga (B01AC06). Buena evolucion, cumpliendo criterios de alta. Alta con diagnostico de angina inestable tratado (I20.0), indicandose Atorvastatina 40mg VO c/noche (C10AA05), Amlodipino 5mg VO c/24h (C08CA01), Losartan 50mg VO c/24h (C09CA01), Espironolactona 25mg VO c/24h (C03DA01) y Furosemida 40mg VO c/24h (C03CA01)."}
{"input": {"dx": ["Enfermedad de TCI (I25.1)"], "proc": ["Implante de marcapasos (99.62)"], "tto": ["Dobutamina EV (C01CA07)", "Aspirina 100mg (B01AC06)", "Furosemida 80mg EV (C03CA01)"], "evo": "SDST en V5-V6, coronarias sin lesiones obstructivas, sindrome de Tako-Tsubo", "dx_alta": ["Enfermedad de TCI tratado (I25.1)"], "med": ["Metoprolol 50mg VO c/12h (C07AB02)", "Furosemida 40mg VO c/24h (C03CA01)", "Bisoprolol 5mg VO c/24h (C07AB07)", "Apixaban 5mg VO c/12h (B01AF02)", "Prasugrel 10mg VO c/24h 12m (B01AC22)"]}, "output": "Ingreso por enfermedad de tci (I25.1). Se realiza implante de marcapasos (99.62). Durante la hospitalizacion, sdst en v5-v6, coronarias sin lesiones obstructivas, sindrome de tako-tsubo. Recibio tratamiento con Dobutamina EV (C01CA07), Aspirina 100mg (B01AC06) y Furosemida 80mg EV (C03CA01). Evolucion clinica favorable, cumpliendo criterios de alta. Alta con diagnostico de enfermedad de tci tratado (I25.1), indicandose Metoprolol 50mg VO c/12h (C07AB02), Furosemida 40mg VO c/24h (C03CA01), Bisoprolol 5mg VO c/24h (C07AB07), Apixaban 5mg VO c/12h (B01AF02) y Prasugrel 10mg VO c/24h 12m (B01AC22)."}
{"input": {"dx": ["Pericarditis aguda (I30.9)"], "proc": ["Toracocentesis (34.91)", "Ecografia abdominal (88.76)"], "tto": ["Tramadol 50mg EV c/8h (N02AX02)", "Insulina NPH 10UI SC c/12h (A10AC01)", "Ciprofloxacino 400mg EV c/12h (J01MA02)", "Hidrocortisona 100mg EV c/8h (H02AB09)"], "evo": "Respuesta adecuada al tratamiento antibiotico, afebril desde dia 2", "dx_alta": ["Pericarditis aguda resuelto (I30.9)"], "med": ["Tramadol 50mg VO c/8h 7d (N02AX02)", "Amoxicilina/Clavulanico 875mg VO c/12h 7d (J01CR02)", "Salbutamol INH 2 puff c/6h PRN (R03AC02)"]}, "output": "Ingreso por pericarditis aguda (I30.9). Se realiza toracocentesis (34.91), ecografia abdominal (88.76). Evoluciona con, respuesta adecuada al tratamiento antibiotico, afebril desde dia 2. Recibio tratamiento con Tramadol 50mg EV c/8h (N02AX02), Insulina NPH 10UI SC c/12h (A10AC01), Ciprofloxacino 400mg EV c/12h (J01MA02) y Hidrocortisona 100mg EV c/8h (H02AB09). Evolucion clinica favorable, cumpliendo criterios de alta. Alta con diagnostico de pericarditis aguda resuelto (I30.9), indicandose Tramadol 50mg VO c/8h 7d (N02AX02), Amoxicilina/Clavulanico 875mg VO c/12h 7d (J01CR02) y Salbutamol INH 2 puff c/6h PRN (R03AC02)."}
{"input": {"dx": ["Trombosis de stent (I21.0)"], "proc": ["Angioplastia (37.0)"], "tto": ["Enoxaparina 60mg SC c/12h (B01AB05)", "Levosimendan EV (C01CX08)"], "evo": "Pericarditis aguda con derrame leve, manejo antiinflamatorio", "dx_alta": ["Trombosis de stent tratado (I21.0)"], "med": ["Losartan 50mg VO c/24h (C09CA01)", "Bisoprolol 5mg VO c/24h (C07AB07)", "Warfarina segun INR (B01AA03)", "Isosorbide 20mg VO c/8h (C01DA08)"]}, "output": "Ingresa por trombosis de stent (I21.0). Se realiza angioplastia (37.0). Durante la hospitalizacion, pericarditis aguda con derrame leve, manejo antiinflamatorio. Recibio tratamiento con Enoxaparina 60mg SC c/12h (B01AB05) y Levosimendan EV (C01CX08). Buena evolucion, cumpliendo criterios de alta. Alta con diagnostico de trombosis de stent tratado (I21.0), indicandose Losartan 50mg VO c/24h (C09CA01), Bisoprolol 5mg VO c/24h (C07AB07), Warfarina segun INR (B01AA03) y Isosorbide 20mg VO c/8h (C01DA08)."}
{"input": {"dx": ["IAMCEST anteroseptal (I21.0)"], "proc": ["Coronariografia (K492)", "Angioplastia TCI (36.06)"], "tto": ["Enoxaparina 60mg SC c/12h (B01AB05)", "Atorvastatina 80mg (C10AA05)", "Digoxina 0.25mg EV (C01AA05)"], "evo": "SDST en I, aVL, coronarias sin lesiones obstructivas, sindrome de Tako-Tsubo", "dx_alta": ["IAMCEST anteroseptal tratado (I21.0)"], "med": ["Espironolactona 25mg VO c/24h (C03DA01)", "Rosuvastatina 20mg VO c/noche (C10AA07)", "Apixaban 5mg VO c/12h (B01AF02)"]}, "output": "Paciente que ingresa con cuadro de iamcest anteroseptal (I21.0). Se realiza coronariografia (K492) encontrando lesion critica, realizandose angioplastia tci (36.06) con implante de stent farmacoactivo y flujo TIMI 3 final. Durante la hospitalizacion, sdst en i, avl, coronarias sin lesiones obstructivas, sindrome de tako-tsubo. Recibio tratamiento con Enoxaparina 60mg SC c/12h (B01AB05), Atorvastatina 80mg (C10AA05) y Digoxina 0.25mg EV (C01AA05). Evolucion clinica favorable, cumpliendo criterios de alta. Alta con diagnostico de iamcest anteroseptal tratado (I21.0), indicandose Espironolactona 25mg VO c/24h (C03DA01), Rosuvastatina 20mg VO c/noche (C10AA07) y Apixaban 5mg VO c/12h (B01AF02)."}
{"input": {"dx": ["Insuficiencia cardiaca aguda (I50.9)"], "proc": ["Implante de DAI (K493)"], "tto": ["Digoxina 0.25mg EV (C01AA05)", "Heparina 5000UI EV (B01AB01)"], "evo": "Shock cardiogenico, requirio soporte con inotropicos, evolucion favorable", "dx_alta": ["Insuficiencia cardiaca aguda tratado (I50.9)"], "med": ["Carvedilol 6.25mg VO c/12h (C07AG02)", "Apixaban 5mg VO c/12h (B01AF02)", "Warfarina segun INR (B01AA03)", "Clopidogrel 75mg VO c/24h 12m (B01AC04)"]}, "output": "Paciente que ingresa con cuadro de insuficiencia cardiaca aguda (I50.9). Se realiza implante de dai (K493). Evoluciona con, shock cardiogenico, requirio soporte con inotropicos, evolucion favorable. Recibio tratamiento con Digoxina 0.25mg EV (C01AA05) y Heparina 5000UI EV (B01AB01). Presenta evolucion favorable, cumpliendo criterios de alta. Alta con diagnostico de insuficiencia cardiaca aguda tratado (I50.9), indicandose Carvedilol 6.25mg VO c/12h (C07AG02), Apixaban 5mg VO c/12h (B01AF02), Warfarina segun INR (B01AA03) y Clopidogrel 75mg VO c/24h 12m (B01AC04)."}
{"input": {"dx": ["Fractura de cadera (S72.0)"], "proc": ["RMN cerebral (88.91)"], "tto": ["Ampicilina/Sulbactam 1.5g EV c/6h (J01CR01)", "Metronidazol 500mg EV c/8h (J01XD01)", "Pantoprazol 40mg EV c/12h (A02BC02)", "Omeprazol 40mg EV c/12h (A02BC01)"], "evo": "Evolucion favorable con tratamiento medico, sin complicaciones", "dx_alta": ["Fractura de cadera resuelto (S72.0)"], "med": ["Glibenclamida 5mg VO c/24h (A10BB01)", "Insulina NPH 10UI SC c/12h (A10AC01)", "Budesonide/Formoterol INH c/12h (R03AK07)"]}, "output": "Paciente que ingresa con cuadro de fractura de cadera (S72.0). Se realiza rmn cerebral (88.91). En su evolucion, evolucion favorable con tratamiento medico, sin complicaciones. Recibio tratamiento con Ampicilina/Sulbactam 1.5g EV c/6h (J01CR01), Metronidazol 500mg EV c/8h (J01XD01), Pantoprazol 40mg EV c/12h (A02BC02) y Omeprazol 40mg EV c/12h (A02BC01). Presenta evolucion favorable, cumpliendo criterios de alta. Alta con diagnostico de fractura de cadera resuelto (S72.0), indicandose Glibenclamida 5mg VO c/24h (A10BB01), Insulina NPH 10UI SC c/12h (A10AC01) y Budesonide/Formoterol INH c/12h (R03AK07)."}
{"input": {"dx": ["IAMCEST anterior (I21.0)"], "proc": ["Coronariografia (K492)", "Angioplastia CX (K493)"], "tto": ["Digoxina 0.25mg EV (C01AA05)", "Enoxaparina 60mg SC c/12h (B01AB05)", "Clopidogrel 300mg carga (B01AC04)", "Enoxaparina 1mg/kg SC c/12h (B01AB05)"], "evo": "Estenosis aortica severa sintomatica, programada para TAVI", "dx_alta": ["IAMCEST anterior tratado (I21.0)"], "med": ["Apixaban 5mg VO c/12h (B01AF02)", "Clopidogrel 75mg VO c/24h 12m (B01AC04)", "Metoprolol 50mg VO c/12h (C07AB02)", "Amlodipino 5mg VO c/24h (C08CA01)", "Prasugrel 10mg VO c/24h 12m (B01AC22)"]}, "output": "Se hospitaliza por iamcest anterior (I21.0). Se realiza coronariografia (K492) visualizando estenosis severa, realizandose angioplastia cx (K493) con implante de stent farmacoactivo y flujo TIMI 3 final. En su evolucion, estenosis aortica severa sintomatica, programada para tavi. Recibio tratamiento con Digoxina 0.25mg EV (C01AA05), Enoxaparina 60mg SC c/12h (B01AB05), Clopidogrel 300mg carga (B01AC04) y Enoxaparina 1mg/kg SC c/12h (B01AB05). Evolucion clinica favorable, cumpliendo criterios de alta. Alta con diagnostico de iamcest anterior tratado (I21.0), indicandose Apixaban 5mg VO c/12h (B01AF02), Clopidogrel 75mg VO c/24h 12m (B01AC04), Metoprolol 50mg VO c/12h (C07AB02), Amlodipino 5mg VO c/24h (C08CA01) y Prasugrel 10mg VO c/24h 12m (B01AC22)."}
{"input": {"dx": ["Hipertension arterial severa (I10)"], "proc": ["Endoscopia digestiva alta (45.13)", "Hernioplastia inguinal (53.00)"], "tto": ["Ondansetron 8mg EV c/8h (A04AA01)", "Vancomicina 1g EV c/12h (J01XA01)"], "evo": "Estabilizacion clinica progresiva, sin eventos adversos", "dx_alta": ["Hipertension arterial severa resuelto (I10)"], "med": ["Omeprazol 20mg VO c/24h (A02BC01)", "Hierro 100mg VO c/24h (B03AA07)"]}, "output": "Se hospitaliza por hipertension arterial severa (I10). Se realiza endoscopia digestiva alta (45.13), hernioplastia inguinal (53.00). Durante la hospitalizacion, estabilizacion clinica progresiva, sin eventos adversos. Recibio tratamiento con Ondansetron 8mg EV c/8h (A04AA01) y Vancomicina 1g EV c/12h (J01XA01). Evolucion satisfactoria, cumpliendo criterios de alta. Alta con diagnostico de hipertension arterial severa resuelto (I10), indicandose Omeprazol 20mg VO c/24h (A02BC01) y Hierro 100mg VO c/24h (B03AA07)."}
{"input": {"dx": ["IAMSEST (I21.4)"], "proc": ["Coronariografia (K492)"], "tto": ["Levosimendan EV (C01CX08)", "Dobutamina EV (C01CA07)", "Morfina 3mg EV (N02AA01)"], "evo": "Oclusion aguda de DA media, angioplastia exitosa con stent farmacoactivo, flujo TIMI 3 final", "dx_alta": ["IAMSEST tratado (I21.4)"], "med": ["Enalapril 10mg VO c/12h (C09AA02)", "Espironolactona 25mg VO c/24h (C03DA01)", "Prasugrel 10mg VO c/24h 12m (B01AC22)", "Apixaban 5mg VO c/12h (B01AF02)"]}, "output": "Se hospitaliza por iamsest (I21.4). Se realiza coronariografia (K492). Durante la hospitalizacion, oclusion aguda de da media, angioplastia exitosa con stent farmacoactivo, flujo timi 3 final. Recibio tratamiento con Levosimendan EV (C01CX08), Dobutamina EV (C01CA07) y Morfina 3mg EV (N02AA01). Buena evolucion, cumpliendo criterios de alta. Alta con diagnostico de iamsest tratado (I21.4), indicandose Enalapril 10mg VO c/12h (C09AA02), Espironolactona 25mg VO c/24h (C03DA01), Prasugrel 10mg VO c/24h 12m (B01AC22) y Apixaban 5mg VO c/12h (B01AF02)."}
{"input": {"dx": ["Pancreatitis aguda (K85.9)"], "proc": ["Colonoscopia (45.23)", "Paracentesis (54.91)"], "tto": ["N-acetilcisteina NBZ c/8h (R05CB01)", "Piperacilina/Tazobactam 4.5g EV c/8h (J01CR05)"], "evo": "Resolucion del cuadro agudo, alta con seguimiento ambulatorio", "dx_alta": ["Pancreatitis aguda resuelto (K85.9)"], "med": ["Salbutamol INH 2 puff c/6h PRN (R03AC02)", "Omeprazol 20mg VO c/24h (A02BC01)"]}, "output": "Ingreso por pancreatitis aguda (K85.9). Se realiza colonoscopia (45.23), paracentesis (54.91). Evoluciona con, resolucion del cuadro agudo, alta con seguimiento ambulatorio. Recibio tratamiento con N-acetilcisteina NBZ c/8h (R05CB01) y Piperacilina/Tazobactam 4.5g EV c/8h (J01CR05). Evolucion clinica favorable, cumpliendo criterios de alta. Alta con diagnostico de pancreatitis aguda resuelto (K85.9), indicandose Salbutamol INH 2 puff c/6h PRN (R03AC02) y Omeprazol 20mg VO c/24h (A02BC01)."}
{"input": {"dx": ["IAMCEST anterior (I21.0)"], "proc": ["Coronariografia (K492)", "Angioplastia OM (K493)"], "tto": ["Clopidogrel 300mg carga (B01AC04)", "Furosemida 80mg EV (C03CA01)", "Dobutamina EV (C01CA07)"], "evo": "Lesion severa de DA proximal, angioplastia con implante de stent sin complicaciones", "dx_alta": ["IAMCEST anterior tratado (I21.0)"], "med": ["Espironolactona 25mg VO c/24h (C03DA01)", "Enalapril 10mg VO c/12h (C09AA02)", "Warfarina segun INR (B01AA03)", "Rivaroxaban 20mg VO c/24h (B01AF01)"]}, "output": "Ingreso por iamcest anterior (I21.0). Se realiza coronariografia (K492) evidenciando oclusion aguda, realizandose angioplastia om (K493) con implante de stent farmacoactivo y flujo TIMI 3 final. Durante la hospitalizacion, lesion severa de da proximal, angioplastia con implante de stent sin complicaciones. Recibio tratamiento con Clopidogrel 300mg carga (B01AC04), Furosemida 80mg EV (C03CA01) y Dobutamina EV (C01CA07). Evolucion clinica favorable, cumpliendo criterios de alta. Alta con diagnostico de iamcest anterior tratado (I21.0), indicandose Espironolactona 25mg VO c/24h (C03DA01), Enalapril 10mg VO c/12h (C09AA02), Warfarina segun INR (B01AA03) y Rivaroxaban 20mg VO c/24h (B01AF01)."}
{"input": {"dx": ["Hemorragia digestiva alta (K92.2)"], "proc": ["Paracentesis (54.91)", "Colonoscopia (45.23)"], "tto": ["Piperacilina/Tazobactam 4.5g EV c/8h (J01CR05)", "Pantoprazol 40mg EV c/12h (A02BC02)", "Insulina cristalina segun esquema (A10AB01)"], "evo": "Control de sintomas con tratamiento medico optimizado", "dx_alta": ["Hemorragia digestiva alta resuelto (K92.2)"], "med": ["Prednisona 20mg VO c/24h (H02AB07)", "Omeprazol 20mg VO c/24h (A02BC01)", "Insulina NPH 10UI SC c/12h (A10AC01)", "Acido folico 1mg VO c/24h (B03BB01)"]}, "output": "Se hospitaliza por hemorragia digestiva alta (K92.2). Se realiza paracentesis (54.91), colonoscopia (45.23). Presenta, control de sintomas con tratamiento medico optimizado. Recibio tratamiento con Piperacilina/Tazobactam 4.5g EV c/8h (J01CR05), Pantoprazol 40mg EV c/12h (A02BC02) y Insulina cristalina segun esquema (A10AB01). Evolucion clinica favorable, cumpliendo criterios de alta. Alta con diagnostico de hemorragia digestiva alta resuelto (K92.2), indicandose Prednisona 20mg VO c/24h (H02AB07), Omeprazol 20mg VO c/24h (A02BC01), Insulina NPH 10UI SC c/12h (A10AC01) y Acido folico 1mg VO c/24h (B03BB01)."}
{"input": {"dx": ["IAMCEST inferior (I21.1)"], "proc": ["Coronariografia (K492)", "Angioplastia CD (K493)"], "tto": ["Furosemida 40mg EV (C03CA01)", "Enalapril 5mg VO (C09AA02)", "Nitroglicerina EV (C01DA02)", "Aspirina 100mg (B01AC06)"], "evo": "Bloqueo AV completo sintomatico, requirio marcapasos transitorio", "dx_alta": ["IAMCEST inferior tratado (I21.1)"], "med": ["Espironolactona 25mg VO c/24h (C03DA01)", "Ticagrelor 90mg VO c/12h 12m (B01AC24)", "Warfarina segun INR (B01AA03)"]}, "output": "Ingresa por iamcest inferior (I21.1). Se realiza coronariografia (K492) evidenciando oclusion aguda, realizandose angioplastia cd (K493) con implante de stent farmacoactivo y flujo TIMI 3 final. En su evolucion, bloqueo av completo sintomatico, requirio marcapasos transitorio. Recibio tratamiento con Furosemida 40mg EV (C03CA01), Enalapril 5mg VO (C09AA02), Nitroglicerina EV (C01DA02) y Aspirina 100mg (B01AC06). Evolucion clinica favorable, cumpliendo criterios de alta. Alta con diagnostico de iamcest inferior tratado (I21.1), indicandose Espironolactona 25mg VO c/24h (C03DA01), Ticagrelor 90mg VO c/12h 12m (B01AC24) y Warfarina segun INR (B01AA03)."}
{"input": {"dx": ["Edema pulmonar agudo (J81)"], "proc": ["Ecocardiograma (89.50)"], "tto": ["Enoxaparina 60mg SC c/12h (B01AB05)", "Furosemida 80mg EV (C03CA01)", "Amiodarona 300mg EV (C01BD01)", "Prasugrel 60mg carga (B01AC22)"], "evo": "Oclusion de ramus intermedio con trombo, trombectomia por aspiracion mas stent", "dx_alta": ["Edema pulmonar agudo tratado (J81)"], "med": ["Metoprolol 50mg VO c/12h (C07AB02)", "Apixaban 5mg VO c/12h (B01AF02)", "Atorvastatina 40mg VO c/noche (C10AA05)"]}, "output": "Se hospitaliza por edema pulmonar agudo (J81). Se realiza ecocardiograma (89.50). Presenta, oclusion de ramus intermedio con trombo, trombectomia por aspiracion mas stent. Recibio tratamiento con Enoxaparina 60mg SC c/12h (B01AB05), Furosemida 80mg EV (C03CA01), Amiodarona 300mg EV (C01BD01) y Prasugrel 60mg carga (B01AC22). Evolucion satisfactoria, cumpliendo criterios de alta. Alta con diagnostico de edema pulmonar agudo tratado (J81), indicandose Metoprolol 50mg VO c/12h (C07AB02), Apixaban 5mg VO c/12h (B01AF02) y Atorvastatina 40mg VO c/noche (C10AA05)."}
{"input": {"dx": ["Miocarditis (I40.9)"], "proc": ["Trombectomia mecanica (39.74)", "Ecografia abdominal (88.76)"], "tto": ["Meropenem 1g EV c/8h (J01DH02)", "N-acetilcisteina NBZ c/8h (R05CB01)", "Metamizol 1g EV c/8h (N02BB02)"], "evo": "Resolucion del cuadro agudo, alta con seguimiento ambulatorio", "dx_alta": ["Miocarditis resuelto (I40.9)"], "med": ["Acido folico 1mg VO c/24h (B03BB01)", "Clonazepam 0.5mg VO c/noche (N03AE01)", "Sertralina 50mg VO c/24h (N06AB06)"]}, "output": "Paciente que ingresa con cuadro de miocarditis (I40.9). Se realiza trombectomia mecanica (39.74), ecografia abdominal (88.76). Evoluciona con, resolucion del cuadro agudo, alta con seguimiento ambulatorio. Recibio tratamiento con Meropenem 1g EV c/8h (J01DH02), N-acetilcisteina NBZ c/8h (R05CB01) y Metamizol 1g EV c/8h (N02BB02). Presenta evolucion favorable, cumpliendo criterios de alta. Alta con diagnostico de miocarditis resuelto (I40.9), indicandose Acido folico 1mg VO c/24h (B03BB01), Clonazepam 0.5mg VO c/noche (N03AE01) y Sertralina 50mg VO c/24h (N06AB06)."}
{"input": {"dx": ["Crisis hipertensiva (I10)"], "proc": ["Toracocentesis (34.91)"], "tto": ["Hidrocortisona 100mg EV c/8h (H02AB09)", "Paracetamol 1g EV c/8h (N02BE01)", "N-acetilcisteina NBZ c/8h (R05CB01)", "Metamizol 1g EV c/8h (N02BB02)"], "evo": "Cirugia programada sin complicaciones, alta precoz", "dx_alta": ["Crisis hipertensiva resuelto (I10)"], "med": ["Calcio 500mg VO c/12h (A12AA04)", "Prednisona 20mg VO c/24h (H02AB07)", "Sertralina 50mg VO c/24h (N06AB06)"]}, "output": "Se hospitaliza por crisis hipertensiva (I10). Se realiza toracocentesis (34.91). Evoluciona con, cirugia programada sin complicaciones, alta precoz. Recibio tratamiento con Hidrocortisona 100mg EV c/8h (H02AB09), Paracetamol 1g EV c/8h (N02BE01), N-acetilcisteina NBZ c/8h (R05CB01) y Metamizol 1g EV c/8h (N02BB02). Evolucion satisfactoria, cumpliendo criterios de alta. Alta con diagnostico de crisis hipertensiva resuelto (I10), indicandose Calcio 500mg VO c/12h (A12AA04), Prednisona 20mg VO c/24h (H02AB07) y Sertralina 50mg VO c/24h (N06AB06)."}
{"input": {"dx": ["IAMCEST anteroseptal (I21.0)"], "proc": ["Coronariografia (K492)", "Angioplastia CD (K493)"], "tto": ["Heparina 5000UI EV (B01AB01)", "Enalapril 5mg VO (C09AA02)"], "evo": "Pericarditis aguda con derrame leve, manejo antiinflamatorio", "dx_alta": ["IAMCEST anteroseptal tratado (I21.0)"], "med": ["Bisoprolol 5mg VO c/24h (C07AB07)", "Metoprolol 50mg VO c/12h (C07AB02)", "Digoxina 0.125mg VO c/24h (C01AA05)", "Carvedilol 6.25mg VO c/12h (C07AG02)"]}, "output": "Ingreso por iamcest anteroseptal (I21.0). Se realiza coronariografia (K492) con hallazgo de lesion significativa, realizandose angioplastia cd (K493) con implante de stent farmacoactivo y flujo TIMI 3 final. Presenta, pericarditis aguda con derrame leve, manejo antiinflamatorio. Recibio tratamiento con Heparina 5000UI EV (B01AB01) y Enalapril 5mg VO (C09AA02). Presenta evolucion favorable, cumpliendo criterios de alta. Alta con diagnostico de iamcest anteroseptal tratado (I21.0), indicandose Bisoprolol 5mg VO c/24h (C07AB07), Metoprolol 50mg VO c/12h (C07AB02), Digoxina 0.125mg VO c/24h (C01AA05) y Carvedilol 6.25mg VO c/12h (C07AG02)."}
{"input": {"dx": ["IAMCEST inferior (I21.1)"], "proc": ["Coronariografia (K492)", "Angioplastia DA (36.06)"], "tto": ["Aspirina 100mg (B01AC06)", "Clopidogrel 600mg carga (B01AC04)", "Furosemida 80mg EV (C03CA01)", "Ticagrelor 180mg carga (B01AC24)"], "evo": "Estenosis aortica severa sintomatica, programada para TAVI", "dx_alta": ["IAMCEST inferior tratado (I21.1)"], "med": ["Espironolactona 25mg VO c/24h (C03DA01)", "Carvedilol 6.25mg VO c/12h (C07AG02)", "Clopidogrel 75mg VO c/24h 12m (B01AC04)", "Bisoprolol 5mg VO c/24h (C07AB07)", "Metoprolol 50mg VO c/12h (C07AB02)"]}, "output": "Paciente que ingresa con cuadro de iamcest inferior (I21.1). Se realiza coronariografia (K492) evidenciando oclusion aguda, realizandose angioplastia da (36.06) con implante de stent farmacoactivo y flujo TIMI 3 final. Evoluciona con, estenosis aortica severa sintomatica, programada para tavi. Recibio tratamiento con Aspirina 100mg (B01AC06), Clopidogrel 600mg carga (B01AC04), Furosemida 80mg EV (C03CA01) y Ticagrelor 180mg carga (B01AC24). Presenta evolucion favorable, cumpliendo criterios de alta. Alta con diagnostico de iamcest inferior tratado (I21.1), indicandose Espironolactona 25mg VO c/24h (C03DA01), Carvedilol 6.25mg VO c/12h (C07AG02), Clopidogrel 75mg VO c/24h 12m (B01AC04), Bisoprolol 5mg VO c/24h (C07AB07) y Metoprolol 50mg VO c/12h (C07AB02)."}
{"input": {"dx": ["Diseccion aortica (I71.0)"], "proc": ["Colonoscopia (45.23)"], "tto": ["Ipratropio NBZ c/6h (R03BB01)", "Metronidazol 500mg EV c/8h (J01XD01)", "Paracetamol 1g EV c/8h (N02BE01)"], "evo": "Cirugia programada sin complicaciones, alta precoz", "dx_alta": ["Diseccion aortica resuelto (I71.0)"], "med": ["Metformina 850mg VO c/12h (A10BA02)", "Omeprazol 20mg VO c/24h (A02BC01)"]}, "output": "Ingresa por diseccion aortica (I71.0). Se realiza colonoscopia (45.23). Durante la hospitalizacion, cirugia programada sin complicaciones, alta precoz. Recibio tratamiento con Ipratropio NBZ c/6h (R03BB01), Metronidazol 500mg EV c/8h (J01XD01) y Paracetamol 1g EV c/8h (N02BE01). Evolucion satisfactoria, cumpliendo criterios de alta. Alta con diagnostico de diseccion aortica resuelto (I71.0), indicandose Metformina 850mg VO c/12h (A10BA02) y Omeprazol 20mg VO c/24h (A02BC01)."}
{"input": {"dx": ["Edema pulmonar agudo (J81)"], "proc": ["Angioplastia DA (35.05)"], "tto": ["Furosemida 80mg EV (C03CA01)", "Aspirina 100mg (B01AC06)"], "evo": "Fibrilacion auricular de alta respuesta, cardioversion farmacologica exitosa", "dx_alta": ["Edema pulmonar agudo tratado (J81)"], "med": ["Nitroglicerina SL PRN (C01DA02)", "Bisoprolol 5mg VO c/24h (C07AB07)", "Enalapril 10mg VO c/12h (C09AA02)", "Metoprolol 50mg VO c/12h (C07AB02)", "Ticagrelor 90mg VO c/12h 12m (B01AC24)"]}, "output": "Ingresa por edema pulmonar agudo (J81). Se realiza angioplastia da (35.05). Presenta, fibrilacion auricular de alta respuesta, cardioversion farmacologica exitosa. Recibio tratamiento con Furosemida 80mg EV (C03CA01) y Aspirina 100mg (B01AC06). Evolucion clinica favorable, cumpliendo criterios de alta. Alta con diagnostico de edema pulmonar agudo tratado (J81), indicandose Nitroglicerina SL PRN (C01DA02), Bisoprolol 5mg VO c/24h (C07AB07), Enalapril 10mg VO c/12h (C09AA02), Metoprolol 50mg VO c/12h (C07AB02) y Ticagrelor 90mg VO c/12h 12m (B01AC24)."}
{"input": {"dx": ["IAMCEST anterolateral (I21.0)"], "proc": ["Coronariografia (K492)", "Angioplastia TCI (36.06)"], "tto": ["Aspirina 100mg (B01AC06)", "Metoprolol 5mg EV (C07AB02)"], "evo": "Oclusion aguda de DA media, angioplastia exitosa con stent farmacoactivo, flujo TIMI 3 final", "dx_alta": ["IAMCEST anterolateral tratado (I21.0)"], "med": ["Metoprolol 50mg VO c/12h (C07AB02)", "Amlodipino 5mg VO c/24h (C08CA01)", "Digoxina 0.125mg VO c/24h (C01AA05)", "Enalapril 10mg VO c/12h (C09AA02)", "Nitroglicerina SL PRN (C01DA02)"]}, "output": "Paciente que ingresa con cuadro de iamcest anterolateral (I21.0). Se realiza coronariografia (K492) evidenciando oclusion aguda, realizandose angioplastia tci (36.06) con implante de stent farmacoactivo y flujo TIMI 3 final. Presenta, oclusion aguda de da media, angioplastia exitosa con stent farmacoactivo, flujo timi 3 final. Recibio tratamiento con Aspirina 100mg (B01AC06) y Metoprolol 5mg EV (C07AB02). Evolucion clinica favorable, cumpliendo criterios de alta. Alta con diagnostico de iamcest anterolateral tratado (I21.0), indicandose Metoprolol 50mg VO c/12h (C07AB02), Amlodipino 5mg VO c/24h (C08CA01), Digoxina 0.125mg VO c/24h (C01AA05), Enalapril 10mg VO c/12h (C09AA02) y Nitroglicerina SL PRN (C01DA02)."}
{"input": {"dx": ["Miocarditis (I40.9)"], "proc": ["Colecistectomia laparoscopica (51.23)", "Endoscopia digestiva alta (45.13)"], "tto": ["Salbutamol NBZ c/4h (R03AC02)", "Tramadol 50mg EV c/8h (N02AX02)", "Metamizol 1g EV c/8h (N02BB02)"], "evo": "Manejo conservador exitoso, sin necesidad de cirugia", "dx_alta": ["Miocarditis resuelto (I40.9)"], "med": ["Metformina 850mg VO c/12h (A10BA02)", "Glibenclamida 5mg VO c/24h (A10BB01)"]}, "output": "Se hospitaliza por miocarditis (I40.9). Se realiza colecistectomia laparoscopica (51.23), endoscopia digestiva alta (45.13). Evoluciona con, manejo conservador exitoso, sin necesidad de cirugia. Recibio tratamiento con Salbutamol NBZ c/4h (R03AC02), Tramadol 50mg EV c/8h (N02AX02) y Metamizol 1g EV c/8h (N02BB02). Evolucion satisfactoria, cumpliendo criterios de alta. Alta con diagnostico de miocarditis resuelto (I40.9), indicandose Metformina 850mg VO c/12h (A10BA02) y Glibenclamida 5mg VO c/24h (A10BB01)."}
{"input": {"dx": ["Shock cardiogenico (R57.0)"], "proc": ["Angioplastia CD (K493)"], "tto": ["Prasugrel 60mg carga (B01AC22)", "Enoxaparina 60mg SC c/12h (B01AB05)"], "evo": "Fibrilacion auricular de alta respuesta, cardioversion farmacologica exitosa", "dx_alta": ["Shock cardiogenico tratado (R57.0)"], "med": ["Losartan 50mg VO c/24h (C09CA01)", "Aspirina 100mg VO c/24h (B01AC06)", "Atorvastatina 40mg VO c/noche (C10AA05)"]}, "output": "Ingreso por shock cardiogenico (R57.0). Se realiza angioplastia cd (K493). Evoluciona con, fibrilacion auricular de alta respuesta, cardioversion farmacologica exitosa. Recibio tratamiento con Prasugrel 60mg carga (B01AC22) y Enoxaparina 60mg SC c/12h (B01AB05). Presenta evolucion favorable, cumpliendo criterios de alta. Alta con diagnostico de shock cardiogenico tratado (R57.0), indicandose Losartan 50mg VO c/24h (C09CA01), Aspirina 100mg VO c/24h (B01AC06) y Atorvastatina 40mg VO c/noche (C10AA05)."}
{"input": {"dx": ["IAMSEST alto riesgo (I21.4)"], "proc": ["Coronariografia (K492)", "Angioplastia DA (K493)"], "tto": ["Clopidogrel 600mg carga (B01AC04)", "Enalapril 5mg VO (C09AA02)"], "evo": "Estenosis aortica severa sintomatica, programada para TAVI", "dx_alta": ["IAMSEST alto riesgo tratado (I21.4)"], "med": ["Amlodipino 5mg VO c/24h (C08CA01)", "Rosuvastatina 20mg VO c/noche (C10AA07)", "Espironolactona 25mg VO c/24h (C03DA01)", "Nitroglicerina SL PRN (C01DA02)", "Losartan 50mg VO c/24h (C09CA01)"]}, "output": "Ingreso por iamsest alto riesgo (I21.4). Se realiza coronariografia (K492) visualizando estenosis severa, realizandose angioplastia da (K493) con implante de stent farmacoactivo y flujo TIMI 3 final. Presenta, estenosis aortica severa sintomatica, programada para tavi. Recibio tratamiento con Clopidogrel 600mg carga (B01AC04) y Enalapril 5mg VO (C09AA02). Buena evolucion, cumpliendo criterios de alta. Alta con diagnostico de iamsest alto riesgo tratado (I21.4), indicandose Amlodipino 5mg VO c/24h (C08CA01), Rosuvastatina 20mg VO c/noche (C10AA07), Espironolactona 25mg VO c/24h (C03DA01), Nitroglicerina SL PRN (C01DA02) y Losartan 50mg VO c/24h (C09CA01)."}
